post_id,text,comment_time,from_id
247086,"Блин, долбанул бы её альцгеймер уже что-ли, хоть и нельзя такое людям желать, но исключения только подтверждают правила, так сказать.",1636993542,149777507
247086,"А она не знает, откуда взялось недоверие?",1637000447,352178300
247086,Журнал Эксперт в последнее время упал ниже интеллектуального плинтуса,1637001333,3341135
247086,Ставка вырастет - ставка пл ипотеке вырастет - ипотечникам не на что будет кушать- цены на продукты снизятся. Ну логика есть конечно...,1637001362,184608346
247086,"Понятно, она хочет стерилизовать наличную денежную массу, привлечь на депозиты, но ведь и ставка кредита вырастет - а она сидит в цене любого товара. А почему не ОФЗ? На 20 лет, по либор+2%. И стерилизует и бюджет пополняет и рост цен не вызывает. А из бюджета ну блин ещё парочку крымских мостов построить.",1637001874,184608346
247086,"Инфляция вызвана высокими инфляционными ожиданиями граждан, которые выросли на фоне инфляции..",1637009332,3200875
247086,"А то, что оборотка организаций растёт из-за роста цен импортных товаров, а цб не дает ликвидность и банки соответственно не увеличивают кредиты, об этом они молчат. В моей сфере товар просто подорожал за год около 40%, вход дороже, доставка дороже, а ликвидности в стране всё меньше. Оборотку поддерживать невозможно уже",1637036262,68471239
247086,"Залезли в ВТО, придерживаются мировым ценам, а потом - ""а что такое?!🙄 а что же случилось?!🙄 а кто это сделал?!🙄"" А..., да пофиг..., скажем, что погода и вообще, люди сами виноваты🤷‍♂️
Сссуки!!!
1. Беспроцентное финансирование банками реальный сектор экономики!
2. Жёсткий контроль цен на внутреннем рынке! А на внешний, пускай, хоть за ахрилиарды продают!
3. Пермонентная ликвидация банков и компаний, допустившая, хоть на 0,1% повышение цен или ставки!

Хотя бы с этого начните!!!",1637039918,174896786
247086,"Ну, да народ не тот... А они,  ...ля белые и пушистые!!!",1637082953,289841624
247086,"Читайте профессиональных экономистов, а не чиновников от ЦБ РФ. Как может чиновник с узким кругозором и отствием системного экономического мышления давать верный прогноз?!",1637086334,51377480
247086,Уже совсем лень что-то придумывать стало),1637089207,174128859
247086,,1637164577,527264401
246741,Остались люди которые верят в эти цифры?,1635704385,5079913
246644,"https://expert.ru/2021/11/2/v-ssha-vspomnili-pro-rossiyskiy-supertank/
Статья про Российский танк, а на фото танк США, причём взятый из игры",1635963771,2779402
246611,"Короче, Склифосовский... Надо перезагрузить систему.",1635234944,219523024
246611,"Так и будет, эта система начала рушиться, дальше только хуже, удобрения по 40 уже, топливо дорожает
Хоть бы налоговую нагрузку снизили на гсм, НДС
Эти подачки не спасут",1635287315,211798738
246611,"С уверенностью смотрим в завтрашний день, уверены, что будет еще хуже 🤣🤔",1635340814,984524
246611,"Думали что дно, а нет от туда постучали..",1635433590,681450293
246590,Помойки будем брать👊,1635147756,633471681
246590,"А что Набиуллина всерьёз считает, что птицефабрика, получив кредит по более высокой ставке, будет снижать цену на куру? Серьёзно? Проясните плз",1635148267,184608346
246590,"Опять бьют по спросу, вместо того, чтобы наращивать предложение. Никто не хочет заниматься производством.",1635152531,294658297
246590,"О, сиськи..",1635154675,42722715
246304,"В огороде бузина, а в Киеве дядька.",1634190317,138697298
246304,"Газ в России не подорожал. А вот удобрения, цена которых у производителей в валюте номинирована, да. Ну если ресурсы для сельского хозяйства страны устававливают в фиксированных ценах в твердой валюте, а потом эти расходы перекладываются в конечную цену, что это за локальное ценообразование на продукты питания? И где хваленная система ФНС прослеживания НДС, которая должна позволять видеть кто и где в цепочке поставок накручивает ценник? Или это секрет? У ЦБ своя статистика по расчетам в разных отраслях тоже, кстати, есть. Они её регулярно публикуют на своём сайте.",1634192408,51377480
246304,"Очередной высер тупой суки под кличкой Наибулина....Пусть свой сраный мозг и совесть, если она ещё осталась, подрегулирует. Подняла процентную ставку, типа для сдерживания инфляции, это у наибулиной называется - таргетирование инфляции.. Выносит деньги из реальной экономики, вместо того, чтобы их туда вливать с уменьшением процентной ставки и выпуском фиатных денег... Тупая сука блт...",1634257773,308200436
245557,Не остановится..,1632156792,343143360
245514,"Апатия,это предсказуемое состояние. Не и имеет резких переживаний, а следовательно и всплесков.Очень желаемое и всячески поощряемое состояние нынешних водил .Но у этого состояния есть побочные эффекты, связанные с простоем основных функций  государственной власти .То есть пропадает функциональность, очень шаткое состояние.",1632084420,267458420
245221,"Вранье, внутренний спрос не вырос, сырье за бугор отправляли за валюту, а внутри создали дефицит и взвинтили цены. Это за бугром вырос спрос, там бум.",1631294588,999896
244967,,1630686407,557516124
244967,значит будут грабить...,1630771997,335052945
244967,"Платить будут все ,пока не позеленеют. 😁  а выхлоп останется прежним. Почему? А потому, что В частных закрытых беседах многие говорят, «мы не понимаем, как будем этого достигать, но мы взяли на себя смелость», — отметил Решетников.",1630814391,494584939
244967,О чем это вы? О чем это они?,1630907537,169514460
244870,"ну а рост автомобильных грузоперевозок от чего зависит? От цены на бензин. Ворье качает народную нефть и ему же ее и впаривает, по рыночной цене.",1630487870,138697298
244870,"Путин сделал верное дело, с легкостью можно увидеть итоги в магазинах. Цены теперь стали вновь доступны, никто не пытается нажиться на обычных людях.",1630487955,636346913
244870,Ведь почти во всех регионах цены в самом деле перестали расти.,1630488189,418165222
244870,"Согласно статистике, в Алтае, Забайкалье, Калужской, Курганской, Нижегородской областях и во многих других регионах, как и обещал президент, цены на продукты были снижены",1630488801,315402790
244870,"Рост цен на продукты неизбежен, но Путин старется стабилизироват эту ситауцию",1630489632,640119947
244870,Национальное достояние уходит не в те руки,1630508529,1693057
244870,"Надо было просто ещё в 10е года создавать государственную мультиотраслевую корпорацию, которая могла бы объединить в единую цепочку все этапы производства и продажи товаров. Тогда бы можно было регулировать цены на оптимальном уровне и е позволять экономике показывать очередные красные линии.",1630566369,219523024
