post_id,text,comment_time,from_id
19508041,Та и дожить то не мечтаю))),1675196412,132720354
19482240,Прямо беда!😭,1674366490,698957865
19482240,Е....ать! А россияне прям обогатились! В квитанции за жкх смотрели?,1674366718,409469450
19482240,"Россиян ""успокаивают"" такими новостями? Может быть про наши проблемы начнёте писать? Или у россиян всё Супер???????",1674368044,324792529
19482240,Ну это их велике итальянские проблемы. Потеряли?! Пусть ищут!,1674368233,379617231
19482240,"пускай скажут спасибо своим властям, которые захотели подлизать американцам",1674369364,707326566
19482240,"Туда им и дорога. Хватит помогать, предатели. В пондемию только мы им и помогали",1674370413,742327386
19482240,,1674373634,590010006
19482240,Пусть больше США подмахивают и Украине помогают.,1674396945,587755572
19482240,"Итальянцам хотя бы с климатом повезло, там сейчас мягкая и теплая зима",1674474649,105915385
19468699,Ждём очередного повышения цен на процент индексации от МРОТ?))))),1673896195,41595317
19468699,Ну если только цен,1673897532,73326633
19468699,"Ну как же помню ""амерам и еэсовсам кердык."" Газ дорожает бензина нет. И тут мы получили платёжки. Так это у нас все дорожает? А говорили у них?когнективный диссонанс.",1673933818,26368437
19468699,Лучше бы цены не повышали!,1673941588,591352769
19455922,Все равно цены вздуют в разы вашей индексации,1673384801,151609204
19455922,"Ещё б работали медики хорошо, скорую час ждали. Когда приехала уже поздно было.",1673416558,38149104
19418379,Уже ж смеялись в прошлом году?,1671912184,772673318
19418379,А когда пенсия  12 т. р станет хоть ближе к средней 25 т. р.? ... И повышается на копейки!!!....,1671912606,273160603
19418379,"Зачем пишут то, о чем не знают? С 1 июля 2022 года пенсионеру выходящему на пенсию, не надо ждать трех месяцев для индексации. Если, например, уволился 31 октября, то 1 ноября сведения уже подадут в ПФР, За ноябрь пересчитают, а в декабре пенсионер получит все уже проиндексированные деньги, плюс те, которые ему не выплатили в ноябре.",1671914526,317656060
19418379,""" с 1 февраля — ежемесячные денежные выплаты всем получателям, кому они положены'  - 
КОМУ ПОЛОЖЕНЫ? Тайна, покрытая мраком..",1671915792,272202974
19418379,пусть сами проживут на 21800)),1671916311,4294431
19418379,И квартплату поднимут у нас в городе на 15% 🤔,1671935723,710635750
19418379,"Да, Новый год будет тяжелым для всех с таким повышением на все, что не приколочено.
Хорошего ждать не приходится.
Лишь бы мирно жилось всем на планете.И здоровье не подвело.",1671937288,547928039
19418379,👿,1671938001,465398637
19418379,,1671938012,427616446
19418379,Где прибавили там и убавили,1671938735,75481722
19418379,Что- то я сильно сомневаюсь насчёт налогового возврата ..,1671939998,690184592
19418379,Новости Буркина-Фасо😡,1671940453,509664557
19418379,"Чушь полная, кормят годами.",1671940623,209525533
19418379,Ю,1671941534,266864322
19418379,зачем работающим пенсионерам платить пенсию?!.,1671942263,165468845
19418379,В. Москве на 10 проц а на. Севере. Надо на 15 тогда,1671943695,494496494
19418379,"Кому-то очень хочется, чтобы люди работали прямо до смерти...",1671943808,166635725
19418379,Путин обещал 8.9 и где,1671945588,344391757
19418379,Хорошая новость,1671946935,193578184
19418379,"Не пудрили бы они мозги пенсионерам...
Назначили пенсии ,которые заслужили...
При стаже Северном 35 лет и Ветеран труда — пенсия 19.800=00
Но это же несправедливо....
Чинуш бы оторвать от кормушки где они сидят годами и для народа ничего не делают — на все бы хватило... и пенсии были бы достойные....",1671947790,602924095
19418379,Опять в Москве добавки,1671949938,533755697
19418379,Пенсия 10 тр а где 21тр,1671954544,480969105
19418379,"Питер. Цены на продукты +30%, коммуналка, свет, газ и прочее +9%, проезд  дорожает. О стоматологии даже не мечтаем. А пенсию индексируют на 4,8%. Ну как так то? Хочется посмотреть в глаза чиновнику и КО, который ""выдаёт на гора"" цифири инфляционные.",1671954692,1084903
19418379,"В нашем городе, как федеральном, никогда не слышала, чтобы что то пенсионерам подбросили, как в Москве, например, ни во время индексации, ни на день пожилого человека, как в др. регионах, ни в каких др. случаях… Может я что-то пропустила, или в нашем городе пенсионеры ничего не заслуживают, кроме астрономических цен на лекарства, повышения тарифов на коммунальные услуги, и зашкаливающих цен на продукты???",1671955120,308109178
19418379,"На усмотрение регионов! Наш регион усматривает,как и где ещё можно ужать по больше,а не прибавить.",1671955411,637395526
19418379,"Знаете ли вы все , что НЕ начисляется пенсия или пособие по старости КОСМОНАВТАМ , ПИЛОТАМ , ИСПЫТАТЕЛЯМ ЛЁТНОЙ ТЕХНИКИ , СТЮАРДЕССАМ ??????????? Кто — нибудь ответит за этот произвол и за такой геноцид ???? За что наказали авиаторов и космонавтов , стюардесс ??? ЗА ЧТОООООООО ???? На эту тему все предпочитают молчать ! 🚀✈🚀✈🚀✈",1671957164,215109186
19418379,"Знаете ли вы все , что НЕ начисляется пенсия или пособие по старости КОСМОНАВТАМ , ПИЛОТАМ , ИСПЫТАТЕЛЯМ ЛЁТНОЙ ТЕХНИКИ , СТЮАРДЕССАМ ??????????? Кто — нибудь ответит за этот произвол и за такой геноцид ???? За что наказали авиаторов и космонавтов , стюардесс ??? ЗА ЧТОООООООО ???? На эту тему все предпочитают молчать ! 🚀✈🚀✈🚀✈",1671957189,215109186
19418379,"Зато получают пенсию люди, которые не работали , не имея никакой инвалидности . Я не против, пусть получают, но почему я с сороколетним стажем  получаю  почти  наравне",1671957832,389584242
19418379,"Если сократить 50% депутатов, то пенсию поднимут ещё на 5%!",1671973940,336786000
19418379,"Квартплата растёт,а пенсия у пенсионеров,маленькая.Как им прожить на пенсию в 11 500?",1671975515,590592288
19418379,Где наше достояние народа у какой кучки ?,1671976994,168506456
19418379,А в ДНР 10.000 пенсия кого не устраивает 21.000 приезжайте в ДНР,1671980310,488776590
19418379,Верните пенсионный возраст! Вот о чем речь!,1671980330,711938359
19418379,"Пенсия 12 тысяч,а коммуналка ,,,9 тыс., Как жить?",1671984017,730752820
19418379,Да не делаете не кому,1671990254,577334399
19418379,А если в январе устроиться то она уменьшится?,1671999056,214707777
19395485,,1671135017,140940585
19373271,"Деловые , в законе ?",1670347703,456820085
19373271,"🤣🤣🤣🤣🤣🤣🤣 только и могут,что обсуждать! Клоуны.",1670348449,118100484
19373271,"Обдумывают, как бы грабануть народ очередной раз. Ведь теперича не то што давича 😬 война развязана, сыны отправлены бойню. Или им всё похер, опустят народ очередной раз.",1670348589,35726941
19373271,Когда обсудит странный 20%скачек ЖКХ?,1670350001,666117373
19373271,"все для народа ... 
ой нет для себя любимых",1670366005,710688133
19373271,Либералом оказался.,1670366412,295597405
19373271,С народом бы поговорил напрямую...эх ма...,1670421425,757041504
19367605,"Макрон уже принял, пообнимался, на этом все?",1670167319,116219564
19367605,"Как говорил один конь в известном мультике  ""не смешите мои копыта"" 😁",1670167590,676697790
19367605,"Попкорном мы уже давно запаслись. Урсула, фас",1670168852,3742215
19361115,,1669925045,614908767
19361115,"Продал занюханный часть б.УССР ,что у них не гетьман то продажней предыдущего.",1669925088,570513021
19361115,"До сих пор находятся идиоты, которые в это верят? Ну и помойка этот лайф.",1669925098,12283146
19361115,Киевская обл хохляндии не оставят. Только капитуляция кастрюлек в столице хохлорейха,1669925193,762341087
19361115,,1669925313,461091768
19361115,Это долбаный фэйк,1669925598,574798288
19361115,"Поляки уж точно не упустят возможность забрать свои земли, под шумок, ещё и Венгры присоединиться захотят, а там и Преднестровье уйдёт к своим историческим хозяевам. От Украины, не оставят ничего... Браво Зеленский, вернёт земли по домам👏😀",1669925609,287953987
19361115,"Самое прикольное, что нам от этого не легче. Тем самым они придвинут и застолбят свои западные границы ближе к нам. Снабжение и доставка вооружения украм станет более эффективной.",1669925817,2271390
19361115,,1669925842,33282717
19361115,Чушь😂😂😂,1669925993,167288191
19361115,"дык, всегда мечтали....",1669926292,79720141
19361115,Сейчас нам скажут что это все все фейки российской пропаганды 😌,1669927085,319701
19361115,"Путин о прекращении Украины как независимого государства Зеленского уже давно предупреждал.
А этот укро-долбоящер всё-таки предал и продал свою страну.
Осталось только выяснить, когда Украина полностью прекратит своё существование...",1669927808,168601746
19361115,Из разряда сказки на ночь 😂😂😂😂,1669928361,25589203
19361115,Это только дибилы могут придумать!!!,1669929349,317364742
19361115,Как  то Польша отттяпала Часть Чехии. Потом Польское правительство и войска удрали в 39-м. А после ВОВ получили немецкие земли.  Вот где избранный народ а не только израильтяне,1669929574,445743603
19361115,Лукашенко очередную карту предоставил?,1669930695,268014768
19361115,,1669935568,69271840
19361115,А как же Преднестровье?,1669936997,359363324
19361115,Плевать мне на судьбу страны украина!,1669937103,42017360
19361115,"Это дураку понятно Что Украина будет Раздербанена, Все что Путин говорил До войны так оно и будет",1669939380,704236489
19361115,"Беда в том что пока мы не возьмём все эти районы там погибнут столько народу, я про мобилизованных пацанов которые будут там до конца СВО. Главное чтобы цель оправдывала средства.",1669940094,79630083
19361115,почему про румынию и венгрию ничего в новостных лентах,1669940151,93852078
19361115,"Всё обсуждают, а мы бороться потихоньку или болтать, России дела нет что ли",1669940450,651038685
19361115,"Интересно,а полякам тоже народ будет снаряжение покупать?",1669940921,133010999
19361115,Да уж ..Украины точно скоро не будет!это было сразу понятно что делят её,1669942255,610322759
19361115,"Самое страшное,что у простого ""народа"" ни кто не спросит хотят ли...?",1669942596,644002567
19361115,Сами дебилы виноваты а так всех ложить и землю забрать ! Всю и поляков и всех остальных уложить прям с укропами! В перед Россия 🇷🇺,1669942762,166472494
19361115,"Вся территория Украины должна принадлежать России, это вообще то всегда и было Россией!!!",1669942874,501196920
19361115,"Ниже первого абзаца можно не читать. Кремлевская чушь типа заражённых голубей, камаров и нацистоа",1669943423,136359552
19361115,"""-Йа-а-йа, кемьский волост, йа-йа""...",1669943609,62395083
19361115,"Много хочет- мало получит! На чужой каравай - рот не разевай! Пиши, пшики захотели 👎",1669943926,383336837
19361115,"Кто это там на Советские земли рот открыл, а ну хайло зажмурьте ироды😡",1669944133,237453236
19361115,Будем надеяться на этом все дележки и войны закончатся.,1669944533,529777950
19361115,А что это за сине-жёлтое пятно в середине? С чего ради?,1669945013,570519319
19361115,"Да пусть забирают этот гемор, они с ними до 2мировой намучались, остаётся ждать когда будет Волынская резня 2,0. Конечно это ужасно всё и не дай Бог, но они же сами возраждали традиции упа-оун в западной Украине, и нацики от туда никуда не денутся, их даже СССР не додавил полностью, гоняли уже после войны в Карпатах. Правда в пекло их всех,самый мерзкий национализм именно там возник, да ещё и развился в наше в ремя с помощью госдепа.",1669945116,508217220
19361115,Донбасс с 14 года захватить не могут а тут  уже захватили кучу областей 😁😁😁 сказочные ( фантазеры)😁😁😁,1669945775,301948917
19361115,"А лет через 80 скажут что РФ и Польша поделили Украину 😄доравнивать надо срочно львовскую область, что бы чистая пустыня досталась Варшаве",1669946175,159617731
19361115,"Цирк уехал,клоуны остались! Бред полнейший. 🤦",1669946380,700277378
19361115,Умный человек был,1669946589,61708890
19361115,"Если по жизни за долги по ипотеке могут отобрать жилье, переселить в какую то хижину. Такая же технология и здесь могут. Венгрия, Польша Румыния могут выкупить долг Украины и расплатиться с США. А США при этом как бы приобретет земли для новых военных баз, если конечно с ней будет все в порядке",1669947473,145958483
19361115,Любит народ фэйки...ну ну.,1669947493,499975206
19361115,А что на этот счет говорят наши политики?,1669948705,37269403
19361115,"Такой расклад как на карте, лично меня вполне устраивает..😏🤗",1669948737,193851876
19361115,Это хорошая карта !! Мы себя не обделили !!! В Одессу очень охота съездить. В русскую !!!,1669949086,569378628
19361115,Это вновь повторяется...,1669949557,337023805
19361115,,1669949613,756517578
19361115,Ватники схавают этот фейк.,1669950242,53676497
19361115,"Как как, очень просто",1669950497,29284903
19361115,,1669950740,625910771
19361115,До что бы Вова показал как он мыслит захват Украины 👍 до самого океана 👍🤣🤣🤣🤣🤣чтобы Америке было страшно носа показать в нашу сторону👍👍,1669951031,232543032
19361115,"Роджерс - политолог? Из него политолог, как из меня генерал!)))",1669951200,214275988
19361115,"Общую границу Украины оставлять с двумя или тремя странами НАТО очень рискованно ... они опять поднимут голову и никогда не будет там мира , как на Ближнем Востоке",1669951674,392314240
19361115,"Всё, пропала Украина",1669951926,190858771
19361115,"Так ей и надо, надо думать своей головой о своем народе, а не пресмыкаться перед западом",1669952541,160264702
19361115,И захватит же.,1669952763,247852326
19361115,"Это более реалистичный сценарий. Москва не будет препятствовать такому ходу событий, оставив за собой права на Одессу и Николаев. Хотя возможно, смысла в сохранении такого государства, как Украина, в урезанных границах, уже нет. Она будет  никому не интересна, включая самих, оставшихся украинцев, трижды преданных и трижды перепроданных Западу.",1669952796,354962625
19361115,"Не было раньше Украины и дальше не будет,история и не вспомнит что там большевики замутили с окраиной России",1669952898,7197821
19361115,"Пускай забираю, нам не жалко, забирайте!",1669953147,471592271
19361115,Полностью согласен с картой! Утверждаю! 🤣,1669953183,271148466
19361115,Не исключено,1669953703,703641344
19361115,,1669954224,174062718
19361115,Какие у вас смешные новости,1669954287,174062718
19361115,Гиена,1669954596,757281979
19361115,,1669954743,42444361
19361115,Ненуачо! Все по честному!,1669955229,292482560
19361115,"Киев не там,где надо",1669955307,175352909
19361115,Украина так-то маленькая страна была.,1669955340,720705994
19361115,Вам это ничего не напоминает?,1669955401,744209473
19361115,Как-бы сама Польша не перешла в состав России...,1669955695,279930995
19361115,"Как можно делить добычу, не убитого медведя🤔...?",1669955721,295940099
19361115,Отличный пост! Кто не верит - Гугл ваш любимый в помощь! Оторвитесь от тупого контента - огромное количество инфы в западных СМИ,1669955826,118235987
19361115,Довыпендривались,1669956918,283130792
19361115,Как государство укропия перестанет существовать и хохлоптеки перейдут к соседям а вот кто и сколько отхватит это вопрос.,1669956950,140016973
19361115,"Украина должна ис чезнуть!
Ленина и Хрущёва к чертям Собачим с их тупыми подарками!!!!
Всё равно бендеры не любили Ульянова,)
Это испокон русские территории!!!!
Украины не бывать!!!
Предлагаю просто -Украинская область!",1669957000,274261502
19361115,Я что так мало получат Венгрия и Румыния. Да Польша себя не обделила.😄,1669957163,626724015
19361115,"Сперва была империя, потом разделили евреи на республики, потом стали страныв1991, теперь чужие страны( Грузия, Украина) хотя это русские территориии и Грузия с Украиной это казачьи угодии Российской империи!!!
Хрен вам а не страны !!!
Господин президент России, верните в Российскую империю наши земли!!!!",1669957188,274261502
19361115,"Житомирская, Винницкая и Хмельницкая это максимум что можно оставить",1669957202,511597682
19361115,"А что? Самый момент предоставил
ся взять быка за рога. Как говорят в народе, - ""Лови момент у моря!"" Армия ВСУ ослабленна и потрёпанна.",1669957431,756086517
19361115,Скорей бы все разделили и все это закончилось,1669957996,12209075
19361115,Пишут что это фейк,1669958207,84988778
19361115,"Зеля чувствует что конец Украине и просит 1 триллион денег якобы на восстановление Украины . Под шумок , перед тем как сбежать , хочет видимо пополнить свои счета за рубежом . У него уже миллиарды на счету и недвижимости полно и он уже гражданин Великобритании . Семья уже давно там . Вот вам и зеля президент Украины растарабанил свою страну . Кому война , а кому мать родна",1669958838,348715188
19361115,И это правильно,1669959890,24410286
19361115,Вся суть официальной информации в любой стране на сегодня),1669960091,32242520
