post_id,text,comment_time,from_id
18383083,300 рублей,1651774545,19162836
18383083,Голосовой ввод всё растёт и поднимается кроме зарплаты,1651776855,364036617
18383083,"Да зачем вам это знать? Есть ваш рубль, на него и живите",1651778604,413819487
18383083,Нарисованные курсы… пшик,1651782779,277759996
18383083,"Раз говорят откатится, значит наоборот доллар упадет, статистика",1651785017,1331630
18383083,Цена автомобиля легко определяет курс доллара к рублю.,1651785799,570359098
18383083,1 доллар= 1 рубль👍,1651807710,132687812
18383083,Всё равно цены уже не упадут😂😂😂,1651821169,721459129
18383083,"[id185708628|Георгий], да, курс падает, а товары растут, коляска которая стоила 3200 р сейчас 6500, подъём на строительстве материалы, самая дешёвая крыша выходит 350000 т. р это односкатная, правда с работой, детское питание с 35р за баночку да 56р, и так всё, я понимаю что большенство людей живёт в хрущёвках без детей и понятия не имют что люди живут всё по разному",1651825210,535789757
18383083,200 - 300 рублей за 1,1651856756,255748667
18332067,В печь!,1650643076,61390227
18332067,"Пусть назовёт причины,почему он не спас золотовалютный фонд России,зная о рисках много лет😑",1650643112,218434026
18332067,Жулье,1650643559,645837071
18332067,Вот этой роже доверять вообще нельзя,1650644177,227756792
18332067,Силуанова с Набиуллиной к высшей мере суд должен приговорить!!!,1650644846,556556277
18332067,А разгона в самой стране расказать неможет,1650645518,563181417
18332067,Прпдатель,1650652118,637188229
18332067,Весь гайдаровский клубок к ответу!,1650657959,172680400
18332067,Гнать его надо,1650733272,388877738
18313538,"говорит что все нормально , толькоцены нпадают",1650289256,628821994
18313538,Если ничего не покупать то цены нормальные,1650289509,65587185
18313538,Маразм крепчает....,1650289676,119699134
18313538,Благосостояние россиян уверенно растёт вниз. Очередной прорыв Путина.,1650289680,685614337
18313538,Я так и не понял. Это зрада или перемога?,1650289986,16793001
18313538,Легко говорить про инфляцию с зп не менее 100 прожиточных минимума в России!!!,1650290520,698522637
18313538,"Как предупредил во вторник главный аудитор страны, ВВП России столкнется с самым большим падением с 1994 года, поскольку страна страдает от западных санкций и увольнений бизнеса после вторжения Москвы в Украину.

«В этом году ВВП, без сомнения, снизится», — заявил глава Счетной палаты Алексей Кудрин в Совете Федерации России, сообщает служба новостей «Интерфакс».

По оценкам Минфина и Минэкономразвития России, ВВП России, вероятно, упадет на 8-10%, хотя есть и «более скептические оценки», предупредил Кудрин.
«Этот рост инфляции начался 24 февраля и будет продолжаться, и он будет очень высоким», — сказал Сергей Алексашенко, старший научный сотрудник Brookings Institutions, бывший замглавы ЦБ. «В этом году инфляция будет в районе 26-29%. Это умеренно реалистичный прогноз».

Алексашенко добавил, что из-за нехватки товаров на рынке инфляция может вырасти до 50%.",1650291075,632586971
18313538,"Зарплаты нужно повышать на том же уровне что и продукты , а не бороться со снижением уровня инфляции , все равно ничего не выйдет так же как и в борьбе с коррупцией",1650291156,83573695
18313538,"забавные данные ему на стол приносят в папке,сам не хочет до магазина сходить,хоть раз в год😑",1650293440,218434026
18313538,Цены 20 лет растут...кот баюн...,1650306286,645837071
18312058,Не удивлён.,1650261748,373713028
18312058,"Бедные,мало получают.Добавьте",1650261776,280184434
18312058,"Видимо всё делают правильно, иначе бы не платили.",1650261887,50359607
18312058,Путинская кодла себе не в чем не отказывает,1650261914,708358944
18312058,"А молоко им не выдают,случайно?",1650261944,67444750
18312058,"Просрали СССР а теперь в спину смотрят,кто какие миллионы получает,😆",1650262100,196820484
18312058,Плятство,1650262146,245889421
18312058,"Не путайте Их и обычных Иванов.
 Судьба Иванов, проводить спец.операции. И обслуживать нормальных людей. 🔥",1650262716,695312219
18312058,Класс мы даже не сомневались что у них все в ажуре !,1650262822,705520825
18312058,"Да вы у половины населения спросите сколько ему нужно и сколько он должен получать на своей работе, он назовет цифры из телевизора примерно 25 т.р😁. Ты ему скажешь, что средняя должна быть, с учетом цен и инфляции в 20 процентов около 400 т.р, он не поверит, все начинается с ""головы"", а раба из большинства уже ""не выбить"" никогда, и также он воспитает своих детей",1650263094,644216767
18312058,"Про зарплаты гораздо,а вот про деньги бизнесменов,,зарплаты не имеющих боитесь и упоминать",1650263296,390365818
18312058,"А мы что все сосем , я тоже очень хороший человек,просто без высшего образования .",1650263318,697986742
18312058,Враньё!!!,1650263384,135870822
18312058,,1650263485,348916110
18312058,"Да лучше бы простым людям зарплаты повышали, за счёт работяг жируют, да с жиру то и бесятся",1650263567,602335351
18312058,"ого, первый раз такое слышу!",1650263766,417368305
18312058,"Вся верхушка так живёт,наша задача кланяться и восхищаться😑",1650263792,218434026
18312058,"Да походу , она не гражданка России.",1650263800,522335290
18312058,""" А нам все равно! А нам все равно ...
Дело есть у нас в самый трудный час - КОСИМ ....""",1650263818,688749003
18312058,Потому что рублей в стране как у дурака фантиков от конфет. Только все деньги в банках осели.,1650263856,19093226
18312058,"Это пишут ленивые бездари!!!Станьте банкирами и у вас такая же зарплата будет!!! чтобы получать хорошую зарплату, не надо было школу прогуливать и не «курить» на задней парте!!:))) А пахать!!! а то получат 3 класса образования, а пенсии и зарплаты хотят, как у начальников!!!)))))",1650264331,322766963
18312058,Они акуели!!!,1650264442,347905507
18312058,А сколько они должны получать работая в ЦБ?,1650265161,23589065
18312058,"Набибулину гнать надо в шею, это враг России.",1650266925,710296100
18312058,"Работники банка не заслуживают ту зарплату какую им сейчас платят. Особенно центральному банку. А набиулина, всем понятно уже кто она и почему она.",1650267677,710737262
18312058,"А не пора ли всю эту верховую борзоту подровнять до средней по стране,страна в кризисе,под санкциями,ведет боевые действия.народу предлагают сдюжить,а им как с гуся вода.",1650267879,429073199
18312058,"Естественно!, выдают россиянам кредиты под 28,3 %, совести вообще нет!",1650269579,168196428
18312058,"Интересно, а простые работники ЦБ в курсе ? 😂😂😂",1650270270,7521967
18312058,,1650270992,698522637
18312058,"Да многих эти санкции никак не коснулись, даже те, кто типа ушёл с российского рынка, на самом деле выплачивают людям зарплаты, потому что покидать нашу страну и нашего потребителя так-то не хотят))",1650271044,593224278
18312058,"Недовольные всегда были, есть и будут. Людей должна вообще такая зарплата мотивировать и доказывать, что невозможное возможно, а вместо этого тонна кучи понятно чего вечно))",1650271591,319442479
18312058,"Это с 90х годов так идёт везде. Чем выше должность, чем больше власти - тем значимее все себя считают, соответственно и зарплаты распеделяют. А уже частные владельцы вообще платят как хотят. Правил распределения уровня зарплат, как в СССР, сейчас нет. Всё списывается на рынок труда. А центробанк работает деньгами, а не кирпичами, и отчётность составляется соответственно, а не от количества денег в натуральном виде.",1650271888,17665932
18312058,"Что так мало, подумаешь три миллиона, это выплачивают всем пенсионерам нашего города за месяц, тебя сучку дворником хотя бы на 3 месяца поработать в зимнее время. Посмотрели как бы ты считать стала.",1650272425,586991972
18312058,"Началось перераспределение доходов , появятся новые аллигархи лояльные власти",1650273602,254517143
18312058,Вот почему в стране повышается СРЕДНЯЯ зар.плата.,1650274917,159080184
18312058,"А че, в других ведомствах намного меньше? Кормить такую армию чиновников, которая всё время увеличивается, пупок у народа ещё не лопнул?",1650274939,201281732
18312058,"Раскачка мозгов для дурачков, очевидно",1650278147,212986984
18312058,"Зарплата в ЦБ, в том случае оправданы, если доходы населения ДОСТОЙНЫЕ.",1650279542,507291568
18312058,"Они не зарабатывают, на полях не пашут за счёт чужих ,как мы  боготеют, а мы б... ть нищие, ссуды за такие большие проценты берем",1650280954,208355585
18312058,"Вся экономика страдает из-за банков проценты очень высоки наверно хватит народ ставить раком куда смотрит Правительство может сдаться Китаю, за месяц наведут порядок везде включая магазины",1650297032,581913116
18312058,Ваууууу..,1650354747,593325603
18312058,Как мы все рады за наш ЦБ Не зря на Украине гибнут наши ребята,1650367399,659129106
18299753,"Путин виноват, кто же ещё...))",1650010116,148462791
18299753,А в России кто виноват?,1650010545,342782304
18299753,"Вспомнишь Задорнова - годы прошли после выборов, а они только созрели.",1650012891,343947216
18299753,"Инфляция у них, а виноват Путин? Хорошо устроились американцы! За всё происходящее в стране отвечает президент США! С него и спрашивайте! И не сваливайте с больной головы на здоровую.",1650014786,518164653
18299753,"А здравый смысл,тем временем,растёт в США. Нужно немного потерпеть и Украина в скором времени,станет изгоем во всём мире!!! Сила в Правде 🇷🇺💪",1650016972,39759533
18299753,"Слушайте, у пиндосов всегда Путин виноват, не удивлюсь, если они скажут, что у них там погода из-за Путина меняется🤣

Только вот простые американцы не так тупы, чтобы наивно думать, что в этом президент РФ виноват👇🏻",1650019170,707662438
18299474,"Если  такая инфляция  , то  индексация пенсий  сколько  %  будет  , также  8,6 %  или  как ❓  Может  хотя бы 10 % .",1650007874,618692534
18299474,"Сахар в январе 45₽, сейчас- 80, не выходит 16,7% как не крути....",1650014197,533939300
18299474,"Самое время оформлять вклады и преумножать деньги, точно не под матрасом их держать. В промсвязьбанк положил под 19% годовых: 1 - защита от инфляции, 2 - возможность умножить средства)",1650031574,614183164
18299474,"Это типа как до всего этого годовая была 7%? Ха, ха, ха!",1650128852,201281732
18230184,Да ни че не подешевеете,1648819656,227756792
18230184,"Падает, только был 73р, а сей час 83 р, да ещё и 12%сверху налог отныне, вот вам и падает, ну как и все остальное. 🤣🤣🤣",1648819666,310024151
18230184,"Цены выросли в разы, а если снизят то на копейки",1648819667,708358944
18230184,"Что то не заметила понижения цен. Как взлетели,так и остались.",1648819704,177936184
18230184,Наоборот все подорожало!,1648819737,470038403
18230184,"Капуста вчера была 95, сегодня 150. Дешевеет всё",1648819737,677397231
18230184,Переписываются только на повышение,1648819746,38260263
18230184,Бананы были 109 а сейчас 115,1648819774,470038403
18230184,Автор статьи большой шутник))),1648819797,38260263
18230184,сейчас сахар подешевеет....,1648819806,28830038
18230184,Барыги своего не упустят.,1648819823,161261744
18230184,"Доллар в России как валюта уже не сушествует( все опирации с ним запрещены), поэтому стоить он может хоть сколько ! 🤣😆😆
Life, вы решили 1 апреля над страной поржать????",1648819967,254530853
18230184,На автозапчасти пусть цены опустят,1648820063,711806538
18230184,"Ойц,вы сами то в это верите?!Если поднялось в цене,то не упадёт…",1648820183,15849803
18230184,"Ойц,вы сами то в это верите?!Если поднялось в цене,то не упадёт…",1648820187,15849803
18230184,"Враньё, как всегда.",1648820459,502067258
18230184,Вы точно про Россию пишете?,1648820480,143456232
18230184,"Ауууу!!)) Мы в РОССИИ живём, тут НИЧЕГО и НИКОГДА не дешевеет, с сожалением конечно же ((",1648820507,106096380
18230184,"Ага поднимали все быстренько в течение месяца, а как курс вернулся, цены не торопятся что-то снижать😒",1648820525,201177810
18230184,"Лишь бы дальше не подорожало, пожалуйста.",1648820639,106096380
18230184,Граждане! С 1 апреля же)),1648820735,10073122
18230184,Как бы доллар не дешевел продукты не подешевеют.,1648820749,222841007
18230184,"Цены реально снижаются. Только взлетели они на 50-60%, а снизились на 10-15%. Закупки то идут по новым ценам. Поставщики наживаются, не сетки. При этом снижение более заметно в сетках продаж техники в частности телевизоры, ноутбуки, смартфоны. Крупная бытовая не снижена. Продуктовые сетки снизили на 5% и то, на те товары, что не особо пользуется спросом населения. Как-то так пока",1648820974,423297211
18230184,То есть айфон13 можно за 600 баксов сейчас купить?,1648821078,14203264
18230184,А где бензин подешевел? Сибнефть 54р,1648821459,394607482
18230184,"Ни какие ,ни на сколько 🤷🏻‍♂️все свободны!",1648821787,415581070
18230184,"Рынок валюты для физ. лиц умер. Курс может быть каким угодно, но пока любой человек не сможет без ограничений ее купить и снять наличные - все это уже фейковые значения. Короче привет из СССР. Там курс был вообще 56 копеек, при реальном (чёрного рынка) 10 рублей за доллар.",1648821796,635605956
18230184,"Сегодня в ,,О-кей,, кефир 1%  100 рублей!!! А зашел в , Пятерочку,, - как и был 63 рубля. Средство для мытья посуды за 17 рублей убрали, Ферри по 98 поставили ( в Окее ). Бардак и алчность.",1648821998,563901854
18230184,"Ничего не дешевеет , наоборот цены стремительно идут вверх!",1648822020,599520520
18230184,"Новости из параллельной вселенной 😁 Враньё всё, от первого, до последнего слова.",1648822044,247140818
18230184,Некоторая электроника дешевеет. И это факт. Про остальное не скажу.,1648822162,278538588
18230184,Продукты всегда были в особом статусе.И чуть что случись слишком недобрасовестные продовцы этим пользуются.Купят мол по любой цене....,1648822600,311036950
18230184,Игорь Муртазин пьян сегодня по ходу! Явно ни в себе! 😁,1648823104,494953020
18230184,"Сколько живу вижу, что цены только идут вверх",1648823331,633517183
18230184,Доллар может и упадёт.... А капуста и лук нет.... И сахар... И хлеб... И молочка и т. д,1648823461,608057283
18230184,"Сахар в понедельник 69.99 сегодня пятница 75.99
Ростовская обл,г.Батайск магазин,,Магнит,,
Дешевеет на глазах",1648823547,443798036
18230184,"Уже подешевели! И стремительно продолжают дешеветь дальше! Прям на глазах! Если так дальше пойдёт, то мы рискуем скатиться к неконтролируемому падению цен до таких мин. значений, что продавец будет отдавать их просто даром! Поэтому, пора уже и остановиться! Не надо больше! Хватит нам падения цен! Харош!",1648823712,201281732
18230184,"переименуйте группу либо в ""минизо"" либо в ""миниправ"" в конце то концов",1648824133,17336354
18230184,не смешите мои ботинки😑,1648824786,218434026
18230184,С первым апреля!,1648824839,120092926
18230184,Сегодня живём не от доллара а от хамства!,1648825045,601571397
18230184,таких товаров нет,1648825833,277452074
18230184,"А мне пенсию подняли на 3000 теперь 38000 🤣 вот такие дела в России происходят, спасибо страна👍",1648825840,589010446
18230184,,1648826283,640361399
18230184,Подешевеет ?! И не ждите. С 80 -х прошлого века ни чего не дешевело.,1648828391,49371495
18230184,Квартплата когда подешевеет?,1648828924,470038403
18230184,Вы видели цену на туалетную бумагу? Она с каждым днем на рубль дорожает,1648830487,135039417
18230184,Самое ужасное что если доллар  пойдёт  в верх  то цены опять начнут расти с уже повышенной цены,1648831439,68519299
18230184,"Никакие, все как всегда блин",1648832154,1855196
18230184,,1648837139,576535961
18230184,Какие продукты дешевеют?) Вы кому сказки рассказываете?) Я 3 часа назад был в магазине сахар 93р за кг🤣 патриотичненько,1648838417,100577052
18230184,Раньше все было стабильно.Даже выбита была цена на товарах.А сейчас ..Сегодня бананы 80..Завтра 110..Через два дня 90...,1648844727,70176766
18230184,Я хочу чтобы RTX 3090 Ti стоила в районе 50к,1648858424,363968049
18230184,"Соду брал вчера за 36 рублей, 1,5 недели назад 95!!! стоила",1648860644,250358294
18230184,Дешевеет только наша жизнь!,1648883816,457713632
18230184,Вы в это верите? Жадность местных барыг не даст это сделать.,1648887237,124873963
18230184,Вчера в 5ке ценники на +5 рублей переклеивали,1648888254,27573338
18230184,"..ох,не говорите гоп..",1648889903,589480409
18230184,"Пока не знаю, но в ДНС вчера цены были ровно в два раза выше, мы хотели с нового года купить холодильник и стиральную машину, поэтому цены млнитиром. Холодильник из цены в 50, превратлся в 102, а стиральная машина из 17 в 29",1648899322,258567821
18230184,"Пресловутые прокладки Тена,стоили 174р,а сейчас 194,вот это прогресс на понижение😲😲😲😢😢😢",1648900032,469229914
18230184,С 1 апреля,1648900422,555943330
