post_id,text,comment_time,from_id
18808032,"А вот США наоборот,своей выгоды не упускает,призывая страны ЕС ужесточить санкции,сами ослабляют,в угоду себе.",1658392942,87920355
18808032,А россиян и украинцев не развели те же американцы? Это же их классика жанра - стравить две страны между собой и греть на этом руки. Не впервой такое проворачивают,1658393245,283534027
18808032,Свои грехи не посчитал перед Россией.,1658393284,589345272
18808032,святой......,1658415445,277452074
18808032,"Часто стал пиариться,боиться что забудут,как московский мэр",1658433719,734531314
18808032,"Ха ха ха, не виноватые мы",1658486677,416841077
18794877,"Да и хрен бы с ней, у нас своих дел полно.",1658208833,532001506
18794877,Зима близко,1658208859,166596520
18794877,,1658209135,106287514
18794877,"Нам то что до Европы.Как-то по фигу,что им там угрожает.Они сами пришли к этому,антироссийские санкции против них же и работают.",1658209213,300270981
18794877,Вообще не волнуют проблемы Европы.,1658209304,313954527
18794877,"Если это публикует лайф то все понятно 
А что лайф не говорят про главного редактора который имеет квартиру во Франции и дом",1658209550,500750242
18794877,"Во всём виноваты америкосы!!!
Америкосы главные террористы в мире!",1658209595,538016252
18794877,Замёрзли падохли,1658209726,137222532
18794877,,1658209816,546871955
18794877,"А в России как дела? Продукты подешевели? Или коммуналку снизили?
Зачем нам эта информация от непонятных источников?",1658210100,21754315
18794877,"У нас будет тепло и светло,если что продуктами с огорода прокормимся,бензин есть,цены кусаются но жить можно.А Европе пламенный привет,пусть и дальше поддерживают клоуна и ждут пока Путин проиграет.Их просто просили не лезть к нашим границам со своим НАТО и это их выбор.",1658210582,570513021
18794877,"Адские санкции США против России привели к МЕГАКРИЗИСУ в Европе! Прикольно, Продолжайте в том-же духе. Как говорится меньше народа, больше кислорода🤣",1658210911,722183944
18794877,"Снимут санкции с СП2, если захотят развиваться, и всех делов. Могут и на биржу в СПб пожаловать за ресурсами. Вариантов тьма.",1658212276,699560948
18794877,Пусть пожинают свои безумства по введению санкций в отношении России. Узнают по чем фунт лихо....,1658213582,602924095
18794877,Очень хорошо. Мы рады за них.,1658214578,147775665
18794877,"Все, кто думает,что Европа живёт в достатке и лучше нас. Знайте! Это все временно! Вспомните Грецию.",1658215574,359708214
18794877,Всем у кого  красные манишки завтра принести с собой,1658228965,177356193
18794877,"У ЕС дела мега хреновые. Газ не успевают закачать, а посевную фактически просрали.",1658266831,6169198
18787464,"скот нацистский
твои граждане тебя судить должны за подрыв экономики, и осознанного её уничтожения...",1658106457,567695241
18787464,"Свои принципы при выше чем народ в своем государстве, это очень тупо. Там реально вместо мозгов мясо говядины",1658106559,626648168
18787464,"Пускай продолжает в том же духе - европейцы забыли цену русофобии, пусть вспоминают.",1658106565,8988941
18787464,"Держись Европа за штаны!
В то время, как жиреет США,
Команда Вам дана от них:
Мяса не есть! Надеть всем  свитера!

Держитесь! По другому ведь никак!
""Свободная Европа"" угасает,
Лишь по тому, что: ""Кто Европе враг?""
Ей США определяет!!!

Держись, Европа!!!
Нет! Держись Народ!!!
А Немцам бы, запасы сделать для колбасок!
А то ""Свобода"" так и прёт!
Из снятых про Россию страшных сказок!",1658106642,685943669
18787464,Влезли в чужой конфликт. Ввели геноцидные санкции на уничтожения народа в России но не вышло. Теперь пускай бумеранг ловят. Евросоюз должен пасть.,1658106644,716943042
18787464,"Терпила,начни с себя.",1658106828,345252535
18787464,Ну пошёл на хутор бабочек ловить!!! 🤣,1658107083,494729410
18787464,Ну ниче! Через год два Шольц уйдёт в отставку и с другим канцлером легче будет договориться,1658107167,483954945
18787464,"С такой политикой , ему не долго осталось сидеть в кабинете!",1658107379,38620589
18787464,Осенью в отставку сам уйдет,1658107420,556836197
18787464,Твоя песенка спета,1658107667,505318158
18787464,Боты в комментах скулят 😎,1658107717,180124479
18787464,Флаг в руки и на минное поле😂. Утопит свой народ.,1658107871,388121690
18787464,"С упорством идиотов будут ждать, пока Украина вернёт Крым?",1658107904,558742081
18787464,"А Вы мучайтесь, а нам по...рать на ваши санкции.",1658108346,573747856
18787464,"А если сократить слова Шольца, то будем примерно так:"" мы готовы пожертвовать людьми, ради своих целей"". Ему тупо все ровно, что из-за их санкций, страдают люди, тогда другой вопрос, а что вы скрываете?! Почему готовы идти на такие риски?! Или вы понимают, что после принятия условий Москвы, Шольц и подобные правители, окажутся как минимум на улице, да и пусть начинает думать о своем будущем, как бы, упаси Боже, люди не устроили самосуд",1658109038,268249909
18787464,Американская марионетка,1658109132,496829798
18787464,"Мыши кололись, плакали, но 
продолжали есть кактус это выражение как раз в тему.",1658109411,40021408
18787464,"""На зло бабушке, отморожу уши"" 🤦🏻",1658109438,23864394
18787464,Что зеля что этот два нацика,1658109540,535451376
18787464,Его точно немцы пустят на колбасу.,1658109605,17719421
18787464,"Никто такую политику терпеть не будет, сами пошли против здравого смысла. Гейропу ждут большие перемены.",1658109676,571691451
18787464,"Он: ""Мы доконца будем поддерживать Украину""
Так же он: ""Извини Украина, но турбину нужно отдать России, ничего личного""",1658109860,521421214
18787464,Пусть доживут до октября посмотрим как это им понравится!!!!!,1658109954,168070810
18787464,"Deutschland Uber alles, звучит не так весело, с таким канцлером. Самоубийственно звучит",1658110245,641385519
18787464,"Вы больше идите на поводу у США и скоро сравняетесь по экономике с прибалтами и украиной.Но будте принципиальными-ввели так вели.А то начинаете,эти санкции оставить,эти на удобрения и продовольствие отменить.Как проститутки.",1658110356,543286426
18787464,Ни чему их жизнь не учит)) а что же тогда немцы скулили чтобы турбинку канадцы вернули? Предлагаю ее еще год проверять. Вдруг диверсия,1658110805,21575608
18787464,Ну и рожа,1658111547,718074824
18787464,Хенде хох !Ливерная колбаса!,1658111705,735304797
18787464,"Ну и сидите в доме всем Евросоюзом. Трудно конечно, но мы переживаем ваши санкции, в конце концов вас тоже надо проучить,а то зажрались и разжирели на воровстве,",1658112587,533156496
18787464,"Ох и клоун, засиделся однако.
Скоро тебя свои немцы скинут",1658112684,501166134
18787464,Не пойму ни как они вовсе сдурели?,1658112908,466329157
18787464,"Немцы думают что понабится отставка, а не выдержка)",1658113338,697717319
18787464,Да мы не против! Пусть будут санкции... Мы честно их не видим! А вот они пусть вводят! У них же жизнь мёдом намазана! Вот и посмотрим через пару месяцев... Нам даже лучше! И снаряды бережем и распыляться не придётся на 2 фронта,1658113406,3351135
18787464,Германцы стали заложниками амбиций ливерной колбасы,1658114054,5138778
18787464,Жалкий фашик,1658114456,665978551
18787464,"Гнать сраной метлой таких руководителей, которые не думают о своём народе, на благо дедушки  Байдена",1658115066,586844596
18787464,Что можно ожидать от потомка фашиста?,1658115593,487892393
18787464,"Они думали, что Россия смолчит? вот и получайте!",1658115658,298076132
18787464,Ну и страдайте дальше кто вам мешает ушлепки о народе нихрена о своем не думают дурни,1658116681,257049151
18787464,Народ Германии уберите этого клоуна,1658116903,430838497
18787464,Всё только начинается😉 обиженная ливерка 🤣,1658117462,272247260
18787464,Подождём до зимы...,1658118412,544198364
18787464,"Вся Европа должна сша денег, поэтому и выполняют навязанные из Америки решения",1658118504,46788307
18787464,Тварина фашисткая💩,1658120170,609983264
18787464,"Его самого скоро снимут,он пкрвый на очереди,кто дальше.",1658120931,712464070
18787464,"Так ответил, что будто его Россия попросила снять санкции🤣 Ваши же и ноют о послаблении. Да хозяева ваши фашингтонские сами уже лазейки ищут и ослабляют по тихой грусти.🤣",1658121148,165578765
18787464,Ливерная колбаска!,1658122731,216815226
18787464,"Скоро спросит Морозко : тепло ли тебе  Германия,тепло ли европейская ....
Это пока присказка - не сказка.... Сказка будет впереди🙃",1658124006,7343689
18787464,Куда денетесь прибежите как миленькие,1658124767,555150205
18787464,"Да нам нас рать чего ты там не будешь снимать, кусок отброса",1658125258,709298159
18787464,Ливерка всех немцев на колбасу отправить хочет,1658125538,339652864
18787464,Вот когда первого под суд.,1658125603,478383153
18787464,а  мы не просим их снять,1658126163,101116852
18787464,"Ну-ну. А чего схуднул-то так, Олаф? Режим жёсткой экономии включён уже?",1658127744,69336646
18787464,"А Шольц похож на одного из персонажей  в ""Девчатах"", помните, Да был тут замухрышка какой то.",1658129136,721213571
18787464,Шольц жаждет крови ..До последнего украинца..,1658136500,695264552
18787464,"Этож как? Им руку помощи предлагают, а они требуют полный пансион.",1658140639,6169198
18787464,Скоро этот арбузик нас покинет: не долго музыке играть!,1658144815,584469869
18787464,Порвут его скоро как прелые трусы свои же сограждане !!!,1658154075,586692919
18787464,"Das 4 Quartal koomt. Eure Aktionen,  Herr Bundeskanzler? 
Wo warmst du den Hintern auf?",1658158889,705203535
18787464,Задний ход включил. Молодец. Хоть опомнился. Еще одна наша победа.,1658163608,276436617
18782827,,1658042648,17719421
18782827,оо новые эксперты теперь индусы наши братушечки,1658042653,374799304
18782827,Желаю ВВП удачи в этом праведном деле... поскорее бы!...,1658042697,462538830
18782827,Кукушка его настигнет окончательно до Нового года,1658042862,409334998
18782827,"Вы как этот, который пургу несёт, а тот не знает что он несёт, такие же клоуны _ пургоносцы,",1658042974,157649949
18782827,"а откуда эта духовная нищита?? и проблемы
мам нужно только любить) и заботится о них
но слушать прекрасно свой разум (Гуру)

страх отец сознания
а мысли материализируются - если их подпитывать
так можно навлечь проблем на свою голову ))
думая не своей трезвой головой = в моменте тут и теперь
хоть и под
одним небом живем - как говорили наши предки !
(по современному = one lоve)
но видят то глаза личные и несут ответственность
а что есть Любовь?

и не факт что поп отпустит грешок и он полегчает в своих кармических узлах
хотя поговорить и отвлечся можно с кем угодно
а сила может проявитьСя через что и кого угодно
главное снять эти рамки и слышать и вовремя здорово реагировать
в моменте тут и теперь
танцуя в лавируя в ритмах Вселенной
но даже язык слов он слишком медленный
а такты и ритмы черезвычайно активны
впадать в механические реакции",1658042999,986628
18782827,"Байден такой упрямый чёрт, что по любому будет воевать до последнего украинского солдата.
А Путину надо брать Одессу, чтобы нанести ещё один мощный удар по Байдену...",1658043043,168601746
18782827,Это не россия там не будет катастрофы а выберут другого .а мы увы лишены этого и будем терпеть и ждать смерти.,1658043076,524606169
18782827,"Слабоумие и маразм Байдена убивают,а Путина так по привычке приплили.😏",1658043500,300270981
18782827,"интересно, Байден об этом знает, с улыбкой управляет мировыми процессами решая любой вопрос😑",1658043706,218434026
18782827,Что тут анализировать 😂😂😂,1658044742,125563488
18782827,"За Байденом стоят демократы, они то и делают политику.",1658049483,689868838
18782827,"На любой государственный пост надо избирать психически здоровых людей,не склонных к алкоголизму и наркотикам,ведь есть комиссии,принимающие документы,пусть требуют и медицинские справки.Байден болен,может,это кара ему за зло ,что творил на Земле.",1658052865,421258304
18782827,У них есть Выбор! У нас Нет((!!!,1658055069,250130729
18782827,🇷🇺🇷🇺🇷🇺,1658057739,225197446
18770568,Вроде седая а соображения нет совсем,1657868551,559636114
18770568,"да да))) Только ВВП давно всех предупреждал и есть много его предупреждений на этот счёт. но слушать ни кто не хотел и поверили америкосам что они справятся и прикроют))) но самое главное европу ждёт впереди сказал ВВП в начале СВО : небывалый наплыв мигрантов, и это будет писец для европы",1657868572,739799416
18770568,"Этой бабушке прогулы на кладбище ставят,а все туда же,рассуждать о глобальном.О вечном думать надо ей уже.",1657868584,428705840
18770568,Пусть говорят.,1657868586,313954527
18770568,Сами сделали что хотели,1657868588,27002811
18770568,"Уже седая, а голова пуста",1657868593,320187630
18770568,Сами себя вы убивайте своими санкциями.,1657868595,175612095
18770568,а мы говорим причина в вас и в святой инквизиции и калониальном подходе к соседям и недобросовесной конкуренциии и главной причины войн - духовной и мат нищиты -и дисгармонии,1657868621,986628
18770568,В дом престарелых её. Нести подобный бред и мочиться в памперс.,1657868679,143435189
18770568,"Америкосы и их прихвостни шарахнули сами все,а виноватить надо крайнего,а кто крайний?Правильно Россия.Идиотизм высшей степени.",1657868682,428705840
18770568,вот упорно бревна в своем глазу не видят,1657868695,599167239
18770568,"А попробуй санкции отмени, много чего положительно скажется на ваши экономики )",1657868731,34119855
18770568,,1657868755,232084634
18770568,Дура!!!??,1657868766,262214670
18770568,"А сколько войн и конфликтов развязывали США, сколько всего ими уничтожено. Это она в расчёт не брала? Боже, похорони уже эту кровавую квази страну",1657868803,99005370
18770568,"Только Санкции против России 🤣… вот как-то совсем уже не смешно! уже не знают, что придумать 😳",1657868831,20604435
18770568,😱,1657868857,554555904
18770568,😳,1657868902,24691883
18770568,Это США санкциями несут проблемы мировой экономики,1657868911,6426627
18770568,"То есть санкции ввели они,а виновата Россия?😅",1657868912,12541808
18770568,Маразматик,1657868937,666721135
18770568,Эта ветошь на ладан дышит и всё туда же,1657868945,509887
18770568,"Прежде чем кидать грязь в Россию,подумайте,до России долетит она или нет,вопрос . А вот на вас она точно останется,кто пытается обвинять",1657868958,350733276
18770568,"По мнению Барака Абамы- Россия это региональная держава…. Получается, что региональная держава влияет на экономику всего мира? Либо Абама был не прав, либо США - не такая уж и великая мировая держава, которая зависит от региональной державы!)",1657868962,12896735
18770568,Шезефреничка,1657868977,195056255
18770568,"Америка почему ни за что не несет ответственность?
За разрушение и уничтожение многих стран и народов.
Вмешивается туда куда ей не следует вмешиваться.
Вот зимой замерзнет и сдохнет с голоду вся Европа — вот посмотрим кто пакостит миру своими санкциями....",1657869011,602924095
18770568,"Коронакризис: 🗿🗿🗿
Рост инфляции во всех странах еще в прошлом году:🗿🗿🗿
Природные катаклизмы, типа засухи в Африке:🗿🗿🗿",1657869024,153367688
18770568,"Если плюнуть на Россию, она утрётся. Если, плюнет Россия, весь мир захлебнётся. - Маргарет Тэтчер.",1657869043,170077243
18770568,Ну и дура😡👎,1657869050,360554155
18770568,"Все таки Россия сверх держава  номер 1 , сами признают это своими заявлениями",1657869075,650212344
18770568,Дурная бабулька🤷‍♂️,1657869146,81502222
18770568,"Старческий маразм, вот он)))))",1657869166,46846809
18770568,"Давит на жалость и на поддержку. С Европой же проканало им, только уже поздно верить в сказки)",1657869276,281025530
18770568,"Мне одному кажется или кому-то ещё, что они там курят что-то☝☝☝☝🤣🤣🤣🤣",1657869312,173286972
18770568,"Куда не глянь, везде Россия виновата, обсуждают, значит боятся....",1657869356,556508718
18770568,"Ну и расчет то был на это...У США пример берем, у них учимся ...",1657869445,261976758
18770568,"Подружка Байдена, на пару дули воробьям крутят 🙃",1657869490,393830197
18770568,"Насколько циничная особь,жесть",1657869501,304499343
18770568,"А до 24.02.2022 года никаких проблем в мире не было? Ни эпидемий, ни голода, ни нищинсивующих стран, из которых люди массово эмигрировали в более благополучные страны. А уж про мировую экономику и говорить нечего, её до этого никогда не штормило и никаких кризисов не было.",1657869533,94959489
18770568,Россия молодец !!! 🇷🇺 так держать этих западных шакалов пусть знают своё место🤣😂,1657869593,473304827
