post_id,text,comment_time,from_id
18618458,"Вырезали из всего интервью маленький кусок, единственный который понравится z патриотам) 
Полная фраза говорит что они настроены на долгую поддержку Украины, несмотря на усталость которую провоцирует этот конфликт. Ну и ещё он произнес много интересного, но об этом наши новости конечно же писать не будут",1655935263,83589437
18618458,"Сдулся, лахмодей! А зачем ездил к Зеленскому?
Какие террористы, не дальновидные. Вам,, всё прекрасно и доступно Владимир Владимирович, объяснил.👊 Доходит, как до  жирафа. Сами себя уничтожите, идиоты. 👊👊👊",1655935263,70453718
18618458,"Англичанка гадит,ничего за 100 лет не изменилось,колонизаторы хреновы!Только крови будет больше от вашей поддержки нацистов,но Победа будет за Россией однозначно!",1655936453,454458467
18618458,"Он что, причесался всё-таки?😂",1655936965,534657710
18618458,Чем-то на Чубайса даже стал похож🤔,1655937035,534657710
18618458,"До последнего Украинца🙁 было сказано, но походу , к этому и идёт 😟",1655937861,541731167
18618458,"Правильно говорит, кстати.",1655941406,516015235
18618458,"Прикольно, можно пытками добиваться своего, то есть все нормально, это не ""навязывание своих взглядов"", поскольку они сами решают, ""что они хотят делать"" в сложившейся ситуации.",1655962516,278270597
18618458,"[id569360984|Дарья], после смерти мозга, организм живёт за счёт систем жизнеобеспечения. 
У Запада уже начинается катастрофическое отключение этих систем.",1655963880,198550940
18618458,5П. Плохое Планирование Приводит к Печальным Последствиям. Идиоты!,1655996960,183338101
18618458,попятился,1656000061,225693388
18618458,,1656047542,163824458
18618458,Джонсон купил расческу?,1656075861,640929414
18614150,И не одно сми про инфляцию в рф не пишет 🤣,1655884517,479330519
18614150,,1655884572,18228417
18614150,"Гнилой запад! Инфляция какие-то 9%, а уже ноют, слабаки! 
У нас вот, все замечательно, 17%, и ещё живы... 
🤬🤬🤬🤦‍♀️",1655884718,11610339
18614150,,1655884773,22186949
18614150,"То есть, если мы их ракетами и сотрем с лица земли, мы им услугу окажем? Зачем нам толпы голодных англичан в России, а ведь скоро побегут с тонущего корабля крысы.",1655885255,139275333
18614150,С чем мы их и поздравляем),1655886940,371376075
18614150,Ближе к земе запоют по другому!!!!!,1655887427,204007926
18614150,А что все про другие страны пишем? Давайте про Россию),1655888372,110153792
18614150,А нас рать.,1655888680,709989491
18614150,Нас им не догнать!,1655890054,6724892
18614150,Ну теперь они пусть плохо поживут,1655899674,202323626
18612723,Когда же эта сша шею себе свернет?,1655859176,529271000
18612723,Это Хазин всё свои идеи проталкивает?😳😂🤦‍♂️,1655859837,277497234
18612723,О ентот чувак авторитет 🤣,1655860259,5027503
18612723,А зачем Калининград защищать? Этож нацизм?🤔,1655868200,1622508
18612723,Поджигают штаты по периметру....,1655870152,471986182
18612723,"Складывается мнение, что дело идёт семимильными шагами к ядерной войне.",1655870396,60227969
18612723,Лайф жжот. Нашли имигчемй фейка 🙈🙈🙈,1655873021,147829308
18612723,а ближе ни кого не нашлось? или из ЮА виднее?,1655886218,9206974
18609412,Интересная такая война получается. Денюшку в рублях за газ и нефть они исправно платят 😏,1655805222,17155502
18609412,Ворона каркнула во все воронье горло ..И .Крылов ..,1655805266,453623667
18609412,"В ответ на это ""карканье"" мтжно поддержать Турцию в вопросе Северного Кипра.",1655805910,424750214
18609412,"Фигня, в России в два раза выше инфляция, если в Европе в целом 8,то в России больше 16 , но говорят про Европу =) как у них там плохо =)",1655806014,369966753
18609412,"Прогнулись под англосаксов дебилы, теперь воют аки волки.",1655806305,24203849
18609412,"Расплакались ,а сами всегда мечтали унизить Россиию, в рабов их превратить.,только последствия не просчитали 🤣🤣",1655806426,595742426
18609412,"Мицотакис берега попутал, это НАТО вторгается в Россию, кто бы ему объяснил.",1655806492,575025051
18609412,"Сами себе в головы стреляют, а потом не знают, что с этим делать 🤦🏻‍♀️ Думать этой головой пробовали, а не стрелять в неё по указке Карабаса Барабаса?",1655806670,177786194
18609412,Россия вроде на Европу не нападала?! С кем тогда они воюют????.,1655806734,127283783
18609412,"Какое имеет отношение Европа к Украине? И при чем здесь вторжение в Украину? Российское вторжение, а трудная ситуация для    Мировой экономики??? Их кто то заставляет помогать, что-ли?    Наверное опять Путин виноват??......",1655807000,467832111
18609412,"Я против любой войны, я за решение всех конфликтов мирным путём.....Но....Перед началом спецоперации Путин предупредил, что если третьи страны вмешаются,  то очень об этом пожалеют. И на кого теперь обижаться?",1655811010,148384479
18609412,"Не надо думать о войне, а надо сделать анализ своих действий",1655821791,590010006
18609299,"А что он предлагает то? Бросить Украину? Так проходили же уже в 1938. Когда отдали Чехословакию и Австрию на поглощение Германией, думая, что она этим удовлетворится. Так сделать - самый проигрышный путь из возможных! Агрессор никогда не удовлетворяется подачками и откупными. Наоборот, он чувствует слабость и страх - поэтому хочет ещё и ещё!",1655804224,483002399
18609299,"Вам п-а,янки😎😎😎",1655804733,528486552
18609299,"Правильно Трамп испугался  и все мы под напряжением живём , кто знает что ещё  может натворить маразматик  Байден  , вдруг бзих с мозгами ещё хуже станет и подарок от него народ плохой получит",1655805083,207396976
18609299,Американцам приходит писец. Скоро начнут рассыпаться на штаты. Народная республика Аляска! 😀,1655805115,163348170
18609299,"Не будет поставки оружия, вот тогда может и наступит конец этому беспределу.
А здесь каждый в изложенном трясется за свою жизнь, в ожидании мировой войны из-за действий Байдена на Украине.",1655805202,547928039
18609299,"Трамп, тоже боится за свою шкуру, а вдруг бомбанет Россия по янкам!всё боятся и правители тоже! Оно к этому идёт, они этого хотят с зеле, они нарываются уже, уже терпеть невозможно, как эти наймиты города громят и до Крыма добрались!?? Только бомбануть по Киеву надо разок.! 💞",1655805655,350257498
18609299,"Вывод американских войск из Афганистана?
Трамп! Это было гнусное бегство.
🇷🇺🇷🇺🇷🇺💪",1655805694,627232435
18609299,Бизнесмен,1655806296,19002011
18609299,"Я боялась, ещё тогда, когда он, Трамп, был в президентах, что он начнёт войну,! Но Слава богу, он не взял, грех на душу свою!!! 🙏🙏🙏",1655807745,350257498
18609299,"Зеля, будет до последнего биться, вздоха, он трус, он то не воюет сам, с помощью наёмников, да байдон, долларами снабжает. Два маразматика собрались! Победа будет за нами! Аминь.",1655808375,350257498
18609299,стилистически неправильно. нет прилагательного бывшая у топононима украина,1655808714,251663320
18609299,"США , вы виноваты в происходящем на Украине!!",1655810816,179705142
18605366,"У нас инфляция и так в 2-2,5 раза больше! Вон картошка в магазинах по 75 рублей кг",1655738610,152911040
18605366,Я бы запретила Центробанку говорить на птичем языке. Есть же аналоги на русском...,1655738671,534950284
18605366,Алигархи держат накопления в валюте Вот и боятся прогореть при крепком рубле Начинают придумывать всякуб хрень р рубле,1655738970,372668729
18605366,"Ну это все понятно. Теперь разъясните, что такое таргетирование.",1655739514,163825703
18605366,галоши резиновые стоят 750 рублей.как жить,1655740044,584365781
18605366,"Курс валюты маленький - плохо, большой тоже плохо, а когда же хорошо🤣",1655741520,20667757
18605366,"Не понимаю, зачем нам резервные валюты, рубль пускай будет резервной и срать нам на их инфляцию. Опять блин кормить весь мир должен РУССКИЙ ЧЕЛОВЕК.🤦‍♂️",1655741726,408057587
18601293,типа успокоил,1655666916,52841218
18601293,Ничего уже никуда не вернёшь,1655667155,292861154
18601293,"В США всё хорошо)). Как бы нам не хотелось, чтобы там было плохо...Бесполезно.",1655668239,236884020
18601293,Нету интереса что-то им ... Главное чтоб тут было все Чики бамбони,1655668642,91358113
18601293,Нет такой страны уже .,1655669088,184942875
18601293,Но это не точно. 🤣🤣,1655669685,8177541
18601293,Это если снова Путин не помешает.,1655671560,6929670
18601293,Нам Греф 10 лет пообещал(((,1655681316,66409605
18600999,"Они все агенты Кремля, и ведут подрывную политику во благо Великой Российской империи.",1655663344,98046344
18600999,Какие молодцы!,1655664982,625900782
18600999,Набиулина покусала..,1655667423,467103711
18600999,"7% там рекордная инфляция, трубим со всех утюгов! В России 17,5%-это в порядке вещей!",1655702076,586089072
18600122,Читатель газеты Washington post с ником Didos1945 уже прокомментировал?,1655651276,499420819
18600122,"Да разве это инфляция, по сравнению с российской?!",1655651809,189637536
18600122,"Странно,что упомянули при этом Путина....в инфляции в США виновен именно он же,вроде бы...",1655654952,28753687
18600122,,1655666513,22186949
18596597,"Мы на горе всём буржуям 
Мировой пожар раздуем!",1655610087,557914260
18596597,"массовое страдание рабочих в капиталистических странах.

Это было известно ещё в СССР.

Хотя, во время правления Горбачева, до нас доносилась несколько иная информация.",1655610331,212874081
18596597,"Пусть прочувствуют нашу жизнь в 90-е, а то нихера не понимают и не хотят.",1655610969,239101570
18596597,"Вот, я же говорил что начнутся хоть где-то и не только в Лондоне в будущем",1655613507,280558492
18596317,,1655597398,238793958
18596317,"Убрать надо старого маразматика,иначе доведёт Байден весь мир до войны,а США будет кирдык.",1655598724,474174728
18596317,"И те и другие все против РОССИИ-капиталисты одним словом, им нужна РОССИЯ-бензоколонка а еще лучше раздроблнная на множество осколков и без ядерного оружия....",1655600622,568961039
18596317,Политический труп.,1655608855,177312776
18596317,"Хрен с ней Америкой, давайте о себе лучше думать.",1655609398,608057283
18596317,"Пора бы уже долбануть Йеллоустоунскому вулкану, что бы эта американская вонь утихла надолго, как геморой в заднице у всего мира.",1655611626,380751798
18596317,"Вообще 🚽на... ть, что у них и как будет.",1655613857,655011344
18596317,"А по-моему они всем там шизанутые, глядя на Байдена в поисках виноватых, прикрывая свою задницу.",1655613938,547928039
18596317,деменция. Старческая. Незаразно.,1655614526,114733639
18596317,Смерть?,1655628074,155875272
18596317,Бедная Америка,1655659108,501919203
18596317,А Европа что подписалась за Байдена вся на понтах Баррель Макрон  шульц напонтовались машины в гараж зубы на полку помыть 3 места все вопросы Байдену,1655661432,392984811
18595557,"Внимание, там происходит отрицательный патриотизм 😂",1655579813,684211109
18595557,😎👍🔥это мой народ...Мы многое способны изменить.,1655579836,627778870
18595557,"Некогда .отстаньте.
Бориске надо помогать Украине,это святое .",1655579940,636581987
18595557,да в интимное место вас) я столько бабла в жизни не отмывал(борис джонсон),1655579944,456626713
18595557,Биг Бен починили?,1655579955,3381569
18595557,"Просите прощения у Путина, может снимет санкции ))",1655580058,674762793
18595557,жить им хочется а хто незолежным SSовцам перемогу делать буде?Путин?,1655580140,141606246
18595557,"Нравится, не нравится — терпи, моя красавица. За русофобию нужно платить.",1655580176,93364207
18595557,"Правильно,пусть спрашивают со своего Бориса,как он с инфляцией борется,а то скоро зимушка придет,может холодная очень! Может голодная очень!",1655580450,709914618
18595557,Британская сучка страдает от своего говна.,1655580813,257941652
18595557,Зато наши сидят уши прижали🤣🤣🤣,1655580854,7373134
18595557,"Иногда не могу понять. Это они ""буйные"" или мы ""терпилы""..🤔",1655581008,616640387
18595557,"Вышли они видители😅Борису не до ваших проблем, там Украина с протянутой рукой на первом месте😂😂😂",1655581660,541376115
18595557,"А она этот момент по хохляндии ездит, как хорошо",1655581770,616580291
18595557,"Так вроде они там все богатые. Когда выходят на пенсию, то сразу в путешествия отправляются...Ну, так нам всегда рассказывали. Это видимо мигранты на митинг вышли. Англичане не могли ;)))",1655583490,15955329
18595557,"Так надо просто сказать : 
--'Отнеситесь с пониманием ! 
В России проканывает😆",1655583818,647242261
18595557,"Все на борьбу с проклятой монархией!!!
Мы на горе всем буржуям,
Мировой пожар раздуем!!!
(Блок)",1655584266,505318158
18595557,"Что-то флагов хохлятских нет, не правильно, все должны поддерживать Борю и Зелю.  Жесть, какое недопонимание. 🙈😭",1655585825,70453718
18595557,"Вообще пофиг, пусть хоть кастрюли на головы наденут.",1655586694,297741459
18595557,"Памагите усраине...), клоуны",1655587082,43630225
18595557,"У него долгосрочная перспектива на Украине, какие вы хотите улучшения👆👉ухудшения ещё больше светит🤔",1655613309,655011344
18595557,Надеюсь халявы от РФ им уже не будет.Пусть демонстрируют.Полезно для здоровья.,1655645314,312608310
18595557,Этот вопрос с инфляцией к Ьайдену,1655659919,392984811
18588792,"Какое снижение, цены на месте стоят.",1655489034,232144392
18588792,"Покажите откуда будет нападение, 
Зачем солнце в Монако, 
Снижение цен на бензин не замечаю",1655489068,655194575
18588792,Это в России??,1655489186,433379858
18588792,Интересно а где он снижался то? в Оренбурге цены вообще не разу не понизили,1655489257,33299000
18588792,"Страна Тотального Вранья .
А что такое 2 копейки ? 
Таких даже денег в обиходе нет . На 2 рубля бы литр подешевел . Заметили б .
Пока что мина Тухлая , при Тухлой игре .",1655489288,81700527
18588792,,1655489350,334676175
18588792,"Где понижение? Розничная цена просто застыла, хотя из каждого утюга слышны новости, что оптовая цена топлива уже который месяц летит вниз, они и не думают удешевлять розницу на АЗС, а гребут лопатой бабло",1655490601,85683619
18588792,То то я смотрю бензин почти даром раздают. Скоро приплачивать прям начнут...,1655493394,32245929
18588792,Чтоб зарплаты у правительства подымались на 2 копейки в год,1655493438,347905168
18588792,При нашем обьеме добычи нефти и газа бензин должен стоить копейки для народа. Везде народ дурят и считают быдлом.,1655493820,61478693
18588792,"С какого хрена дешевеет,админ,что за фейки,где в каком месте увидел дешёвый бензин!?😡",1655495960,118100484
18588792,"Ничего не снижается, пустой базар",1655500427,35331826
18588792,2 копейки... Смешно,1655507467,420990386
18588792,Сказали что понижается значит понижается и не huy здесь демогогию разводить 😜,1655522302,641959474
18588792,"С начала все этой хуни бензин аи92 стоил 47руб так и стоит, а газ 18руб и ещё падает, это ещё где то дешевле, где то дороже",1655542774,247793705
18588792,"В Москве и МО почти везде уже перевалил за 52₽/литр за 95, а 92 стоит 46-47",1655571912,89671842
18588792,оказывается он дешевел)),1655576524,50556645
18587430,И не за такое брались и не делали…,1655474748,483445939
18587430,где он был 20 лет назад?,1655474768,359280798
18587430,"ключевая ставка 11%, сам говорил 0% инфляция недавно😑",1655475125,218434026
18587430,Анонсировщик...23 года анонсирует уже,1655477138,49802632
18587334,🙏🙏🙏🙏🙏🇷🇺🇷🇺🇷🇺🇷🇺🇷🇺,1655473910,176558168
18587334,"Они не не понимают что происходит, а не хотят это понимать. Им так проще.",1655473963,596746909
18587334,А рост цен у нас он как-то объяснил?,1655474830,385126336
18587334,❤️❤️❤️❤️❤️❤️🇷🇺🇷🇺🇷🇺🇷🇺🇷🇺,1655475073,455406224
18587334,,1655476065,363262423
18587334,"Ха отбелил себя, врунишка",1655476436,416841077
18587334,"Путин начал войну на Донбассе, захватывает Украину, и не понимает, почему на западе называют инфляцию путинской! Это последствия его вторжения в независимую страну",1655478977,416841077
18587334,👍👍👍👍👍,1655480089,597462668
18587334,"Костя, ты идиот🤮Иди лесом… Путин мыслит глобально, а у других / представителях стран / мозгов нет.Время расставит всё на свои места. России победит!!!!!",1655484569,344022834
18587334,"Вера ты дибилка, иди лесом со своим путиным, мысли глобально, мы в жопе, по его воле, Россия победит, мясом как всегда завалит, тут бесспорно, умения не надо",1655485666,416841077
18587334,Самые болтливые-идите в президенты! Порешайте там всё как надо! Что в кустах отсиживаться-то???🤣🤣🤣,1655501705,340582506
18587334,"Молодец, всё так сказано!!!!!",1655549563,226477639
18583537,"Эти люди даже в булочную на своей машине ездят, а небольшая ситуация с бензином, и привет, стали беспомощными.",1655434060,655804785
18583537,В Америке личное авто жизненно необходимо. Она есть у каждого члена семьи.,1655434231,240899884
