post_id,text,comment_time,from_id
37872789,"ПОЧЕМУ СТРАНЫ НАТО НАЧАЛИ ГЛОБАЛЬНУЮ ВОЙНУ НА УКРАИНЕ ЗА СХРАНЕНИЕ ЧАСТНОЙ СОБСТВЕННОСТИ? ДОЛГО ЛИ ПРОДЕРЖИТСЯ ЕВРОСОЮЗ БЕЗ ПЛАНА ГОЭЛРО В.И. ЛЕНИНА? 
Россия, Европа и сегодня живут за счет Плана ГОЭЛРО В.И. Ленина, по которому уничтожена лошадиная сила, сила наемного раба, которые заменила сила электрической энергии. НЭП сегодня актуальна в связи с переходом к социалистическому, империалистическому, госкапиталистическому укладам хозяйствования, что подтверждает практика в Китае, который дыши в затылок издыхающим США, Европейскому Союзу! Сегодня Китай на первом месте в мире по генерации валовой энергии. В каждом товаре уже кристаллизована застывшая электрическая сила, энергия, а не физическая энергия раба, крепостного или наемного раба по трудовому договору! В современном способе производства уже господствующее, ведущее положение занимает умственный труд, который открывает, создает новые потребительные стоимости, а меновая стоимость равна нулю. 
В основе любой цивилизации мы видим разделение труда, чтобы овладеть силой, энергией природы, а не создание человеком орудия труда, как нас извращенно учили сталинские дебилы семинаристы. Цивилизации зарождались с разделением общественного труда при взятии во владение, распоряжение и пользование энергии, силы открытого огня, то есть обретение его в собственность. В СССР план ГОЭРО был доведен до создания ЕЭС ""МИР"", которую разрубили на части жиды-идиоты Чубайса. Сегодня мы видим, понимаем, что электрическая, тепловая энергия углеводородов не является вещью, предметом и её нельзя разделить на части, продать ведрами. Такая энергия максимально технически, технологически обобществлена и не поддается законам о частной, государственной собственности! 
Капитализм уже сдох, ушел в историю, прав Ф. Энгельс! 
Почему страны НАТО начали глобальную войну на Украине за сохранение частной собственности? Нефть, газ, уран, дрова можно продавать ведрами по старым законам, так как они представляют вещество, или предмет, вещь, товар, а энергию, силу, получаемую из них, так продавать уже нельзя потому, что это уже беспредметная продукция, которая не поддается законам о частной собственности, и продавать её уже нужно за электронные деньги. 
Если раньше была одинаковость в рабовладельческом, феодальном и капиталистическом формационных способах производствах, то сегодня такой одинаковости, общности в новом способе производства, где господствующее положение заняла наука, нет. Человечество заменило физическую энергию, силу человека, раба или наемного раба за зарплату силой, энергией электрической по Плану ГОЭЛРО В.И. Ленина. Теперь вся сила, энергия идет в электронах по проводам технически обобществленной бывшей ЕЭС ""Мир"", по трубопроводам ГазПрома, Трансгаза, Транснефти, а не варится в желудке человека или лошади. Частная собственность на физическую силу, энергии наемного раба или лошади умерла! 
Например, лукавый Сашка Лукашенко, построив новую АЭС, готовит вязанку дров, хвороста в частную собственность для Европейского Союза! Гражданский Кодекс Франции (Наполеона) о частной собственности уже умер, подох и умер буржуазный сталинский ГК РСФСР 1922 г. о частной и государственной собственности на физическую силу наемного раба за МРОТ! Подошло время, когда пролетарские классы современного способа производства не хотят жить по-старому, а нынешняя буржуазия не знает, и не хочет управлять новым способом производства по-новому.
С другой стороны, сами земли Украины уже давно проданы на подставные лица физическим лицам США, Франции, Германии, Великобритании и иным странам Европейского Союза!",1663670571,547848000
37872789,Дык в Европе газ упал в цене ниже 1800,1663670918,218980497
37872789,Европе нужно брать примеры с России и избивать всех протестующих и выписывать огромные штрафы,1663671343,212649145
37872789,Молодцы,1663671906,609741002
37872789,А чего они только сейчас задумались . Нужно был санкции отзывать,1663672104,675708718
37872789,"Я уж думала, что жители города Росток тоже хотят провести референдум о вхождении в РФ",1663672253,150810735
37872789,А в России некому протестовать. Интересно почему!,1663672402,618904458
37872789,"Интересную тему читал про мышей, вселенная 25, в общих чертах ...посадили в ограниченное пространство крыс ...кормили поили, когда они заполнили все касались и грызлись, потом переродились в гомосеков и перестали родить ...в итоге все сдохли...вывод поост сытая и спокойная жизнь ведёт к вымиранию...что то мне это напоминает европию🤔🥴😁🧐",1663672513,745510547
37872789,"не удивлюсь, если немцам щас объявят очередную волну пандемии и быстро рассортируют по домам😏 а там придется танцами согреваться, а кто заболеет от холода - значит короной заболел😏",1663672780,97077278
37872789,Зато столько оружия на Украину поставили!,1663672838,151492998
37872789,"Вышло человек 30.
Но зато ""новость"".",1663673110,52908418
37872789,"а наши даже с лозунгом - Я за м🌷р ! боятся выйти, тк можно и под следствие попасть , а так что хотят то и вменят...😇 А не то что требовать снижения цен...

С - свобода слова!",1663673203,642256661
37872789,"Смешные, это только начало",1663674742,706322202
37872789,Еще не зима,1663675245,6807056
37872789,Референдум и к нам,1663675366,116190009
37872789,Ещё не зима.,1663675639,583278589
37872789,"Бедные люди , вот от таких царей правящих. вот так и живут , митинги и всё остальное, поможет только что им ?переворот на....й шайку лейку",1663675678,697460162
37872789,Шольца в отставку ☝,1663675957,429995629
37872789,"они там по моему только счастливы, судя по лицам.",1663676122,604549344
37872789,"Рано, очень рано господа Вы вышли протестовать. Мы то думали февраль - март, а Вы уже !!!!!.",1663676804,721428187
37872789,https://vk.com/wall-121653742_372102,1663677971,484428698
37872789,Жители немецкого городка случайно не хотят вступить по референдуму в РФ?😂,1663677991,175556433
37872789,Хорошо,1663678004,484428698
37872789,"Ну, прошлись по свежему воздуху, тоже норм. Только на простых людей всем пофиг.",1663678878,710245783
37872789,"Как в песне некой женщины, муж которой иноагент, ""... то ли еще будет, ой-ой-ой!""",1663679969,615913723
37872789,"Пусть европейцы не жалуются,пусть почувствуют как жили люди в 90-е годы после развала СССР",1663681625,712480682
37872789,Населения этого города около 200тыщ.какой тут митинг 50 ну край 100человек вышли.побродили и ушли.,1663681779,6467203
37872789,"Они могут себе позволить и выйти на улицу и сказать государству нет ! И ни кто их не упакует в автозаки и не посадит в тюрьму ! Потому что живут в нормальной демократической стране ! А не в диктаторской с царьком , который всего боится !",1663686621,245580268
37872789,Ну и как от европы рф зависит не могу понять . Зависимость от зависимого,1663687741,11897662
37872789,У них город у нас детский сад с таким названием,1663688703,3742215
37872789,Ребятки а скоро ЗИМА? Будут еще ВЫШЕ!!!,1663689533,716673359
37872789,"Ну они привыкли пособиями довольствоваться! Есть такая поговорка в России и не спроста"" затянуть поясок"".",1663689701,172866726
37872789,Сотни тысяч!😂,1663690294,545790690
37872789,зато летом с хохлами плясали и частушки пели)),1663690933,740025943
37872789,Гоните своё фашистское правительство вон!!!,1663691066,192855212
37872789,"Ооо уже в лапсердаках ходят ,видать прохладно.",1663691366,446856291
37872789,Интересно у них там своего Навального нет,1663691641,750623422
37872789,"Люди, речь идёт о отмене гец, это плата телевидение и радио. Больная тема в Германии, так как платить обязаны все. Другой плакат против короны. Где там про энергию то… ни слов , ни речей, дибильная музыка со стадом людей. Может они пенсионный возраст трепетали  или за отмену авто внутреннего сгорания. Как вы ведётесь на это. Все митинги в Германии анонсированы и есть телевидение на них всегда…линки в студию",1663694950,3938214
37872789,"Не фиг было объединяться с ФРГ. Вот и радуйтесь. Да, ещё один памятник сварганьте своему M.C. Horbi. Что значит не знать собственной истории. Вы же БДМ онемеченные полабские славяне. Вот сейчас и русские, которые себя в угоду полякам называют себя украинцами, хотят повторить Вас, стать еропой.",1663697061,330912329
37872789,850 человек из более 200 тысяч жителей.,1663698576,580909383
37872789,Вот же фашисты,1663699336,646959087
37872789,А это еще только сентябрь,1663703376,335849328
37872789,Кому понравится тратить большую часть дохода на коммуналку? Теперь денег не хватает на дорогие виды развлечения)) как было ранее)),1663732597,407236978
37872789,Город с исконно немецким названием,1663734692,23644613
37872789,Как вышли так и зайдут обратно,1663738947,711206429
37872789,Ведьма урсула-у нас в евросоюзе все под контролем.,1663739091,596738127
37872789,Что -то идут слишком вальяжно и с весёлым видом: будто для постановки ... 🤔 или против РОССИИ ? 🤔,1663741568,635840028
37872789,"Скоро санкции Россия введёт,вообще в средние века скатитесь",1663758008,273874509
37872789,Они улыбаются тип потому что на улицу вышли? Там теплей чем дома?),1663762660,388396910
37872789,"Ходят на демонстрации, греются в толпе.",1663763843,741259592
37872789,"Господа, а социализм кончился для советских граждан в 90-Х, а до вас только докатился...",1663778187,152758570
37872789,Дайте им денег на коммуналку или разогните несогласованный митинг,1663779472,745871010
37872789,☝☝☝🤣🤣🤣🤣🤣,1663785723,432647842
37872789,Зато они говорили что приехать к ним это привилегия.)) 😁,1663813145,110559948
37872789,"Это только начало. Вот доведут их ""до ручки"", как бы не сорвало.",1663829769,6169198
37853357,"Ничего страшного, вы согреетесь мыслями об Украине.
P.S. Видео чисто посмеяться, атака украинских БМП на свою же пехоту. Короче, эти украинские БМП украинского мяса задавили больше чем русские.
😎",1663580063,635825218
37853357,А в Армении что происходит!?,1663580107,603114500
37853357,"Потому что власть там проамериканская, а народ россию любит.",1663580112,494507458
37853357,"Молдаване спокойные, покладистые, не воинственные. И если они на подобное идут, это значит, что их уже достало всё конкретно",1663580155,700405918
37853357,,1663580175,61860270
37853357,У нас бы уже всех палками забили и скрутили😃,1663580200,529134749
37853357,А когда у нас митинги начнутся против едросов и прочей нечести?,1663580327,707244739
37853357,О теперь и в Молдавии.,1663580516,710099003
37853357,"Что значит ""выгодные цены""? Цены формируются на бирже.",1663580543,26831721
37853357,Да зима скоро,1663580572,611842897
37853357,"почему россияне не бастуют против роста цен ?все бастуют . только россияне боятся не то что бастовать , но даже слова сказать . 15шку впаять могут .",1663580623,492854473
37853357,"Как выбирать ,так западный марионетка,как за свет платить ,так не хотят...",1663580652,210119184
37853357,Пусть меняют Санду на дрова.,1663580762,186739992
37853357,Тупые кремлеботы. Если митинг против санду то это норм.а если против пу...то это плохо. Шакалы кремлеботские,1663580774,707244739
37853357,Я уже сбилась со счета в какой стране проходит волна митингов. Все недовольны ростом цен .,1663580999,720482528
37853357,"Отли,чно правильно",1663581010,336040259
37853357,"Правильно,  выгоняйте Сунду в Гейропе,  выбирайте либо Санду либо газ)))",1663581111,220009798
37853357,,1663581167,561664006
37853357,Давайте безсрочный митинг уберите амерканскую власть возьмите в свои руки свою страну,1663581367,391373476
37853357,Тем временем в Молдавии...,1663581605,69530841
37853357,"Гоните эту КУРИЦУ пока она страну не развалила,прислужница запада",1663581650,267182459
37853357,"Знакомый путинский почерк, потом начнут грабить магазины и бить машины, а потом попросят путина спасти их от американцев, какие идиоты!",1663581691,747459235
37853357,Народ Молдавии вас поддерживает Череповец!!!!!!!!!!,1663581821,209574604
37853357,Так пускай в сша едут митингуют,1663581978,14925914
37853357,Сами выбрали - наслаждайтесь 😏,1663582568,494166963
37853357,Не бойтесь это не в россии,1663582721,577572866
37853357,"🇲🇩 МОЛДОВА, 
🇷🇺 РОССИЯ С ВАМИ✊
МИР ВАШЕМУ ДОМУ, МИРА, ЗДОРОВЬЯ, УДАЧИ, ДОБРА, СОЛНЦА, СЧАСТЬЯ❗️
🌹✌️💖🍀🍀🍀
ГОНИТЕ “🇺🇸 ХОЗЯЕВ» В $$ВОЮ 
БАНДИТ$$КУЮ ПОМОЙКУ…",1663582866,651685773
37853357,"Не так давно люди в раше выходили в одиночку с чистым листом или *** ***** или ""два слова"" - паковали вмомент.",1663583030,51964195
37853357,Молодцы.,1663583080,543892943
37853357,Ахаха! Там кучка пенсионеров вышла которые по СССР настальгируют! Молдова в евросоюзе будет! Зачем ей загнтваюшая рашка отжавшая Приднестровье? 😀😀😀,1663583119,18644739
37853357,Гоните на хрен американскую шушеру!,1663583290,284961704
37853357,"Безмозглые политики не думают о благополучии народа . А про марионеток и говорить нечего, что велят , то и делают. Вот только народный гнев , может низложить всякую власть и мало не покажется . Сколько не лги , правда все-равно проявится. Сколько ни говори "" халва"" , слаще не будет. И сколько ни говори , что ""всё хорошо "" , проблемы почувствуются.",1663583311,295510498
37853357,Молодцы!,1663583648,284200277
37853357,Браво,1663583926,711003630
37853357,Дык сами хотели же сандо? Че не нравится?,1663584592,739266231
37853357,Молодцы,1663584610,609741002
37853357,Продали свой народ за баксы,1663584664,506389900
37853357,Это только ночало...,1663584933,64091253
37853357,Дальше будет интересней...,1663584967,64091253
37853357,Нам самим бы зарплаты поднять... чтоб тапки не отлетели...,1663585087,64091253
37853357,Только силовые методы понимает европейская власть. Только восстания. Эйропейцы сбросте гнет англосаксов! Этих дармоедов.,1663585618,384113
37853357,"Вот нужно России взять и подождать до весны, пусть все эти европейцы и их приверженцы до весны себя пожирают, а весной можно подумать как быть дальше.
А то как ноги годами вытирать об Россию так они первые, а как быстро переобуться - так нет, пусть в очереди до весны постоят, а мы подумаем, правильно ли и честно они переобулись, или опять лишь обещания и ложь",1663585792,155161704
37853357,И это только начало. Сейчас в ЕС страна за страной будут тонуть в бунтах и массовых протестах,1663585878,472362651
37853357,"Ну митингуют и что ? В России за одиночный пикет на зону попасть можно, почему об этом не говорите ?",1663585957,706937141
37853357,👏👏💪💪💪💪 Начнётся война народа)) народ покажет своих пугливых марионетках думаешь о себе а не  народах лидеров их всех Отправить в США  и Украине,1663586345,268996537
