post_id,text,comment_time,from_id
38725147,"А у нас нет роста на бензин , а сливочное масло 200 рублей пачка, и наклейка , чтобы не украли , пищать будет после кассы. А почему масло подорожало ? Коровы наши, фермы наши , поля наши , корма заграничные ? Или что случилось ? Почему тушенка из дружественной Беларуси стоит 300 рублей за банку ? Почему колбаса стоила 160 р за 100 гр нарезки брауншвейская , а сейчас 200? Почему соки стоят непонятно высоко, хоть и экономят на раскраске упаковки? Почему шоколад был 80 рублей , а стал 120 , да к тому же не 100 гр , а 90? И коммуналочка выросла не знаю как у вас , а у меня так: в прошлом году за 54 квадрата было 6500, а сейчас 7500. Это ещё почему ? Откуда берётся ценообразование ? Что за дичь ? Типо бизнесмен хотел купить Range Rover и все хорошо шло , но вдруг он вырос в цене в 2,5 раза и мечта стала дальше , чем хотелось бы , а с чего это бизнесмен должен жить хуже, чем раньше - вот и поднимает стоимость своей продукции. И никто не запрещает. Я думаю именно так все и происходит.",1667308414,6157238
38725147,Хорошо было жить почти на халяву под пазухой у России... С Украиной вы так жить не будете...,1667308648,145287625
38725147,В Италии протестуют?В Италии поминают Дучу. У них там сабонтуй с флагами и вскидыванием руки в фашистском приветствии.,1667308830,240497738
38725147,"Италия новых санкций не вводит, все обоссан кцились. 🤣",1667309104,698987658
38725147,"Когда в 90е у нас каждый день все дорожало, и за месяц зарплата обесценивались, они над нами ржали. Считали неудачниками и нищебродами.",1667309390,31439572
38725147,А это вероятно?,1667309842,4161085
38725147,"Протестуйте, не поможет",1667311176,398833873
38725147,О мама мия🤣🙏,1667311524,718375069
38725147,Какое отношение это имеет к России,1667311547,712695499
38725147,"Дак мы так уже, как лет 20 живем!!",1667311820,710785662
38725147,"А Вы ,господа,обратили внимание как они одеты?им балона газа хватит на ....",1667312988,582013465
38725147,"Всё это враньё, нормально живут в Италии 🇮🇹",1667313994,1002371
38725147,орки олени😆,1667314466,417707392
38725147,"С любовью от них получили послание, что не день, то
 сюрприз.
Giorgia - Credo
Анна Седокова - Не люби его
Lara Fabian – NOS CŒURS À LA FENÊTRE

))))) Надежда Кадышева и ансамбль ""Золотое кольцо"" - Давай мы будем счастливы
Icy - Kim Petras
Dieter Bohlen - Brother Louie
Ольга Серябкина - 1985
Scooter - '' No Fate '' '
Filatov & Karas - Движ [В Пижамах📢📢📢
Filatov & Karas - Дай Мне Сил
Старые Песни О Главном I. 6. ""Девчата"". Лариса Долина, Ирина Отиева-приятно было встретиться.
Anna Naklab feat. Alle Farben & Younotus - Supergirl
Clean Bandit feat. Demi Lovato – Solo",1667314474,421619047
38725147,"И что, нам пожалеть их надо?...😉",1667314734,232355695
38725147,,1667315831,20863674
38725147,"Как же , как же они проживут, не то мы .....",1667317358,163161882
38725147,"Черри 250 рублей за кг, у нас в лучшем случае 500 за кг",1667318005,202281570
38725147,Добро пожаловать в россию,1667318031,406711016
38725147,Риа новости мусор,1667318068,81493212
38725147,И у нас в тоже цены подскакивают,1667318379,500533479
38725147,"Такая занимательная весна предстоит,)))) да пусть хоть передохнут,ножки Буша,лучшее блюдо дня,7 дней в неделю...",1667321498,629249717
38725147,"Главное, что россияне не протестуют🤣",1667323898,735817115
38725147,"А вы дружите дальше с США и будет ещё лучше, штаты ведь любят ""помогать""",1667328229,718598832
38725147,Они в России не были !😂😂😂,1667329650,749444105
38725147,"Ноют на камеру, не забывая сделать взнос в общеевропейскую копилку  на убийство русских...",1667329809,58873789
38725147,"у нас всё ровно на оборот, всё дорожает, все довольны и никто никуда не выходит и своё мнение не высказывает...будем голодать, но молчать",1667333951,509994999
38725147,"Все! Кирдык уникальным итальянским продуктам! Спагетти, фитучини,  тольетелли из твёрдых сортов пшеницы, пермиджано риджано, маслу экстра верджин, прошутто, бальзамико… и так будет со всеми, кто дружит с сша. Бигмаки теперь жевать будут на сланцевом  газе приготовленные",1667338794,309866631
38725147,"вот так,как они сейчас - мы так живём всегда",1667365198,680380691
38725147,"Теперь посидите в «нашей шкуре», у нас всегда цены растут а зарплаты падают. Так было, так есть, так будет…
А у вас только это началось, вы уже ноете, ну ни чего, привычка, она со временем появляется.",1667365794,497227973
38725147,Почти как в России...,1667373532,515781713
38725147,я не помню-чтоб я пошла и купила лишнего-только самое необходимое и то по очереди)))Итальяшки насмешили))Пусть поживут как мы -русские!,1667396551,87386013
38725147,"Итальянцы какие-то на внешность все светлые, русские, если бы не их речь, язык, можно подумать что в России ролик сняли )",1667397678,144597276
38725147,"Ну что сказать, фигово Вы протестуете, если Ваши власти избранные Вами до сих пор спасают Украину не понятно для чего. Значит кошелек еще позволяет платить по высоким счетам. Сил Вам и разума.",1667509483,665386223
38622433,Прям как у нас. Или про это не принято писать?,1666809476,371146268
38622433,А че они за нашими ценами случаем не следили в 2014 и 2022.а теперь там все жалуются,1666809486,291586643
38622433,Натворила Лизанька дел,1666809496,610911909
38622433,"Надо ядерные ракеты запускать а не цены смотреть, даешь только культ апокалипсиса",1666809498,348049104
38622433,На видосе истинные британцы.,1666809506,633575211
38622433,"Как хорошо , что у нас цены не растут ни капли , сарказм.
Для ватников - уровень зарплаты  большинства англичан позволяет с лихвой компенсировать рост цен в 5-10%.
Тем не менее, гражданское общество настолько развито, что возмущаются даже этим.
Тем временем у нашей стране инфляция в  20%
РИА новости🗿🗿",1666809514,757201611
38622433,"Запад обеспечивал себе высокий уровень жизни за счёт грабежа своих колоний и России.
Теперь ангосаксонскому порядку - приходит кирдык!
Поставлять Европе газ, нефть, металлы только за оплату реальными товарами (даже не за рубли, а то наши либералы в ЦБ и Минфине курс рубля постоянно в пользу доллара и евро наровят повысить, да и печатает Запад свои зелённые фантики не обеспечивая ресурсами, а просто скидывая свою инфляцию на нас и другие страны).
И поставлять ресурсы наши только тогда - когда Европа под дудку США перестанет поддерживать оружием и ресурсами киевский террористический режим.
За Россией правда! Мы победим!",1666809533,752059092
38622433,"А Россияне не жалуются, уже привыкли к такому давно",1666809542,400150527
38622433,"Йенс Столтенберг — НАТО призывает Россию продлить зерновую сделку.

НАТО хочет жрать.",1666809555,753077877
38622433,Посравнению с прошлым годом я в день на 300р больше трачу .походу курить придется бросать)),1666809581,291586643
38622433,,1666809582,755739299
38622433,Да вы че?!!!,1666809589,228067977
38622433,Это мировой финансово-экономический кризис. Который начался чуть раньше пандемии.,1666809616,120990586
38622433,Эй ну давай уже а другую эпопею. Ну там же по расписанию атака нло в 2023. Отмотайте немного побыстрее,1666809633,470552266
38622433,Я смотрю на видео одни этнические британцы...,1666809664,73565533
38622433,"Ничего, Сунак вам своих денег добавит теперь в бюджет, чтобы инфляцию остановить.😄",1666809666,300324946
38622433,Молодец Собчак . Обула все службы 👍. Купила билеты по инету в Дубай через Турцию . А свалила через Белорусь💪. Красотка 👏,1666809668,124022647
38622433,По-моему видео из Кении?🤔,1666809678,6079045
38622433,"Ну что ж, пора британцам почувствовать то, что за последние 30 лет регулярно, с завидной периодичностью чувствовали россияне. В последний раз всего полгода назад.",1666809694,283109166
38622433,"ЗИМОЙ В ВЕЛИКОБРИТАНИИ ОДИН СТАРИК УМИРАЕТ ОТ ХОЛОДА КАЖДЫЕ СЕМЬ МИНУТ - GUARDIAN

В Великобритании пенсионеры умирают от холода. Дело в том, что с наступлением холодов всё больше семей поставлены перед выбором, как потратить скромный доход - обеспечить членов семьи едой или теплом.

Согласно оценкам экспертов, в Великобритании прошлой зимой, несмотря на то, что она была относительно тёплой и мягкой, умерли 43 900 пожилых людей. Это на 140% больше по сравнению с предыдущим годом и худшая статистика с 1999-2000 годов, пишет Guardian.",1666809776,698987658
38622433,"Правильно, ешь меньше здоровее будешь, но что это за англичане с таким акцентом?",1666809817,11850029
38622433,"Добро пожаловать в Рашу, большинство всю жизнь так живут, особенно пенсионеры.",1666809855,564848581
38622433,Да вообще пофиг.,1666809897,171301896
38622433,Британцам на ярик надо там бомжи больше зарабатывают и не думают об отплении,1666809959,291586643
38622433,Они прямо в Кремль жалуются? 😂,1666809976,440683046
38622433,"на работу хожу мимо кулинарии, и два дня подряд замечаю такую картину, заходит бабушка спрашивает, а у вас вода только на продажу, так нельзя попить, ей нет нельзя, и она уходит. День следующий заходит женщина пожилого возраста в туже кулинарию, а скажите стакан сока с чем он?, с клюквой! сколько стоит 35, разворачивается уходит. Душу щимит когда такое видишь",1666809999,-195458681
38622433,Погодите зима придёт в одни штаны сразу по Троя залазить будете. 🤣🤣🤣,1666810033,471979717
38622433,"Главное, что у нас все дешевеет на глазах.",1666810087,499784974
38622433,Яблоки также стоят как у нас по 120 рублей за кг,1666810091,35847692
38622433,"В Британии хоть рынки есть и поддерживают частных фермеров, а в России одни гипермаркеты с второсортным и просроченным товаром для свиней.",1666810097,687336280
38622433,да на них пахать надо.,1666810128,39544696
38622433,Надеюсь зима будет холодной,1666810130,486418724
38622433,"Ну вот меньше всего меня это волнует, от слова совсем! Пофиг как то на них! Как, собственно, и им на нас!",1666810158,541127390
38622433,Кто верит в этот бред?🤦‍♂️,1666810160,495640165
38622433,Вранье для быдла,1666810163,501993822
38622433,Так им и надо,1666810173,704790678
38622433,Почернели от голода?🤣,1666810176,227231904
38622433,"лагодарим за службу товарищ Трасс!

За 45 дней наш агент достиг потрясающих результатов:

▪️Разрушили экономику Великобритании;

▪️Развалили консервативную партию;

▪️Отправили на покой королевы Елизоветы II;

▪️Повысили налоги на прибыль предприятий;

▪️Повысили государственные займы;

▪️Неудачная экономическая реформа;",1666810207,698987658
38622433,Манька Облигация сдала пост Ваське Копчёному на туманной альбионе!)) Но пока в фашингтоне сидит горбатый ничегошеньки не изменится!))),1666810208,21560465
38622433,"А кому жалуются-то? Сами себе? Им там вообще  жаловаться желательно потише ,а то по их ""законам"" за это и присесть можно",1666810212,481055697
38622433,"А в России цены оставили, а массу сделали меньше,сахар,крупы 800гр. Масло подсолнечное  800 мл. и т.д.",1666810273,29874597
38622433,У нас тоже самое РФ,1666810286,320231222
38622433,,1666810341,698987658
38622433,"Меня убивает то,что всё пишут в англии,в германии,во франции,про себя что не пишут?У нас не лучше,а то и хуже,как буд - то все сыты да одеты,да многим есть нечего,сто раз говорили ВЫ СНАЧАЛА У СЕБЯ РАЗБЕРИТЕСЬ,чем других обсирать,своё бревно достаньте",1666810363,753760903
38622433,Путин присвоил Лизе трасс досрочно звание майора и участок под Рязанью,1666810406,698987658
38622433,,1666810435,227562231
38622433,"перестанут помогать укрофашистам, и жизнь лучше станет...",1666810473,493526918
38622433,"Поназапускали к себе иждевенцев в добавок которые не работают а живут на одни пособия, ща они включатся и Европа станет второй Африкой",1666810511,575527586
38622433,"Враньё. Хуже, чем Зеленский никто не живёт. 😐",1666810590,70453718
38622433,Теперь те российские граждане которые никогда не были в Британии будут радостно сидеть дома.  Ведь зачем им на такие ужасы вживую смотреть!,1666810610,306958581
38622433,У нас не так!,1666810612,90844423
38622433,Обезьяны на рост цен на бананы жалуются?,1666810689,51394686
38622433,Довы***. Сейчас со**** будут,1666810763,37759745
38622433,"Самое чудовищное, что делает наша пропаганда  с людьми - это  внушает радость когда кому то плохо. Горе и беда в другой стране - повод для злорадства в России. Дружно орете : так им и надо!!!",1666810988,457320793
38622433,"Зато у нас с ценами полный порядок,поэтому за британцев и беспокоимся",1666811062,456929704
38622433,Скоро  с  голоду  помрут  ужас  что  за  бред,1666811115,382162453
38622433,"Из книги:
Англия , средний век. Долгожитель, ему далеко за 100 , живёт уже при 12-м короле. И этот король узнал об этом и отправил за ним  карету. Но долгожитель не смог доехать на карете, умер,......, от обжорства. 
Возможно дороговизна  продуктов питания поможет долголетию и развитию трезвого мышления???",1666811161,145958483
38622433,"Хз, знакомые в Лондоне говорят вообще пофиг - все как было",1666811210,4677750
38622433,"Все жалуются что нет колбасы по 2,20.",1666811224,257033021
38622433,"А что там у них соучилось? Министры уходят, королева померла... колдует кто то",1666811245,118904353
38622433,"Работать надо побольше,а кушать поменьше,это везде так.",1666811311,257033021
38622433,Рус..о..фобия дорогая сейчас..,1666811432,302132387
38622433,"т.е., население станет более здоровое? Разве за это мы боремся?",1666811600,256602320
38622433,,1666811614,25772190
38622433,"Есть надежда, что теперь негры, арабы и индусы вернуться в собственные земли.",1666811839,51901874
38622433,https://youtu.be/LMUBoSk8Yvw,1666811847,93609280
38622433,Лиза с Трассы передала Факиру эстафету.,1666812227,583278589
38622433,"За то в России всё хорошо и нищих, кроме пенсионеров нет. Не страна, просто рай",1666812521,739212808
38622433,Зато у каждого британца есть флаг Украины. 🤣🤣🤣🤣🤣🤣🤷‍♂️,1666812718,711273194
38622433,,1666812996,698987658
38622433,"А где на видео британцы? Африканцы,индусы,британцев и не видно))",1666813907,368859589
38622433,"Жаль что Лизка ушла  , не досмотрел театр😁😁😁",1666814083,745510547
38622433,Коллапс 😂😂😂😂😂😂🤦‍♀️💁🏼‍♀️,1666814085,185815208
38622433,"""Бабушка Британии"" вовремя ушла почувствовав Армагеддон.",1666814158,17198848
38622433,"Они плюнули на народ, и полностью ушли в войну на окраине...,мечтая о ""победе"", потому как на кону большая ставка...",1666814678,609620903
38622433,Ну как то не очень.пора бы уже за собой следить.,1666814897,26368437
38622433,Недавно за арбузы была потасовка🤣😅🤣,1666814949,209013476
38622433,А у нас санкции,1666814960,532743889
38622433,"Пусть страдают, не сильно жалко 🤷‍♂",1666814993,158672308
38622433,,1666815171,180523045
38622433,Россия позаботится о фигурах жителей недружественных стран 🤣,1666815669,458602815
38622433,Все пропальщики завыли 🤣,1666816269,372052539
38622433,Ну мы не Европа жизнь у нас будет идти и дальше даже через боль,1666816362,611842897
38622433,"В Прибалтике холодает, вот и обезумевшие латыши разбирают деревянные лавочки на остановках для отопления. Все равно в вымирающей стране общественный транспорт уже почти не нужен. Если что, на растопку пригодятся шпалы, части старых домов",1666816873,505096788
38622433,Нам пожалеть британцев??? Все у них нормально!! Когда уже будем о своей стране и людях думать??,1666816897,595733484
38622433,Чёт странные британцы на видео)),1666817431,64646360
38622433,,1666817889,738650804
38622433,Красивые в Англии коренные англичане.,1666817915,239216344
38622433,Сразу видно- чистокровная британка 🤣🤣,1666818292,112692136
38622433,"Они просто жмоты, вот м всё. Всё у них нормально! Они готовы мёрзнуть и недоедать, лишь бы пару баксов сэкономить.",1666818830,520919
38622433,"Это ерунда, а не инфляция.",1666819622,461608095
38622433,"Ерунда в Англии сестра с моей мамой живут, всё там по-старому. Подняли энергоресурсы,но незначительно. В России ,каждый день.без объявления ,цены на продукты поднимают,а россияне всё на запад смотрят,у них зарплаты то в десять раз выше российских и пенсии ,дай бог каждому. Просто они привыкли к низким ценам,а сейчас надо перестраиватьсЯ. Привыкнут. Надоели такие посты,смотрите,что в вашей стране делается.",1666819935,745316662
38622433,"РИА ""тоскует"" о ценах в Британии, Германии, на Западе! Но не разъясняет, что к уровню их зарплат, это ничто!",1666821257,735161651
38622433,"Так вам и надо, бананы ешьте, вы же банановый остров сша",1666821954,398833873
38622433,"Британка от плохого питания почернела, извините за черный юмор.",1666822076,373344163
38551757,,1666506017,29703135
38551757,Слава маржинальности за счет имения клиентов!,1666506047,1419637
