post_id,text,comment_time,from_id
40298564,Поручатель😂,1674832810,233845919
40298564,,1674832818,12162755
40298564,"20 лет поручает, и все только хуже становится",1674832836,309113278
40298564,"Укры, вперёд 
👏👏👏🤣🤣🤣",1674832866,186739992
40298564,,1674832872,565908459
40298564,предлагаю этот МРОТ платить депутатам Госдумы. чтобы поближе к народу были. пусть научат нас как на такие копейки выжить можно,1674832887,191627807
40298564,"Что толку?
Цены вырастут ещё!🤷‍♂️
Это было всегда такое!
У бизнеса всегда отмазка есть!",1674832952,752531285
40298564,Снова,1674832987,14925914
40298564,Это все потому что укропы наступают.,1674833049,611544125
40298564,на 100 рублей?,1674833052,629826307
40298564,"А можно проще! Привязать зплату министров,депутатов и прочих,борющихся за благополучие народа,к МРОТ + не более 8 раз для себя(с учётом доплат и прочих чего они там себе назначают). Там глядишь и работа попрёт в этом направлении.",1674833108,579438064
40298564,"Поручил, но не издал указ ! Обещать не значит жениться 😂😂😂",1674833116,225848270
40298564,"Сейчас секта поклонения МРОТ набежит, которая всю свою жизнь работает за мрот.",1674833136,771580639
40298564,50р? 🤦‍♀,1674833164,671966106
40298564,И смысл? цены взлетят до небес. Ценовой потолок никто не контроллирует.,1674833177,268354230
40298564,"Пока в России низкая инфляция, МРОТ повышается, как и пенсии, а ресурсы на восток идут- Запад обнищал в энергокризисе",1674833188,683610975
40298564,Сказочник,1674833194,542710962
40298564,Виагру бесплатно 😁😁,1674833209,15762502
40298564,Игра слов и цифр. 😆😆😆,1674833228,687336280
40298564,А ну все дружненько скидывайтесь мне деньгами за то что я на вас внимание обращаю🤣,1674833323,557212638
40298564,И тарифы повысить с опережением темпов,1674833377,467177624
40298564,"Уже доказано что чем беднее тем больше рожают, а не наоборот",1674833383,50734226
40298564,Куда ещё то рожать?Все детские сады и школы забиты под потолок черно)!(опыми.Ни одной русской poжи днём с огнём не сыскать,1674833404,719392911
40298564,"Меры поддержки растут, а коэффициент рождаемости всё падает, может не там копают?",1674833428,80155950
40298564,"И бла бла бла😁20 лет рождаемость повышаем,кстати ещё 2 года назад минимальная зп должна быть 2700$",1674833471,44060647
40298564,"Всё равно все в обезьян, а потом в медведей!!!!! Начиная с 2025 года!!!!! Всё по фен-шую!!!!! А дети наши и будут-белые Боги!!!!!Как и говорила мама-""простота хуже воровства "", но палочка то о двух концах, всё взаимосвязано!!!!!",1674833480,317508826
40298564,⚡Фэйк,1674833549,711195300
40298564,НАС РАТЬ НА БЕЗДАРНОГО ПРАВИТЕЛЯ ВЕЛИКОЙ РОССИИ,1674833553,779903378
40298564,"Поздно старый России конец, у нас и так население маленькое, рождаемости не было, а теперь ещё много молодых мужиков с сво не вернуться. Скоро аукнется, а с таким количеством людей, нам не защитить такие территории.... Так что поздно дед спохватился рождаемость стимулировать",1674833636,42465891
40298564,🤣🤣🤣🤣в какой раз по счету?)))))),1674833645,752172412
40298564,"В России, ещё не кому не удавалось опередить инфляцию их жалкими подачками.",1674833727,394125030
40298564,А с инфляцией бороться рука дрожит?,1674833731,765135487
40298564,"Повысить рождаемость захотел? 
Стрелять прекрати. Самая лучшая мера.",1674833747,283109166
40298564,"Ходят вокруг да около а от истины уходят в сторону. Не могут понять, почему в СССР рождаемость росла из года в год и без материнского капитала. А тут и с деньгами никто не хочет. Значит дело не в деньгах а в морали, культуре, воспитании, стабильности . Стало быть, это и есть определяющий критерий. А не то на, что подсадили всю страну. Смешно читать одно и тоже десятилетиями. 
Крали, тащили, разваливали, оптимизировали а теперь ужаснулись и озаботились.",1674833782,615711874
40298564,"А кто будет затягивать и срывать сроки, тот завербованный предатель и шпион",1674833792,177420641
40298564,Мобилизовать остатки мужиков?,1674833816,75065353
40298564,,1674833883,779584095
40298564,очередная путинская коунада,1674833890,8552041
40298564,"Цены выросли в три раза, так что памперсы, детское питание, вещи, коляски и оствльное выходит под пол ляма и больше...",1674833991,458329847
40298564,"Вообще-то нормальные руководители отчитываются об уже проделанной работе, а не строят ""воздушные замки""..",1674834081,29318670
40298564,"алименты уберите, маткапитал повысьте, а после, мужчины начнут строгать детей!)",1674834235,359879258
40298564,Такими темпами лет через 10 и Гондурас догонят.,1674834298,262369701
40298564,"Бабки есть ,теперь .Всю нечесть выгнали из страны .",1674834308,398796570
40298564,"Если бы Я был президентом.
Один раз в несколько лет наша страна пытается выбрать себе наиболее правильный путь развития. Этот путь должен базироваться на неизменных ценностях и выражаться в конкретных законах,которые должны неукоснительно соблюдаться. Это в идеале. По факту во всем мире,где-то больше, где-то меньше,эти требования не соблюдаются и законы, а следовательно и путь развития принимают некоторый уклон в зависимости от тех базовых ценностей, которые присущи первому лицу в государстве. Вот Я и решил пофантазировать, а какие бы я хотел видеть законы влияющие на направление развития страны. В области устройства государства. Отменил бы двойное гражданство, упростил бы принятие гражданства РФ, ужесточил бы экономические требования для не граждан РФ находящихся на территории РФ не в качестве туристов. На выборах первых руководителей всех уровней власти добавил бы в избирательный документ графу ""Кандидат назначаемый выше стоящим руководителем"". Это решило бы сразу три задачи. Первое - сохранило бы демократический принцип. Второе- упразднило бы тупиковое предложение некоторых политиков внести в избирательный документ графу ""Против всех."" Третье- укрепило бы вертикаль власти через взаимоответственность за поведение назначаемого кандидата и послужило бы индикатором доверия к назначающему руководителю вплоть до президента. Отменил бы суд присяжных как атрибут слаборазвитых обществ. Наказание за преступления сделал бы однозначные и четко прописанные в законах. Суды только профессиональные. Суд решает виновен или нет. В области экономического устройства государства. Ввел бы прогрессивную шкалу налогов на доход. Максимальный налог 50 процентов при доходах превышающих 100 минимальных доходов. Минимальный доход - 100процентов прожиточного минимума с учетом максимально необходимых потребностей. Все природодобывающие предприятия сделал бы с 50 процентным государственным участием. Обязал бы центробанк из государственных средств выдавать беспроцентный кредит на 20 лет, каждому желающему гражданину РФ, достигшему 18 лет,один раз в жизни, на приобретение жилья в эквиваленте однокомнатной квартиры(не более 2000000 рублей)с передачей в собственность гражданина после полной оплаты кредита. В области здоровья: физического, нравственного, интеллектуального.
Вместо строительства огромных стадионов и спортивных комплексов для ограниченного количества вип-спотсменов построил бы в сотни раз больше простых спортивных залов, под патронажем государства,при школах или в центре жилых кварталов. В целях снижения травматизма и смертности и соответственно государственных расходов на компенсации и реабилитации в обязательном порядке обязал бы установить на лобовом стекле транспортных средств красный фонарь загорающийся при превышении разрешенной скорости для возможности снаружи и изнутри реагировать на неадекватного водителя как пешеходам, и другим водителям, так и работникам государственных инспекций со всеми законными последствиями. Культивировал бы только не травмоопасные виды спорта нацеленные на укрепление физического и нравственного здоровья, а виды спорта приводящие к физической и нравственной инвалидности объявил бы вне государственных дотаций и законов. Отменил бы ЕГЭ и вернулся бы к нормальному школьному и среднему образованию с нормальными экзаменами подтверждающими полученные знания. Я обозначил примерное направление и количество фантазий, но если каждый из нас выразит хотя бы такой же объем, а соответствующие наблюдатели сложат все вместе и систематизируют, то как раз и получится тот путь и направление куда надо двигаться нашему государству.",1674834385,314835365
40298564,Отлично!,1674834460,97310758
40298564,"Зарплаты надо повышать,а не подачки",1674834487,564194925
40298564,"Не нажимайте ОТВЕЧАТЬ 🐷ботам, пишите комментарий свой в ленту, указывая оппонента. Не кормите 🐷ботов!!!",1674834505,419821100
40298564,Голодающие укры 😃😂☝️,1674834522,70453718
40298564,"Мера отлично работает, только на новоиспечённых граждан РФ",1674834541,118261761
40298564,,1674834544,780178306
40298564,"Молодец Владимир Владимирович!
💪🇷🇺🇷🇺🇷🇺❤️",1674834573,70453718
40298564,Шел 24 год. Обнуленыш все поднимает рождаемость. 🤬 Сколько же ты бед принёс и натворил. Проклят людьми,1674834622,710168624
40298564,Значит жди повышения цен,1674834682,325647525
40298564,,1674834741,87393623
40298564,То есть основательно узбеками и таджиками заселить,1674834752,281687
40298564,,1674834756,87393623
40298564,"Одних родят, других на ладу поменяют...",1674834973,763896219
40298564,А теперь поднимем ручки  ! Кто у нас здесь чистый  русский 🤔,1674835043,565200923
40298564,путин,1674835069,17265161
40298564,Президент также поручил до 10 февраля разработать и представить комплекс допмер...... Кому? Этим?,1674835282,720944278
40298564,Это прям праздник какой то)),1674835400,173504520
40298564,,1674835491,17272378
40298564,"А что привязались к этому МРОТ? Он был разработан в пору развала и грабежа, туда не включено многое из того, что в уважающих себя странах считается неприличным не включать.",1674835701,31799566
40298564,"темпы роста инфляции они нарисуют сами и подгонят под них МРОТ, реальные цифры будут как всегда отличаться в разы, народ уже не обманешь, надолго ли хватит терпения?",1674835837,520779759
40298564,"Что мы не в ту сторону пошли: у нас деньги в голове вместо любви в сердце и души! Дети это же здорово! Это радость то какая! С голоду не умирает никто, кто рожает. Крыши над головой у всех есть. А если не у всех так помогите тем кому нужна помощь. Надо всём объединяться и друг  другу помогать. Тогда выживем!",1674835849,708959691
40298564,Сменил бы он уже пластинку. Великий поручатель.,1674835919,167785192
40298564,Цены как в 94-м...,1674835932,502067258
40298564,Причем данная мера будет распространена и на новые регионы. Об этом объявлял Мишустин,1674835938,720177123
40298564,При Путине лично я реально ощущаю поддержку семей и общества в целом,1674835992,720477992
40298564,"Деньги обесценились . Теперь пора на каждого рожденного по 3 Ляма выплачивать , как минимум 3",1674835997,663450128
40298564,"Сейчас прям самое время рожать,спокойная мирная жизнь,уверенность в завтрашнем дне,цены снижаются,доходы и покупательская способность растут,уровень жизни повышается,реально а не по статистике,когда лгут с умным выражением лица.",1674836042,770554772
40298564,"🤣🤣🤣он сам понял, что подписал? 
1-от кого рожать если почти все угнаны и возврата обратно почти не будет. 
2-Для кого рожать, для кремля и опять на убой?",1674836066,523215780
40298564,"Конечно проще было б дать МРОТ всём министрам, а их зврплату - многодетным мамам",1674836107,708959691
40298564,"Насмешили! Повысить рождаемость, на какие шиши кормить, учить детей.  Работы нет,а если и есть то смешная.",1674836113,420820725
40298564,он бы лучше раздал всем бесплатно презервативы.,1674836217,523215780
40298564,"Как всегла президент говорит,а месным властям по.... на то что говорит президент.",1674836361,139184859
40298564,"[id760076603|Вера], ципсо, сюда смотри",1674836370,512171318
40298564,"Повышать рождаемость? 😂 кем? 300 т, мужиков ушли Интересно кто же будет за них рождаемость поднимать?) 😂😂",1674836382,94568967
40298564,"Семьям с детьми льготная ипотека, материнский капитал уже на каждого ребёнка, помощь и пособия одиноким матерям — всё это в ""демократических"" девяностых и не снилось молодым родителям.",1674836708,757564508
40298564,Повышать?Вы молодых пацанов по все стране собрали и на мороз выбросили.Такое чувство что многие из них кто вернется в этом государстве постить детей не захочет Показуха и лицемерие,1674836781,297899360
40298564,"Пока ситуация в стране не придет в норму, не закончится сво, думать даже о рождении второго нет мысли!",1674836795,8505018
40298564,А когда работающие пенсионеры получат индексацию пенсии. Видимо дл нас не дойдет очередь в решении этого вопроса.,1674836809,435883818
40298564,"Ну да, нещету плодить, он цены видел на детские вещи, а принадлежности к учёбе, а стоимость проезда, у нас только у делопутов все бесплатно, а детки нынче очень дорогие!!!!",1674836911,79816124
40298564,"Что ж, России нужны солдаты.",1674837257,708307152
40298564,Рожать в 21 веке эт большой грех!!,1674837300,671965744
40298564,"Аха, дед опять в лужу пернул и забыл. 
Пук принесли все сми и забыли.",1674837474,697295712
40298564,Ага рожайте детей а потом их погонят на войну😂,1674837486,708464488
40298564,"Путин готов,бабки на юпитер",1674837643,692273330
40298564,"Ядерные ракеты,нло отключили как и в 2007 году чем ответит путин нло высокоразвитая вторжение на россию",1674837743,692273330
40298564,Где то мы это слышали уже из года в год.и что? Ничего,1674837832,272896947
40298564,Просто есть Москва а есть Россия не путайте так всю жизнь было....,1674837940,317916482
40298564,"И выселить людей из трущоб? И пенсии, наверное, поднять?",1674838054,5127447
40298564,"В таком случае,  будем получать около 100 т.р. 💪💪💪🤣🤣🤣 Сарказм 😔",1674838058,197834477
40251443,"стандартно нужно написать про рост цен в западных странах, а тем временем танки едут",1674645404,5666262
40251443,"🌟Как вариант, но по объективной оценке происходящих событий (общая нац. валюта БРИКС, сожжение Корана, отказ Колумбии от поставок вооружения Украине, массовые протесты в Европе и т.п.) на геополитической арене, однозначно будут перемены в нашу пользу до прибытия танков, а ещё и обучить надо...
Танки приедут, уже в новый многополярный мир, для мирных целей... если приедут...
Либо, будут уничтожаться🎖️
🌟Правда за РФ🇷🇺
💢💢💢💢💢...",1674645414,448063889
40251443,Вучич хитро улыбнулся 😉,1674645430,633575211
40251443,Не жалко,1674645446,186739992
40251443,"Нет, ну надо потерпеть за кастрюлек. Вы же все лето скакали за них.",1674645446,590067515
40251443,Цэ Эвропа,1674645453,86256033
40251443,"А в России не жалуются, просто терпят стабильность.",1674645507,382912657
40251443,"У всех рост цен и у нас тоже. 
Причём, на внутреннем рынке,  цены на энергоресурсы нам могли бы и не поднимать.",1674645516,356122517
40251443,А в рашке не жалуются??,1674645522,671965744
40251443,"Пусть побудут в рашке, там не только жаловаться начнут",1674645565,737537867
40251443,"Не верим, такого не может быть в садах гейропских",1674645570,10818210
40251443,"Жалуются и жалуются , ничего удивительного. Сами выбрали этот путь. Нужно было раньше думать. Киев тоже жалуется на отсутствие света , но они его и не придумывали , чтобы он у них был...",1674645606,688297238
40251443,Замечательно👍😄,1674645607,709357455
40251443,За то рабам и терпилам всё ок. Путинские чувствуете свой конец?,1674645630,779692264
40251443,"А че жалуются то?Все рвутся в Евросоюз,кричат как там хорошо  прям рай а сейчас что не так? Хрен с ними,это их проблемы.",1674645630,520154162
40251443,их проблемы,1674645634,751827043
40251443,Вторая армия мира сантехников 😂😂😂,1674645652,225848270
40251443,Квартплата постепенно превращается в ипотеку😁,1674645662,199838323
40251443,пРО ХОРВАТОВ ТО НАМ ЗАЧЕМ?,1674645670,741077708
40251443,"Яблоки 140 рублей на наши , да норм 💁‍♂️",1674645688,17476742
40251443,"[id448063889|Алексей], уничтожаться, потом мир. Пока есть резервы танков, запад надеется победить Россию. Поэтому если танками нельзя стрелять по городам, пусть присылают. Не надолго.",1674645691,186739992
