post_id,text,comment_time,from_id
39257307,Лол) всего 10% инфляции) мы за 30 перевалили,1669821428,9555082
39257307,,1669824086,20863674
39257307,А северный поток пока не готов 🤣 все претензии к Англии,1669824404,243919869
39257307,"Только в России не протестуют, одни терпилы",1669825038,309715810
39257307,"Это из-за санкций против России 
Запад стал жить хуже. Есть надежда на то, что население США и ЕС не захочет терпеть лишения в угоду амбициям властей.",1669826181,61154242
39257307,Скоро опять на половнике штопать будем!!😂😂😂😜,1669826741,539134089
39257307,"Чё протестуют? И так нормально живут, чем эти фашисты всегда недовольны?",1669826972,697594315
39257307,"Вот они там ходят, ходят,а их не слушает власть и делает по-своему.",1669827454,609008057
39257307,Да Россия то и не против поставок.,1669827522,58873789
39257307,"Не  черное ,ты, затмение мозга ! Факт 😂",1669828332,500955590
39257307,Все таки и нам есть чему научить запад. Наш ОМОН разогнал бы этот балаган минут за 15,1669829185,9159617
39257307,"Помню, лет 30 назад в Ленинграде квартплата была фиксированой. Но с начала сезона отопление всегда задерживали. Однажды задержали на 3 недели. Температура опустилась до 17 градусов. Немного спасали от холода толстые 70 см стены нашего дома старой постройки и постоянно включенного газа. Одевались как бабки ежки, а носы все равно были хододными. Сейчас платим за отопление по общедомовому счетчику и все равно платим много. За зимний период 2021 года было 7 аварий теплоцентрали, но включали  быстро серез день.",1669830451,711001138
39257307,А что случилось?),1669834522,544390324
39257307,"- Ой да-ну, притворяются, всё у них нормально...)",1669872023,63546505
39194465,,1669474486,395805392
39194465,👍🤣🤣,1669474493,735891105
39194465,,1669474537,296826171
39194465,Путин спровоцировал рост беженцев из Украины и России. Вот из-за них и рост нуждающихся в бесплатных продуктах,1669474829,759924732
39194465,😼,1669474875,745970329
39194465,Зачем обманывать ? Фудбанки на западе получают продукцию от производителей ..это в России возле деревни зерно растет..а в деревне ни заработка ни карты продукт . Кто имеет от небывалых урожаев ? Испанский бедный который может получить еду ?,1669475115,598605255
39194465,"А,что там случилось ?..Санкции вроде не вводили..",1669475179,275472227
39194465,"Я бы зашел и набрал продуктов, сэкономил на одежду. Совсем в обносках вынужден ходить в своей Рф.",1669475219,120990586
39194465,В России возле каждового продуктового есть свой фудбанк. И никакого ажиотажа. Все пенсионеры в очереди. Главное поймать время вывоза,1669475232,233845919
39194465,"Боты все о ценах, а у сына Кадырова часы за 85 миллионов рублей",1669475516,622300671
39194465,Ребят.... есть изобретение для вас... карточки... талоны на продукты... вот так и победил социализм)))),1669475619,481478339
39194465,Может им просрочку отправлять? Раз еды не хватает.. 🤔,1669475634,270226530
39194465,"ну так это наверно не коренные кто работает, а беженцы разные и работать скорее не хотят (",1669475892,534721890
39194465,"⚡Россия чтоб не было так как у них, специально эту показуха делают, чтоб Россия не так плохо живёт 😂😂😂😂😂",1669475984,711195300
39194465,"Хватит уже людям есть. Едят и едят... как саранча. 💀💀💀
(Пора уже посадить народы на простую манку, на воду и репчатый лук! И жить им по 70 лет тоже нет нужды! А зачем?.. Достаточно 40-ка лет.)",1669476023,258835709
39194465,Кушать все хотят🤣,1669476112,761804626
39194465,Хватит жрать!,1669476237,80486900
39194465,"Посмотрите фильм Няньки (США, 1994). Героии фильма готовили еду и раздавали бездомным, это нормальное явление волонтёрские банки. Секонд-хенд по такому же принципу работает, только всраные бизнесмены везут все и продают...",1669476331,763856231
39194465,Беда печаль. Держитесь. 😔,1669476891,70453718
39194465,"Нужно только обратиться к белым людям из РФ, 🇷🇺 Помощь обязательно будет для аборигенов из ЕС!!",1669477002,497267138
39194465,Молодцы!,1669477441,611829240
39194465,,1669477486,755739299
39194465,"''Дожили поляки- ни соли, ни табаки...'' в масштабах ЕС!!!🤦‍♀️🤪",1669477622,493078365
39194465,"Вот и пусть делом занимаются, а то придумали всякое ЛГБТ 👎👎и нежатся сплошь.",1669477917,186739992
39194465,"России больше надо смотреть на себя ,а не то что в Европе",1669478108,236976416
39194465,"Нет там никакого ""энегретического кризиса"", и с продуктами всё нормально. Не врите, риашки 😃🤡",1669478309,1002371
39194465,"Пропаганда не позорьтесь, отстаньте от Европы, ваша страна Россия, вот о родине и постите новости, а так глупы и смешны ваши потуги и злорадство😊",1669479398,703618949
39194465,"Да да, как в Европе всё плохо...а у нас з..бс..🤮",1669482230,28799075
39194465,Европа на гуманитарке.. кто бы рассказал такое год назад.,1669483214,321202433
39194465,Во ссут нам в уши,1669486552,479219574
39194465,Свои проблемы надо публиковать…,1669488856,55492303
39194465,Неисповедимы пути твои ЕС..,1669498203,467103711
39194465,"У них есть ЧМ по футболу им нужны зрелища, а есть не обязательно.",1669504817,583278589
39194465,"Сами себе в штаны срут,но виновата Россия!",1669511334,157078868
39194465,Толи ещё будет ой ёй ёй.🤣🤣,1669522558,232203568
39194465,Так им и надо,1669523781,20863674
39194465,"Всё врут наши пропоганько Гандисты , как жили так и живут люди ,хлеб салят виноград выразивают , их деревень не бегут в города , Вот про нас это скорее относится ,",1669530711,345297856
39194465,Испании грозит голод.,1669538108,736610263
39194465,Поддерживать идиотов дорого..👏👏👏,1669543278,722495063
39159743,Загнивают потихоньку,1669307270,594993919
39159743,Хрен с ними. 🙈☝️,1669307285,70453718
39159743,"За своими ценами следите,в своей стране",1669307325,86750646
39159743,Ну так пусть давят на своё руководство чтобы те не разбрасывались долларами и оружием за тысячи километров от своих границ!😡,1669307337,711343786
39159743,Сейчас боты будут кричать что это не критично они зарабатывают много🤣,1669307343,39759533
39159743,"А нефиг было трогать "" региональнаую бензоколонку!""",1669307343,238260247
39159743,Путин отдай удобрения Кубе )нет Африки,1669307359,282655213
39159743,I couldn't care less,1669307379,160571476
39159743,С их зарплатами они могут себе позволить взлёт цен в два раза)))),1669307401,351174903
39159743,Это хорошо или плохо ?,1669307410,5599332
39159743,Ну емае,1669307413,763484261
39159743,"Везёт им, не в 2 раза продукты подорожали, как у нас.",1669307419,216449312
39159743,"Их цены меня мало интересуют, меня интересуют наши цены 😑",1669307441,2783865
39159743,Пофиг на Африку)там бананы больше .ничего нету)Куба спасла СССр от войны),1669307473,282655213
39159743,На 20% выросли в Америке 🤣 у нас цены улетели в космос,1669307475,759924732
39159743,"Ну там и люди и зарплаты получают в разы больше, чем люди в России...",1669307480,696991529
39159743,"Вот только посмотрите, что они наделали со своими санкциями! ☝🏻",1669307505,336495513
39159743,У нас ЖКХ на 20% подняли,1669307569,715523976
39159743,"РИА как всегда… А в России как дела с инфляцией, ур@ды проп@г@ндонские?",1669307580,4842955
39159743,,1669307588,143048882
39159743,"О, понабежали... Одни и теже методички.. Информациннпя война на последнем издыхании уже что ли?",1669307619,145287625
39159743,"У нас , как с ценами, кто в курсе?",1669307624,223897211
39159743,Это хорошо👍,1669307647,747238442
39159743,А у нас не выросли?!,1669307674,405803902
39159743,Админ в РИА Новости ... 🤣🤣🤣 ...а комментарии мои зачем удаляешь ?,1669307695,246975915
39159743,Так тварям !! 🤣👍👍👍,1669307713,735891105
39159743,Нафик нам америкосы,1669307723,405803902
39159743,"Решили сравнить , может зп сравним ?",1669307729,748298341
39159743,"Вы свои покажите цены,рехнуться можно,ещё и комуналку поднимают",1669307746,494892349
39159743,"УЖАС! Как они выживают то в США, ума не приложу! (((
Кусок готового копченого мяса примерно с пол-кило аж 9 долларов! Если учесть что в США за час работы получают минимум 7,5..12 долларов, то как же они тогда ухитряются питаться?",1669307749,258835709
39159743,Кошмар! Только для них а у нас это обыденное дело.,1669307751,288845339
39159743,Благодарите Байдена в том числе 🤷‍♀️,1669307774,186739992
39159743,Что вы говорите!,1669307815,377283506
39159743,Жизни индеек важны 🐔,1669307816,3773003
39159743,"А у нас всё дешевеет, вот парадокс.",1669307851,145416496
39159743,Прочитал сперва стоимость индейца увеличилась на 21-23%!),1669307883,646925458
39159743,Россиянам от этого что? В магните индейка сколько стоит скажите клоуны из риа лучше,1669307895,458058659
39159743,"А в России ничего не дорожает? Газ скоро золотым станет, это заметно особенно когда у тебя частный дом с агв. Полгода назад с тысячей еще можно было что то накупить, то сейчас отнес, и не заметил куда их потратил и что купил.",1669307910,290757199
39159743,Дак и наши чинуши не отстают....цены на ЖКХ поднимут с 1 декабря....а соответственно всё опять подорожает!😡,1669307923,342446418
39159743,Хорошие параметры для роста рубля. Как минимум до 58 рублей за доллар....,1669307954,710313517
39159743,"Прочитал сперва ""стоимость индейца увеличилась на 21-23%...""!))",1669307965,646925458
39159743,"Так что у них, что у нас - капитализм...и бизнесхрены как ценами хотят - так и крутят.",1669307989,407725917
39159743,А у нас смотрю падают,1669308047,62949634
39159743,То-ли ещё будет ой-ё-ёй! Байден вам в помощь!👍😁,1669308062,752531285
39159743,А у нас на все выросло!,1669308063,707910304
39159743,https://vk.com/club217236686,1669308089,183938175
39159743,"В РФ на мясо комбинаты раньше ездили скотовозки ,теперь парашок )) .хз что хуже подъём цен или товар душманский из пальмы ))",1669308140,142922846
39159743,"Мы бы немного возмутились, а для них такое шок))",1669308170,76667069
39159743,"Хорошо ,что у нас благодаря присоединению новых экономически развитых территории цены на все так упали.",1669308189,9159617
39159743,радость то какая они еще наш дошерак в пятерочках не видили!)😜,1669308210,241617507
39159743,без индейки останутся 🤣,1669308286,-195458681
39159743,Показывают Whole Foods самый дорогой супермаркет в сша,1669308363,710094972
39159743,странно что не могу себе позволить эту огромную курицу как она там называеться индейка но то что амерекосы скоро станут нищебродами как я очень даже радует!)😂😂😂,1669308400,241617507
39159743,"Да , неплохо , а в украине , ваши денежки , выделенные вашими политиками , неплохо взлетают в воздух , при атаках ВС Рф",1669308414,612999286
39159743,"А почему я беларус, должен жалеть врагов, я Россию люблю 🤣☝🇧🇾🇷🇺",1669308429,718375069
39159743,"Срочно надо референдум провести 🤣🤣🤣 . Будут сыты , но бедны .",1669308445,663450128
39159743,"Хорошо, что хоть в России все дешевеет с каждым днём, а к НГ вообще все за три копейки будет🌚",1669308463,395293069
39159743,Почему эти новости транслируют на территории России? Почему замалчиваете о  инфляции в России? 🗣,1669308467,553282327
39159743,Зачем целую? Не жалко целое поголовье уничтожать?,1669308476,186739992
39159743,"Для общего развития)Население США составляет менее 5 % от мирового, при этом 25% всех заключенных в мире — это американцы.

— Форд, «Дюпон», «Дженерал моторс», IBM, Exxon, ITT Corporation, Голливуд, Кока-кола, Nestle, General Electric — сотрудничали с Гитлером.

— Американцы, самая больная нация людей, ими потребляется 50% таблеток от всех выпитых в мире.

— 20 тыс. детей постоянно ночуют в приютах Нью-Йорка

— Лишь 32% всех американцев в возрасте до 25 лет имеют работу с полной занятостью.

— Америка основана каннибалами. Переселенцы 17 века пожирали друг друга при неурожае и в суровые зимы. Учёные до сих пор находят останки поселенцев Вирджинии, со следами кулинарной разделки.

— За 10 лет более 20 тыс. детей погибли в США от рук членов их собственных семей (это в 3 раза больше потерь в Ираке, Афганистане).

— 26% янки не знают, что Земля вращается вокруг Солнца, опрос агентства ""Фонд национальной науки.

— Согласно исследованиям профильного агентства (SAMHSA) более 20% американцев, в возрасте от 18 лет имеет отклонения в психике.

— За последний год количество бездомных в Нью-Йорке увеличилось почти на 15%, до отметки в 60000 человек.

— Америка, лидер по производству порнографии. Почти 90% всей порнографии в мире сделано в США",1669308505,546394836
39159743,"У нас к Новому году растут еще больше... Зачем мы о них, давайте о нас! У нас квартплата ВДРУГ в декабре растет...",1669308523,665612372
39159743,oh no!,1669308614,231278457
39159743,"Я извиняюсь , а в России на скол ко процентов поднимется абсолютно все на новогодние праздники?",1669308642,92828470
39159743,"Действительно, неуместная новость",1669308702,54595016
39159743,Риа не посуществу так то везде на праздники так по цене,1669308878,142795786
39159743,"Я спагетти покупал до СВО по 45 рублей, сейчас по 90рублей - но это всё ничего, вот в США как же здорово что у пендосов в праздник на 20% поднялись цены!!! Вот им там точно плохо.",1669308978,351174903
39159743,Завязывайте с этой дешёвой пропагандой,1669308988,-175116891
39159743,"Бедные американцы, на целых 20%, какой ужас, это просто ужасно, я плачу. Пойду сахар куплю по 66 рублей (до 24.02 он стоил 45) и бананов по 95 (до 24.02 стоили 55) . У нас то нет инфляции, но уж точно не такая, у нас всё стабильно, а все кто орут что плохо это всё либералы и иностранные агенты и ципсо.",1669309222,747754250
39159743,Так вот зачем американцы взорвали газовуютрубу и продают РСЗО : что-бы жить хорошо!,1669309373,346562766
39159743,"Индейцев уничтожили, за индеек взялись, проклятые янки!",1669310167,164401124
39159743,"Да, давайте, РИА, расскажите нам в очередной раз, как плохо живут в США и Европе. Любимая тема для ура патриотов. Ну, есть, наверное, и те, кто верят в это))",1669310267,280019653
39159743,говорят в гейропе уже замерз один буржуй!),1669310387,241617507
39159743,"У нас тоже в России на носу ""новый год"" как обычно тоже все дорожает... уже даже началось...",1669310709,705856909
39159743,"Методички ципсо одинаковые. 
Подорожали продукты, но понемногу стали дешеветь.",1669310918,583278589
39159743,"Мистеры, бунтуйте",1669310979,609741002
39159743,У них до сих пор пандемия?,1669311019,172178912
39159743,"Я в 2012 году покупал куриное филе по 120 руб. и был сильно возмущен, сейчас его покупаю по 410 руб. и счастлив, все стабильно!",1669311331,56669126
39159743,Это не имеет никакого значения для американцев с их доходами 🤡🇺🇸 💰 🤑 💸 💲 💶 💵,1669311755,1002371
39159743,У нас помидоры больше 100 руб. Наверное всё с Европы.,1669311813,98870787
39159743,"Т.е. в Америке кг индейки стоит 5 баксов? Итого за 1к кг примерно 4500 рублей, в России за 13 кг примерно 7000 рублей? Это они нас пугают их ценами? Серьёзно? При средней з/п в загнивающем западе 500 рублей в час и при нашей в 120? Серьёзно? Зачем вы это вообще показываете?",1669312003,383622567
39159743,Курица 2020 84 руб курица 2022 154 руб. ©® Пятёрочка. Выручает.,1669312055,164470752
39159743,- Хорошо...),1669312309,63546505
39159743,"Какой день благодарения, день геноцида коренного населения Америки",1669312324,14925914
39159743,"То то я смотрю все с Америки валят. Кто на плотах, кто на лодках надувных, кто просто в плавь. А всё из-за ""лютой"" инфляции на индеек.",1669312404,361644282
39159743,"США входит в десятку высокоразвитых стран,о чем речь,дети ваши все в США",1669312487,302554949
39159743,Хорошо что в России цены не растут.,1669313358,262369701
39159743,Ну чо может смсками американам  на индейку скинемся. 😆.,1669313463,183479373
39159743,А у нас прям все цены вниз и вниз)) насмешили.,1669313527,582133
39159743,А в России в разы,1669313657,211376470
39159743,Вобще без разницы что там в сша,1669313690,47316582
39159743,"Б...ть , вы за своей страной смотрите, за своими ценами☝",1669313930,663718553
39159743,И он. Решили вместо  индейки  купить просто  хлеб . ? Вы что пишите нам до Америки ещё 10000 развиваться,1669314241,170875474
39125923,Хорошо что в России все дешевеет последние 22 года,1669171674,760060933
39125923,привыкнут мы 30 лет так жили,1669171763,108620897
39125923,А реальная инфляция в РФ какая?,1669171802,233845919
39125923,,1669171934,755739299
39125923,"Все федеральные каналы с утра показывают как плохо живётся европейцам, как будто у нас цены не подняли на 50%",1669171966,747754250
39125923,"Вот мы то переживём, а вот там, вопрос.",1669172157,160889356
39125923,По барабану,1669172241,223537659
39125923,А они об этом вкурсе?,1669172345,96685604
39125923,Хорошо что при пыне всё дешевеет уже четверть века,1669172382,745596944
39125923,"да. Мир оплачивает попытку сша остаться гегемоном. Гегемоном сша не останется. А Мир, в результате, останется в разрухе.",1669172398,463494671
