post_id,text,comment_time,from_id
2404104,Экспертов по финансам в России как собак не резанных . Лучше-бы предложил не далекой Сахипзадовне как рубль стабилизировать . 🌚,1699759920,438356814
2403038,"Особенно удивляет цена нового Москвича- под 2 лимона. Сделан с китайского г-на, почему такая цена? Неужели найдутся идиоты, которые его купят?",1699643157,215172956
2403038,Кому вообще интересны эти цены? Выбор есть.,1699643618,646199767
2403038,Это рывок,1699643901,710776279
2403038,Отмазали чтоль ЦБ и Минфин ?,1699647091,183660268
2403038,в час,1699647206,66217118
2403038,если не ходит в магазин то цены то нормальные,1699673943,749306553
2403038,Что с экономикой? Кто ей управляет? Рост цен никто не контролирует. Беспредел,1699716999,353256094
2401613,"Никакой пользы от существования Израильского государства нет. С момента его образования по настоящее время в регионе возникло опасное проявление замкнутого круга насилия. Израиль оккупировал земли Палестины. Аппетит новых поселенцев рос из года в год, с вытеснением коренных жителей региона. Конфликт, длившийся 75 лет, может быть прекращен только, с восстановлением статуса-кво - удаления государства Израиль с карты мира.",1699593809,206034490
2401613,"На след неделе будет возвращен экспорт нефти, Путин вроде как приказ отдал восстановить. Посмотрим, что будет с ценами и курсом",1699595127,730821992
2401613,"а ведь могли бы политики просто сесть за стол переговоров, как это советовал Путин, но ведь Запад раскачивал конфликт не для этого",1699596171,806816996
2401613,Это будет на руку нам но как обычно на чужом горе не разбогатеешь,1699605456,400107149
2396449,Меньше надо покупать тогда будут цены снижать?,1699378652,708600308
2396449,Оракулы ...им бы профессию сменить.,1699378685,494367262
2396449,Озвучен сигнал начала атаки!,1699378803,239190555
2396449,,1699378807,606064487
2396449,"Это.. Всё. Враньё.. Единая. Росси. Я
Враг. Народа",1699378985,731410159
2396449,"Где поднятие МРОТа? Хотя что такое 18.5 %? С такими ценами в магазинах его должны поднять минимум на 50%, а не на 18.5%.",1699379128,173928104
2396449,"Какая нахрен инфляция по 4%, Вы видели сколько стоят продукты,
а зарплаты и пенсии....
Позор нашему Правительству за такие индексации как будто смеются над пенсионерами......",1699379620,602924095
2396449,Сколько можно людей сказками кормить???,1699379672,20229396
2396449,По прогнозам наше будущее всегда лучше нашего настоящего😊,1699380235,420369443
2396449,"Если прогноз не сбудется, то никто за это не ответит.... Даже забудут😁",1699380425,720224746
2396449,"Ох уж эти прогнозы...
Самое правдивое из сказанного - Пока же рост цен продолжит ускоряться, ...",1699380606,538722239
2396449,Пи...ть не мешки ворочить.,1699381911,139512083
2396449,"Только что ЦБ извещал о 14% инфляции в 2023г Ну, артисты. Как быстро переоделись",1699382205,209942616
2396449,крысятник Пути всеми силами топят рубль....наверно выслуживаются перед хозяевами из Вашингтона,1699383419,720165515
2396449,"К лету как всегда инфляция снижается,но до лета надо дожить....)))",1699420013,608126479
2396449,,1699443385,488342308
2391790,С новым годом.,1699180888,109463900
2391790,"У нас на все повышаются цены —-
Кроме повышения зарплат и пенсий ...",1699181241,602924095
2391790,"Жульё свои карманы набивает, цены на цитрусовые поднимает.",1699181354,355406780
2391790,Мясо вкуснее и дешевле,1699181388,524607722
2391790,"В СССР, апельсины и мандарины привозили тоже только к новому году, да, ничего выжили без них и до сих пор живёт...",1699181416,621570777
2391790,А на что не растут цены ?,1699181440,43636142
2391790,"Вот чего у нас не отнять никому, так это роста цен. Хорошо, что пенсии с зарплатами не так быстро растут и то какая - то стабильность.😂",1699181457,422507039
2391790,Не может быть что Абхазия задерёт цены на мандарины!!! Там коровы их жуют.,1699182252,677176032
2391790,,1699182331,32124701
2391790,Да пошли вы все со своими ценами!..........,1699182508,20229396
2391790,"да хоть на тыщу процентов, всё равно они в пятерочке невкусные",1699182527,171882202
2391790,Это не хлеб с маслом и картошкой,1699182729,155084603
2391790,Китай и Африка ешьте сами...,1699182799,174772343
2391790,"даёшь мандарины по 300,кстати пишут, что икра подешевела!!!Может на икру переходить?Скажите, а логистика из Абхазии проходит через Суэтский канал?",1699183060,372260877
2391790,Я давно забил на них! Яблоки ни чуть не хуже по витаминам😎,1699183247,240658938
2391790,опять евреи виноваты...,1699183279,199678198
2391790,Так ведь не только мандарины подорожали вся молочка опять поднялась Кто следит за ростом цен не понятно,1699183952,601344704
2391790,Мандарины скоропортящийся продукт. Спроса на будет и сгниет.,1699188349,151203587
2391790,"Зато прошлогодний снег подешевеет, а ,может, и нет?",1699188581,623972958
2391790,Пусть сами кушают.,1699189971,42215130
2391790,"2 бакса за килограмм толстокожих апельсинов ,ТРУДНО СЪЕДАЕМЫХ не круто ли?",1699190101,372260877
2391790,"В детстве ели два мандаринчика ТОЛЬКО на новый год в новогодних кульках......вы представляете мы выжили в эпоху СССР без мандаринов....только по тому ,что не было засилия ХИМИИ В ПРОДУКТАХ!!!!СЕЙЧАС НАВЕРНОЕ В ПРОДУКТАХ НЕ ОДНА ,ТОЛЬКО ТАБЛИЦА МЕНДЕЛЕЕВА ,НО СБОРНАЯ СОЛЯНКА ИЗ ЭТИХ ЭЛЕМЕНТОВ!",1699190354,372260877
2391790,Потому что великая рассея  !,1699190378,538873040
2391790,"И кому они нужны будут   по 500р, гнить начнут и на помойку....",1699192901,358538655
2391790,Подумаешь зато НАТО получит своё! А в Америке госдолг вот какой большой ),1699210131,8258541
2391790,Дорожает обсолютно все-в этом стабильность мтраны🤣,1699214863,248638783
2391790,"здравствуй, ...опа, Новый год!!!🤣🤣🤣",1699214872,341473031
2391790,"Если бы только мандарины,подорожало 
и дорожает все.Главное, граждане , бизнес кошмарить нельзя,что б в наваре был,ну а народ,
можно и покошмарить 
ценами,ну кто с ним 
когда считался",1699217753,620886877
2391790,"США оказывали колоссальное давление на сторон конфликта, вместо того, чтобы предложить странам компромиссы! Их влияние в этом конфликте нельзя недооценивать",1699222843,795102744
2391790,"наш президент действительно заботится о людях, на встрече с президентом Ирака он призывал обе стороны конфликта заняться вопросами обеспечения безопасности мирного населения",1699222853,794097510
2391790,"Израиль и Палестина должны сделать все, чтобы урегулировать свой конфликт. Путин правильно сказал.",1699222856,794849824
2391790,"можно сказать ""спасибо"" США за их помощь в решении палестино-израильском конфликте, они не искали компромиссы, они лишь давили на стороны под выгодные им решение, от этого градус агрессии накалился 😒😡😒",1699222875,798875602
2391790,"При участии всех конфликтующих сторон, как заявил наш президент на встрече с президентом Ирака, ущерб гражданскому населению должен быть сведен к минимуму",1699222880,795104335
2391790,"И Палестина, и Израиль должны сотрудничать в вопросе сокращения ущерба среди мирных жителей, об этом не так давно напомнил Путин, с ним трудно не согласиться!",1699222881,795699229
2391790,"Женщин и детей в контексте палестино-израильского конфликта необходимо оставить в покое, Путин верно подметил.",1699222884,797906639
2391790,"Путин утвердил, что РФ готова и дальше вести работу над урегулированием конфликта Израиля и Палестины, что крайне важно👆🏻",1699222886,794849169
2391790,"Согласно заявлению В. Путина, США намеренно оказывали давление на Израиль и Палестину вместо того, чтобы попытаться найти компромисс",1699222887,795817637
2391790,"На недавней встрече с президентом Ирака Путин заявил, что ущерб гражданскому населению нужно минимизировать!",1699222890,805082532
2391790,"Россия активно содействует мирному решению палестино-израильского конфликта, Путин открыто заявляет, что сейчас главное - остановить кровопролитие!",1699222891,795581229
2391790,"Путин при встрече с президентом Ирака указал на то, что при посредничестве обеих сторон конфликта необходимо свести к нулю ущерб гражданскому населению",1699222891,794847153
2391790,"Сторонам военного конфликта стоит оставить женщин и детей в покое, об этом верно сказал Путин",1699222893,796073469
2391790,Наша страна готова помочь урегулировать конфликт между Палестиной и Израилем. Путин лично об этом заявил,1699222893,798866590
2391790,"Я считаю важно сказать, что наша страна, наш президент полностью ""за"" мирное решение палестино-израильского конфликта!",1699222894,799252798
2391790,"палестино-израильский конфликт не мог обойтись без США, как отметил наш президент: США оказывали давление на обе стороны конфликта",1699222895,799606277
2391790,"Несомненно, Путин прав в том, что в конфликте Палестина-Израиль необходимо перестать затрагивать детей и женщин.",1699222895,795092111
2391790,"Как сказал Путин, главное сейчас - остановить кровопролитие. Уже сейчас предпринимаются шаги для нормализации ситуации, для того, чтобы не допустить эскалации конфликта",1699222896,799062798
2391790,"США стремились монополизировать урегулирование палестино-израильского конфликта, а не найти компромисс для конфликтующих сторон, как наш президент заявил",1699222897,793564144
2391790,"Со своей стороны Россия, как Путин заявил, готова помочь конфликтующим сторонам урегулировать вопрос и прекратить кровопролитие☝️☝️",1699222898,799072908
2391790,"Штаты оказывали воздействие на обе стороны конфликта Израиля и Палестины, на что указал Путин",1699222898,799070307
2391790,"США принимали попытки монополизировать свое влияние не конфликт Израиля и Палестины, вместо компромиссных решений, это отметил наш президент!",1699222900,795596588
2391790,"если где-то есть война - значит рядом США. Уверен, что США оказывали давление на обе стороны израильско-палестинского конфликта!",1699222903,795824395
2391790,"Именно США оказывали давление на стороны конфликта, к чему это привело?! США - всегда несут угрозу миру!😒😒",1699222907,799062716
2391790,"Дальнейшая эскалация насилия недопустима, Россия делает все, чтобы нормализовать отношения Палестины и Израиля, об этом заявил В.Путин",1699222908,805951274
2391790,"Наш президент верно подметил, что важнее всего на данный момент не допустить дальнейшей эскалации насилия и остановить кровопролитие❗️",1699222909,801174836
2391790,"США же играли важную роль в урегулировании вопросов между Израилем и Палестиной, однако вместо того, чтобы реально искать компромисс, Америка занималась тем, что укрепляла свою роль регулировщика этих отношений, как отмечает наш президент, с ним я абсолютно согласен!",1699222911,804188153
2391790,"Президент Путин указал, что на все конфликтующие стороны оказали давление Соединенные Штаты",1699222914,799284677
2391790,"Как Путин сказал, США не пытались найти компромисс палестино-израильскому конфликту, а лишь монополизировали его урегулирование",1699222915,799629980
2391790,"Российская сторона, согласно заявлению Путина, готова и дальше работать в направлении мирного урегулирования палестино-израильского конфликта",1699222919,826496326
2391790,"Все конфликтующие стороны, по словам Путина, должны участвовать в том, чтобы минимизировать ущерб для гражданского населения, об это он заявил на встрече с президентом Ирана❗️",1699222925,800871797
2391790,"На встрече с президентом Ирака Путин верно подметил, что ущерб гражданским от конфликта должен быть сведен на нет.",1699222927,794147204
2391790,"США оказывали давление на обе стороны палестино-израильского конфликта, об этом заявил Путин",1699222928,803874225
2391790,Боты заблудились 🤣,1699230487,760841892
2391305,Абсолютно ничего не происходит)),1699164201,185258825
2391305,Пользуйтесь наличкой,1699164485,830124119
2391305,Может у Набиулиной так хорошо? А периферии нужна наличка.,1699164926,623994828
2391305,Даешь доллар по 66 коп ! Гойда бл дб .,1699164953,642315696
2391305,"Такое дерьмо эта ""цифра"" Раздолье для мошенников.",1699165014,659367180
2391305,В жопу себе засуньте свои ии и радуйтесь.,1699165256,518154719
2391305,Мошенница!!! У неё видно что хорошо все!!!,1699166182,173126636
2391305,Правительство воров и вранья!,1699166629,118100484
2391305,Так стоп . .а где кремле боты и фейки?,1699166725,2529623
2391305,"Титанические сдвиги / финансовая устойчивость🤣😂🤣😂 Льёт годами эту мочу в уши людей вместе с остальными своими Володькой и компанией и большинство это хавают🤢 Простой пример тайский бат 10 лет назад был 1к1 к рублю , а ТЕПЕРЬ 2,5-3рубля за 1 тайский бат🤦‍♂️ тайский бат блин😐 И о чем вообще эти люди голосят - @издешь хуже некуда уже , ну совсем для отупевшего стада если только. Банковская система абсолютно здорова🤣🤣🤣🤣 их система да здорова , ой цирк никогда этот уже не закончится , на их место других посадят и всё продолжится 🤮",1699167053,209196197
2391305,"Экономика свелась к выживанию . Крутись , обмани и выживешь . Живёшь внизу - работай , выживай .",1699167803,269916880
2391305,Бумага стерпит все.а цифры невидимые исчезнут.,1699168254,686746287
2391305,А что бы предложили вы?,1699168349,626538378
2391305,,1699168621,380711264
2391305,Гориваду!,1699169587,183660268
2391305,"Молодец, успехов ей.",1699170790,478691094
2391305,🖕🖕🖕🖕🖕🖕🖕🖕🖕,1699171690,504048742
2391305,"У  тех что много денег , тем наверное и делают цифровой рубль, но как известно даже в больших мегаполисах пенсию  начисляют по книжке,это наверное только для бизсменнов и нового поколения!",1699172934,830181655
2391305,"Финансово - экономические успехи приятно удивляют. Но еще больше удивляют успехи нашей статистики. Способ существования лжи, посредством манипуляции статистикой.",1699182058,422507039
2391305,"""Все хорошо, прекрасная маркиза""",1699187971,419904946
2391305,,1699188693,64058770
2391305,Пока что в стране всё великолепно только у банков - размеры их ПРИБЫЛИ колоссальны.☹️,1699189864,371939864
2391305,Ставка ЦБ 15-это нормаль? Серьезно?,1699191670,759181087
2391305,"3,14здит и берёт то недорого.",1699191675,55194505
2391305,Дешевый рубль -показатель спада в экономике,1699208068,215207320
2391305,"Наличка не нужна,- сказала Набиулина и отправила все деньги за границу",1699255026,138245859
2391305,Нам нужны роботы!!! Требуем роботов!!!,1699300279,2066988
2391305,,1699334828,192620547
2386432,Как форма насмешки?,1698931966,24346728
2386432,Лучше премиями мотивируйте.,1698932617,68174509
2386432,"Когда придут коллекторы, можно их сводить, фото своё на доске почета показать🤣",1698932658,103774615
2386432,"Почет составляет значительную часть вознаграждения почти во всех  профессиях. А если почести не помогают, попробуйте наказать!😂",1698933107,422507039
2386432,"хорошая премия, вот это мотивация, остальное - благодарности, грамоты, доски почёта-отмазоны, чтоб не платить премий и надбавок 😉",1698933656,224830183
2386432,"Повышение зарплаты тоже ведь разным бывает. Вот к примеру если повысить человеку зарплату с 20т.₽ до 21т.₽, можно ли это назвать повышением? Теоретически - да, и, наверное, работодатели так и считают. Но практически повышением это назвать ну никак нельзя.",1698934479,491272791
2386432,Усиаревшие подходы в мотивации. Даже если и появится мотивация то очень не на долго. И работает на ограниченный круг,1698934759,5393230
2386432,"Это от возраста зависит и от амбиций самого работника. Если работник тщеславен, ему важно всеобщее признание, то тогда - ДА. Если работник думает только о своей семье, тогда ему важны только деньги, и значит - НЕТ.",1698934895,684230143
2386432,Достаточно высокие зп на предприятиях 😡 это шутка такая? Для кого или чего достаточные? Капиталюги всё наровят сэкономить и точно не на себе!,1698935090,42601370
2386432,"Заработанный авторитет накладывает на человека БОЛЬШУЮ ответственность, так как мало кто сомневается в его компетентности.",1698936036,476979452
2386432,,1698942839,606064487
2386432,Герой капиталистического труда? Смешно.,1698969672,696258582
2386432,Лучше деньгами),1698996791,72347802
2386432,"При хорошей зарплате можно и грамоте радоваться. Карпенко, наверное, не на тех предприятиях бывает, где предпочитают грамоты , а не зарплаты. Да и не шикарные зарплаты на производстве.",1699539912,439352004
