post_id,text,comment_time,from_id
2270326,Куда выше. В банки за кредитами больше ни кто не пойдет. Если вы повысьте то будет  уже за 30% годовых.  А при такой средней зарплате это не реально оплачивать. 22 % 🙉🙉Сбербанк прислал смс возьми на осенние каникулы. 😡😡,1693944002,261101246
2270326,"Такое впечатление, что в Центробанке сидят одни саботажники и вредители на зарплате МВФ.",1693962669,111601824
2267623,"Наши чинушки с набисрулиной и,серулановым уже руки потирают,смеясь над простым народом...",1693815564,723395829
2266186,придуманно скабеевим. ее почерк. в ес все порядке,1693733412,750442979
2266186,"Не смешите, а что в России все подешевело?",1693733750,223424389
2266186,"А у нас, в России, цены не растут. Мне эта ЕС до фонаря. Вы про цены в России пишите.",1693734190,802404979
2266186,"Изначально было понятно, что санкции так или иначе коснутся обеих сторон, слава богу, что наши власти хоть как-то попытались нивелировать последствия санкций, чего нельзя сказать о властях Европы. Сейчас европейские страны страдают от повышения цен, так как ни риски не были просчитаны ничего, вот им и урок.",1693734703,816762226
2266186,Бензин растет как на дрожжах. Какая к черту Европа???!!,1693735853,94079044
2266186,"Как-то все равно.. Переживаем за свою страну, надеемся, что сами разовьем свою промышленность, построим проект Север-Юг, торговые пути в Азию, Африку, Латинскую Америку и все будет хорошо)",1693744187,761836132
2266186,"Мне вообще параллельно, что там за границей. У нас тоже цены растут, как на дрожжах. Зарплату не прибавляли три года уже. А цены растут на всё. И поэтому уровень жизни падает. Не хватает денег трехлетней давности что бы сейчас прожить.",1693746973,64664154
2266186,"Что посеяли , то и пожинайте , а то смеялись , в ладоши как хлопали , когда пакет за пакетом выплёскивали с радостью",1693751477,812596635
2266186,"Ах, жители ЕС страдают!.. До каких пор?!. Мало страдают, раз ничего не делают",1693775210,5411245
2264348,Выручка ларька с шаурмой с хорошей проходимостью 1 000 000 рублей в месяц!😃,1693655868,218445700
2264348,"Главная и основная причина, в грязно-лживой экономики!
У нас цены растут, даже когда уже ничего не растет.😂",1693656076,422507039
2264348,"На каких основаниях хлеб, овощи, фрукты, мясо должны дорожать, когда пшеница, мука, мясо, овощи, фрукты в России 🇷🇺 достаточно хватает на всех и не является дефицитом, мука, пшеница, мясо, овощи, фрукты производятся в России 🇷🇺 а не за границей, на каких основаниях должны дорожать???",1693656341,109463900
2264348,хлеб стратегический продукт. жаль упыри не понимают. Ленин когда то учил.,1693657112,411447857
2264348,У РОССИИ-ОСОБЫЙ ПУТЬ РАЗВИТИЯ было сказано с высокой трибуны,1693657499,544405476
2264348,"Скоро веревки с мылом раздадут,чтобы повесились ...",1693658908,179480798
2264348,"Шаурма не дорожает, потому что делается из просрочки.",1693659283,383691449
2263002,,1693583594,543241576
2263002,"Они там все только о себе и, своих родычах думают...",1693584748,723395829
2263002,"Теперь с рублем все ясно 😜

­На совещании у Путина раскрыли тайну падения рубля. Пока официальная пропаганда активно рассказывала, что падение рубля связано с низкими ценами на нефть, санкциями и кознями Запада, — реальность оказалась далеко не такой. 🤔

Когда доллар перевалил за сотню, а ЦБ и Правительство продолжали всех убеждать, что это никак не повлияет на рост цен и вообще чем ниже курс рубля, тем радостнее на душе у народа, — в ситуацию решил вмешаться Кремль. Сначала советник Путина Орешкин прозрачно намекнул, что это безобразие пора заканчивать, а затем и сам Путин позвал к себе на доклад Правительство и ЦБ. 🤓

В ходе совещания выяснилось, что курс рубля уронили особо умные крупные бизнесмены, которые мало того, что придерживали валютную выручку за рубежом, так еще и активно брали кредиты по низким ставкам и скупали на них еще больше валюты. Суммарно хитросделанные бизнесмены в 2023 году набрали кредитов на 5,8 трлн рублей! 🤯

Зачем им столько денег, если они не вкладываются в развитие и расширение производства? Чтобы не продавать свою валютную выручку, а все текущие платежи совершать за счет дешевых кредитов, которые задумывались властями для поддержки и развития бизнеса в столь непростые времена. Ведь выгодно купить доллар за 70 и продать, дождавшись его падения до 100. Отсюда и такой невероятный отток капитала из России в 280 млрд за полтора года. Примерно по такой же схеме роняли курс и в Украине в 2014 году. 🤷‍♀️",1693589023,677958978
2263002,"Российская экономика не рухнет. В России просто изменится парадигма экономического развития – вместо экспорта выпуск будет концентрироваться на внутреннем спросе. Нет никаких сомнений, что наша экономика останется на плаву. У нас очень много грамотных профессионалов в этой сфере",1693589372,803433408
2263002,Весь и все в ЦБ валютные спекулянты. Лапшу какую то вешают.,1693592682,74222342
2263002,"Не знаю зачем они ставку поднимали, причины роста доллара и евро весь совсем другие.",1693613432,419904946
2263002,"Все делается для того чтоб мы орошо жили, надо только верить в чудо.",1693649828,633137062
2263002,а центробанк он чей?,1693658370,215207320
2259993,"Боюсь пока Эрдоган торговался с Путиным, Украина смогла наладить альтернативный путь продажи зерна)",1693410944,419904946
2259993,Шаурму бесплатно .,1693410957,269916880
2259993,"Двуличная, тв@рь Эрдоган вот и всё, скользкий тип",1693411077,582926191
2259993,Мели Емеля!,1693411370,623713923
2259993,"Президент Турции - сильный лидер, который действует в интересах СВОЕЙ страны, а в интересах его страны - партнерские связи с Россией.",1693411387,796467314
2259993,"А нам силой, что ли, на Турцию влиять? Вы войны хотите?",1693411398,805093394
2259993,Помидоры?,1693411887,139669455
2259993,"НЕТ ВЕРЫ ТУРКУ...ПРОЛИВ ЕМУ УЖЕ ОБЕЩАЛ НАШ МИНИСТР ИНОСТР.ДЕЛ,БЫЛО ДЕЛО....,обещан был очень быстро....новый пролив на месте Стамбула? СРАЗУ ОТКРЫЛИ ПРОЛИВ
...🇷🇺🤣🤣👍",1693412842,465825856
2259993,В Кремле Эрдогашу знают как облупленного!,1693413244,235688436
2259993,Верить турецкой свинье не стоит однозначно . Продажная страна продажный народ .,1693420357,768451969
2259993,,1693423656,719712963
2259993,Худой мир лучше доброй ссоры,1693425914,436982401
2259993,"Да все-таки нужно говорить по поводу зерновой сделки, главное, чтобы наши условия все были выполнены, так в убыток себе мы работать уж точно не будем",1693460381,731838965
2259993,"Да Эрдоган обычный торгаш,мы будем разивать свои отношение согласно нашим социальным и экономическим интересам путь дальновидный президент, он прекрасно знает как нужно разговаривать с Эрдоганом чтобы в дальнейшем свои интересы защитить",1693463491,731814248
2259993,"Ждем его к нам в гости, надеюсь, что они двоем смогут переиграть западников и укров, что сделка все таки будет проведена уже сразу напрямую к реально нуждающимся странам",1693464423,699940836
2259993,"Да нужно понять,что вообще хочет от России Эрдоган, если это будет выгодно нам, то само собой нужно будет сделать определенные выводы",1693466765,729720036
2259993,"Россия сказала, что не видать им зерновой сделки пока Запад не примет все условия России",1693467374,731836186
2259993,"Да Турки пусть нам на уступки идут, из-за последний действий против нашей страны с ними отношения реально тяжелые",1693472619,810697494
2259993,"Пусть Запад соблюдает условия зерновой сделки, тогда и РФ в нее вернется и не будет у них никаких проблем по этому поводу. И не будут ныть, что сидят и голодают.",1693475265,729719085
2259993,"Россия уже озвучила условия возвращения к сделке - это полное соблюдение всеми сторонами всего того, что в ней было прописано!",1693475598,679215604
2257120,"ну посмотрим - хорошо бы если так, это стало бы неплохим бустом для развития . ну и на детей очень много надо, правда, да и обучение очень дорогое сейчас",1693302657,817817996
2257120,"а учитыая то, как в России вообще относятся к семье, то повышением маткпитала займутсяю в следующем году еще и МРОТ до 20 тысяч поднять хотят",1693303538,696457627
2257120,"Почему негде резать,депутатам урежьте зарплаты до чуть выше прожиточного минимума,какая экономия выйдет!",1693304561,145864046
2257120,А эти депутаты госдуры не уточнили с кого они собираются брать этот 1 млн рублей + на коррупционные расходы-наценку? 😑,1693461197,-104480865
2249465,"Ха ха! Ну нормально,ныне люди в России богатые,что им стоит--ребенка на целую зарплату собрать!",1692893670,784283142
2249465,"Какая чушь? Какие траты на ребёнка?
Вот на ненужные солдафонские железяки - вот где траты. Причем, огромные и страшно бесполезные...",1692893772,312386234
2249465,Особенно копейки умиляют... 🦧,1692895024,674534783
2246039,"Почему банки не подняли автоматически ставки по вкладам, при росте ключевой ставки? При этом по кредитам подняли? Вопрос к мадам Наебуллиной.",1692728952,638329904
2246039,"А что все уже получили по вкладам СССР?
Теперь очередной обман?",1692729116,191275873
2246039,"В Главном управлении по вопросам миграции МВД России сообщили, что число вставших на учёт иностранцев в России выросло с 13,4 млн в 2021 году до 16,9 млн в 2022 году. За минувший год количество тяжких и особо тяжких преступлений, совершённых мигрантами, выросло с 11 до 15 тысяч – на 37%. Впрочем, реальных цифр никто не знает. И если демографическая политика в стране не улучшится, то в 2035 году в России будут жить в 2-3 раза больше выходцев из Средней Азии, а славян станет меньше на 15-20 млн.",1692729140,677958978
2246039,Иными словами-все летит в тартарары,1692730987,340377747
2246039,каких мам ...,1692731843,590179852
2246039,Такую хрень несёт🤔,1692735051,677958978
2246039,Помним СССР как вклады сгорели и сейчас доверять банку 😂😂😂😂😂😂 только идиот в это поверит  . Лучше закопать на заднем дворе .,1692736654,768451969
2246039,Добровольно- принудительно ! Мы уже это проходили ! 🤔☝👎,1692738514,79713934
2246039,"Плешь, уходи",1692740081,283290138
2246039,"Не удивительно, что нам президент старается для того, чтобы народ не боялся за завтрашний день и поэтому все гарантии имеются)",1692742115,767162856
2246039,А что за пособий дабавил он,1692742524,812074394
2246039,Слава богу сбережения станут добровольными! Все россияне с нетерпением ждали этого! Слава президенту!,1692745843,703468065
2246039,"Он обещал что пенсионый возрост не тронем,а прибавил мужыкам 5 лет",1692748581,692656771
2246039,"Поддержка семей - это фундамент. Благо, наше руководство это понимает и выделяет огромное количество средст и сил на это.",1692750509,766233164
2246039,Я ему уже не верю ни как человеку ни как президенту одни обещания да и только,1692783878,764827207
2246039,"Сначала с доверчивых людей, тех которые любят путина и телевизор, соберут добровольные сбережения, а потом заморозят их до лучших времён (проще говоря - украдут) 😂
Мне таких не жалко. А те кто с умом, в эту авантюру не пойдут",1692791894,260293166
2246002,"Подождите , а разве инфляция не 4%? Так скажите наконец правду : 4 или 12!",1692728339,662626446
2246002,"Где деньги , Зин ?",1692728476,2471154
2246002,"Собрать первоклассника дороже, чем сама зарплата!",1692728496,804459780
2246002,"Как можно сэкономить на сборах в школу? Не рожать, блин 🤣",1692728708,760841892
2246002,Хе.ра се--у многих в стране зарплата едва до 30тысяч дотягивает...,1692728733,737567792
2246002,вот оно счастье ..держите не обосритесь,1692731882,590179852
2246002,"Чем старше ребенок, тем проще собрать в школу. Заявил, что ему не надо ничего покупать, у него к школе все есть… пол карандаша с того года и пара тетрадок, а ручку, говорит, он на полу в классе найдет.",1692734193,204074561
2246002,Но голикова заявила что в демографическом кризисе виноваты 90-е .,1692736446,209702735
2246002,"Всё купили и собрали, и без проблем. 👍😊",1692747375,412115109
2243855,"Да кто ж его посадит, он же.. Трамп! Да еще с такой надписью на бейсболке.",1692634219,383691449
2243855,Дед Джо поскорее хочет избавиться от ненавистного конкурента.,1692634382,355406780
2243855,Бедные клопы,1692635676,749883921
2243809,как то сухари подорожали. да и меньше стали.,1692632107,411447857
2243809,"Всё в Африку, внутренний рынок , это МЫ, покроет недоимки барыгам, приятного аппетита...",1692632158,677176032
2243809,Только вес стал меньше..,1692632196,383691449
2243809,Буханка скоро в карман рубашки со свистом залазить будет,1692632417,772414136
2243809,Жрать надо меньше.У 50 % населения избыточный вес и всё равно молотят и молотят.,1692632446,199678198
2243809,"цена муки понизилась, цена хлеба повысилась.",1692674729,40874104
2238318,"идиотизм, самое безопасное вложение денег- это покупка золота",1692379160,796556433
2238318,нет вложение в акции золота,1692379613,134937937
2238318,За миллион.. Из г..на без палок чтоли?,1692379660,13261724
2238318,"Уже не знают, куда строящуюся недвижимость девать. Скоро ипотеку для младенцев введут под материнский капитал. Ребёнок только родился, а у него уже ипотечный долг.😏  Ну и конечно города-призраки как в Китае.",1692379677,816864848
2238318,"""Индивидуальный коттедж в пригороде"" - шалаш😁",1692380288,270472766
2238318,,1692383111,66841455
2238318,"Это эксперт сказала о чинушах?!?Так,у них не по одному миллиону $ и,€!!!!!!!
Поэтому курс валют сильно не падает...
При наших же зарплатах,о миллионе и, не мечтаешь...",1692384227,723395829
2238318,Покупайте и храните.,1692388077,606064487
2238318,Недвижимость малоликвидный актив..,1692420091,796571762
2238318,Не надо лохматить бабушку.....,1692422331,227065702
2238318,Кому назрен еудна недвижимость в россии? Уже и узбеки с таджиками покидают россию,1692451611,21743773
2238318,"Теперь с рублем все ясно 😜

­На совещании у Путина раскрыли тайну падения рубля. Пока официальная пропаганда активно рассказывала, что падение рубля связано с низкими ценами на нефть, санкциями и кознями Запада, — реальность оказалась далеко не такой. 🤔

Когда доллар перевалил за сотню, а ЦБ и Правительство продолжали всех убеждать, что это никак не повлияет на рост цен и вообще чем ниже курс рубля, тем радостнее на душе у народа, — в ситуацию решил вмешаться Кремль. Сначала советник Путина Орешкин прозрачно намекнул, что это безобразие пора заканчивать, а затем и сам Путин позвал к себе на доклад Правительство и ЦБ. 🤓

В ходе совещания выяснилось, что курс рубля уронили особо умные крупные бизнесмены, которые мало того, что придерживали валютную выручку за рубежом, так еще и активно брали кредиты по низким ставкам и скупали на них еще больше валюты. Суммарно хитросделанные бизнесмены в 2023 году набрали кредитов на 5,8 трлн рублей! 🤯

Зачем им столько денег, если они не вкладываются в развитие и расширение производства? Чтобы не продавать свою валютную выручку, а все текущие платежи совершать за счет дешевых кредитов, которые задумывались властями для поддержки и развития бизнеса в столь непростые времена. Ведь выгодно купить доллар за 70 и продать, дождавшись его падения до 100. Отсюда и такой невероятный отток капитала из России в 280 млрд за полтора года. Примерно по такой же схеме роняли курс и в Украине в 2014 году. 🤷‍♀️",1692455113,677958978
