post_id,text,comment_time,from_id
2524568,,1703930729,335551381
2524568,"наши обещались все исправить, ФАС так или иначе с ценами на яйца уже разбирается... посмотрим..",1703930917,768743861
2524568,"поэтому народ рожайте у кого есть хорошее финансовое положение, кто беден лучше не рожайте, не портите судьбу ребенку",1703930920,774401275
2524568,"давайте теперь всё на ковид сваливать, а не на дикие расходы на силовиков и армию",1703931381,20903048
2524568,Бла-бла-бла....,1703932153,717555162
2524568,"Ну этот,, экономист,, Вовану уже доложил?",1703932715,836704865
2524568,А что по этому поводу думают наши буржуины?,1703933390,623972958
2524568,мы все заплатим за эту войну !!! кто - то жизнью а кто - то деньгами !!!,1703933442,499159054
2524568,"Когда в мире утихнет все эти конфликты и расприи, тогда и будут цены падать в большинстве своем . Наша страна идет в правильном направлении и развивает экономику, что даст огромный прирост через несколько лет",1703933493,681514664
2524568,Спасибо большое Единой России и Президенту России за нами цены и жизнь,1703933948,201168256
2524568,"Хочется узнать, долго будет идти этот  поиск баланса???? Похоже, многие не увидят сбалансированного интереса между покупателями, производителями и поставщиками.",1703934433,525713877
2524568,"Встречайте Новый год позитивно!!! Вот такое новогоднее обращение должны быть от главы государства, а не вот это вот всё... крепитесь, держитесь, и т.п. длинною в 20 лет..",1703935093,99164106
2524568,Бой курантов без Путина.,1703935115,99164106
2524568,"Если говорят, что 90-х не будет - значит ждите повторения",1703935438,261854034
2524568,"Нет времени на раскачку ©
Импортозамещение. 
Реновация. 
Инновация.",1703935800,207541046
2524568,"Почем сегодня яйцы путена, помогли ему турки?",1703935985,46188929
2524568,"А как же ""великие достижения"" Путина?)...",1703936265,129658462
2524568,Бой курантов и гимн в СССР,1703936350,99164106
2524568,Поздравление Юрия Гагарина,1703937503,99164106
2524568,"Товары на которые вырастут цены в 2024 году запретить и уничтожить , а их заменить импортозамещением .👁",1703937651,438356814
2524568,"А если не заказывать на корпоративы всяких Киркоровых, Милявских и иже с ними, глядишь, останутся деньги и на своих работников. И цены повышать не придётся...",1703938604,491272791
2524568,Маразм и идиотизм продолжается...,1703939957,488342308
2524568,Одни разговоры,1703940854,179187677
2524568,"Нет, Кирьян, достаточно поумерить аппетиты капиталистов, ростовщиков и чиновников - высвободится огромное количество средств, и инфляция упадёт до естественных размеров экономической погрешности. 
А уж сколько средств эти вышеозначенные за кордон выводят - у нас в стране, вообще, дефляция будет.",1703943911,172461117
2524568,"Ну так-то конечно насрать, зарплаты, пенсии и все пособия тоже растут, так что не скулите бедолаги 😂😂😂",1703945561,684967844
2524568,А шо ваш баланс  поможет  снизить цены или поднять  клеркам думским бабла,1703955938,699721946
2524568,"Очередная лапша,,, правды небудет.",1703957351,738849396
2524568,"По осени нефтяники продали весь дизель за границу, а скудные остатки подорожали до небес. Вот и вся «балансировка». Долбанный капитализм",1704000320,21016664
2524568,"⚡️Всего за одну ночь на массированный обстрел Украины Россия потратила:

Бюджет Тамбова на 16 лет вперёд

На 20 миллиардов больше, чем бюджет всей Рязанской области на год 

На 17 миллиардов рублей больше, чем получат все российские регионы на модернизацию систем коммунальной инфраструктуры в 2024 году

В два раза больше, чем выделили всем регионам РФ на обновление общественного транспорта в 2023 году

На 30 миллиардов меньше, чем выделят на строительство школ в 64 регионах России (149 миллиардов рублей)

На 30% больше, чем выделяет Минздрав на оборудование, ремонт и строитель­ство городских поликлиник, районных больниц и сельских медпунк­тов (90 миллиардов в год)
 Вот куда деньги идут , вместо того что бы вкладывать в свою страну  а не отправлять на войну . А рабы радуются Путину ,",1704008174,281679642
2524568,"А ещё в соц выплаты залезли, ну что хорошо живёт наше ""государство """,1704013071,147074315
2524568,"Ага, конечно две: как сказал министр: народ много зарабатывает и много ест. 
Вот и всё причины.",1704018346,149052123
2524568,"В Москве район Хорошево-Мневники в этом году превратился в мусульманское гетто, елку к новому году ставили всегда с 1971 году у памятку Ополченцам, а в этом нет елки и во всём районе в угоду мусульманам. Префект истинный исламист, традиционные ценности русские отменил.",1704024928,141938737
2524568,В марте за Путина голосуйте,1704025336,536761571
2524568,,1704036201,139369679
2524568,"Вчера в Уфе сьездил на Колхозный рынок купил мандарины за 250р., апелсин за 400р. И подумал,  азиаты оборзели, почему, а в России они элита, всех купили, вот и творят, что хотят.
Пора возобновить на День ВДВ традицию громить лавки азиатам, как раньше кавказцам.
И не только им и другим родам войск.
Тогда цены не росли, а сейчас вообще оборзели.
Я пенсионер, денег не пожалел, а в Магнитах дешевле, но вид их вызывает сомнение.",1704036605,691094692
2524568,,1704041779,339375801
2524568,Причина то одна больной несменяемый дед-маньяк.,1704048054,89680743
2521383,Замануха...,1703825490,7209262
2521383,"Пока не очень надёжно всё, поэтому регулировка идёт постоянно. Волноваться не нужно за повышение ставки.",1703829271,767080578
2517787,Милей не намерен останавливаться в разрушении Аргентины разве что,1703687308,665028463
2517787,😂,1703687620,679912154
2517787,"Аргентина, 52 штат америки.",1703687632,738849396
2517787,"Милей к гайдару никакого отношения не имеет... 
🤨",1703688042,306236544
2517787,Вот тебе и рождественский подарочек аргентинцы получили... не позавидуешь,1703689075,687424204
2517787,"Умный учится на своих ошибках, мудрый учится на чужих, а дурак не учится никогда. Милей, похоже, дурак",1703689618,206034490
2517787,президент-весельчак это счастье для народа!,1703689822,199678198
2517787,"Ну-у-у, сами же выбирали",1703689845,20120196
2517787,Быть добру!,1703690074,113221863
2517787,Карма вернулась . Нациков принимала .,1703694205,269916880
2517787,"вспоминается ремарк , где зарплату давали чемоданами , и еще нужно было успеть купить галстук (к примеру) пока миллиарды не обесценились (после первой мировой войны)",1703695245,51048638
2517787,"Они там все, с приветом?",1703696598,352947864
2517787,Пацан сказал-пацан сделал😂😂😂😂,1703704032,570895309
2517787,"Вот действительно, с кем Зеленский не поручкается, у тех проблемы.
Видимо Украина стала заразной проказой",1703704179,339652864
2517787,Пора и в РФ снова нолики обрезать. И рублики золотые начинать чеканить.,1703712930,606064487
2517301,"Блин,вообще оболдеть. Уже от много и так приходится отказыватся. Скоро походу вообще от  всего придется.",1703673395,4822531
2517301,"Ой, да каждый новый год все дорожает. Новый год - это только для детей волшебная добрая сказка, а для взрослых - праздник повышения цен (",1703674807,33175883
2517301,Написали бы коротко : подорожает ВСЁ !,1703675176,179480798
2517301,Беспредел. Оббирают народ до ниточки,1703675196,240748848
2517301,,1703675319,40760893
2517301,"Сколько повышают,а народа в магазинах меньше не становится.Парковки забиты ..",1703676726,602051383
2517301,"Зарплаты же повысят,вот и,цены на всё повысят!!!!!!!
""Спасибо"" всем чинушкам,в т.ч. и путику...",1703677485,723395829
2517301,"АиФ!!! Провокаторы!!! Почему не пишете про увеличение зарплат по всем категориям граждан России, выплат, увеличение льгот, снятие процентов за переводы, и увеличение пенсий?!!!!😡😡😡",1703678825,779538429
2517301,"– Так точно, ваше величество! – А тебе известно, чем ты отвечаешь? – Известно, ваше величество! – Чем? – Неизвестно чем! – Да он же дурак! – Зато преданный! (Огонь, вода и медные трубы)",1703683308,606766316
2515600,"Супер. Пенсии проиндексировали, отдельные выплаты тоже. Кто-то еще будет жаловаться на то, что им ничего не увеличили?)",1703619652,701825177
2515600,"зп и выплаты военных соответсвует их работе, не нравится идите тоже попробуйте так поработать",1703620689,808192991
2515600,"Диванным войскам просто завидно, что настоящим военнослужащим хорошо платят 😂😂😂",1703620696,808802638
2515600,"Зп военных и других силовых структур и будут индексировать, кто деда защищать то будет, когда народ с вилами встанет. Подкармливает ментов и вояк регулярно.",1703639789,616196761
2515600,Правильно делают. военным нужно поднимать все выплаты. Потому что они как раз делают работу очень важную. Так ещё и защищают рубежи нашей страны,1703640639,710573712
2515600,"Компенсации на 4,5. А цены с нового года на все на 10 процентов и более. И на бензин (уже пошёл вверх), и на электроэнергию предел убрали. Только эти два пункта в цене любого товара",1703645869,640994528
2515600,Сегодня военный центальная фигура в России. Где ещё заработаешь такие деньги.,1703646111,633137062
2515600,"Депутаты в окопах не сидят,а получают в разы более и каждый хату в Москве имеет...Правильно военным добавляют.",1703647503,694053616
2514435,"Да, скоростью роста цента замедлится.
Доллар его обгонит в сто раз.
.",1703591896,229217297
2514435,Космический рывок.,1703592181,662275578
2514435,"Если кто хочет обманывать,врать и не моргать при этом,учитесь у цб.",1703592359,722498643
2514435,Ага счас!,1703592407,662626446
2514435,Верим как Пескову,1703592937,20903048
2514435,"Цены будут расти-однозначно.Но...
По ТВ будут рассказывать сказки,будто цены не растут или практически не растут-как всегда...",1703593693,723395829
2514435,"Статистика покажет тот рост, который нужен Кабмину и ЦБ, а мы ощутим его реальность уже с января((",1703595164,186839289
2514435,"Что за бред, какие 7,5%??? Что ему сказали, то  он и чешет!! А буржуи, видя что за счет участников СВО денег у людей побольше, решили тоже подзаработать...Вот цены и ползут вверх.",1703596823,780974417
2511393,"Западные ожидания были таковы, что мы еще в 2022 должны были жить в полностью разоренной стране без работающего произвродства, товаров и услуг.",1703515360,729706706
2511393,Это много,1703518562,754572371
2511393,"В Нидерландах 10 штук среднего размера (есть ещё маленькие, крупные и курицы биологические) 1.75 белые и 2.38 коричневые. И ничего.",1703590304,330197897
2511393,"Калининград,с сентября яйца подорожали в два раза.",1703597508,489364530
2511001,"Ой, какая беда, а Вовчик с компанией звиздят,что в стране всё путём и инфляция незначительная, а зарплаты с пенсиями вообще шикардос, можно на курорты Кубы летать.",1703508068,836704865
2511001,"Заработать не хотят, ждут, когда народ за них выплатит?",1703508509,352947864
2511001,Дефицит трудовых ресурсов????  Платите как надо и не будет никаких проблем с трудовыми ресурсами.,1703508638,746547740
2510931,Ну ваше право искать обиды для своих родителей.,1703505045,137378038
2510931,"АиФ, ну и для чего эта статья? 👎
Проплатили её что ли магазинные олигархи?💰 
Доживём до нового года и увидим. Такие продукты не длительного хранения. Чепуху не пишите заранее. 😡",1703505054,598942152
2510931,Кто бы сомневался !!!,1703505481,179480798
2510931,Голосуйте за президента от Коммунистов и увидите как всё изменится к лучшему!,1703505570,279789998
2510931,"Ну прямо Америку открыли, у нас все только дорожает каждый год, снижения цен со времен социализма небыло. Не зря количество миллионеров в стране каждый год растет, все за счет простого народа.",1703505669,808876802
2510931,"Отчитается ли самовыдвиженец сколько впустую будет затрачено человекочасов, бумаги и прочих и прочих затрат, сколько миллионов благосостояния народа? А это еще одна спецоперация, фарисейство и фикция демократии при диктатуре власти, лицемерие. 
На сбор подписей надо затратить 25000 человекочасов. Штаты забрали 300 млрд. долларов — ерунда, мошной тряхнем, наберем любую сумму, народ не обеднеет, ни арабские шейхи, переживет. Цены каждый год должны расти — сказал президент.",1703505799,406351901
2510931,"Да цены уже на всё полезли вверх, кстати, на бензин тоже и чхали нефтемагнаты на Вову и ФАС!",1703506071,836704865
2510931,Но есть и хорошие новости - Зарплат инфляция не коснется.,1703507787,3141953
2510931,"А что никто не хочет сказать про то, что зарплаты поднимут со следующего года? Государаство не позволит народу быть в сложной ситуции",1703508314,721031657
2510931,,1703510041,51048638
2510931,"А зато пенсии , зарплаты и прочие выплаты проиндексируют на 7, 5 % говорят что такая вот инфляция , это что плевок в лицо собственным гражданам? Или мы не видим что цены выросли на некоторые продукты до 100 %",1703510314,68662872
2510931,Виноват во всём доллар.,1703511918,199678198
2510931,ВВП правильно заметил: поменьше надо жрать тогда буржуи не будут цены повышать,1703512550,708600308
2510931,Надо менять производимое оружие и технику на продовольствие .,1703526771,269916880
2510651,Ну так и есть. Выросли зарплаты значительно и праздники на носу,1703499216,500394692
2510651,"Жалкая отмазка, обычный новогодний спрос, на Пасху тоже будет повышение цен в связи со спросом и будет ли снижение цен до прежнего уровня когда спрос спадёт?",1703499366,52841218
2510651,"Молоко пальмой заменили, а тут не прокатило,так и будут закупать",1703499405,153463659
2510651,"Чем больше постят сию галиматью, тем больше подозрений, что это отвлекающий маневр. Ну если задуматься, кто еще не успел обсудить эти ""яйца""? Чем-то похоже на призывы Пригожина о снарядах. Президент и тот высказался.",1703499443,29332217
2510651,что за бред! у вас пасха на носу? Рост цен на все это провальная политика государства во главе с ним,1703499490,672504245
2510651,"Продажи яиц сократились в 10 раз, липовая отмазка",1703499493,317541231
2510651,У этой Наибуллиной авторитет в народе отрицательный. Эти еë слова это пукание.,1703499519,814480537
2510651,"Чушь ни несите.магазины завалены яйцами,и с какого перепугу на них должен быть спрос,на Пасху и то нет ажиотажа.",1703499528,312940570
2510651,А мы-то думали! А оно вот оно что. Даже полегчало.😁,1703499545,562538038
2510651,Согласен! Куры не справляются с нагрузкой! Народ яйца поглащает буквально с колёс! Буквально сожрали все яйца.,1703499626,211491623
2510651,"Население  увеличилось за счёт бесконтрольного числа иностранцев, так если Вы господа представители власти завезли такое количество людей, то кормить вы их чем собирались?",1703499771,765363302
2510651,"Этот искусственный дефицит продуктов специально делается, чтобы был повод для повышения цен!",1703499775,160965478
2510651,У нас уже пасха?,1703499827,209734096
2510651,"1) Эльвира Набиуллина в России за производство яиц отвечает?
2) чем кормят яйца, чтобы они такими дорогими стали?",1703499846,482562503
2510651,"Ну да, ну да, как же!",1703499857,231504340
2510651,"Т.е. в миллиардном Китае спрос меньше, поэтому и яйца дешевле (70-80 руб. (на наши)). Л- логика. ЖЛ - женская логика.",1703499881,250139343
2510651,Не пи пи,1703499971,376977408
2510651,В Сербии 500 р за десяток,1703500002,376977408
2510651,"Вранье, спроса не было, полки были затарены, причина в росте на бензин и на корм, пшеницу отправили в Африку и оплатили потребители яйцами, не надо врать",1703500046,560878709
2510651,"У нас на, что ни посмотри, на все спрос опережает предложение. Ниже новость о повышении с нового года на пять категорий продуктов на 20%. Уже заранее у нас спрос завышен на них. А как с повышением на ЖКХ ( в нашем регионе на 14,3%), тоже спрос огромный.",1703500079,217030269
2510651,хватит обжиратся,1703500090,40760893
2510651,"Не понимаю, зачем повышать цены из за высокого спроса?, чтоб яйца оставались в магазине?), чтоб их никто не купил?, или что?.. Ну есть спрос и есть, пусть люди покупают, если на полках будет пусто- подождут. И почему после ""спроса"" цены обратно не опускают, когда спроса нет?",1703500191,269143141
2510651,"Только что был в магните весь стеллаж забит яйцами и никакого спроса, один стоял у стеллажей",1703500279,52841218
2510651,"Соль, спички, мыло, но где яйца хранить можно, причем не гусиные?",1703500764,226907241
2510651,"Покупал чёрную икру,цена нормальная",1703500896,4096384
