id,owner_id,post_time,post_text,comments.count
2589929,-23482909,1663691461,"Годовая инфляция в августе замедлилась в большинстве российских регионов. Замедлению роста цен способствовали расширение поставок отечественного и импортного продовольствия, сдержанные потребительские настроения и укрепление рубля в предыдущие месяцы, говорится в аналитических материалах ЦБ РФ.

Цены на продовольственные товары по сравнению с июлем снизились во всех федеральных округах, в основном за счет плодоовощной продукции. Среди непродовольственных товаров наиболее заметно подешевели техника и электроника, автомобили. Основной вклад в замедление роста цен на услуги в большинстве регионов внесли авиаперевозки.

Незначительное ускорение роста цен в августе отмечено в трех регионах — Ингушетии, Магаданской области и Чукотском автономном округе.

[club23482909|@kommersant]",3
2589603,-23482909,1663685808,"Швейцарский банк Credit Suisse опубликовал 13-й ежегодный отчет Global Wealth Report 2022. Согласно исследованию, по итогам 2021 года мировое богатство выросло на 9,8%, до $464 трлн.

Говоря о ситуации в текущем году, банк отмечает, что рост инфляции и военный конфликт на Украине замедлят рост мирового благосостояния, но это негативное влияние будет кратковременным.

Размер благосостояния России сейчас соразмерим с американским показателем 1908 года, и до 2026 года будет расти так же, как в США с 1908 по 1912 год.",9
2587731,-23482909,1663614123,"Банк России сообщил об усилении проинфляционного давления, связанного с санкциями, ростом издержек, сохранением на повышенном уровне инфляционных и ценовых ожиданий. Согласно отчету регулятора, месячное снижение цен в августе сократилось до близкого к нулю значения, следует из материалов регулятора.

«В августе годовая инфляция замедлилась до 14,30% при дальнейшем снижении годовых приростов цен на многие основные группы товаров. Дезинфляционное влияние продолжали оказывать устойчивое расширение внутреннего предложения продовольствия, перенос в цены укрепления рубля, сдержанные потребительские настроения домохозяйств»,— сказано в документе.

При этом месячное снижение цен с поправкой на сезонность сократилось до близкого к нулю значения после 0,27% в июле, сообщил ЦБ. Основной вклад внесло торможение удешевления непродовольственных товаров, которое указывает на завершающуюся коррекцию спроса и цен после всплеска в марте. 

«Начинает в большей мере проявляться проинфляционное давление»,— отметил регулятор. Оно связано с сохраняющимися ограничениями по выпуску и импорту ряда непродовольственных товаров, ростом издержек, сохранением на повышенном уровне инфляционных и ценовых ожиданий.

По прогнозу Банка России, годовая инфляция составит 11,0—13,0% в 2022 году, а с учетом проводимой денежно-кредитной политики снизится до 5,0—7,0% в 2023 году и вернется к 4% в 2024 году.",6
2587552,-23482909,1663603455,"На фоне рекордной за последние 40 лет инфляции центробанки массово повышают процентные ставки, несмотря на угрозу замедления экономики и даже рецессии. С начала года ставки уже были повышены более чем в 90 странах мира.

Причем в половине из них регуляторы пошли на резкое повышение — на 75 базисных пунктов (б. п.) и более за один раз. Некоторые сделали это неоднократно. Подобные меры — самое масштабное ужесточение денежно-кредитной политики за последние 15 лет, сообщает Bloomberg.

Уже на этой неделе будет принято очередное решение по ставке ФРС США. По прогнозам экспертов, она может быть в третий раз повышена на 75 б. п. Банк Англии может повысить ставку на 50 б. п. Аналогичные решения ожидаются в Индонезии, Норвегии, Швеции, Швейцарии и на Филиппинах.",8
2586151,-23482909,1663547690,"Глобальная инфляция пройдет пик в третьем квартале этого года и затем начнет снижаться, прогнозируют аналитики, опрошенные Focus Economics (всего в опросе приняли участие 120 экономистов). Повышение ставок примерно на 200 базисных пунктов негативно скажется на экономической активности — многие экономисты теперь закладывают спад ВВП в США и зоне евро и замедление роста в Китае в свои базовые сценарии.",5
2584117,-23482909,1663419775,,0
2583136,-23482909,1663360483,"На пятничном заседании совета директоров Банка России обсуждался вопрос о снижении ключевой ставки или ее сохранении, но на следующем заседании в октябре 2022 года, вероятно, обсуждать придется все три возможных варианта. Новый размер ставки — 7,5% годовых, по мнению ЦБ, это нейтральный уровень, при этом куда именно сдвинется в октябре инфляция — неочевидно, тогда как к началу 2023 года Банк России ожидает скорее усиление инфляционного давления.",5
2582304,-23482909,1663325410,"Совет директоров Банка России принял шестое по счету решение о снижении ключевой ставки с 8% до 7,5%. Причинами для снижения показателя, как пояснили в регуляторе, стали продолжающееся снижение инфляции и оживление внутреннего спроса.

«Это связано как с влиянием набора разовых факторов, так и со сдержанным потребительским спросом. Динамика деловой активности складывается лучше, чем Банк России предполагал в июле»,— объясняется в пресс-релизе на сайте регулятора.

Представители ЦБ поясняют, что инфляционные ожидания населения и ценовые ожидания предприятий все еще остаются на повышенном уровне.

По оценке Банка России, к концу года годовая инфляция снизится до 11-13%, в 2023 году — до 5-7%, а в 2024 году вернется к 4%. В регуляторе также фиксируют смягчение денежно-кредитных условий.",7
2579076,-23482909,1663182806,"🔸️Азербайджан в одностороннем порядке предложил Армении гуманитарное прекращение огня.

https://www.kommersant.ru/doc/5560088?vk

🔸️Евросоюз продлил на полгода санкции против 1,2 тыс. физических и 108 юридических лиц из России.

https://www.kommersant.ru/doc/5560145?vk

🔸️МИД РФ ввел персональные санкции против 30 руководителей британских структур и представителей оборонного лобби Великобритании.

https://www.kommersant.ru/doc/5560090?vk

🔸️Госдума приняла закон об унификации общеобразовательных программ. Со следующего года в российских школах введут единые федеральные общеобразовательные программы.

https://www.kommersant.ru/doc/5559868?vk

🔸️Профсоюз журналистов и работников СМИ ликвидирован по решению Мосгорсуда. Деятельность профсоюза была приостановлена 4 июля из-за иска прокуратуры.

https://www.kommersant.ru/doc/5560042?vk

🔸️Недельная дефляция в РФ замедлилась до 0,03%. С начала года цены выросли на 10,27%. По оценке Минэкономики, годовая инфляция замедлилась с 14,08% до 14,06%.

https://www.kommersant.ru/doc/5560117?vk

#Главноеквечеру",3
2575013,-23482909,1663027686,"По данным Сбериндекса, номинальные траты граждан на товары и услуги за неделю с 5 по 11 сентября по сравнению с тем же периодом 2021 года выросли лишь на 4% против 5,4% и 7,5% в предыдущие недели — при инфляции на 5 сентября около 14,1%. С последней недели августа устойчиво ускоряется рост спроса на услуги, прежде всего на медицинские и отели в РФ (с 5 по 11 сентября годовые темпы роста их потребления вышли в плюс), и развлечения, рост трат на которые за эту неделю составил 62,5% год к году.",3
2574625,-23482909,1663008533,"Главные новости к вечеру 12 сентября 🌒

🔸️Действующие главы регионов по итогам выборов остаются на своих постах, следует из предварительных данных голосования. На муниципальных выборах в Москве кандидаты от «Единой России» получили 1160 мандатов, набрав суммарно 81,86% голосов.

https://www.kommersant.ru/doc/5558383?vk
https://www.kommersant.ru/doc/5558699?vk

🔸️Убийство заместителя главы пророссийской военно-гражданской администрации Каховского района Херсонской области Виталия Гуры было инсценировано ФСБ, заявил сам чиновник. О смерти Гуры сообщалось в начале августа.

https://www.kommersant.ru/doc/5558454?vk

🔸️Полиция проверяет один из каналов Ксении Собчак на предмет пропаганды ЛГБТ среди несовершеннолетних после обращения неназванного москвича. О каком именно канале идет речь не уточняется. Сама она предположила, что это YouTube-канал «Осторожно: Собчак».

https://www.kommersant.ru/doc/5558505?vk

🔸️«Яндекс» закрыл сделку по продаже VK сервисов «Дзен» и «Новости», получив взамен доставку Delivery Club. В компании уточнили, что все изменения в сервисах «Яндекса» будут появляться у пользователей постепенно, начиная с сегодняшнего дня.

https://www.kommersant.ru/doc/5558513?vk

🔸В Кремле пока не видят предпосылок для переговоров России и Украины, заявил пресс-секретарь президента России Дмитрий Песков. По словам Пескова, Путину постоянно докладывают о развитии военных действий на Украине.

https://www.kommersant.ru/doc/5558630?vk

🔸️Президент РФ Владимир Путин заявил, что Россия не допустила резкого спада в экономике и стабилизировала инфляцию. По его словам, РФ справляется с давлением со стороны стран Запада, и их «тактика экономического блицкрига не сработала».

https://www.kommersant.ru/doc/5558639?vk

🔸️Депутаты из комитета Госдумы по обороне предложили внести поправки в федеральные законы о мобилизации и воинской обязанности. Они внесли законопроект, согласно которому гражданам, имеющим трех и более детей, будет предоставлена возможность поступить в мобилизационный людской резерв.

https://www.kommersant.ru/doc/5558796?vk

[club23482909|@kommersant]",2
2574060,-23482909,1662981832,"Президент Владимир Путин провел совещание по экономическим вопросам. Он утверждает, что Россия не допустила резкого спада в экономике и стабилизировала инфляцию. По его словам, РФ справляется с давлением со стороны стран Запада, и их «тактика экономического блицкрига не сработала».

Господин Путин напомнил, что уровень безработицы в стране находится на исторических минимумах: в мае–июле он достигал 3,9%. В июле в промышленности сокращение составило 0,5%, а снижение ВВП замедлилось до 4,3%, перечислил президент. Он добавил, что в августе «оживилось и кредитование экономики, реального сектора и населения со стороны банков».

По мнению господина Путина, состояние российского бюджета «существенно лучше», чем в экономиках большинства стран G20 и стран БРИКС.

Фото: Пресс-служба президента РФ

[club23482909|@kommersant]",23
2567875,-23482909,1662673748,"Совет управляющих Европейского центрального банка (ЕЦБ) в четверг единогласным решением поднял ключевую ставку сразу на 75 базисных пунктов, до 1,25% годовых. Это максимальное за все время разовое ужесточение монетарной политики — аналитики ждали повышения на 50 пунктов.",0
2562838,-23482909,1662463797,"Валютные сбережения граждан России продолжат уменьшаться, а доля иностранной валюты в их портфеле классических сбережений по итогам 2022 года составит около 10%, сообщил заместитель президента--председателя правления ВТБ Анатолий Печатников в рамках ВЭФ-2022. По его словам, это в два раза меньше, чем в начале года.

Анатолий Печатников пояснил, что раньше россияне рассматривали иностранную валюту как относительно стабильный сберегательный инструмент.

Сейчас же на фоне ограничений, высокой инфляции на европейских рынках и в США, а также практически нулевых ставок по валютным депозитам интерес населения к таким сбережениям практически угас.

[club23482909|@kommersant]",9
2559481,-23482909,1662284700,"Немецкое правительство сегодня, 4 сентября, согласовало план по снижению инфляции на €65 млрд, сообщает AFP со ссылкой на соответствующий документ. План принят с целью ослабить давление на домохозяйства на фоне сокращения поставок российского газа и роста цен на электроэнергию.

«Своевременная и соразмерная помощь гражданам и предприятиям необходима в связи с быстро растущим бременем высоких цен на энергоносители»,— говорится в документе, общий пакет составил «более €65 млрд».

Эти меры включают единовременную выплату в размере €300 нескольким миллионам пенсионеров, чтобы помочь им покрыть растущие счета за электроэнергию. Правительство также выделит студентам меньшую единовременную выплату в размере €200 и дополнительную плату за отопление для людей, получающих жилищные пособия.

Ранее в Германии были приняты два пакета льгот на общую сумму €30 млрд, которые включали снижение налога на бензин и субсидируемый тарифы на проезд на общественном транспорте.

Правительственная помощь поступает на фоне остановки поставок газа по «Северному потоку».

Ожидается, что рост цен на энергоносители приведет к росту инфляции в Германии и еврозоне примерно до 10% к концу 2022 года, что является самым высоким показателем за последние десятилетия. Инфляция в Германии в августе выросла до 7,9%.

Об остановке трубопровода читайте в публикации «Ъ FM» «""Северный поток"" взял паузу».",17
2559148,-23482909,1662256800,"Средняя стоимость элитного жилья в Лондоне упала на 17,6% относительно пиковых значений 2014 года, сообщила газета The Financial Times (FT). Элитное жилье подешевело из-за пандемии коронавируса, санкций против России и инфляции.",12
2555486,-23482909,1661992501,"Страны G7 (Великобритания, Германия, Италия, Канада, Франция, Япония и США) достигли значительного прогресса по введению ограничений на цену российской нефти, что также поможет в борьбе с инфляцией, заявила глава американского Минфина Джанет Йеллен. США считают ограничение цен на нефть лучшим способом снижения доходов России, сообщили в Белом доме.",26
2550909,-23482909,1661805305,"В правительстве, готовясь к инвентаризации антикризисных мероприятий и расходов, представили в понедельник новые, заметно более оптимистичные оценки экономической ситуации в РФ. По ожиданиям первого вице-премьера Андрея Белоусова, спад ВВП в этом году может составить лишь немногим более 2%, инфляция — 12–13%, а падение инвестиций не превысит 2%.",2
2550303,-23482909,1661781858,"Инфляция в РФ по итогам 2022 года может составить 12-13%, сообщил первый вице-премьер Андрей Белоусов. Об этом он заявил на заседании президиума правкомиссии по повышению устойчивости российской экономики в условиях санкций.

 На президиуме господин Белоусов также дал оценку спаду потребления в России. По его словам, в 2022 году спад составит 4,2%, в 2023 году потребление вырастет на 2,5-3%. Спад экономики России в 2022 году может не превысить 3%, отметил первый вице-премьер. https://oml.pw/1gbkullmm",23
2549285,-23482909,1661733602,"ФРС США намерена продолжать ужесточение монетарной политики, хотя для нормализации уровня цен потребуется дополнительное время, что приведет к охлаждению темпов роста, заявил глава регулятора Джером Пауэлл на ежегодной конференции в Джексон-Хоул, не исключив и еще одного значительного повышения ставки на заседании в сентябре. В ФРС опасаются, что преждевременное смягчение политики приведет к изменению ожиданий и не позволит достичь целевого ориентира, несмотря на замедление роста цен в июле.",0
