id,owner_id,post_time,post_text,comments.count
2144690,-23482909,1643133620,"Обострение конфликта между Россией и Украиной, вероятно, разгонит мировую инфляцию. Также это приведет к дальнейшему росту цен на энергоносители для многих стран, заявила первый заместитель директора-распорядителя МВФ Гита Гопинат.",3
2144242,-23482909,1643094471,"Аналитики датского Saxo Bank представили прогноз по глобальным рынкам на первый квартал 2022 года. Банк считает, что мировая экономика переживает полномасштабный энергетический кризис, вызванный «недостаточными инвестициями в добычу ископаемого топлива и чрезмерным политическим приоритетом в отношении ""зеленой"" энергетики». 

Поэтому главной темой этого квартального прогноза стали высокие цены на энергоносители, которые, по сути, являются налогом на потребителей и бизнес и разгоняют инфляцию.",0
2143394,-23482909,1642962442,"Основной темой прошедших в пятницу онлайн-сессий Всемирного экономического форума в Давосе стала почти повсеместно выросшая инфляция. Глава МВФ Кристалина Георгиева заявила, что из-за разной скорости восстановления странам придется справляться с проблемой самостоятельно — единого рецепта помощи нет. 

Председатель ЕЦБ Кристин Лагард, впрочем, полагает, что в еврозоне инфляция снизится до целевых 2% уже к концу года. Глава Минфина США Джанет Йеллен также уверена во временном характере всплеска цен, который случился из-за сильного изменения структуры расходов от товаров к услугам и проблем в цепочках поставок, — теперь она возлагает большие надежды на рост американской экономики, который уже «превзошел самые оптимистичные ожидания».",3
2143277,-23482909,1642943770,"Портфельные менеджеры крупнейших инвестфондов обеспокоены высокой инфляцией в мире.  Они ожидают роста ставок в США и потому снизили спрос на акции высокотехнологичных компаний, которые сильно зависят от уровня ключевой ставки ФРС.",1
2143230,-23482909,1642936708,"Пока Демократическая партия США, контролирующая обе палаты Конгресса, из-за внутрипартийных разногласий безуспешно пытается согласовать ключевые для демократической же администрации законопроекты, борется с инфляцией и кризисом в здравоохранении и внешней политике, все ближе центральное для нее событие этого года — промежуточные выборы 8 ноября.  Пока ситуация складываются не в пользу правящей партии.",1
2141798,-23482909,1642705216,"Котировки драгоценных металлов вернулись к уровням двухмесячной давности. Лидерами роста оказались платина, стоимость которой закрепилась выше $1000 за тройскую унцию, и палладий, переваливший за $2000. 

Благородные металлы дорожают на фоне высокой инфляции в мире и опасений инвесторов относительно перспектив мировой экономики в случае сворачивания монетарных стимулов со стороны центробанков. 

Благодаря более высокому использованию металлов платиновой группы в промышленности они растут опережающими темпами на фоне позитивных ожиданий по экономике Китая.",1
2141449,-23482909,1642674314,"✅ Госдума России одобрила в третьем чтении закон, согласно которому пенсии будут повышены на 8,6% с 1 января 2022 года. Правительство России ранее внесло эту норму поправкой в принятый в первом чтении правительственный законопроект о социальной пенсии представителям малочисленных народов Севера. Документ опубликован в думской электронной базе данных.

12 января президент России Владимир Путин поручил правительству принять решение об индексации пенсий на 8,6%, по уровню инфляции. Как сообщал первый вице-спикер Госдумы Александр Жуков, средний размер пенсии после индексации в 2022 году составит 18 984 руб.

Напомним, с 1 января страховые пенсии неработающих пенсионеров проиндексированы на 5,9%, их размер составит 18 521 руб.",22
2141250,-23482909,1642644674,"Дискуссия о возможной глобальной зеленой инфляции, спровоцированной энергопереходом, становится частью повестки не только в ЕС, но и в России.  Пока ее участники спорят о природе, масштабах и последствиях явления, все более понятным становится то, что России придется заплатить за европейский энергопереход дважды — и как экспортеру традиционных источников энергии и углеродоемкой продукции, и как импортеру готовой продукции.",2
2141174,-23482909,1642627328,"Прошлый год стал самым успешным за восемь лет для инвестбанков, работающих в России.  Они заработали $434 млн.",2
2140563,-23482909,1642588804,"📱 «Вымпелком», который владеет брендом «Билайн», «МегаФон» и Tele2 в ближайшее время намерены поднять цены на архивные тарифы, выяснил «Ъ». Причинами стали инфляция и увеличение мобильного трафика. Эксперты ожидают дальнейшего подорожания услуг операторов на 10–12%.

МТС еще в начале января уже уведомил абонентов об увеличении стоимости тарифов на 60 руб.

В пресс-службе «Вымпелкома» также подтвердили «Ъ», что рассматривают возможность «изменения цен» на часть архивных тарифов. Сейчас у компании около 40 архивных тарифов стоимостью от 650 до 2,5 тыс. руб. в месяц.

В «МегаФоне» и Tele2 отказались от комментариев.",4
2140372,-23482909,1642564900,"«Вымпелком» вслед за МТС поднимает стоимость архивных тарифов на 10%, то же планируют сделать «МегаФон» и Tele2, рассказали источники “Ъ”.  Эксперты связывают рост цен на связь с общей инфляцией и увеличением мобильного трафика, ожидая дальнейшего подорожания услуг операторов на 10–12%.",6
2140317,-23482909,1642549391,"«Вымпелком» вслед за МТС поднимает стоимость архивных тарифов на 10%, то же планируют сделать «МегаФон» и Tele2, рассказали источники “Ъ”.  Эксперты связывают рост цен на связь с общей инфляцией и увеличением мобильного трафика, ожидая дальнейшего подорожания услуг операторов на 10–12%.",1
2140042,-23482909,1642518908,"Опрос портала SuperJob. ru показал, что 23% россиян считают рубль надежной валютой для хранения сбережений. Столько же отдают предпочтение доллару и 14% — евро. 25% россиян не знают, в чем лучше им хранить сбережения.

В опросе говорится, что приоритет рублю отдают граждане с зарплатой 50–79 тыс. руб. (26%) и респонденты от 45 лет (25%). Доллар предпочитают россияне до 34 лет (30%). В евро вкладываются люди с доходом от 80 тыс. руб., таких 19%. Еще 15% предпочитают другие валюты для хранения сбережений.

Инфляция в России за 2021 год составила 8,39%, в США — 6,8%, в Евросоюзе — около 3%.",12
2137781,-23482909,1642170028,"🗣️ Пик инфляции в России пройден, заявил глава Минфина Антон Силуанов. Он связал ее высокие темпы с финансовой поддержкой россиян в наиболее кризисные периоды пандемии. По данным Росстата, инфляция в России по итогам 2021 года составила 8,39%.

«Инфляция — это одна из тех проблем, которые мы получили с прошлого года... Причины в конечном счете — это всегда монетарные факторы, и монетарные факторы были вызваны тем, что мы стремились поддержать граждан, экономику в условиях, когда вводились ограничительные меры. Сработало? Сработало. Но последствия мы видим — инфляция», — сказал он.

🔗 http://amp.gs/jmtKQ",40
2137518,-23482909,1642127172,"Рост цен стал главным сдерживающим фактором для развития бизнеса в последний год, следует из подготовленного для президента отчета Российского союза промышленников и предпринимателей (РСПП) о деловом климате.  Хотя инфляционный всплеск обеспечил получение сверхприбылей, что вылилось в расширение инвестиционных планов компаний, динамика цен вытеснила даже системные проблемы — правосудия и коррупции в госорганах.",6
2137208,-23482909,1642089775,"👔Год Быка оправдал свой образ — большинство рынков пошли вверх, подчас обновив исторические максимумы. Во многом это определялось накачкой экономик и кошельков граждан финансовыми регуляторами на фоне борьбы с пандемией. Однако лошадиные дозы кэша неизбежно должны были привести к росту инфляции, которая к концу года также взлетела до многолетних максимумов. 

В идеале, она должна сократить баснословные обязательства правительств и центробанков. Но уже появились и растут риски дефолтов, предупреждает редактор отдела финансов Дмитрий Ладыгин.

Подробнее — в спецпроекте «Ъ».",0
2136816,-23482909,1642047208,"На новогодних каникулах московские рестораторы смогли увеличить выручку на 10-22%.  Причем этому способствовал не рост числа посетителей, которые по-прежнему реже, чем до пандемии, питаются вне дома, а подорожание продуктов и сырья на фоне общей инфляции.",1
2136807,-23482909,1642038911,"Потребительская инфляция в США по итогам декабря 2021 года побила 40-летний рекорд — в годовом выражении цены выросли на 7% (после 6,8% в ноябре).  Такой значительный рост объясняется в первую очередь увеличением базовой инфляции, которая в декабре выросла до 5,5% с 4,9% в ноябре.",2
2136806,-23482909,1642038911,"Торможение роста мирового ВВП в 2022 году до 4,1% произойдет на фоне продолжающихся вспышек ковида, сокращения мер господдержки экономик и сохранения трудностей в цепочках поставок, отмечают аналитики группы Всемирного банка (ВБ).  Снижены до 5,5% и ожидания роста 2021 года.",0
2136789,-23482909,1642032909,"На новогодних каникулах московские рестораторы смогли увеличить выручку на 10-22%.  Причем этому способствовал не рост числа посетителей, которые по-прежнему реже, чем до пандемии, питаются вне дома, а подорожание продуктов и сырья на фоне общей инфляции.",0
2136747,-23482909,1642019776,"Финальный показатель индекса потребительских цен (ИПЦ) за 2021 год — 8,39%: предновогодний прирост цен был ниже ожиданий, посленовогодний — немного выше. В среду объявлено об индексации социальных выплат, она точно совпадает с инфляцией прошлого года. Исключение — немного более высокая индексации пенсий, на 8,6%, причем в «неразовом» варианте, более затратном для бюджета.

Если сам по себе всплеск цен 2021 года вызван факторами, вряд ли зависящими от власти, то распределение инфляции по разным доходным группам в основном совпадает с социальной политикой: быстрее дорожали группы товаров и услуг, потребляемые защищаемыми группами населения. В ближайшие годы это явление, видимо, неизбежно при любых масштабах инфляции.",3
2136731,-23482909,1642017010,"Курс доллара в мире обновил двухмесячный минимум. Снижению курса американской валюты способствовали прогнозы главы ФРС относительно инфляции в стране, которые оказались мягче, чем ожидали участники рынка. При этом российская валюта оказалась в числе аутсайдеров. Доллар смог вырасти в цене на российском рынке на фоне сохраняющихся геополитических рисков и роста выкупа валюты со стороны Минфина в рамках бюджетного правила.",0
2136681,-23482909,1642011002,"👨‍👩‍👦 Материнский капитал и другие соцвыплаты, не привязанные к размеру прожиточного минимума, с 1 февраля проиндексируют на 8,4%. Таким образом, размер маткапитала на первого ребенка составит 524,5 тыс. руб., на второго — 693,1 тыс. руб. Инфляция по итогам 2021 года составила 8,39%.

«Пособия, компенсации и социальные выплаты, которые не связаны с размером прожиточного минимума, будут проиндексированы на 8,4%. Это материнский капитал, выплаты ветеранам, пособия по беременности и родам и по уходу за ребенком до 1,5 лет для неработающих граждан, единовременное пособие при рождении ребенка, компенсации гражданам, подвергшимся радиоактивному воздействию, и другие меры социальной поддержки»,— приводит ТАСС сообщение министерства.",2
2136650,-23482909,1642008609,"Инфляция в России в декабре 2021 года ускорилась до 0,82% и составила по итогам года 8,39%, свидетельствует публикация Росстата. Ведомство подтвердило предварительный прогноз годовой инфляции, который оно дало в конце декабря. Инфляция достигла максимума с 2015 года — тогда Росстат фиксировал повышение потребительских цен на 12,91%.

Рост цен на продукты питания за 2021 год составил 10,62%, на непродовольственные товары — 8,58%, сообщило ведомство.",4
2135743,-23482909,1641865155,"Стоимость продовольствия в прошлом году в среднем выросла на 28,1%, подсчитали в Продовольственной и сельскохозяйственной организации ООН. Прирост оказался самым значительным за последние годы — повышение цен затронуло все основные группы сельхозпродукции, а не только зерно и масло.

Продовольственная инфляция в РФ, видимо, значимо ниже мировой, ее роль в формировании инфляционных ожиданий выше.",10
2135225,-23482909,1641779771,"Инфляция в странах зоны евро в декабре продолжила расти — хотя прирост стоимости энергоносителей несколько замедлился, базовая инфляция на фоне роста цен производителей осталась выше таргета в 2%.  Эксперты прогнозируют сохранение повышенной инфляции как минимум в первом полугодии этого года, несмотря на снижение цен на энергоносители и небольшое ужесточение политики ЕЦБ.",2
2132843,-23482909,1641471188,"Минувший год оказался для рынка коллективных инвестиций менее успешным, чем кризисный 2020 год.  Лишь две трети розничных паевых фондов продемонстрировали прирост стоимости пая.",2
2130991,-23482909,1641125711,"Наступает 2022 год, и «Ъ» предлагает читателям экономический прогноз на него.  Эксперты отвечают на вопросы, что случится с курсом доллара к рублю, как изменятся мировые цены на нефть, какой окажется инфляция и как поведут себя доллар и евро на мировом валютном рынке.",2
2130622,-23482909,1641036613,"💰 Термин «инфляция» в 2021 году снова во всех языках мира

Ускорение инфляции в этом году стало главным глобальным трендом — повышение цен затронуло почти все крупные экономики, как развитые, так и развивающиеся.

Препятствия со стороны предложения могут быть сняты уже в следующем году, но если ранее стабильно низкая инфляция позволяла раз за разом прибегать к монетарной поддержке, то теперь у такого стимулирования появилось весомое ограничение, считает корреспондент отдела экономики Татьяна Едовина.

http://amp.gs/jt2d0",2
2130054,-23482909,1640888720,"Видимо, одним из главных открытий 2021 года не только для российского общества стала легкость принятия простых и эффективных решений, предполагающих быструю и красивую победу добра над злом.  Неважно, что будет выступать в одном из этих двух качеств в 2022 году — инфляция, бедность, диктатуры, климат, невежество, капитализм или гендерная дискриминация.",0
2130048,-23482909,1640888594,"Ускорение инфляции в этом году стало главным глобальным трендом — повышение цен затронуло почти все крупные экономики, как развитые, так и развивающиеся.  Препятствия со стороны предложения могут быть сняты уже в следующем году, но если ранее стабильно низкая инфляция позволяла раз за разом прибегать к монетарной поддержке, то теперь у такого стимулирования появилось весомое ограничение, считает корреспондент отдела экономики Татьяна Едовина.",0
