post_id,text,comment_time,from_id
1639826,👏,1703843253,152512497
1639826,А зачем тогда вводили обязательную продажу 💶 и 💵 экспортёрами?!,1703845781,694295529
1639826,Когда в карманах ветер свищет мы доверяем только пище.,1703847565,818528368
1639826,"Я доверяю доллару и евро, не знай как другие. Юани мне нужны, как зайцу стоп сигнал",1703847964,173628274
1639636,Когда?,1703821280,837390518
1639636,"Некоторое повышение стоимости архивных тарифов не так катастрафично, потому что находится в пределах инфляции, да и является весьма целесообразным развитием всех мобильных операторов. Связь постоянно модернизируется и используется почти каждым современным человеком, невозможно обесценивать работу их.",1703822494,798874142
1639636,Национализировать надо все сети,1703825039,159011493
1639636,"А они то знают про это??? Да впрочем им на эти высказывания..., бабам по пояс корче",1703825952,174166645
1639636,А кто не разрешит?,1703829537,694247444
1636440,И чем занимается офисный планктон?,1703521611,445661840
1635559,"С нашей инфляцией, пенсиями  и "" дегенератами"" здоровьем России можно уже не интересоваться! "" Пациент скорее мертв""🤣🤣🤣",1703444136,592755993
1635559,"Националистическая политика Киева привела к закономерному итогу. Все, видимо, забыли как одна националистическая европейская страна, тоже при поддержке штатов, кстати, развялаза Вторую мировую войну. То, что сейчс происходит на Украине - желание предотвратить новый глобальный конфликт в будущем. То, что сейчас делает Россия и миллионы беженцев в Европе - целиком и полностью вина Зеленского.",1703445297,792124397
1635559,ПОСОбия мигрантов в РОссии не хочет сравнить с пенсиями и даже зарплатами граждан РФ?,1703445625,642079548
1635559,"Поинтересовался бы здоровьем того, кто на почту получит вот эту карту",1703455006,152512497
1629710,А кто управляет этим разогнавшимся автомобилем?🚘,1702657434,403811201
1629710,Остановится эта ... Или нет когда нибудь?,1702658155,573998506
1629710,Как говорила Эльвира - ближайшие 5 лет ничего хорошего не ждите,1702659265,29545530
1629710,Брехня,1702662955,633522276
1629710,Когда уже ей скажут: Довольно гнать!,1702669038,403811201
1629710,Когда её КамАЗ по трассе распидорасит уже!?,1702674660,828872697
1629710,Гнать рыночную бестолочь,1702689679,274438375
1629710,Куда едим,1702705400,118837335
1629710,"Какой автомобиль сейчас разогнался?)))Уж не тот,который яйца по магазинам развозит?",1702748247,683141632
1629710,"это капитализм,а им капиталистам выгодно",1702762307,793738032
1629652,"Конечно, она наш риск основной",1702648289,50742024
1629652,Наебулина — один из сильнейших рисков!,1702648312,173339000
1629652,"У ЦБ нет других инструментов, кроме повышения ставки? Возмутительно 🤬",1702650243,711445060
1629652,Кто эту дуру,1702651807,788691683
1628887,"Сегодня доширак покупать даже не надо, лапшу развешивают всем, причем бесплатно",1702546853,52309250
1610610,"Лиса Алиса рассказывает Базилио (народ) про 5 золотых,5на два не делится, тогда 5 разделим на 5 ровно 1, значит Алисе 4 золотых, а народу 1, вот так.",1700145602,635128478
1610610,"Женщина хоть сказала правду, а остальные министры""мужики"" только о новых достижениях в экономике, улучшение жизни людей",1700147787,232931960
1610571,Ей верят ещё? 🤣😂,1700138129,828332827
1610571,То ли ещё будет.,1700141143,173628274
1609734,Это даже очень хорошо. Спасибо правительству и дяде Вове.,1700045755,731071486
1607639,"Это точно, для этого нужно очень много сделать - остановить военные действия, раскулачить олигархов, начать вкладывать деньги в развитие страны, сделать реформу налогообложения и не подстраивать законы под заинтересованных лиц, начать думать о населении. Это так, основное...",1699705599,514859817
1607639,"Да, но основную причину экономической задницы экономист назвать бздит.",1699707572,40643017
1607639,Посмотрим какие будут тарифы монополий и посчитаем инфляцию.,1699707982,616924632
1607639,Это понятно любому кто хоть немного разбираеться в экономике и только видимо в ЦБ этого не понимают.,1699714660,809029935
1607639,,1699717835,215172956
1607267,Кому сейчас поёт Эдита Пьеха? Куда приедет Николай Носков?,1699646473,13001167
1607267,"Самое главное, все очень любят страну, поддерживают ребят на СВО и часть гонорара передают им. Или я ошибаюсь?",1699687176,313855769
1607127,Никто не думает о Будущем!,1699628939,388967445
1607127,"Лет 20 назад рукожопые правители думали, что России больше не потребуются токари, слесари и сварщики. Гораздо важнее для них были менеджеры да юристы. Теперь имеем что имеем",1699629710,215172956
1605597,"54 - по Чернобылю, 22 года от звонка до звонка по 40 часов в неделю= ШИШ от государства - 14 000. НадоТь старичка найти - вместе прожить можно!",1699451156,44829884
1605597,"24 тысчи у меня в Беларуси, так коммуналка копейки и цены по сравнению с вашими +бесплатная медицина. Жаль что такое в России происходит(((",1699452044,190827712
1605597,"А может уже не надо приводить в пример Московских! пенсионеров!😡. И льготы, и пенсии, и подарки - все у них! 
Не злите народ!",1699452480,313855769
1605597,"""Каждый народ имеет то правительство, которое он заслуживает."" Жозеф де Местр. (1753 - 1821г.)",1699452796,254458661
1605597,"Москва не Россия? У нас цены другие , все дороже",1699455289,813670059
1605597,"Что значт все дороже. В Пятерочках, Перекрестках, Магнитах и прочих сетевых магазинах цены одинаковые по всей России. Пенсионеры покупают в основном в этих магазинах. Пенсии в Москве и за МКАДом  отличаются значительно.  При этом, коммуналка дороже, чем в Москве.",1699456396,448883294
1605597,"Только коммуналка 10 к, это как?",1699456844,313233984
1601759,"Надо не тратить меньше, а больше зарабатывать",1698984924,597519422
1601759,Уволить главного редактора.,1698987005,4504120
1601759,"За бюджет, проголосовали люди ни чего не смыслящие в экономике. И эти же спортсмены и артисты принимают законы. 
  Мы видим, к чему приводит, когда клоун добирается до власти. 
  И в нашей стране пора задуматься, - а нужен ли нам такой орган как Госдума? Которая живёт далеко в облаках и  не вникает в реальное положение дел на земле. Оставить один Совет Федерации, который можно сократить, что ни как не повлияет на результат.",1698988369,337388092
1600911,Врет и не краснеет.,1698890472,667064011
1600911,Это кому он всё время рассказывает? Счастливчики!,1698891531,182296045
1600911,Сказочник,1698892865,717271769
1600911,Уже не интересно!,1698896562,535111933
1600911,Хорошо жить информационном поле президента! Там всегда всё хорошо!,1698900019,255216315
1600911,"Жалко, что российские граждане об этом не знают.",1698901373,337388092
1600911,Он выдает то что докладывают чиновники ему.,1698903278,686237371
1600911,Его обманывают😆😆😆 вспоминается сказка про короля (голого),1698907110,186187948
1600379,Странно. Даже при Ельцине жили без кредитов и ничего не схлопывалось... что случилось на 24 году стабильности то??!!,1698767943,40643017
1599473,"Почти как в начале 1990 годов.
Только разница, товары есть.., денег нет",1698406483,10155084
1599473,"Что значит все кроме бензина?...он так резко подорожал, что дальше только в космос",1698406661,2226959
1599473,а что так?,1698406698,70348275
1599473,,1698407166,22662558
1599473,Путинский режим во всей красе. Но по телевизору скажут что опять американцы виноваты🤦‍♂️,1698407384,250083636
1599473,получается 7.5 процентов инфляция это Филькина киркорго грамота .ну что все безграмотные не могут посчитать как я инфляция? она как минимум в два раза больше,1698645961,761515615
1598623,"Интересно, а прожиточный минимум останется тот же? Тогда у многих пенсия не изменится",1698233983,533893979
1598623,"А между тем при Медведеве пенсию в 2009 увеличивали аж на 46%! И это привело к росту экономики! Почему теперь то Кремль с ума сошел, пилит сук, на котором сидит???",1698235275,40643017
1598623,Оклады маленькие 6т..доводят до 16....и пенсия 11..Всё,1698236832,218440828
1598623,Вообщем как всегда получим от хрена уши.,1698247347,767477619
1595591,"Да ладно, враньё, по телевизору говорили и продолжают говорить. Что все хорошо, всё нормально!!!!))) И даже повышение цен не существенное!",1697568378,233482585
1595591,"Чем дольше война, тем выше процент инфляции.",1697569245,373874011
1595591,Тихо сами с собой уже эти аналитики разговаривают.,1697570910,437291323
1588045,,1696772725,215172956
1588045,"Ну почему же «неприятно удивит»?
И почему, собственно, «удивит»?
В России с 24.02.2022 всё идёт по плану.
Это просто план такой.",1696784737,13755381
1588045,"То есть магазинам будет выгоднее ставить цену,например, на ту же капусту 300 рублей и ждать, когда она начнет гнить в ящике? А потом выкидывать?
Флаг продавцам в руки!",1696791456,313855769
1584972,Просто эта треть воюет с окладом 200к.,1696434489,82062614
1580911,Syki!!!!!,1696014104,22662558
1580911,Если правительство не может сдержать цены и управлять страной? Ответ очевиден в отставку!,1696051815,132486621
1578540,мы верим нашему правительству...,1695669010,62411174
1578540,"Не густо путешествовать на пенсии по миру, как это делают пенсионеры в Европе не получится.",1695669333,173628274
1578061,"это только народ дурить, каких 7 процентов. Они в магазины не ходят ,цены не знают",1695627378,69581378
1578061,"Инфляция от слова "" коррупция "" ? 🤔😁",1695627711,392314240
1578061,"Почем нонче доллар, Решетников? Тоже на 7,5 процентов с декабря? Вашу контору видимо так дроном контузило что запятые не там ставите уже...",1695632427,40643017
1577959,"Удивительная история, уровень инфляции 7,5%, за жкх уже готовят людей на подьем 9,8 %, арифметика немного не совместимая.",1695614494,246522425
1577959,"Полностью поддерживаю! Уверена, старики обрадуются повышению!",1695629423,767628692
1577959,"Прочитал статью ничего не понял причем здесь 25 и 26 годы и цифры 7,5% нигде не вижу как всегда муть какая то.",1695629803,616924632
1576923,Ритуальные услуги,1695479597,40643017
1576923,Все,1695479632,378135355
1572048,Дык лучше в меру пить чем уехать вперед ногами в 30-50 будучи правоверным ЗОЖником!,1694853077,40643017
1571772,"А Путин может что-то сделать? Он же умный, его 80% россиян поддерживает!",1694799356,514859817
1571772,"Вы тоже прочитали эти ""новости"" голосом Николая Николаевича?",1694801790,19086506
1571772,"Все по плану, не переживайте.",1694856666,37187869
1571558,Даёшь 98-ой год !💪💪💪,1694777024,753567633
1571558,"Приехали. Уже не знают что делать, скорее всего гиперинфляция опять.",1694777434,173628274
1571558,"Молодчина,умница .такой хернёй можно заработать место в истории государства российского.я будь моя воля исполнена открыл мемориальное кладбище погибших отдеяний этаких.",1694804017,445298258
1567730,"Закупаю еду на один - два дня , хранить излишки негде.",1694268949,429407576
1567730,То есть сейчас копейки все стоит🤣🤣🤣,1694274706,504898374
1565972,"Даже же Индия снизила зависимость от российской нефти, так как есть более выгодные предложения! Успокойтесь уже со своими скважинами)))) пейте эту нефть, купайтесь в ней!",1694066010,213180854
1565972,"Нефть и газ принадлежат кому, разве государству?",1694068106,193791443
1565475,"Да вы чо, правда чтоль??? А вот мне кажется, у нас критическая ситуация с пониманием причины инфляции. Точнее, КРЕТИНическая...",1693980513,40643017
1565475,"Капец, почему??? Из за чего???",1693983358,213180854
1565475,"Скоро наверно инфляция в гипер перейдёт, а они всё бегают геев ловят.",1693983857,173628274
1565059,И че теперь?,1693928322,382843833
1565059,Во что это все выльется для нас?,1693928344,382843833
1563985,"Да нам сейчас начнут втирать, что 200 рублей за доллар это благо",1693759279,158020907
1563985,"Как можно писать и читать такую ересь. Автор считает, что в России есть только нефте и газо добывающие компании, которым сегодня разрешено оставлять валютную выручку за рубежом. Жителям России было бы наплевать на курс, если бы все необходимое для жизни производилось в России. Но этого нет. По абсолютному большинству товарных позиций страна зависит от импорта на 40-70%. Следовательно выросший на 30% курс минимум на 30% поднимает цены на такие товары, сюда же добавляется логистика, где цены на моторное топливо растут каждый день(бывает на 1-2 рубля). И как в этих условиях жить? Может Набиуллина с Силуановым объяснят.",1693761723,788695668
1563026,Никакой Сталин сейчас не поможет. Надо в первую очередь остановить войну.,1693645390,429407576
1561477,,1693413777,9120128
1561477,,1693414636,815579563
1561477,У олигархов и чиновников посмотрели,1693414981,817170671
1561477,,1693415007,692674152
1561477,А толку? Цены опять скакнут и всех делов то!,1693422105,175054852
1561477,"А что без росстата россияне не заметили повышения? Как всегда невнимательность подводит. Повышают, повышают, а россияне не замечают!",1693473135,604973372
1559235,"Ну а что бы и подороже не сделать этот школьный набор?😡
У нас же все для детей, недавно читали: на группу детей-участников 3 миллиона, Билану за час пения 5 с лишним 😡",1693151105,313855769
1559235,"Правительство и минпросвещения не предпринимает ни каких попыток для снижения цен на школьные преднадлежности, зачем нам такое минпросвещение!!!??",1693165927,715439968
1559235,И снова президент России Владимир Путин должен это решать!?что происходит с обеспечением образования в России?,1693166157,715439968
1553125,Вот и пусть монополисты всех сфер  чутка цены снизят от стройматериалов до продуктов питания.  Тогда население вздохнет хоть чутка!,1692542131,748337097
1553125,Откуда у нас малоимущие? В самой лучшей стране мира!,1692551946,429407576
1553125,"Как же так ? Страной управляет гениальный геостратег , а народ нищий ..",1692555330,817395208
1553125,Трепотня с их стороны,1692617221,631753272
1551594,12 -расстрелять..,1692382809,490507432
1551594,Скорее в минус,1692390167,173628274
1551594,"Да вы чо??? правда??? А ыхсперды по Первому говорят ничего страшного, не утихает забота о простом россиянине...",1692391143,40643017
1551594,,1692391352,19086506
1551594,Думайте  перед избирательнлй урной.....,1692460494,305380808
1548730,"А сейчас они не обгоняют чтоль??? В 2002 г электричка до Твери из Москвы стоила 64 рубля, сейчас почти 700 нормально?",1692117392,40643017
1548492,Вот смотрите на предателей России.,1692089065,478383153
1548492,"Мне интересно, они  за Россию? В, чем я, сомневаюсь. Но почему то, они устраивают Президента России.",1692089677,384849186
1548492,"Наббиулина обещала 30… Она четко выполняет указание своего хозяина за лужей🤬
Сейчас ЦБ спасает экономику США от мировой долларовой инфляции, перетягивая её на экономику России . Для стабильного развития нашей экономики нам не нужны ни доллары ни евро,  они нужны только финансовым спекулянтам. Российский рубль полностью обеспечен ресурсной базой, в отличии от  Американских и Европейских фантиков. Штаты рушатся и, для того  им устоять они должны опять устроить в России 1991 год. Не дождутся😎💪🏻💪🏻💪🏻",1692090900,357490165
1548492,Цб  и правительство на довольствии олигархов банкиров  .вывоз доллара прекратите и не надо поднимать ставку,1692091951,595449682
1548492,"В прошлом году не могли остановить падение, в этом не могут остановить рост. 20% в сентябре?.",1692093333,96194231
1548492,Цена за бакс,1692093824,99115354
1548492,Везде трубят что Россия отказывается от доллара а он уже перевалил за сотню такое впечатление что нашим ЦБ руководят даже не иноагенты  а враги России,1692094649,764411897
1548492,150 к нг,1692097067,309261801
1548492,Судя по снимку- им насрать на происходящее.,1692104726,531684947
1548492,Все золото закончилось,1692112430,411662573
1548492,Опять за рыбу деньги! Ну надоели же уже же!,1692115880,437291323
1548492,"ЦБ это враги нашей страны, ставленники Запада, зависят отМВФ, хранят своё бабло на западе. Вот и дрочат наш народ.",1692116262,792544348
1548492,"Помните слова Путина, доллар дорожает нам выгодно.",1692191549,789657447
1548014,А зарплаты как? В ближайшие месяцы не увеличатся?,1692033999,8821635
1548014,Не может быть..,1692034057,245213392
