post_id,text,comment_time,from_id
1330745,Балабол. Уже даже не смешно,1673973677,40643017
1330745,"Приказ нужен, а не призыв.",1673986992,211225809
1330745,Сказочник,1674014448,644686211
1330745,А как это сделать в коммерческом секторе? Ау!!,1674034959,591312921
1323581,зато внешний долг растёт и подходит к 40 триллиона долара! Сша всю свою жизнь живёт в  долгах и в кредит!,1673573062,158839344
1321635,"Может, помидоров?",1673455361,465019671
1318249,Нормальная компания.,1673271310,173628274
1318249,"Не 12 а всё 50  , если взять  в примеру моторное масло цена была 1200 р а стало 3,500 р Лукойл ,это даже не 50 а все 100.",1673284282,644686211
