post_id,text,comment_time,from_id
1548014,"В России не только две беды, но и две инфляции — одну считает Росстат. Согласно его оценке, цены растут, но не критично — где-то больше, где-то меньше, где-то на два процента, где-то на пять и даже на десять, но не более того.

Другую инфляцию считает народ — и у людей цены растут двузначными темпами.

В подтверждение своих слов Росстат предъявляет данные наблюдений, а люди показывают чеки из супермаркетов.",1692034169,33491464
1548014,Ахахаха! А цены на учебу в вузах на 12 % в среднем поднялись. Дык кто врет как сивый мерин?!,1692037562,40643017
1548014,В строжайшем соотвествии с планом,1692040076,437675162
1548014,ЦБ сколько лет торгетирует инфляцию? Где результат? Кто так «крышует» Набиуллину? Кого она так «держит за яйца»? Нормальный руководитель уже давно придал бы ей «ускорение» с «волчьим билетом» за профнепригодность.,1692040676,391015343
1548014,"Мы,оказывается в том,что покупаем?!",1692040770,232943208
1548014,Виноваты!,1692040789,232943208
1548014,"Мясо говядина на базаре стоило год назад 350 руб,сейчас 550-600руб",1692067335,225506455
1548014,"Каждая бабка в деревни знает что если в ведре дырка то вода утечет.
Вывоз капитала и спекуляции не запрещены.",1692123634,308627349
1545959,"Ещё ускóряться?! 🤦‍♂️
Понятно, что дутое ""импортозамещение"" ВАМ на пользу, но про народ тоже иногда думать надо, а то снесут ваши ""скрепы"" ненароком - дозакручиваете гайки...",1691848767,19086506
1545201,"Уверен, что в цб с рублем все спокойно порешают без проблем, было же уже в прошлом году подобное, когда нам санкций за воротник накидали, и ниче, вылезли как-то🙌",1691770325,797041643
1545201,Когда же разгонят эту либеральную экономическую кодлу !,1691771835,719142056
1545201,"Да, тяжело сейчас нашим с американскими чертями биться!",1691832236,296306526
1545201,"Помнится, и доллар был по 120 рэ, и ""экономика в клочья разорвана"" уж не первый год, и апокалипсис обещан был.
   ...но чёт всё откладывается постоянно, одна либерда в разочаровании ноет😄.",1691842005,153127848
1545201,Это ...и есть враги госсударства...прыщ на спине народа...сорняк пожирающий всё....просравший народные деньги..👺,1691842461,364675572
1545201,"ну упал,зато цены растут!.",1691845127,784600584
1545201,Я ведь сказал и написал что будетс рублем и набиулиной.,1691851346,749564823
1545201,"Норм все будет, либирасты заныли блэт)",1691852022,156493183
1545201,Мне кажется не хватает ума что бы доллар опустить отестаты куплены у них бездари,1691868596,183688568
1545201,"Главное, не делать резких движений! Уже бывало и не такое!
Например в Турции это происходит регулярно, но они живы.",1691871439,677678414
1545201,👏 Это всё из-за Навального,1691875675,225058948
1545201,"Что-то я вот, пенсионерка, и не чувствую этих изменений долларов, евро. Надо в своей стране жить и плевать на всякую валюту. Это волнует очень спекулянтов, беглых рабов из нашей страны)))",1691876443,296306526
1545180,неуправляемый рубль...,1691768855,490507432
1545180,"Пусть найдут другого, который сможет.",1691769047,619740159
1545180,"Помню , как Президент объяснял падения рубля ... по его словам стало понятно , чем ниже курс рубля тем лучше .
   Если доллар стоит 1000 рублей , может вообще отлично ? 🙂",1691769271,392314240
1545180,Сложная ситуация. Объяснишь - уедешь за дискредитацию армии. Не объяснишь - окажешься некомпетентным.,1691769558,1204801
1545180,отправился в свободное падение,1691770508,184718507
1545180,"Не могут,значит освободи место,столько лет и все не могут.за сто им ордена??может они тоже засланые казачки,подорвать нам экономику",1691773032,155406182
1545180,Драматичное? Как в театре?,1691773042,799474629
1545180,Поэтому он и Заботкин!От слова забота!,1691774005,513500414
1545180,Вредители России,1691775301,36494620
1545180,БРАВО!!!,1691776395,23674045
1545180,Что Алëшенька не весел? Что головушку повесил? 🤣,1691776547,486187880
1545180,"Нужно чтобы участникам заседания вопрос задал матрос Железняк. Тогда, глядишь, и ответ появится.",1691778828,610741544
1545180,Причины на фото,1691779005,198211008
1545180,"Пустые разговоры, так, для галочки.",1691779613,780135765
1545180,"Просто закупили доллар по 40 , сейчас по 100.зарплату всем платят в рублях. Фиксированную. Получается в рублях денег дофига, на оплату всем хватит. Собственно такая экономика. Им на наши чаяния Насра...",1691781261,711811479
1545180,Враги!,1691784820,484032971
1545180,"Да, понятно почему и они всё знают. Так , видимость бурной деятельности.",1691791413,766645647
1545180,По-моему эта дама!!!ЗАЕ...ЛА всех!!!НИКЧЕМНАЯ СОЗДАНИЕ И ЭТО ТЕЛО РУКОВОДИТ БАНКОМ СТРАНЫ!!!!!!!,1691801414,153851710
1545180,"Чует кошка,чьё мясо съела!",1691803859,352286132
1545180,Пистаболы дешёвые!,1691808892,404807751
1545180,Одни кругом враги России,1691823304,739732883
1545180,"Если на мосбирже до сих пор работают американцы, англичане, то, что ожидать. Мошейничают на мосбирже.",1691823548,392307665
1545180,"Есть подозрения, что этот фактор называется набиулина-силуанов.",1691825305,178644638
1545180,"Надо помнить, что в 90-х годах, подлецы, через продажных пропагандистов, требовали всеми силами поддерживать национальную валюту. Итог известен - пустой бюджет, дефолт и залоговые аукционы, где бывший советский партхозактив растащил последнее, оставшееся от приватизации.",1691826169,449342600
1545180,Он и думает так же.,1691847928,203070839
1545180,Менять бы всех надо но кто этим  займётся?,1691848257,404903122
1545180,Набиулина - сука,1691882550,813589023
1545180,Заврались,1691909635,18361031
1545180,"Главную причину назвать бздит, потому и выглядит дураком. Они же соскочить не могут теперь, как в мафии. Набиуллина с Силуановым пытались смыться в феврале 2022 года, дык начальник не отпустил! Вот и сидят как избитые за ларьком...",1691918272,40643017
1545180,Предательство в Минфине  не знает границ,1691929981,756155557
1545180,"Язык не поворачивается сказать правду. А правда в том, что львиная доля  экономики России принадлежит иностранцам. 
Они заработанные рубли конвертируют в доллар или в евро.
Это обратная сторона иностранной инвестиции.",1691938303,523134612
1545180,Ух,1691946336,243229776
1545180,Спекулируют в наглую валютой для личного обогащения и вот всё.,1691956008,711794939
1545180,"Спросил бы Мишустин у меня я ему популярно  объяснил бы причину девальвации рубля и инфляции. 
Хотя я думаю что они прекрасно знают причину девальвации рубля и инфляции. Тут  о росте потребления и речи не может быть. 
Эти продажные твари слишком занялись с иностранной инвестицией. 
Красивая слово "" ИНВЕСТИЦИЯ"" это продажа доли в проекте ""экономике"". Западные инвесторы и МВФ не зря настаивают на приватизации и условия МВФ запрет свободные деньги для финансирования собственных проектов кремлём исполняется безукоризненно даже сегодня.",1692044982,523134612
1545180,"За провалы ни кто наказан не будет. 
Будь у меня власть я бы их всех вместе с Путиным сгноил бы Колыме или Магадане.
Собирал бы всех и отправил бы на стройки дорог, ЖД, заводы, фабрики и заставил бы посадить деревья вместо вырубленные тайги.",1692045160,523134612
1545180,Наебенова это главный фактор. Гнать эту пропиндосовскую шалаву с поста главы ЦБ.,1692048943,90527759
1545180,Решение напасть на Украину - один из основных факторов падения рубля,1692066578,709070138
1545180,"Уволить Всех менеджеров ЦБ за обвал рубля и за замороженные сша русские активы!
Можно и кто назначал!",1692106754,794197271
1545180,Гнать в шею живодеров,1692125743,272106889
1543344,И всё равно дешевле чем на родине в России 🇷🇺 😆,1691581327,766508812
1534066,Не хрен разбазаривать,1690676228,718469262
1527565,,1690128312,19086506
1527231,Лук по 70 рублей каеф,1690096638,603822858
1527231,В Екатеринбурге 50 р,1690099409,135333598
1527231,"Кто-то из тех кто даёт такие цифры в магазинах был? Хлеб цена убойная(при рекордных урожая) картошка 50 р, все овощи подорожали, к рыбе не поступить я, а инфляция всего, 0,08. Ну не смешно? Это она у Набиулиной такая",1690102833,144623635
1527231,они в другом мире живут и другие магазины ходят😡,1690103310,261227050
1527231,А … теперь понятно почему ключевую ставку повысили аж на 1 пункт😂😂😂👍,1690104563,294741609
1527231,"Сколько можно брехать? Все ходят в магазины и видят как подняли цены на всё, минимум процентов на 20 а на некоторых продукты на 30 и выше",1690104584,787094848
1527231,Филе куриное в Крыму 438,1690105375,297507911
1527231,"Пиз@ешь , впрочем чему удивляться если  нас там нет, аналоговнет тоже 🤦‍♂️",1690108870,613082708
1527231,Кремлеботы то же наверное верят в эту чушь 🤣,1690109612,570359098
1527231,Про фудбанки в Европе забыли?,1690110065,422415892
1527231,Что? А в магазин за продуктами давно ходили те кто это написал??? 😡,1690165192,36494620
1527231,"Это к тому чтоб пенсию не добавлять  ,вот тварье.долго бумеранг летит на этих тварей.",1690183354,785216433
1523142,Эрдоган идет на восток. Значит его уже с Россией ничего не держит. Кому нужен голый гопник.,1689688202,206730169
1517541,"К ноябрю всё может измениться в лучшую сторону, много поворотов в жизни будет.",1689102379,281121711
1517541,Задолбали пугать,1689105955,251419716
1517541,Самое время другие страны поднимать...,1689106576,40643017
1517541,Карманная гойда,1689106808,234452489
1517541,,1689107686,737003168
1517541,,1689107699,737003168
1517541,"Мы уже год,не зависим от импорта....👍",1689110926,255867932
1517541,И что.!?,1689111894,710977225
1517541,Все идет по плану путина 🤣,1689112099,113829099
1517541,"акуительно,то есть рост цен на товары местного производства ну никак не повлияет и никак не ударит?тока проклятый импорт жизнь портит..",1689116568,34278406
1517541,путин молодец себя обнулил и деньги россиян тоже обнулил.,1689133911,12353081
1517541,,1689134898,784600584
1517541,Омериге скорофсё !!!!,1689135339,597477875
1517541,"Как по 2% в месяц? Набиуллина про 4,5% в год вещает сколько лет! Путин про 2,9% обьявил! Я в коментах про цены написал, так адепты «набиулинские» тапками закидали.",1689138122,391015343
1516049,"Не хватает пенсии, пусть дети помогают, это их долг.",1688927201,429407576
1514736,"Нихера не буде кроме спекуляций. Сейчас денег полно, но предпринимателей погасили так, что они деньги не хотят брать.",1688803776,530147713
1512269,"Инфляция уже 100%.
Тот набор продуктов, что я покупала за 3 тысячи рублей стоит мне теперь 6 тысяч рублей.",1688510042,699086935
1507667,"Ну тут же слова такие специальные: "" в годовом выражении"", ""реальные зарплаты"". Капуста подешевела - реальная зарплата выросла в годовом выражении, что тут непонятного))))",1688046438,174485155
1507667,У депутатов Госдумы растут хорошо,1688059260,164831195
1505899,Россия со временем превратится в пустое пространство.,1687913117,429407576
1505337,Конченые,1687849825,247728592
1505337,"А ничего, что все соседи к полякам затовариваться ездят? Может у них инфляция, но цены почти на всё ниже, чем у соседей",1687850210,796784481
1505337,Вот и орут больше всех.,1687851144,403440154
1505337,"Хотели нас в каменный век загнать, а тут оказывается мы их туда загоняем. Доброго пути вам ляхи.",1687851975,577191877
1505337,"Россия виновата даже в том, что Польша до сих пор существует! Пся кровь!",1687870508,539851518
1498397,Заметное недельное ускорение,1687365858,432895237
1494544,Одновременное повышение МРОТ и налогов - так за чей счет банкет будет?,1686932072,514859817
1494348,😁,1686908003,74930525
1494348,"И чего ноешь, Силуанов? Вон к царю все вопросы! У нас ведь то карантины, то СВО... Какая экономика это выдержит? И какой дурак будет давать в долг ТАКОМУ государству?...",1686908472,40643017
1494348,"Ну да долги на население повесят, от продажи богатств недр в карман.",1686908813,588032896
1494348,Это уже так называется рост экономики в педерации?😂😂😂,1686910014,775934495
1494348,"Господа кровососы, активнее выворачивайте карманы! А да, и личным примером надо стимулировать, господа филателисты.",1686910436,712026513
1494348,Силуанов поживи с Набиулиной на пенсию 18 тысяч а то все ноешь,1686911931,713863773
1494348,Долги опять на людей в виде кучи налогов и без конца растущих цен на всё? Народ будет из своих карманов последнее отдавать?,1686912096,717804154
1494348,Это господин уже просрал бюджетные деньги.,1686912207,173628274
1494348,"Как таких недорослей, недоумков подпускают к финансовой системе, претендующей на симуляцию идентификации СВВПНП на оккупированной территории, они здесь тренируются, у них, здесь треннинг совмещенный с практическим геноцидом, всю банду на полную локализацию..., это не просто не недокомпетенция и полная безграмотность..., это давно, уже перешло в род деятельности осознанного государственного преступления..., полное уничтожение источников СВВПНП, тупое предательство и геноцид населения оккупированной юр. /лицом РФ территории своей не законной и не правомочной деятельности..., но как говорят:""... Солдат спит, служба идет...,"" грабят и убивают и территорию, и население, и экологию территории..., в полный рост..., смотрите, хлопцы, не подавитесь..., и держите штанишки, наготове, снятыми..., спрятаться все равно не удасться..., везде найдут..., всех вам благ, гр-не физ лица Силуановы и весь коллектив, замещающий ""служащих"" ОПГ РФ, вы, не заметили сами, как превратились в животных, вы забыли, что возможно были когда-то людьми, а не физ./лицами, вы взахлеб совершаете преступления даже не замечая этого, для вас это норма вашего животного существования..., всех благ вам, физ./лица юр./лица РФ..., возможно, в следующей жизни, вы, сумеете правильно оценить истину, и настоящие ценности в жизни и принять правильное решение, а не быть просто тривиальными жуликами, мошенниками, бандитами и профессиональными ворами, просто животными..., конечно, вам, тогда интеллект не нужен, от слова совсем, все уже придумано..., но интеллект и хотябы понятия о чувствах, которые должны присутствовать к своему ближнему есть даже у животных..., это забота и ответственность о ближних своих и себе подобных.., не говоря о, просто, чести,  совести, порядочности, сегодня, это как некий очень дорогой, интеллектуальный и, не овеществленный продукт для вашего восприятия, вам, НЕ ДОСТУПНО, ОТ СЛОВА, СОВСЕМ..., всех благ вам не до управляйка РФ, осталось вам НЕ ДОЛГО, ОТ СЛОВА, СОВСЕМ, будет все очень быстро, не успеете, даже, штанишки сдернуть, как в цирке..., население, уже, почти вымерло, кто же на, вас, таких хитроумных и сверхинтеллектуалов будет работать..., многие задачи, не доступны, даже, сверхумным биороботам, физлицам, прочим самообучающимся, интеллектуальным дронам, похожих на силуановых, наибулиных, шойгу, красновых, голиковых, мантуровых, чубайсовых, чемезовых, миллеровых, сечиных, нарышкиных, почти, князей, лордов и прочих, бортниковых, горбачевых, ельциных, путиных, медведевы- мендели, игнатьевых, примаковых, колокольцевых, гайдаровых, яровых, и прочих атрибутики управляйки, НЕ СУЩЕСТВУЮЩЕГО ЮР./ЛИЦА РФ..., УДАЧИ ВАМ, ОНА ВАМ, ПОНАДОБИТСЯ, ОЧЕНЬ СКОРО, И ДОЖИТЬ ВАМ ДО ТОГО ДНЯ КОГДА В ИСТОРИИ ГОС-ВА РОССИЙСКОГО, ИМПЕРИИ, И ПЕРВОГО СОЦИАЛИСТИЧЕСКОГО ГОС-ВА СССР, КОТОРОЕ ВАМ НЕ УДАЛОСЬ ТАКИ УНИЧТОЖИТЬ, ВАС БУДУТ ИДЕНТИФИЦИРОВАТЬ КАК ГЕНЕТИЧЕСКИЙ МУСОР..., НЕИНТЕЛЛЕКТУАЛЬНЫХ НЕУДАЧНИКОВ, СЛУЧАЙНЫХ И НЕ СЛУЧАЙНЫХ, НЕ ПО КОМПЕТЕНЦИИ ОКАЗАВШИХСЯ В ЭТОЙ СИСТЕМЕ ОТСЧЕТА, С ИСПУГУ...., И ТАК ЖЕ, ВАС, К ВАШЕМУ, ВОЗМОЖНОМУ УДИВЛЕНИЮ БУДУТ ИДЕНТИФИЦИРОВАТЬ ВСЕ ВАШИ ПОСЛЕДЫШИ...., УСПЕЙТЕ, ПРАВИЛЬНО СОРИЕНТИРОВАТЬСЯ В ЭТОЙ ЖИЗНИ, СЛЕДУЮЩЕЙ, УЖЕ НЕ БУДЕТ ДЛЯ ВАШЕЙ ГЕНЕТИЧЕСКОЙ ЦЕПОЧКИ..., ЕЩЕ РАЗ, ВСЕХ ВАМ БЛАГ, КОТОРЫХ, ВАМ, ЕЩЕ НЕ ХВАТАЕТ...., в прошлой жизни..., ДЕД...",1686913394,358632105
