post_id,text,comment_time,from_id
7593721,"Мир делится перед решающей битвой на силы зла и добра. На западную натовскую расползающуюся гнилую плесень. 
 И на свободные независимые государства и народы, объединяющиеся вместе с Россией, с нашим народом, с нашим Верховным Главнокомандующим В.В.Путиным, против этой оси зла и лжи.",1675834441,465763207
7593721,Разогнать поганой метлой это НАТО.... И будет мир во всём мире...,1675835186,495180393
7593721,Слава России.,1675835503,781277391
7593721,"Мощная речь мощного лидера! Всю эту чушню читал в детстве в брошюре ""Акулы капитализма""...",1675835638,297366786
7593721,Ну наконец-то сказал открытым текстом кто и с кем воюет.,1675835769,29945022
7593721,,1675836143,757715730
7593721,И кто его из больницы выпустил.....,1675836779,710201419
7593721,"Интересно, какой мир он имеет ввиду? Это вот этот вот?!)))🤣🤣🤣🤣🤣",1675837135,779538429
7593721,,1675838276,193545066
7593721,🤦‍♂️ полный бред.,1675838512,711898628
7593721,Я не вижу в СМИ информации о странах из западного блока кто сейчас оказывает помощь пострадавшим от землетрясения? Идут вагоны с гуманитаркой? Едут спасатели с современным оборудованием? Какие именно страны?,1675839312,261694319
7593721,"Храни Бог Россию матушка от нечисти западной,от страны терроризма США...!",1675840336,572692856
7593721,"Ага,сплотили они страны НАТО... Развели на оружие и обеспечили заказами свой ВПК,вот и все сплочение. Врёт и не краснеет дедуля.",1675841213,178186569
7593721,"Его ежегодное послание, с каждым разом напоминает бред сумасшедшего",1675843489,721016796
7593721,"испытание для мира? - это точно, а для америки пинздец!",1675843599,190346180
7593721,"США спонсор мирового терроризма, ну не могут они жить без вмешательства в другие страны. Они этим зарабатывают",1675845258,706725319
7593721,А наш мямлит....,1675845948,214586767
7593721,"Штаты настроены, а они спросили у Китая он настроен на работу с ними, или может ему и на фиг не сдалось работать с теми кто всегда делает все для своей выгоды",1675846001,773349841
7593721,Россия выстоит все санкции ЕС.,1675846656,10061343
7593721,"пока Россия выступает за многополярный мир и взаимовыгодное сотрудничество, США кричат о конкуренции и пытаются угнаться за лидерством, чтоб всех себе подчинить.",1675849768,779980282
7593721,"Байден уже напрямую говорит, что НАТО воюют с Россией, хотя столько раз на этот вопрос всё отрицали.",1675850419,720846319
7593721,Россия большая страна и может дать отпор в случае угрозы от США такой степени что США как страны не будет на карте мира. Почему они не думают о последствиях? Все видят что Запад агрессивен... И никак не реагируют кроме России и Китая,1675850650,780818837
7593721,"Мне кажется, что США много на себя берет. Хотят управлять всем миром, но ничего не получится. Россия показало место запада",1675851376,780022333
7593721,"Забавно, ведь мы НАТО , ЕС или США не объявляли войны , а США против нас создало коалицию...и это слова президента США: США противостоит России",1675852500,779687128
7593721,"""Высокие отношения"" предлагают Китаю ради продвижения интересов США.",1675852766,711252510
7593721,"Блок НАТО во главе с США создавался именно для того, чтобы подавлять СССР, а теперь Россию. Только сейчас Россия хорошо подготовилась к любым нападкам и санкциям, победить нас не получится",1675854413,780788884
7593721,"Байден - это олицетворение слабой США, на сколько США хватается за соломинки как Байден за жизнь - подталкивая остальные страны в бездну за собой - выкачивает оружие, не останавливает печатную машинку с деньгами, порождая инфляцию, разрушение доллара как стабильной валюты",1675854862,780806244
7593721,байден и америка в целом этот конфликт развили,1675855210,779639652
7593721,"Украина даже не состоит в НАТО, так что они не должны были вообще никак вмешиваться и воевать с Россией.",1675855302,775436702
7593721,"США главный террорист, который приносит разруху и зло в наш мир",1675859861,775450455
7593721,"США творит хаос по всему миру, это и есть корень всего зла",1675864416,775505340
7593721,США готовы уже на все что бы показать какие значимые,1675865830,773612035
7593721,"НАТО вообще не должно касаться РФ) а уж тем более сво на Украине) вы сами там задумали. но ваши задумки пошли не по плану,это ваши проблемы!",1675871124,774061608
7593721,"США могут сколько угодно обвинять Россию во всех грехах, но напрасно! Правда ясна всем и давно!",1675873328,776161718
7593721,,1675917536,215401163
7593721,,1675917549,215401163
7593721,"Политические силы США только поддерживают терроризм в Украине, поставляя им оружие, точнее продавая, и зарабатывая на этом миллиарды, а кто потом будет выплачивать в Украине, никто не думает",1675926721,780788674
7593721,"Демократией и не пахнет, Америка сама управляет всеми странами Европы, сначала ужесточает им жизнь, а потом просит переехать предприятиям на их территории, ибо так дешевле, дешевле Америке))",1675928744,777860871
7593721,"сколько можно обвинять Россию, чего США не признают того, что они помогают украине, и что они воюют с Россией",1675928918,779562514
7593721,"Америка слишком подлая страна, чтобы она делала всё без возврата какого-то, скорее всего Польше отдадут некоторые области Украины) ничего просто так не бывает, да и ПОльские политики недавно заявляли так же",1675930484,780732411
7573325,Очень хорошо)),1675260316,760571761
7573325,Они в 21 веке живут,1675260640,292763736
7573325,"Сунак довел народ, потому что он марионетка США и ему плевать на простых англичан",1675260711,719464363
7573325,"у Лондона есть время только на решение украинских проблем, а что там с мирными гражданами в их стране не интересует никого",1675261025,696418783
7573325,"Что тут непонятно пошумят, пошумят и затихнут. Не в первой у них, до революции и смена режима у них не доходит.",1675261082,303801745
7573325,И это только начало.,1675261376,549170623
7573325,"У бритов нет ни войны , ни единой санкции, отчего у них рост цен?!😀 Они все богатые, зарплаты в 10000 раз больше наших, куда ещё повышать?!😁Зажрались в конец, просто выгуливают свои сытые тельца😂",1675261461,188852098
7573325,А что же случилос!!!)))),1675261627,690123080
7573325,"ОРУЖИЕ, им нужно оружие! 
И печеньки",1675261824,264690161
7573325,Долой власть Риши Сунака!!!,1675261933,264690161
7573325,Это все нормально?,1675262233,165434712
7573325,"Что то они фестивалят, фестивалят и ничо не меняется",1675262376,580653958
7573325,"Класс, я думаю пора и поговорить с властью.Куда уходят деньги налогоплатильщиков и почему. Пусть только не останавливаются.",1675262440,446856291
7573325,"Пусть Сунак собирает свой чемодан, так как его как и Джонсона выпрут из кресла прьемер-министра, ведь он не решает проблемы англичан",1675262946,712704284
7573325,че нам лондон..вон в россии все дорожает,1675264915,590179852
7573325,"и вот такие проблемы у них начались после санкций, которые вводил Джонсон против России)) а в итоге пострадали сами англичане",1675265810,709784977
7573325,"Политики экономят бюджеты, для того чтобы спонсировать конфликт на Украине, но забыли про внутренние проблемы! Это ещё не конец, будет ещё хуже... Хэппи энда не будет в ЕВРОПЕ... Еще лет 10-15...",1675266871,599688806
7573325,"Л - лицемерие. Пишут про забастовки в Лондоне, мол смотрите, как там у них вновь плохо. Но сами прекрасно знают, что в России люди уже давно лишены прав на забастовки и митинги.",1675266943,1625790
7573325,"Там такие НАЛОГИ!!! Мама не горюй
У рядовых обывателей свободных денег нет Поэтому  всё подсчитано и поднятие цен на 5-10% рушит всю английскую идиллию",1675267965,552147209
7573325,"До чего они довели людей, что им приходится на улицах своии права отстаивать",1675271904,634785987
7573325,"пускай власти знают, что народ не согласен с их политикой",1675272216,634783959
7573325,К чëрту лондон,1675273568,582061291
7573325,"Знаю, что на западе, в том числе в Великобритании мнение обычных граждан сильно разниться с мнением политиков, которые у власти. Обычный народ живет своей жизнью, политики своей. Уверен, что мало кто среди обычного народа на западе поддерживает санкции, введенные относительно России или моей страны - Беларуси. Политики проводят политику, которые им диктуют определенные бизнес-элиты, которые привели их к власти.",1675277857,594066436
7573325,"Нас""Рать""",1675281624,345956056
7573325,Не удивительно. Потому что Западные страны максимально довели себя своими санкциями. Там люди выбирают между едой и бензином,1675283791,707128496
7573325,Нет дела до них.,1675334398,62312258
7573325,может они  радушно приглашают Путю в Гаагу ?!,1675342005,720165515
7573325,В Англии каждую зиму в своих жилищах умирают от холода по нескольку тысяч человек. В основном старики. Для них это давно уже норма жизни.,1675358403,392310777
7572007,Вот она забота государства о своем народе. Кому они сделали хуже санкциями? Только себе.,1675236189,100479611
7572007,"У нас бы тоже вышли, если бы не были так запуганы. 
Свободная страна, свобода слова ну и тд",1675236227,243019733
7572007,"Ничего ничего, мыж жили с каждым годом нам повышали цены ради спасения Европы.. пусть поживут как мы, раз их политики без мозгов все про.. рали . Когда Европе трубы тянули, а сами жители еще дровами топились, так как дорого Газпрому тянуть своим, а европе по морю - дешево за наш счет.",1675236342,17705866
7572007,Сунак в очереди на вылет. А потом и прекращение монархии,1675236976,339652864
7572007,"Блин Навального то нет, кто б у нас собрал народ на митинги против антироссийских санкций))
К посольствам стран которые ввели санкции с требованиями, -снимите санкции! Вашему народу живётся всё хуже и хуже.
Эх не поддерживает наш народ европейцев, одни бедняжки)",1675237019,155994264
7572007,У нас хуже просто запуганы все .,1675238244,246239138
7572007,"Надо ещё десяток лярдов Зелепупкину перечислить, чтобы британцы хорошо жили! Это ведь именно так работает, да?",1675238348,156253974
7572007,"Попездят и разойдутся , дальше работать",1675238384,747409157
7572007,Почти в любой стране мира... Властям наплевать на свой народ.. они играют в свои игры...,1675238440,603294620
7572007,Был бы толк ещё от этих забостовок 🤦‍♀️,1675239013,10621988
7572007,Какая инфляция? Рекордная? Сотни лет в Европе модно бастовать и проводить митинги. Это их права и культура. Тут нет ничего особенного,1675239397,191836743
7572007,Кстати любопытный факт . Медсестра начального уровня в Англии на годовую зарплату может позволить себе 2 новых автомобиля . Вопрос сколько лет надо нашей медсестре чтоб купить новенький автомобиль ? Года 3 ???,1675239500,246239138
7572007,"В британии,как и по всей европе,дела совсем плохи,чую скоро начнётся там волна расколов конкретных",1675240227,720876544
7572007,"Так европейским политикам пора начать своими странами заниматься, а не чужими!",1675240292,696457881
7572007,"Ну вот и пошли протесты в Великобритании, то то же не делать ничего в своей стране и совать свой нос в Украину",1675240569,720135774
7572007,"Жить в стране становится все дороже из-за антироссийских санкций.
🤣🤣🤣
Интересно чем же россия снабжала медицину Великобритании ?
Забастовки в Европе проходят ежегодно практически во всех странах и по всем направлениям отраслей. Они имеют на это право , они же не в россии.",1675241246,73758222
7572007,вот и им их санкции несчастные а они все больше и больше их на нас кидают не поняли еще что они работают больше на их же граждан,1675242001,777088814
7572007,Вот все бастуют. Одна наша страна молчит. Все хорошо видать у нас.....,1675242735,537185446
7572007,А что у них медикаментов то не хватает они что их у нас что ли закупали,1675245806,678829855
7572007,"Зато в России все хорошо, никаких недовольных и протестующих, потому что за это статья",1675249713,19219310
7572007,Это их проблемы!,1675250951,298569771
7572007,"Вот пошла российская санция,крепитесь Не Дружественные страны🥱",1675256188,196571975
7572007,"Своими же решениями Великобритания ухудшила состояние своей экономики, а также доверие и отношение граждан. Зато в России замечен хороший рост экономике, а также развитие и наращивание объемов производства. Например только в одной Москве замечен рост объемов производства на целых 9 процентов! https://www.mos.ru/news/item/118712073/",1675260837,708715245
7572007,"Чему тут радоваться,чем больше безработных и голодных .тем больше наемников на Украине",1675336221,578496608
7560376,Да норм. Зато на оружие для наркомана зеленского есть.,1674885944,360680405
7560376,"Пистеж, оне там овсянку наяривают!",1674886110,406568004
7560376,"Европа сама себя добивает санкциями по требованию США, а потом снова обвинять во всем нас?",1674886151,720902617
7560376,🤣главное что у нас на пенсию и МРОТ можно разгуляться... Целых 250 $... Из них 100$ за ЖКХ... Ешь не хочу...,1674886174,9379088
7560376,"Хватит жрать, бритые..",1674886260,768440920
7560376,Печально. Лайк не ставлю. Люди страдают и там. А в России люди не злорадные.,1674886307,58008922
7560376,А у нас не так ? За небольшую квартиру 7-10 тысяч.  Ладно если ты работаешь.  А пенсионеры как ? Топливо для машины в месяц около 7-8 тысяч в месяц в стране богатой ресурсами . При этом экспортная цена для Индии и Китая ниже чем для внутреннего потребителя .  В магазин за продуктами чтоб набить пару пакетов 5-7 тысяч.  И это не хорошие продукты а обычные . Йогурты 300-400 граммов  стоит под 100 рублей.  И этот список можно пополнять.,1674886447,246239138
7560376,"Хорошо,  что у нас люди с зп 15000 рублей досыта детей кормят)))))
Когда уже начнут говорить о проблемах в нашей стране?",1674886541,83877893
7560376,У них наступили 90-е,1674887037,531465602
7560376,В России половину детских пособий отдаём за ЖКХ,1674887220,436362966
7560376,А в России все могут купить себе еду и содержать семью??? На 15 тысяч зарплаты?,1674887564,2650884
7560376,"А у нас всё лучше и лучше, поможем бедной европе.",1674887567,166883816
7560376,За то у нас с излишками пропагандонов🤣в каждой группе по десятку...🤣,1674887814,9379088
7560376,Девочки и мальчики не надо обольщаться Зарубежная пресса печатает всё эти рассказы не из жалости к своим гражданам а для НЕНАВИСТИ Чтобы было больше и больше желающих повоевать Отличная англо-американская идея (саксы здесь ни при чем) Кормить этих дураков у себя не надо и закопают в чужую землю без проблем Уже 500 лет живут по этим принципам,1674887898,552147209
7560376,А у нас что по другому🤬🤬🤬🤬🤬🤬🤬🤬🤬🤬,1674887942,707831671
7560376,"Бедные британцы. 
. 👎👎👎",1674887958,148953979
7560376,"Ничего страшного,мы в Узбекистане всегда так жили и живём,и ничего...если не считать что многие мигрируют за границу...🤣",1674888093,710930299
7560376,"Как так то? Это в "" процветающей"" Европе? А что ,кто то против них санкции ввел?😂😂😂",1674888093,123602523
7560376,"Ой,блин, смотрите,не опухните там от макарон...голодальцы...",1674888210,713357453
7560376,"Правильно все выше пишут...пенсию добавили на 400 руб....а все на сто процентов подорожало ..и наши производители моющее,,гель для стирки такую херню делают...как вода..как впрочем и продукты.наживались на народе ,а теперь вдвойне наживаются.В магазин зашла в """"Победу """"самый дешёвый..бабушки стоят в гнилье копаются .морковь по 20 рублей пришла в продажу...которую выкинуть надо..,и какое мне дело как там заграницей..",1674888218,587633966
7560376,Главное таааам на западе все плохо и замерзают и голодают а россияне на 10000₽ пенсии хватает на все отлично в чужих глаз соринку замечаем а в своём бревно не видим мдаааа уж ! Лучше бы за своей страной следили бы идиоты!,1674888366,132682268
7560376,"О! в Англии , становиться, как в России.",1674890144,427226670
7560376,"Многие говорят, что на себя надо обратить внимание, согласен, не поспоришь. Но, так же надо говорить, что кто затеял всю эту кутерьму, у них тоже проблемы, причем не маленькие.Богато жили за наш счет, посмотрим как без нас им жить придётся. Люди там выходят на демонстрации, их жестко прессуют, разгоняют, не довольство растет. Так что где хорошо а где плохо, надо еще посмотреть.",1674890466,749452989
