post_id,text,comment_time,from_id
8562360,"они в госдуме яйца не едят, они там икру ложками жр....................................................",1703503711,89697165
8562360,"Опять значит граждане виноваты,а не сговор производителей🤣",1703504385,551021258
8562360,а перепелиные по чём нынче ?!,1703504543,294398471
8562360,а откуда такой спрос?),1703504677,596978933
8562360,Берём десяток яиц раз в неделю... Некогда цена на них не парила,1703504792,817446473
8562360,"Прежде чем выдвигать такие заявления - следовпло бы привести факты, на сколько и в каких регионах вырос спрос. Сейчас слова Набиулиной выглядят обычной болтовнёй, которой у нас обычно спамят чиновники.

А самое главное, Набиулина не сказала, что когда возросший спрос спадет (если он вообще был, и был ли соразмерен росту цен) - цены на яйца останутся на текущем уровне, т.е. десяток по 150 это уже константа.",1703504832,25737951
8562360,"Сказал же Путин, что «кто-то» решил денег срубить, подняв цены, тем самым снизив спрос.  Импорт не окрыли при этом, чтоб бабла поднять. Вот и вся причина. А спрос увеличился, так как у народа с деньгами туго, мясо дорого брать, а есть надо.",1703504842,445407984
8562360,"Очень жаль, что многим приходиться объяснять такие элементарные вещи как - спрос рождает предложение и рост цен…. Экономика 8 класс",1703504955,-50560057
8562360,,1703505129,206048
8562360,"Так это понятно, что яйца САМИ подорожали. Госдума, депутаты.... Не причём...
А где руководители... 👀
😂😂😂😂Ппц... Как классно
И прекрасные певцы лолиты, пугачихи, иевлевы, меладзееее без голосые сами вышли петь и танцевать... Жесть, как примитивно",1703505183,355559740
8562360,"Инфляция создается исскуственно, некоторым невыгодно чтобы люди сами себя обеспечивали. По принимаемым законам инфляции конца не видать... Россия на ноги встаёт, не хочет жить в зависимости от других стран. А тут инфляция... Кто и как",1703505571,821232244
8562360,"Это НАДО ЖЕ, ВСЁ ПРАВИТЕЛЬСТВО И КРЕМЛЬ, ТУЖИЛОСЬ, ТУЖИЛОСЬ, ОБЕЩАЛИ, ОБЕЩАЛИ,И ВСЁ РАВНО ОБОСРАЛИСЬ !!!",1703506287,811486836
8562360,Бред,1703507019,151511085
8562360,Они кстати после болтовни товарища ещё на 10 % выросли,1703507102,246239138
8562360,Коротко! ЦБ объясняет рост цен на яйца! Вывод  - эти люди перестали думать вообще.,1703507623,710834865
8562360,Надо с курятниками по положению военного времени разбираться,1703507631,52841218
8562360,"Мы за бугор по дешевке, а нам по европейским ценам, это они называют рыночные отношения!",1703508055,832081557
8562360,"Не пи#дите, да не пи#димы будете. 🤣🤣🤣",1703508082,610168219
8562360,"Как только где то что то у нас создают искусственный дефицит,так было с гречкой, с сахаром и прочими продуктами питания!",1703508165,832081557
8562360,,1703508171,323064144
8562360,"Странно. Вроде людей больше не стало. Кто ж тогда пересел на яичную диету? Может стоит провести расследование и проверить, сколько отгружено и сколько куплено.",1703509552,267177251
8562360,"А Глава ЦБ не объяснила, по чьему высокому указу в РФ поспешно ликвидируются НАШИ птицефабрики вместе с продукцией...??",1703510578,403374319
8562360,"Не заметно, чтоб спрос повысился - полные полки почти всегда. Перед самым привозом разве что немного пустели. Да и магазинов тьма, где-нибудь да есть.
 Так что скажите честно, что денег захотели срубить.",1703512318,136881073
8562360,,1703512620,637700900
8562360,"Получается что люди стали больше кушать,,,,,,, Это не производители сговорились и подняли цены.Очередная отмазка как и с ценами на ГСМ, которые так и не снизились, а диз. топливо подорожало.",1703513534,136575419
8562360,Интересно!!!! Все вдруг на яйца перешли по её логике?,1703515939,365114571
8562360,"Хозяева птичников говорят, что не сокращали производство яиц! Может дело в жульничестве?",1703516524,470816213
8562360,"Все резко стали жрать яйца десятками, бредятина",1703520099,783528942
8562360,"у неё явно свои куры несутся...!?Сочиняет, предлагает?",1703520724,710233104
8562360,"Пора опять пригонять танки и стрелять в Ду у, другого выхода на них нет! Цены уже бьбт все немыслемые рекорды!",1703522623,33231209
8562360,Эльвира всегда ответ найдет !,1703523763,765540868
8562360,Как сказал Путин - сбои имеют место быть и в этом нет ничего страшного),1703528012,830840029
8562360,"Сыр по 900, кофе по 800, яйца по 150, филе куриное по 500.... Как же много всего набирают россияне-то.... Кстати, вы с версиями определились как то странно. Одна кричит, что народ хватает много, в Кёне Антошка (Губер) кричит, что средняя зарплата сейчас 80000 стала, вот и цены подняли, третьи кричат, что торгаши уроды. И заметьте, что никто не сказал, что плохо антимонопольная служба сработала, что Патрушев, для выполнения плана по курям под нож несушек пустил и то, что комбикорма своего не было....",1703535638,14838357
8562360,"Да, да одновременно. И с этим ни как не связано закрытие птицефабрик по чиновьечему беспределу в прошлом году.",1703538667,424193899
8562360,"Да она снести может яиц столько сама лично,что цена их будет копейка,но некоторым это невыгодно и они мечтают превратиться в будущем в яичницу-размазню...😂😂😂",1703540310,33207259
8562360,,1703540316,33207259
8562360,Бездарная тетка,1703562346,791914657
8562360,"высокий спрос, ""утка""из СМИ. Повод поднять цену на соц, продукты!!!!!",1703564541,700921466
8562360,"Каждый год под Новый год на что-то начинается ажиотаж (то гречка становится золотой, то макароны с подсолнечным маслом и сахаром, а когда-то телевизоры разбирали как ненормальные). Всё мало этим торгашам, а люди ведутся на их мульку",1703568689,41476277
8562360,"Ну наконец то, акции по яйцам побили все рекорды, а я давно говорил, однажды яйца захотят купить абсолютно все, не то что вчера.",1703571802,5643190
8562360,,1703575815,527735446
8562360,с августа цены растут на яйца каждый день. с августа спрос растет?🤣аппетит у куриных олигархов просто вырос..,1703634358,259966851
8558263,"Мне иногла кажется, что европейским политикам нет никакого дела до своих проблем.",1703413900,683624241
8558263,"Может ему о России подумать, а то Европа как будто он там кто-то?",1703414088,750306979
8558263,"Европа выздоравливай , давайте жить дружно всей планетой . 😪",1703414228,246163223
8558263,Заботливый .,1703414308,608299825
8558263,,1703414450,735590922
8558263,Господин Медведев ты бы лучше рассказал почему все мобилизованные не дома?! вы же набрали уже больше чем 500000 тысяч на контракт и добровольцев. Так же ответь почему твоё золото не на СВО. Слышь?,1703414667,477861864
8558263,Амеркианцы своего добились. Избавились от конкурента в лице Европы ее же руками,1703415316,681514575
8558263,"Что интересно ответ Европа на поздравления ,и  приветствия  от Дмитрия Медведева.",1703415735,212782664
8558263,,1703416337,265025051
8558263,"Злорадство, это так по православному.",1703417262,805918766
8558263,Ну зачем он так🤣,1703417770,824997759
8558263,"Почему Димону можно в сети Х тереться, а остальным нет?))",1703420293,698329710
8558263,"Европа продала свой суверенитет американцам и поэтому страдает сейчас максимально, ей тупо не дают развиваться.",1703423859,674514352
8558263,Почему наши политики думают о Европе. А не о россии,1703425190,700092927
8558263,"Отберите уже у товарища бинокль. Пусть посмотрит, что в своей стране происходит. Инфляция так то и у нас только обороты набирает.",1703425442,14838357
8558263,Протрезвел малость что-ли 😂,1703429089,829435470
8558263,"🧌🇷🇺🌏👎как может человек политик ,находящийся во власти РФ..высказывать публично такие  глупые  речи в адрес запада ?👎, какая Разница господину м е д в е д е в у ?",1703432944,707631379
8558263,"Друзья, рада представить вам кандидата в президенты РФ. Мой старый кроссовок! Голосуйте за него!",1703438759,644682127
8558263,Ну у нас тоже мигранты не хидые пособия получают. Под носом не видно!,1703438958,787570940
8558263,"Нечего было санкции вводить и вписывать за укронациков, так бы Европа жила благополучно",1703444944,732520538
8558263,"Хорошо в России без отходов , не кому шататься 😏, всех уложили , экономика прет со всех щелей , по трупам пошли и заповедям , не говоря о понятиях и законах , это о возрастном и все , что связанно с возрастом .",1703445548,708867738
8558263,"Я вообще не чего не получаю , это о России и о людях которых вы всего лишили , а в основе смысл .",1703446012,708867738
8558263,"Вот вам и бла и бла и все понятия и темы , вы хоть за базаром , действиями и поступками мужики следите , не говоря о законах и заповедях предков наших .",1703446097,708867738
8558263,"Предавший раз , предаст и дважды .",1703447639,708867738
8558263,,1703447660,708867738
8558263,"Ну у нас то инфляции то совсем нет. Только машины подорожали в четыре раза, яйцо в три, проезд в два, мясо в полтора, коммуналка почти в два, ну и ещё по мелочи. Ах да, пенсию подняли на шестьсот пятьдесят рублей, и зарплаты на тысячу.",1703455869,741611199
8558263,"украинцы только рады происходящему, и на украине оставаться не пришлось, и деньги от других получают",1703466874,838412327
8558263,"Везде боты , украинские цепсошники.. Тошнит от негатива..",1703485806,569543890
8558263,Многодетные? Беременные? В декрете? Спасибо.,1703490032,370726554
8558263,Европа-логово сатаны,1703499006,399553757
8550675,Класс!👍👍👍👍,1703170216,218445700
8550675,"Куда деньги девать будем😳 не треснуть бы, от жиру😎🤣",1703170273,608394546
8550675,"Ага и поднимут ЖКХ на 10 процев в первые 3-4 месяца 24 года, ну чтобы жизнь медом не казалась 😂",1703170459,829435470
8550675,"Только в России! Средний размер пенсии в РФ, по сравнению с 2013 годом, вырос с 10038 руб. до 19322 руб. то есть с 304 до 212 долларов США...",1703170958,403374319
8550675,,1703171508,177592808
8550675,,1703173126,790624803
8550675,"С ума сойти! Пенсионеры, готовьте огромные мешки для своих ""огромных"" пенсий, а то не унесете!",1703174331,811257550
8550675,https://vk.com/wall-138140232_1168134,1703174586,105493874
8550675,И цены вместе с ними😂,1703174855,180533067
8550675,"Не знаю вот правда или нет , вчера прочитала , что депутату Госдумы 5 тысяч рублей  в день на харчевание выделяют🤔",1703178944,318957152
8550675,Верните пенсионный возраст 55/60. Уже скоро пенсии получать некому будет.,1703185993,547917294
8550675,С каждым годом пенсионер всё беднее и беднее.,1703190025,326823443
8550675,"Вместо жалоб на недостаточные пенсии и недостаточные зарплаты, лучше попытайтесь вытребовать у Президента РФ второй, недависимый от зарплаты, источник дохода своими письменными волеизъявлениями от каждого лично, но саморганизационно и ""самосвободно"", как недавно помянула М.Симоньян, отбольшинства Ваших сограждан: «Я, как гражданин РФ, обладающий конституционным статусом носителя суверенитета РФ и верховенства непосредственной власти в РФ, приказываю (требую, предлагаю, ...) Вам, господин Президент РФ, как должностному лицу РФ, подчинённому волеизъявлению большинства граждан РФ, выраженному их письменными волеизъявлениями, в строгом соответствии со статьями 3 и 33 Конституции РФ и ФЗ № 59, поручить разработать законопроект о бесплатной приватизации в равных долях всем гражданам РФ и всем последующим со дня их рождения всех природных ресурсов РФ без права купли-продажи, наследования и дарения и с автоматической передачей всех этих приватизированных долей природных ресурсов, ставших частной собственностью граждан РФ, в аренду государству РФ для продолжения профессионального использования и распоряжения всеми этими природными ресурсами самой РФ, но за ежегодную арендную плату из расходной части бюджета РФ всем гражданам РФ, в рамках закона о Природной Ренте и её производной: прижизненном капитале, накапливаемом ежегодными арендными платами. Далее инициировать процедуру рассмотрения законопроекта в ГД РФ. Прижизненный капитал расходовать гражданам РФ строго безналично на социально важные цели, устанавливаемые государством РФ и одобренные непосредственной властью большинства граждан РФ, варьируя эти социальные цели, исходя из стратегии развития РФ, ситуационной конъюнктуры, возрастов граждан РФ и блокированием от расходов пропорционально накапливающуюся страховую неприкасаемую долю прижизненного капитала на нетрудоспособный возраст граждан РФ, устанавливаемый ими по заявительному принципу после 55 или после 60 лет, в любом превышающем возрасте». 
В два адреса: Президенту РФ, 103132, Москва, ул.Ильинка 23, или www. Kremlin.ru, и Председателю Правительства РФ 103274, Россия, Москва, Краснопресненская наб., д. 2, или www.pravitelstvo.gov.ru 
 
vk.com/noosnsk",1703217357,85243727
8550675,"Разве это РОСТ наших ПЕНСИЙ на копейки? 2 - 5%. Если рост только на ЖКХ и цен в магазинах, составляют десятки и сотни рублей!!! В результате этого якобы *РОСТА* наших пенсий МЫ ещё должны государству. Где же это *ПОВЫШЕНИЕ* ЖИЗНЕННОГО УРОВНЯ пенсионеров?",1703226756,103358230
8529888,"Очевидное незнание проблем, доставки пассажиров РЖД на ЮГ, на курорты России.",1702552443,836704865
8529888,,1702552466,752315291
8529888,"Дороги стали в разы лучше, но почему то раньше Пермь-Екб я доезжал за 4-5 часов сейчас 6-7, феномен😞",1702554605,9666156
8529371,а цены выросли уже на 100% а на яйца на 200%,1702546385,613334039
8529371,"В принципе зп и так стабильно растет, поэтому нет сомнений, что и дальше будет рост",1702546504,719853558
8529371,Прошу повысить зарплату дворникам!,1702546648,644682127
8529371,Боты вперёд,1702546659,180533067
8529371,"Пока нам запад обещал пустые полки и хлеб с водой, мы повышаем МРОТ на 18% 🔥",1702546748,719853558
8529371,Выросла. Но не в России🤡,1702546977,828819242
8529371,"В Лугамаше зарплату только резать умеют. Кому там повысят зарплату, полиции и депутатам?",1702547172,226515392
8529371,А цены уже повысились на 100%,1702547444,822070410
8529371,Интересно,1702547529,-109339318
8529371,"Обычная математика: средняя зарплата по стране вырастет на 8%, средняя годовая инфляция 7.4%, ставка Центробанка сейчас 15%(ср. За год около 10%).",1702547733,53773195
8529371,😂😂😂,1702548299,159750115
8529371,Опять лапшу вешает😄,1702548473,393312725
8529371,Доширак. Россия это москва,1702548785,700092927
8529371,"Вова поживи на минималку ,что ж ты за человек то такой ,за что ты ненавидишь Россиян",1702548821,807239352
8529371,"У большинства зарплата будет меньше 8%, даже без вычета инфляции. А вот у чиновников и депутатов больше 8%!",1702549001,722045919
8529371,Что то он фигню сморозил.,1702550162,246239138
8529371,"Такого вообще никогда ещё не было в истории России! 
🤣🤣🤣🤣
Он навязывает свое мнение о том как мы хорошо живём! 
Я уже не могу с вас!",1702550428,800446966
8529371,"-инфляция, -ндфп,-рост цен и тарифов,....одни минусы.....",1702551544,305380808
8529371,"Главное, чем манит система, — чувство безопасности, рождаемое принадлежностью. Снаружи воняет серой, еда дрянная, экономика в удручающем состоянии, цинизм не знает границ, но внутри — КЛАССОВЫЙ ВРАГ РАЗГРОМЛЕН.",1702552316,735324211
8529371,"Кто-то ест капусту, кто-то мясо, а в среднем по стране все едят голубцы 🤦‍♂️",1702552630,11279184
8529371,,1702554044,773634000
8529371,"3,14здабол, спустись на землю, прогуляйся по городам и деревням,  чтоб знать как люди обычные живут.",1702555769,171820611
8529371,"Зарплаты в России реально растут и приятно видеть, что МРОТ успешно повышается",1702556231,697272540
8529371,"Что я сразу заметил, так это то, что Путин принес документы с реальными цифрами, по которым можно увидеть значительный рост экономики: ВВП, промышленности. Радует, что уровень прочности нашей экономики достаточен для того, чтобы не только жить, но и развиваться)",1702556279,730824569
8529371,"Реальная зп выросла и МРОТ аж на 18% повысился, а это на все соцвыплаты позитивно повлияет",1702556456,697139468
8529371,"отлично, что зп растут, радует",1702557205,820089567
8529371,"это хорошо, что она вырастет, все таки важно, что в этом плане люди держат руку на пульсе",1702565511,730834752
8529371,А цены на 100% в чем гордость непонятно,1702568088,26228145
8529371,Главная проблема а России - это отсутствие полного государственного суверенитета!,1702571682,530179822
