post_id,text,comment_time,from_id
8280323,"А как думает госпожа Набиуллина очередное повышение ключевой ставки разве не ведет к увеличению цен на продукты, на товары и на всё остальное???Незнаю как у кого с момента повышения ключевой ставки с июля по сентябрь у нас в Норильске например бензин стоил 53,60 а сейчас 64 рубля . А цены на продукты так же за этот период идут только вверх. Или я неправ и действия ЦБ не ведет к росту цен???И это только совпадение.Кто  , что думает по этому поводу, много ли здесь тех кто поддерживает повышение ключевой ставки из простого народа????",1694793756,449767280
8280323,Первый предатель в стране,1694796826,145616551
8280323,А как сахипзадовна пишется? Как слышится?,1694803630,445298258
8280323,Когда её уже арестуют?,1694805255,58361626
8280323,"Чем сильнее работает печатный станок, чем быстрее растет денежная масса, тем выше рост инфляции... Появление новых территорий и СВО требуют больших средств... а значит печатный станок должен работать с ускорением... отсюда и обвал рубля ... и рост инфляции... всё просто...",1694840233,8769015
8280323,"Вопрос: что в её понимании есть ""финансовая стабильность""?",1694886504,121630573
8279962,😊 а как же не виданный экономический подъем . Высокая процентная ставка только добивает экономику . Нам нужно импортозамещенни а на это нужно много дешевых кредитов😊,1694774090,246239138
8279962,"Умножайте на 3 сразу,и получите реальную инфляцию🤷‍♂️
Нас продолжают набиуливать🙄",1694774163,551021258
8279962,"Ипанулись совсем

Но.... У нас всё хорошо
См тв",1694774308,22113977
8279962,"Моя Россия

Нет прекраснее на свете,
хоть ты мир весь обыщи,
государства чем Россия! 
Забугорец не взыщи. 

Нет светлее, чище, глубже
чем она - святая Русь. 
В этом я уверен твердо
и своей страной горжусь! 

Тот, кто скажет: ""тут болото"", 
тот, кто жаждет за бугор, 
тот слепой, глухой и глупый, 
он не любит дом родной. 

Мной же Родина любима, 
я живу лишь ей одной, 
берег за морем далёкий
для меня всегда чужой! 

Да, со мною не согласных
много будет из меньшинств, 
только я на мнение этих
болт давно уж положил. 

И еще, давно приметил -
те, кто свято любят Русь, 
те взаимно ей любимы, 
это факт, я в том клянусь. 

Так что помни россиянин:
ХОРОШО ТАМ, ГДЕ МЫ ЕСТЬ, 
а иное трактование
из умов пора стереть!",1694774573,14017569
8279962,"""У нас все стабильно, надежно"", – заявил Владимир Путин на встрече с Александром Лукашенко, говоря о российской экономике.  🤣🤣🤣🤣🤣🤣🤣",1694775031,6733572
8279962,🤢,1694775423,236866174
8279962,,1694778418,695401645
8279962,,1694784574,70628180
8279962,"В 1809 году Майер Амшель Ротшильд произнёс: «Дайте мне право выпускать и контролировать деньги страны, и мне будет совершенно всё равно, кто издает законы». Центральный банк России являющийся сателлитом ФРС США  , повышает ключевые ставки  с целью подрыва экономики, курсы валют в России устанавливает в соответствии фиксингом Ротшильда, вместе с финансово- экономическим блоком ведут экономическую войну против государства Российского, против политики проводимой Государем России В. В. Путиным , направленной на приобретение полного суверенитета ! Сейчас они спасают экономику США от мировой долларовой инфляции, перетягивает  её на экономику России . Для стабильного развития нашей экономики нам не нужны ни доллары ни евро,  они нужны только финансовым спекулянтам. Российский рубль полностью обеспечен ресурсной базой, в отличии от  Американских и Европейских фантиков. Штаты рушаться и, для того  им устоять они должны опять устроить в России 1991 год.",1694793366,760968561
8279962,"Это сейчас на каком языке было? Это для кого? Ключевые ставки, прогноз инфляции... Я ямы копаю, я не понимаю всего этого. Можно проще сказать? У нас жопа или мы на коне?",1694796459,698028165
8279962,"Вчера Леонид Игнатьев долго уверял меня, что бороться с инфляцией необходимо с помощью снижения потребительского спроса. Красавчик. Никто ничего не покупает, а экономика и зарплаты рванут вверх.😶",1694837533,391015343
8276385,"ну вот кстати беспалтно могут учиться, у кого папы ветераны СВО ,это ж хорошо",1694683571,807560199
8276385,"Ха-ха ха, смешно,ну правда,смешно🤣",1694684207,737567792
8276385,"Тем не менее есть кучи льготных мест и возможности себе баллов пропускных заработать ,что уже очень хорошо 
Я уже молчу про плюшки для военных",1694684337,820108480
8276385,"но много кому проще поступить стало, например тем, кто с новых регионов, или тем ,У кого родителои ветераны СВО",1694684352,720907424
8276385,"Повышая стоимость образования,вы убиваете будущую экономику страны🤷‍♂️лучше завозить мигрантов всех уровней,чем учить безплатно своих граждан!",1694684574,551021258
8276385,У нас всё хорошо 🤣,1694684861,753216577
8276385,"Ну давайте не будем кривить душой!!!Это касается только тех кто не может претендовать на бесплатные места в силу того ,что в школе учились так себе,а вышку хочется.Только вот я не понимаю зачем?Если такие «средние» специалисты покупают себе обучение,то какие специалисты опять наводнят наш рынок труда?Вы хотите таких врачей?Учителей?Управленцев?Зааачем???",1694685408,100437351
8276385,"тем не менее, у каждого есть возможность учиться бесплатно, но для этого нужно немного напрячься",1694686990,709814570
8276385,"Да в своё время знания давали, а теперь продают и причём сомнительного качества.",1694687041,806267410
8276385,И улыбаться🤢😡,1694691565,817924873
8276385,"Как до чиновников РФ не Дойдёт!что   , в РФ надо вводить на равне ==высшее образование для всех граждан РФ     как среднее образование. Образование высшее может быть разным  о ч н ы м, заочным, вечерним .. и бесплатным ...",1694700497,707631379
8276385,"""В Пeтpoзaвoдcкe зaдepжaли гpaждaнcкoгo aктивиcтa Никoлaя Дoмнинa. Oн пoчти чac cтoял в oдинoчнoм пикeтe c плaкaтoм «Нe вceм poдитeлям нyжнa бeлaя """"Лaдa"""". Мнoгим нyжны живыe дeти. Нeт вoйнe!» вoзлe aдминиcтpaции гopoдa. 
Тeпepь гpaждaнcкoгo aктивиcтa ждёт cyд, и мyжчинe гpoзит штpaф. 
Пoдoбныx cлyчaeв oчeнь мнoгo. Oчeнь мнoгo. Дa, oни мaлeнькиe, oдинoчныe пикeтики, НO – oни ecть. Этo гoвopит o тoм, чтo нe «вce cплoтилиcь вoкpyг пpeзидeнтa».""",1694759950,459327291
8232521,👏🏻,1693473836,298544756
8232521,Опять наколют наших простофиль.,1693473940,193431539
8232521,Слышь Песков?! Прокомментируй тот факт что одной из матерей в Ростовской области за погибшего сына в зоне СВО вручили орден мужества волонтеры. Это нормально? Слышь меня эй Песков?,1693474930,477861864
8232521,"Думаю, что сейчас Эрдоган приедет к Путину на встречу в сентябре, тогда может что то и будет решено более менее",1693476155,730821671
8232521,"Думай, а не фантазируй",1693476660,817974150
8232521,,1693476844,755472101
8232521,"Сейчас если заводятся разговоры о зерной сделки как минимум требование Российской стороны исоплняется,те же морскими маршрутами не должны пользоваться для провозки вооружение для целостности нашей страны это большую угрозу предоставлят! Поэтому мы будем тормозить их суда",1693477327,701314220
8232521,100 % подпишите,1693477384,17205703
8232521,"Да у нас зерно куда лучше, рано или поздно они на условия сделки по факту пойдут же",1693477590,699951259
8232521,"Сейчас констриктивный диалог с Турцией возможен лишь в том случае, если будут выполнять требование Российской стороны,по тому же морскому маршруты,плюс бандеровцы в страны Африки вообще зерно не поставляет, а все хоязевам свои отправляет",1693478094,730833237
8232521,"Черноморская инициатива будет продлена только после того, когда запад выполнит взятые на себя обязательства перед Россией",1693478502,713567515
8232521,"Мне очень нравится, как наш Владимир Владимирович и его команда ставит в позу Запад по этой самой сделке.",1693478702,699946241
8232521,"Россия проявляет жесткую позицию по сделке. Потому что никакой веры европейцам больше нет, и нам нужны 100% гарантии.",1693481147,721791065
8232521,думаю что рост можно не ждать по ценам. тем более когда так много у нас выплат и не льгот,1693482000,730821930
8232521,"Всё верно,все условия России должны и будут выполнены,а запад считает себя ""умными"",богатыми и прочими,так пусть наводят порядок и кормят свои страны сами,а Россия всегда поможет тем народам и государствам,кто действительно в этом нуждается.Умом Россию не понять,аршином всю не переменить.Россию нужно просто знать,в Россию нужно просто ВЕРИТЬ!.",1693483649,778423926
8232521,Надо в первую очередь думать о себе. Так что слать Эрдогана и весь Запад если не хотят под нас прогибаться,1693484060,527041052
8232521,"Меня всегда удивляли 
тупость и дебилизм западных чинуш.А ведь ещё Маргарет Тетчер  премьер Британии говорила:""Если мы(запад) плюнем в сторону России,она утрется,а если плюнет Россия в нашу сторону- мы захлебнемся"".Не услышали ее слова на западе,а ведь она была права,и сейчас её слова стали для запада пророчеством.Как говорится ,хлебайте ложкой господа,а Россия,была,есть и будет,и не родился ещё тот,кто мог бы ее поставить на колени.",1693485510,778423926
8232521,,1693490030,49661238
8232521,Смените пресс-секретаря на человека с более сочувствующим и озабоченным выражением лица!!!!😡,1693491057,575520729
8232521,"ага счас, бежим и спотыкаемся выполнять условия деда😆от вас уже даже и африканские страны отвернулись, так кка вы нарушили условия зерновой сделки! Из-за вас голодают африканские страны!",1693521206,688283239
8232521,расия вообще не нужна для такой сделки. без нее можно обойтись. так оно и будет 🤠,1693557868,816727749
8227846,"Может, пора снижать цены на жизненно необходимые лекарства?",1693376235,91363507
8227846,"Сегодня цены на лекарства поднялись, но все это конечно временно. Произошло это из-за неопределенности. Сейчас же выяснилось, что Россия обладает своим производством лекарственных препаратов, да и многие зарубежные производители продолжат поставки лекарств в Росии. Так что переживать нечего",1693376789,814470413
8227846,Сходил в аптеку и сдох от голода,1693376792,200514370
8227846,"Пора снижать на все препараты !!! Только этого не будет НИ КОГ ДА !!! Фармация - это золотое дно , Кландайк !!! И медицина тоже !!!!!! А то посетил Псковскую областную больницу ! Куратор ! Проверить своего главврача ! Засланного казачка ! А до Горбольницы почему то не добрался !!! 🤷‍♀️👎👎👎",1693377078,614912979
8227846,"Санкции никак не затронут сферу лекарств, и поэтому дефицита препаратов ждать не приходится. Сейчас просто некоторые проблемы с логистикой при закупке зарубежных препаратов. Как только они разрешаться, то и цены снизятся",1693377537,809564373
8227846,"Враньё,  цена поднялась не менее 30 процентов только в этом году. А с начала СВО в 2 раза в лучшем случае.",1693377978,528858659
8227846,"Такие люди нужны власти , трепят языком и зарплату за это получают .... А на деле,  зайти в аптеку и убедиться в ценах на лекарства  ....🤣 Не, царьки жопу из кабинета не вынимают ...🤣",1693379610,570359098
8227846,"[id809564373|Тоха], Не смешите !!! 🤣🤣🤣 Когда это у нас что то снижалось ??? 📌",1693379741,614912979
8227846,"Ты сам то ,когда был в аптеке ? Цены просто самолёт.",1693381060,568833685
8227846,Когда будут в поликлиниках все в полном объёме врачи ?,1693381882,303516408
8227846,"просто никто не сломал нас своими санкциями , как бы они не пытались)",1693382527,732473888
8227846,Вообще лекарства очень дорогие.,1693386043,137669354
8227846,"Не ну кст в плане лекарств я правда не заметила каких-то прям подорожданий в России, это надо сказать радует",1693386074,701797806
8227846,"Государство следит за повышением цен, а значит и за повышением зарплат и пенсий для граждан.",1693387028,732475447
8227846,"Особенно ""подешевел"" бензин. К примеру АИ - 95 был 49.80, а сейчас 55.00. Как всегда в России две беды. Первая - тупые олухи в министерствах?",1693394049,198585111
8227846,"Смешно, цены стали ниже. Ко перинева 90 шт была около 900 р, теперь  1800.",1693396224,264046554
8227846,У него свои аптеки. Нас в них не пустят,1693396317,264046554
8227846,,1693398301,1767269
8227846,"Опять ложь 🤥 
Ведь мы же понимаем ситуацию, война и всё такое, но врать то зачем",1693401723,708211077
8227846,,1693420221,403374319
8227846,"В России за год на любые лекарственные препараты цены вырастают не единожды! Люди, которые вынуждены постоянно покупать какие то неоходимые лекарства для поддержки здоровья, знают, что цены постоянно растут ( независимо от производителя лекарств).",1693429035,34849496
8227846,"Переживать точно не стоит. Предполагаемого дефицита лекарств, из-за которого все ринулись в аптеки, не будет. В России есть качественные аналоги многих зарубежных лекарств, так что боятся нечего. Скоро цена лекарства пойдет вниз",1693440029,816386768
8227846,"То что сейчас поднялись цены на лекарства не о чем не говорит. У нас рыночная экономика и это вполне нормально. Сейчас цены поднялись из-за того, что некоторые иностранные производители приостановили сотрудничество с Россией, но это не страшно. Уже идет работа по увелчению производства собственных лекарств, а это значит, что цены скоро снизятся",1693440050,814561166
8227846,"Какая разница,  сколько они стоят. Скоро все равно купить их будет не возможно, ибо с 1 сентября большинство привычных нам лекарств без рецепта не купишь. Кто будет выписывать рецепты, если первичное звено в ауте ? При такой нагрузке последние терапевты убегут, и мы все приедем лечиться к вам, господин министр.",1693443266,329545380
8203012,Это лишь слова !!!!,1692717722,139884959
8203012,Боремся! И победим! Ура!!,1692718014,273443889
8203012,При провале рубля на 30% опережения не получится.,1692718068,65464723
8203012,"А остальных оставшихся свыше 4 и 8 десятых миллиона работников, что будет?",1692718090,697424547
8203012,Да у нас солярка подорожала на 18%🤣спасибо,1692718212,462416700
8203012,"Пособи по уходу за ребёнком отменили, теперь только 1,5 МРОТ на Лена семьи получают, остальные свободны! Что то вводят повышаю что то отменяют! Вот и всё🤷‍♂️",1692718456,461561672
8203012,"Мы не собираемся останавливаться, а будем и дальше укреплять страну и делать условия только лучше",1692719116,720128525
8203012,"Это позволит улучшить условия труда, обеспечить достойную оплату и справедливое распределение доходов!",1692719137,762548245
8203012,"Самое смешное это когда маткапитал индексируют.Как только это сделали в феврале,квартиры выросли на 500т.р.",1692719827,764601254
8203012,А пенсии на 4 процента!,1692720037,739212808
8203012,все станут богатыми скоро..скоро,1692720221,590179852
8203012,"Владимирович! Стараемся ,как можем!",1692720669,80052642
8203012,Мне ЗП не повышали более 10 лет. Работаю в детском саду.,1692721658,435516602
8203012,"Я хочу спросить это где рост заработной платы опережает инфляцию опять в Москве и в Питере….???Что то в регионах такого нет , если я не прав люди добрые расскажите на какой процент выросли ваши зарплаты….",1692723097,449767280
8203012,"МРОТ, как то похоже на МРУТ.",1692724040,176173711
8203012,Похоже не много кто из смертных до 01.01.24 доживёт,1692724231,61853294
8203012,🌍👍👍👍📡👑🤝,1692725196,759512717
8203012,"А почему бы нашей верхушке власти НЕ ПОЖИТЬ на этот МРОТ годик - другой, третий? Пожить жизнью простого НАРОДА России? А свои миллионные оклады использовать для передачи этих денег БОЛЬНЫМ ДЕТЯМ, на лечение и приобретение нужным им медикаментам и протезировании!!! Власти ПОКАЖИТЕ ПРИМЕР!!!",1692725313,103358230
8203012,Пенсии тоже проиндексируют?,1692729227,702590708
8203012,"В. В. Да засуньте вы свои инициативы в за@ницу, будет лучше и спокойнее.",1692732972,727896007
8203012,"Жаль, что это не поможет простым людям((",1692749122,772660396
8203012,Только доходы падают и падают.,1692768298,11568988
8203012,,1692773743,555066065
