post_id,text,comment_time,from_id
8012398,"Столько идиотов оказывается безграмотных осталось, я уже думала, что все стали более финансово подкованы и понимают, что это произошло из-за увеличения экспорта в страны, которые в этом году стали активнее на нашем рынке принимать участие, и это все в условиях санкций ☝",1687258966,807576751
8012398,"Вот это цифра! Только больше половины этой суммы распинают олигархи, часть пойдёт на футбол и так далее, потом налоги и на зарплаты штук по 15-30.",1687258982,477861864
8012398,Это из какого фильма про фантастику ?,1687261967,24166157
8012398,"Где же больше то, все компании были в 2022 чуть ли ни в минусе, дивиденды вообще никто не платил, по сравнению с 2021",1687262813,310434638
8012398,"Просто сейчас деньги не воруют точнее меньше воркуют через офшоры, всё обрубили вот и приходится показывать более менее почти «всю» прибыль и о чудо прибыль выросла !",1687263750,765540868
8012398,"Вот это я понимаю, у компаний мотиваци была - надрать зад всем, кто патылася изолировать Россию",1687264117,808402842
8012398,"Интересно,а это планировал запад, когда санкции на нас накладывал?",1687264293,730426772
8012398,"А помните как год назад мамкины рЭволюционеры кричали, что российская экономика катится в яму, доллар будет по 500 и бизнес можно хоронить? А мы с западными санкциями только рекорды ставим)",1687277812,791795424
8012398,"Такими темпами мы реально скоро начнем благодарить запад за санкции и просить еще)) Нам от них лучше, а сам запад на колени встал",1687279551,676434215
8012398,"И это только начало , наша экономика достигнет 2 таких квадраллиона",1687279885,807757126
8012398,Результат беспрецедентной и опаснейшой изоляции России. Санкции нанесли сильный удар))),1687297464,758455935
8012398,"Какие, оказывается, бывают деньги!?...",1687326563,806415621
8004635,"Приветствую вас, хотите попасть в историю на щепетильную тему я даю такую возможность. 
С информацией можно ознакомиться на моей странице, пожалуйста вам…",1686950315,441792690
8004635,Весь мир ржал с этого бункерного карлика😂😂😂,1686961394,717237443
8004635,"Все таки какие бы у нас сейчас трудные времена не были, но наши власти стараютя сделать все, чтобы уж наша экономика точно стояла стойко",1686972975,758445317
8004635,Когда уже я смогу спокойно зайти в магазин и купить на свою пенсию всё что захочу и не буду думать хватит ли у меня денег дотянуть до следующей пенсии,1686975381,730173398
8004635,"Минимум безработных в России за СЧЁТ азиатов - мигрантов!!! А о качестве *работы* этих мигрантов Путин почему то упорно УМАЛЧИВАЕТ? И почему то на заводах России этих азиатов - мигрантов, НЕТ!!! Все они *работают* на стройках, либо на рынках, перепродавая купленное ими по ДЕШЁВКЕ у селян сельскохозяйственную продукцию. Селянам продавать свою продукцию НЕКОГДА, её надо посадить и ухаживать за ней. Вот и продают за ДЁШЕВО азиатам!!!",1686978873,103358230
8004635,"Вот Божий Дух объял весь мир, 
И Благодать доступна каждому из нас! 
Коль ждете, ищите, придаст Своих вам сил, 
Для тех кто хочет перемен в Священный час! 
16.06.23. И кто готов, тех Бог, объединяет в Своем Духе! 
ПМЭФ-2023. Пленарное заседание. Встреча Президентов 
РФ и ОАЭ. 
 
Ну, с Богом! Президент Алжира открыл первый 
памятник, мусульманскому и арабскому лидеру 
Алжира А. Теббуну, в России! 
Переговоры глав РФ и Алжира в Кремле! 
15.06.23. 
 
Россия в Боге, возродись - Благими Личностями! 
Бог, не дал, нам глубокого слияния с Западом! 
Отвел Россию вовремя и отрубил все связи, 
Чтобы очнулись мы от всех воздействий адовых, 
И чтоб детей уберегли от всей греховной страсти! 
Раскрыть в нас нужно - Русский Код и проявить Дух Истины, 
В котором Благородство Дум и Чистота Начал! 
Стать вновь живыми, радостными, искренними, 
Все лучшее - детям нашим, что Бог нам передал! 
14.06.23. ПМЭФ - 2023! 
 
В начале было Слово и Слово было у Бога, 
и Слово было Бог! 
Бесконечное Осознание Главного! 
Но после Осознанности - Дела Благие! 
 
""Как важно, чтобы Осознанное Слово, 
Делами доводилось до конечного результата! 
И чтобы приобретенный опыт лег в основу, 
Возвращения - Благого Царствия на Земле, как было когда-то, 
Заповедано чадам Божиим!"" 
15.06.23. 2 день ПМЭФ-2023. 
 
Все силы Света, нам ныне помогают осуществить 
Квантовый переход из сознания и бытия страсти и 
Страдания в Вечность Благодати и Добродетели в 
Боге, с Ним и для Него (в Бесконечное Осознание Главного) уже 
Здесь и сейчас всему Живому Мирозданию через 
Личностный Аспект Бога, т. е. обожествления 
Человеческой цивилизации, дабы жить вечно во Славу 
Божию!!! 
 
Мы друг у друга на глазах меняемся, 
А вместе в нами обновляется и мир. 
Бог, Живой Жизнью через нас, нам представляется, 
Пусть Дмитрий не легко вам, но Он дает вам Сил! 
16.06.23. Храни вас Бог, Д. Песков! И за все спасибо! 
 
Благодарим Бога, за С. Шойгу и его служение Богу 
и Отечеству на своем ответственном посту! 
 
С какой любовь., нежностью, добром наш Президент 
и Валентина Владимировна Терешкова относятся друг к другу, 
так и должно быть между людьми мира в целом! 
16.06.23. Награждение В. Терешковой орденом Гагарина.",1686978883,281042135
8004635,"На самом то деле у России полным полно достижений, да даже взять экономику, которая под шквалом санкций осталась устойчивой и позвляет и дальше, повышать тот же МРОТ",1686989766,758846110
8004635,"Запад в бешенстве от того, что санкции не могут разрушить российскую экономику.",1686990154,777435122
8004635,"Когда запад погряз в последствиях своих же санкций всему миру понятно стало, что Россия далеко не страна бензоколонка)",1686998578,734674555
8004635,"Нравится, что попимо нефти с газом мы начали осваивать другие способы повышать свою экономику. Молодцы",1686998716,807576751
8004635,"как бы запад не пыхтел, сколько бы не ввели санкций против РФ- она остается сильным и независимым государством. У нас нет цели кому то вредить и мстить, мы просто работаем над собственным благосостоянием",1687010977,730016209
8004635,"Вранье: ""Путин обратил внимание на то, суммарное повышение МРОТ позитивно отразится на доходах почти 5 миллионов человек"" 
В России две третьих населения получают заработную плату близкую к прожиточному минимуму (сейчас он приравнен к МРОТ) - около 20 тысяч рублей в месяц. Это около 100 миллионов человек, не ""5 миллионов"". Повышение МРОТ (включая региональные надбавки, вредность, разряд и премии) позитивно отразится на их доходах. 
Это объясняется законами рынка, которые точно так же регулируют рынок труда - работодатель ВСЕГДА стремится платить меньше, и все, что его ограничивает в этом устремлении, это МРОТ. Причем часто это тоже легко нарушается - неофициальный найм, полставки и хищение заработной платы.",1687012303,718755792
8004635,"Санкционная политика Запада по итогу нашу экономику не ограничила, а наоборот только укрепила, плюс мы не только социальную поддержку граждан увеличили, но и поднимать стали свой технологический суверенитет",1687013698,758476524
8004635,мира стало меньше,1687028559,749306553
8004635,"Санкции запада на нашу страну вообще не особо повлияли, благодаря грамотно выстроенной экономической системе. Да и изоляции нету, на ПМЭФ вон сколько людей с разных стран приехало",1687033733,718460084
8004635,"проблема с безработицей на самом дел енеплхо так решена, как и почти с бедностью, но страдают тут уже, скорее те, кто вообще ничего не делает",1687034051,806033766
8004635,думаю что даже раньше чем 2030 год может мрот увеличиться. судя по тому как сейчас у нас экономика успешно развивается,1687071431,806817006
8004635,"ну так по сути балгоприятная среда сейчас получается для развития бизнеса в стране, так что рабоатйте народна благо себя и страны",1687075131,793355498
8003944,СМОТРЕЛ ГДЕТО ПОЛЧАСА . СПЯТ ЧИНУШИ ИЛИ ИГРАЮТ В ТЕЛЕФОНЕ . . ИНТЕРЕСНО . А ГИМН ЕСЛИ ВКЛЮЧИТЬ КТО ВСТАНЕТ ?,1686925472,739824820
8003944,Почему кредиты потребительские взлетели уже до 23% годовых?? Развиваемся ?,1686926035,24166157
8003944,Хотелось бы посмотреть на настоящего.,1686926131,710685870
8003944,"Если поставить цель ""дедолларизация экономики"", то есть шанс сохранить богатства своей страны для своих же граждан.",1686927480,288404894
8003944,И доволен.,1686928503,32649461
8003944,"Не поняла, что значит нет цели дедолларизации экономики? Что ещё за неприятный сюрприз? Это должно быть целью!!!",1686932369,181171106
8003944,"Молодец, Президент! 
Горжусь!!!!",1686933602,158784874
8003944,"Это недоразумение как росия, не должно быть вообще!",1686939895,614784548
8003944,Верните пенсионный возраст пожалуйста.,1687253431,89697165
8003651,"И этим очень даже можно гордиться, потому что Россия одна из сильнейших стран, кто сдердивают инфляцию и вообе снижает ее",1686918462,729908769
8003651,скоро марковка чемодан денег будет стоить...😂😂😂..,1686918955,720165515
8003651,"Вот Божий Дух объял весь мир, 
И Благодать доступна каждому из нас! 
Коль ждете, ищите, придаст Своих вам сил, 
Для тех кто хочет перемен в Священный час! 
16.06.23. И кто готов, тех Бог, объединяет в Своем Духе! 
ПМЭФ-2023. Пленарное заседание. Встреча Президентов 
РФ и ОАЭ. 
 
Ну, с Богом! Президент Алжира открыл первый 
памятник, мусульманскому и арабскому лидеру 
Алжира А. Теббуну, в России! 
Переговоры глав РФ и Алжира в Кремле! 
15.06.23. 
 
Все силы Света, нам ныне помогают осуществить 
Квантовый переход из сознания и бытия страсти и 
Страдания в Вечность Благодати и Добродетели в 
Боге, с Ним и для Него (в Бесконечное Осознание Главного) уже 
Здесь и сейчас всему Живому Мирозданию через 
Личностный Аспект Бога, т. е. обожествления 
Человеческой цивилизации, дабы жить вечно во Славу 
Божию!!!",1686918963,281042135
8003651,"надо же, инфляция маленькая и безработица тоже. может быть, эти явления связаны?",1686988273,39544696
8003651,"Кто хотя бы немного знаком с экономикой, прекрасно понимает какую дичь здесь озвучили. 2,9 %? Да, конечно 🤣",1687075163,158111533
8003618,Что значит среди ведущих? Россия разве была среди ведущих?,1686918554,246345587
8003618,"Пфффф, как быстро трут неудобные коменты 😡🤦‍♂️",1686918828,18083024
8003618,"2.9%???😡😡😡, он вообще точно в России президент???",1686918870,18083024
8003618,"Вот Божий Дух объял весь мир, 
И Благодать доступна каждому из нас! 
Коль ждете, ищите, придаст Своих вам сил, 
Для тех кто хочет перемен в Священный час! 
16.06.23. И кто готов, тех Бог, объединяет в Своем Духе! 
ПМЭФ-2023. Пленарное заседание. Встреча Президентов 
РФ и ОАЭ. 
 
Ну, с Богом! Президент Алжира открыл первый 
памятник, мусульманскому и арабскому лидеру 
Алжира А. Теббуну, в России! 
Переговоры глав РФ и Алжира в Кремле! 
15.06.23. 
 
Все силы Света, нам ныне помогают осуществить 
Квантовый переход из сознания и бытия страсти и 
Страдания в Вечность Благодати и Добродетели в 
Боге, с Ним и для Него (в Бесконечное Осознание Главного) уже 
Здесь и сейчас всему Живому Мирозданию через 
Личностный Аспект Бога, т. е. обожествления 
Человеческой цивилизации, дабы жить вечно во Славу 
Божию!!!",1686918977,281042135
8003618,"Есть страны который понимают, что с Россией выгоднее сотрудничать. Особенно те, кто не хочет прогибаться под США",1686919910,730426772
8003618,"В итоге придется потом другим странам с нами сотрудничать, только это уже будет на условиях хуже. я про тех, кто поддерживает антироссийскую политкиу",1686920201,730418085
8003618,"За год ничего не потеряли и не сметились ни с одного места ,и это при том ,что на нашу страну запад наложил много санкций",1686923695,708713097
8003618,"Тогда почему в наших магазинах большинство товаров НЕ НАШИ, а импортные? Автомашины, телевизоры, холодильники и многое другое? Всё дело в том, что наши ВЕРХА ВЛАСТИ практически не бывают в наших магазинах, продающих технику. Им же доставляют эту технику домой. А нашим Верхам власти надо чаще бывать в любых магазинах и беседовать с простым народом России. Только так наши ВЕРХА будут знать как живёт простое население нашей России, а не навешанная лапша на уши наших ВЕРХОВ. Которую им вешают наши ЧИНОВНИКИ!!!",1686926153,103358230
8003618,"Мечты,мечты-вот наша слабость...",1686943856,542608435
8003618,нужно так же и внимание много уделять другим отраслям экспорту. кроме нефтной сферы,1686946515,793171389
8003618,"Россия и дальше будет повышать своё вес, свою значимость, дальше будет развиваться, а санкционное давление не поможет западу. Наша страна только сильнее будет становиться",1686956574,718460084
8003618,"учитывая, что Россия по уровню экономики только растет ! тут и безрабтица падает",1686968785,791330377
7971335,"Россия стремится к независимости от других стран, потому что это позволит нам никого не слушатьи развиваться так. как нужно это",1685992068,806027061
7971335,💪🇷🇺,1685992160,145626236
7971335,Тут одни боты (((,1685992807,755368220
7971335,"Сегодня инфляция 2, завтра 20",1685992985,777797682
7971335,"да, нам еще повезло с такой маленькой инфляцией в сравнении с теми страннами, кто вводил против нашей страны санкции",1685993423,704781969
7971335,бакс потолок еще не пробил ))),1685993905,314918820
7971335,"Устойчива , несмотря на  силуанова. 💀",1685995826,51901874
7971335,Против нас вводят все больше и больше санкций а рубль что то не умирает. Они похоже не учли что вставляют себе палки в колеса.,1685999917,789946488
7971335,"Да это и видно даже по ценам на тех же прилавках,что инфляция в районе 2.3%, так что западные санкции явно на нас вообще никак и не влияют особенно в экономическом плане",1686005625,793217438
7971335,"Фак 🖕🏼 ему . 
Квартиры, транспорт, спецтехника и т.д.  ... МЕТАЛЛ (!)  _ ВСЁ в 2-2.5 раза стало дороже ,а ЗП нихрена. 😡🤬 
Чуть доллар подскочит _ тут же металл и цветмет. Это ни о чём не говорит ?",1686008282,664972761
7971335,СЕгодня прочитал что оказывается у России есть гдето за бугром заначка в 130 триллионов Правда или нет об этом Силуанов с Набиуллиной не расскажут А так все хорошо прекрасная маркиза ....,1686022589,467393622
7971335,"Мне хочется понять они в какой стране живут.Про какое снижение инфляции он лично говорит. В моем городе всё только дорожает каждую неделю в магазины хоть не ходи, вот на днях бензин подорожал и это город Норильск Российская Федерация .А он про какую страну рассказывает???Вообще пора давно вводить уголовную ответственность чиновникам за приведение ложной информации …. Но мы этого ни когда не увидим это я уж точно знаю.",1686022882,449767280
7971335,"Вот этому человеку верю безоговорочно!!! Надо пойти, запас гречки, мыла и спичек прикупить...",1686024934,271762618
7971335,"Не бывает в современном мире независимых стран, все друг от друга зависят.",1686025408,429407576
7971335,"Хлеб тоже подорожал на 3% – 2,3%... Наверно от сверхвысоких урожаев...",1686026584,423870973
7971335,Очередные побасенки от олигарха от правительства...,1686028218,42224626
7971335,"Россия всегда была такой и все делается для того что бы в нашей стране все хорошо было ,Путин ради этого и старается!",1686037555,720148960
7971335,"И так видим все это ,не смотря на санкции у нас все отличнО ,цены мб и выросли немного, но тем не менее держимся и неплохо)",1686037697,793355611
7971335,"Пусть американцы расскажут лучше, как у них дела с бюджетной системой, после антироссийских санкций, когда у них стали закрываться крупнейшие банки страны",1686037923,701321537
7971335,,1686077233,62411174
7971335,Наша экономика в прошлом году показала всему миру что она не сгибаемая! Сейчас мы наверствыаем упущенное,1686083908,791338881
