post_id,text,comment_time,from_id
7129154,"Если и поставлять, то излишки, причем не зерном, а мукой( там турки молоть хотят, у нас мельниц нет?)
Титан дома нужен, и мне плевать на развитие Боинга и эрбаса. 
Помните про социализм в отдельной стране? Так пора строить самую лучшую страну дома. Здесь и сейчас. Все для этого есть.",1669620793,8962155
7129154,,1669621895,730471684
7129154,"Давно пора,а то совсем уже санкциоулись в ЕС🤣",1669621940,277543811
7129154,Точно,1669622617,606168990
7129154,"Не надо идти на поводу у европейских хотелок - именно вы, придурки европейские, тянетесь за США с этими санкциями. Вот и сидите во тьме и холоде без белых булок.",1669623379,286829136
7129154,"Ой и надоели же эти санкции, честное слово) 
Вот уже не хочется их воспринимать всерьёз, потому что на все их ограничения, мы находим обходные пути. 
Они у нас что-то закрывают, мы открываем своё. 
Даже в фармацевтической промышленности есть положительная динамика. 
https://www.mos.ru/news/item/116635073/",1669739564,637682450
7128088,А что так),1669575796,7585193
7128088,Это не моя нефть.,1669575804,64366271
7128088,В Китае вовремя замутили пиндосы.Теперь надо думать ху есть ху,1669576179,505790773
7128088,Да уж скорее бы. Перекрыть кран гейропейцам. Это будет весело. А еще можно переводить оплату нефти в рубли. Контракты европа сама разорвет. Тоже будет круто.,1669576952,111192648
7128088,По серым схемам будут,1669577049,707995028
7128088,"Они так и будут , прыгать с одного угла в другой. Пока не перегрызут друг другу глотки.",1669577136,758787961
7128088,"Литий и смерть.
Эдуард Тополь – о Путине и Украине
 

С 24 февраля и по 21 сентября не утихали дебаты о причинах вторжения России в Украину. Политологи, психологи и прочие эксперты с научными степенями и званиями объясняли эту войну характером и психикой Владимира Путина, его пацанским стремлением доказать всем мировым лидерам, кто здесь главный, мечтой войти в историю ""собирателем земель русских"", его раздражением возможностью вступления Украины в НАТО или просто скукой человека, которому обрыдло заниматься внутренними делами своего унылого государства. А на самом деле ""ларчик просто открывался"", и открыл его очередной номер прохановского журнала ""Изборский клуб"" статьей генерал-майора Владимира Овчинского ""Литий и смерть"". Назову обозначенные в этом тексте причины вторжения.

Причина первая. ""На Украине имеются большие месторождения нефти и природного газа, каменного и бурого угля, торфа и горючих сланцев. Добыча нефти и газа производится в Причерноморско-Крымской провинции, в Предкарпатской области и в Днепровско-Донецкой области. Что касается угля, то его добывают во Львовско-Волынском бассейне, в Днепровском и Донецком бассейнах"".

Причина вторая. ""Рудные ископаемые: марганцевая руда (Никопольский бассейн и Великотокмакское месторождение); железо (Криворожский и Крымский бассейны, Белозерское и Мариупольское месторождения); никелевая руда; титан (Малышевское, Стремигородское, Иршанское месторождения); хром; ртуть (Никитовское месторождение); уран (Желтореченское месторождение и Кировоградский р-н); золото (Сергеевское, Майское, Мужиевское, Клинцовсколе месторождения)"".

Причина третья. ""Нерудные ископаемые: Месторождения озокерита и серы расположены в Предкарпатье. Каменную соль добывают в Солотвинском, Артемовском и Славянском месторождениях, а также в озере Сиваш. Лабрадорит и граниты добываются преимущественно в Житомирской области. Залежи полудрагоценных и драгоценных камней, таких как горный хрусталь и аметист, янтарь и берилл, яшма, добываются в Закарпатье, Крыму, Криворожье и Приазовье"".

Вовсе не уничтожение мифических украинских ""нациков"" было нужно Путину и К*, а вожделенный украинский литий

 

 
Стоп! Поскольку в Украине открыто 800 месторождений, где добывают 94 вида полезных ископаемых, причины вторжения можно перечислять бесконечно, перейду к генеральским выводам: ""Согласно оценке SecDev (август 2022 года), базирующегося в Оттаве исследовательского и аналитического центра, Украина занимает 4-е место в мире по общей оценочной стоимости природных ресурсов с годовой добычей примерно 15 миллиардов долларов и потенциальной оценочной стоимостью до 7,5 триллионов долларов. При этом Украина является одной из самых богатых европейских стран, когда речь идёт о запасах редкоземельных металлов и лития, стоимость этих месторождений оценивается в диапазоне от 3 до 11,5 трлн долларов. Если нефть из–за её значимости традиционно называют ""чёрным золотом"", то литий по оценкам мировых экспертов становится ""белым золотом"" этого столетия… В ядерной энергетике и атомной технике при его помощи получают радиоактивный изотоп водорода – тритий, львиная доля лития уходит на производство литийионных аккумуляторов… В Украине запасы литиевых руд категории С1 только в месторождении Шевченковское в Донецкой области составляют 5,67 млн тонн, а категории С2 – более 8 млн тонн… Прогнозные объемы запасов лития в России – 1 млн тонн…""
Бинго! Как говорил один мой приятель: ""Вот вы и открылись!"" Прогнозные объемы запасов лития в России – всего 1 млн тонн, а в Украине, только в Донецкой области – более 13 млн тонн!

Теперь понятно, зачем Путин в Украине и почему мёртвой хваткой вцепился в Донецк? И почему так упорно, до 21 сентября, отказывался называть это вторжение войной, а называл ""спецоперацией""? Да потому что это и вправду было задумано как специальная операция по захвату украинского лития! ""В конце 2021 года Украина начала выставлять на аукцион разрешения на разведку своих запасов лития, а также меди, кобальта и никеля, – пишет генерал Овчинский, бывший руководитель российского Интерпола. – В ноябре 2021 года австралийская компания European Lithium заявила, что находится в процессе получения прав на два многообещающих литиевых месторождения в Донецкой области на востоке Украины и в Кировограде в центре страны. В том же месяце китайская компания Chengxin Lithium также подала заявку на получение прав на месторождения лития в Донецке и Кировограде… В середине февраля 2022 года 17 американских военных экспертов написали письмо министру обороны США Ллойду Остину, в котором подчеркнули необходимость расширения доступа США к полезным ископаемым"".

Понятно? Сразу после заявок Австралии и Китая на право разработок украинского лития Путин начал собирать войска вдоль украинской границы, а стоило американским экспертам лишь заговорить про ""необходимость доступа США к полезным ископаемым"", тут же дал приказ о вторжении. И даже если в те же дни Дмитрий Козак, помощник Путина, действительно добился сделки по отказу Украины от членства в НАТО, это уже не имело значения – вовсе не уничтожение мифических украинских ""нациков"" было нужно Путину и К*, а вожделенный украинский литий. ""Теперь настала пора американских войн за ""белое золото"", – сообщил, перекладывая с больной головы на здоровую, генерал Овчинский. – СВО России на Украине, помимо других целей, предотвратила прямой захват залежей лития на Украине. Цена вопроса предельно высокая"".

Итак, истинная причина путинской оккупации Украины – её месторождения редкоземельных металлов и лития. Правда, оказалось, что Украина ценит свою свободу дороже, но путинской команде это в голову не приходило, иначе куда дешевле всей его ""спецоперации"" было бы взять эти месторождения в концессию. Как в 2014-м взять в концессию Крым вместо хамски-позорной аннексии, которая обошлась России куда дороже…

Эдуард Тополь",1669577585,532021519
7128088,"""А впрочем, для здоровия, полезны холода, 
А впрочем, для здоровия, полезны холода.""",1669579373,355420568
7128088,"Ну и останутся оне без нефти,точнее, будут покупать втридорога,переливая из такеров в танкер...",1669581887,737567792
7128088,Ждать пока на Западе похолодает .,1669582317,56504954
7128088,"Для начала мож скинуть цены на бензин в самой России,да прогазофецировать хутора и сёла",1669616133,612471110
7128088,"Сколько не выпендривается Хейропа, без нашего глаза никуда.",1669625052,590419624
7128088,"Мне кажется, что на их месте, лучше всего было бы остановить и искать пути решения проблемы, а не усугублять ситуацию. 
Это они от нас зависят, а не мы, и только в их интересах, сделать всё возможное, чтобы дальше жить нормально. 
Слава богу, что у нас есть всё для нормальной жизни, даже нет трудностей в медицинских препаратах, потому что производство увеличили и дефицита не возникнет. https://www.mos.ru/news/item/116553073/",1669633788,637485459
7121490,"Сказано на зиму в Ирландию,значит в Ирландию!Болгар обожрали,теперь пусть ирландцев обжирают.Всего то года 2-3 гостейки поживут,мадама зеля так сказала.",1669442764,505790773
7121490,"Про ""Варяг"" не пойте - это русская песня!",1669442811,541343831
7121490,"Новое племя образуется-хохлоцыгане,такиеже наглые любители халявы",1669442988,697672646
7121490,да ради членства жевтоблокитные кастрюли хоть щас готовы в позу встать (уже стоят),1669443000,193444768
7121490,"90% украинцев, это выходит совсем мало, ведь чухляндцы разбежались включая и главную чухляндку по всему миру",1669443213,700092773
7121490,"Шлю ха , сама же сейчас в другой стране живёт жинка",1669443234,605381052
7121490,Нечаев. Ты не прав. Ты сам антиисторический,1669443323,762535016
7121490,"Ну и прекрасненько,все довольны оказывается",1669443356,670867442
7121490,,1669443813,465670693
7121490,Сама мадам Зеленская в эти 90% явно не входит,1669444170,10338767
7121490,"Самое смешное, что в основе членства Украины в ЕС, лежит обычная халява.
Это в крови у 90% её жителей, что-нибудь украсть, получить даром...лишь бы не работать (это не относится к жителям восточной Украины).
На халяву жить, жрать, получать пособие, пенсии.
Основная масса, узнав что им в ЕС светит пенсия 3 тысячи Евро, изошлась слюной...
🤑🤤🤤🤤
Весь Донбасс по своей сути кормил Украину, теперь халява закончилась.

А что жена Зеленского вдруг стала участвовать в политической жизни страны? Находясь в тепле, абсолютной безопасности в особняке под Лондоном.
К ней что ли все 90% украинцев подошли и заявили о своём желании? 
Она помалкивать должна, что её муж военный преступник.",1669444329,558938321
7121490,"Так Зеленский отменил пожизненный финмониторинг политиков, а это одно из условий принятия в ЕС! Жена зеленского тоже употребляет что то тяжёлое?",1669445196,170705562
7121490,Очень красиво выглядит Украина с высоты !! Что хотели - то и получили!!!,1669445904,187172491
7121490,"Запад член, украина кружок.",1669447972,755314239
7121490,"Могут , пускай живут. Мы поможем им привыкнуть к такой жизни. Нам больше останется тепла, света, горючки.",1669448180,493928986
7121490,"Сбылась мечта идиотки 90%уже в Европе, правда их ещё не заклеймили,ну это дело времени,а 10%сидит обдолбаная и командует в Киеве",1669448180,759639405
7121490,Хотят в члены....пока только в членососы,1669448209,588485874
7121490,"Ты плыви , наш Титаник, плыви...",1669452082,416374686
7121490,Да скоро вообще без не чего будите жить хохляньдия,1669465359,332450300
7118987,Так прижало ❄?,1669380792,217405652
7118987,Так стоп. Европарламент недавно признал РФ страной-спонсором терроризма. Но газ и всё остальное покупать у террористов вроде как наши соседи по континенту не против. Что на это скажет Еврокомиссия? Или «это другое»?,1669381289,417228
7118987,Война войной..а бизнес это превыше всего!!!!!,1669381569,738852890
7118987,"Рынок не приемлет никаких потолков, закон рынка – это свободные цены  ЕС спи нарушает эти основы",1669381753,292372876
7118987,Три месяца не продовать газ и санкции исчезнут сами по себе вместе с пакетами,1669381990,562202906
7118987,,1669383056,187901013
7118987,"Всё закончится, а к санкциям так привыкли, что их будет не хватать!",1669383722,541343831
7118987,Что увидели цену на газ и врубили заднюю ох уж эти 321сы европейские 👌🐷,1669383831,14882526
7118987,Видно подгузники сменили,1669384098,757041504
7118987,"Вся европа под Натовцами. Будут делать Всё,что прикажут америкашки.",1669391294,320072987
7118987,А куда они денутся без нашего газа хочешь не хочешь придется покупать у спонсоров террористов  кому зимой хочется мерзнуть,1669391546,577615321
7118987,"Мерзни, мерзни волчий хвост.",1669391781,748703380
7118987,Пусть сдохнут . Перекрыть всё. Нас никто не жалеет.,1669426891,472578467
7118987,"Жалко главного гинеколога и борреля так обосраться и как будут отмыватся,",1669444288,416964350
7118987,Какой позор! С ними общаться теперь западло. Зашкваришся!😆 А если серьезно ни чести ни достоинства! Противные жалкие лизоблюды весь этот так называемый запад,1669446081,751502937
7118395,"Они лучше превратятся в сосульки, но перед Россией не извинятся никогда! Упоротые русофобы и нацисты...😡",1669375038,286829136
7118395,,1669375171,353250511
7118395,Браво.,1669375215,90236524
7118395,"Во, круто, молодцы! Не мытьём, так катаньем)",1669375264,759181087
7118395,"Промахнулись , гейропке «буржуйки» нужны а не электрообогреватели ! 🙃",1669375291,717070731
7118395,Лучше буржуйку🤣,1669375297,495660831
7118395,Соболезную гражданам Европы,1669375341,298551544
7118395,,1669375351,405302784
7118395,Красавцы!!!,1669375414,376289642
7118395,"В РФ с 1 декабря очередное повышение стоимости ЖКХ, газа и всего остального. Но при этом хреново почему-то только европейцам. Нам же от повышения цен только хорошо, видимо.",1669375448,417228
7118395,"Обогреватель на киловатт так десять, чтоб включать боялись 🤔🤗",1669375449,374481092
7118395,"🤣🤣🤣🤣🤣Следующая акция-термос с горячим чаем.Нуууу,холодец на НГ не предлагаем,это как-то бесчеловечно.",1669375494,505790773
7118395,Им же нельзя теплее +18 дома обогревать.,1669375558,172546920
7118395,👏👏👏,1669375587,85932045
7118395,"Вы думаете, что они не напишут извинения? Лицемерие- это их жизненное кредо! Они напишут ""извини"" и тут же пошлют на Украину оружие и деньги, а русских будут держать за дурачков, которых можно обмануть на четыре кулачка(",1669375812,5742460
7118395,😂👍,1669375964,650871214
7118395,💪,1669376402,464249821
7118395,"А нaxpeн им электрический обогреватель если энергокризис?
Как грится, нaxpeна коту баян",1669376437,16752476
7118395,Они испугаются извиняться,1669376508,510352356
7118395,"Самонадеянные заявляющие,что Россия- ничто и без нее им лучше. Что русские не люди,или не совсем люди или даже - нелюди,и русских надо- унижать,обкрадывать,унистожать...и ,что? Им от этого теплее, светлее,радостнее жить?  Их жизнь обретает цель и великий смысл? По логике,получается,в мире утрачен смысл жизни человека...человек низведен от творения до продукта и его надо использовать. Что и происходит ...",1669376651,180447531
7118395,"Целиком и полностью поддерживаю. Пускай катятся и извинются, твари неблагодарные.",1669376749,758787961
7118395,У них нет недостатка в обогревателях,1669380552,340556955
7118395,Хитро ),1669381202,19002011
7118395,Может кто газ в баллончиках начнёт продавать?,1669381269,19002011
7118395,"'Компания по производству электрообогревателей' в Краснодарском крае, это, наверное, тоже самое, что 'Компания по производству пляжного оборудования' в городе  Оймякон...",1669383578,750876953
7118395,"Смншно просто.
Извинения - это конаертируемая валюта?",1669383904,707605861
7118395,Компания- молодцы. Креативно и по теме.👍👍👍,1669386416,717365297
7118395,Европа там зимы нету какую-то дичь порити как бута там зима минус 30 смишно там максимум 10. 8 градусов плюс ито не везде стоит жора .,1669387082,463930975
7118395,Жгут 😄,1669394156,39898481
7118395,"Деревню не как не включим, генератор мозги компосирует",1669406411,95201768
