post_id,text,comment_time,from_id
7314656,"Без своего бабла хоть приехала, на прожиточный минимум живёт в сьемной квартире на Дальнем Востоке?",1673516631,606766316
7314656,😂😂😂😂😂😂😂😂 А русские преподаватели которые работают за копейки что об этом думают?,1673519755,772571022
7314656,"Трудно, но нужно быть сильными. К тому же есть всё таки кто против санкций -Китай, Индия, Азербайджан. Санкции постоянно будут сопровождать Россию нужно быть готовыми.",1673521191,748599225
7314656,Проживем!,1673535191,474418891
7314578,Вымерзли наверное уже.,1673513234,756217783
7314578,"И что это все наши СМИ так переживают за экономику ФРГ и прочих ""партнёров"", они что там живут? За свою экономику надо переживать, а об ней если строчку напишут, так большое дело. А вот мне пофиг эта экономика ФРГ, Англии, и Франции, сами только выживаем, а не живём, тут уж не до Гоа!",1673530718,178284675
7314578,Все норм у них. Не жалуются.,1673534088,156246284
7314578,Где профсоюзы пушай  танкам ход не давают,1673546045,663641503
7314578,Не интересно🤮🐖,1673600306,616358961
7314578,"Хорошо, что на наших экономических показателях, не сказались санкции. А наоборот, можно заметить, что благодаря им, у нас со стремительной скоростью развиваются производства. Взять даже в пример, индустриальный парк, который в скором времени будет выпускать беспилотные летательные аппараты. https://www.mos.ru/news/item/118392073/",1673610813,96899388
7314578,Отлично обходимся без российского газа и нефти!Информация для злопыхателей!,1673627553,211243497
7314490,"Ай яй яй, как обеднели, теперь на завод рабочими пойдут.....",1673512465,672702397
7314490,"Может посчитать насколько обеднели россияне?)) Очень легко, см от чего отталкиваться😆",1673512511,17192803
7314490,"Так это импортные олигархи, других Forbes не держит, извините 🤪
Они бежали, чтобы сохранить свои состояния 🎈",1673512628,484134055
7314490,"Пора считать миллиардеров в рублях, а не во вражеской валюте.",1673512678,756217783
7314490,"Экспроприация у экспроприаторов.Больше всего умилила фраза-беда пришла.Беда это когда поправить НИЧЕГО нельзя,а деньги-не последний же х без соли доедают.",1673513058,505790773
7314490,"Судя по опубликованным вами заработкам ,,звездулек,, на корпоративах , не сильно то и обеднели , раз на банкеты хватает.",1673513171,352236758
7314490,"Последнее не доедают, не жалко",1673513221,372281989
7314490,"Дорогие Олигархи!
Обращается Народ!
Вы, по сути, все монархи.
Ну а мы, живём, как скот.
Нам до вас не докричаться.
Дайте ссылку в Телеграм.
Лично надо пообщаться.
Рассказать про свой ""фигвам"".
Мы же снизу и не ропщем.
Но скажите честно нам.
Как нам жить в дальнейшем, в общем.
Без Фейсбука с Инстаграм.
Собственно, не в этом Дело.
Мы же в упряжке-то одной.
Ведь Россию можно смело.
Сделать Райскою Страной.
Ну зачем вам Дикий Запад.
Наше станем развивать.
Пусть для всех Россия - Лапоть.
Дайте ей всех круче стать!
Мы же многое умеем.
Есть и прочности запас.
Пусть Буржуи охренеют.
Через 20 лет от нас!",1673513338,318533934
7314490,"По-моему, все подумали об активах так называемых олигархов, как об их кошельке. Сокращение доходов, между прочим, привело к сокращению рабочих мест на их предприятиях, к сокращению заработных плат работников, к сокращению их соц.пакета. Вот о чём нужно думать, а не об яхтах и чёрной икре, настоящим воротилам некогда отдыхать.",1673514395,177016409
7314490,Пускай привыкают,1673514495,600383876
7314490,"Всех ждёт конец как Чубайс, земля ждёт всех, ответ держать перед Богом, в чем родился человек",1673522495,292433734
7314490,"Лучше бы не про олигархов говорили , а честную статистику как обеднели граждане работники и пенсионеры. Олигархи не обеднели последние штаны снимают с людей и это в порядке вещей.",1673546348,615903621
7314490,А их тварей и не жалко,1673591150,632259582
7314147,Да  ну🤔,1673510280,462834384
7314147,"Не вводить сложно, а придумать их.... 🙈",1673510676,368558457
7314147,"Начали чувствовать, что без России возвращаются в средневековье🤣",1673510812,761855815
7314147,быстро сдулись😂 наверное это было мечтой - зубы на полку,1673511053,88363374
7314147,,1673511056,717070731
7314147,"Не стала полностью скринить, и так понятен смысл😂",1673511286,9887419
7314147,"Особенно удивились компании ушедшие из России, которым сразу же нашли замену, или продолжают ввозить через другие страны",1673511665,19909972
7314147,"А какие ещё санкции нужны?
Нефтяное эмбарго, эмбарго на нефтепродукты с весны вроде.
Перенаправить такое количество на другие рынки невозможно.
Турки не пустят через проливы.
Датчане не выпустят из Балтики.
Поэтому, берут по 60 потолок, так и отдавать не думать.",1673511994,127879262
7314147,Фантазия слабая.За отдельную плату могу помочь.Дорого.Только для обеспеченных стран.,1673512141,505790773
7314147,Осталось лишь на воздух,1673512444,707605861
7314147,Ум заканчивается?,1673512873,758164991
7314147,До полоумных не скоро дойдёт!))),1673515885,776459998
7314147,Санкции сработают. Но не сразу.,1673517667,64366271
7307469,"Вообще пох,всю жизнь пиратками пользуюсь и все работает.",1673406335,285045408
7307469,бесполезная статья.,1673407075,75978512
7307469,У меня после него так и не загрузился. Это не шутка,1673412156,10577924
7307469,"А для Винды 3.11 тоже нет обновлений! Вот это - боль, но все молчат...",1673412975,584495464
7307469,Переходите на Linux,1673419020,487848084
7307469,На Linux не смог загрузить Ворд оф танк,1673458192,637686355
7307469,"Последнее обновление ,как выстрел киллера 😅",1673466957,119694781
7305709,"Состояние Мордашева сократилось,обеднел.Остались крохи-20,6 млрд.Надо помочь семье.",1673363308,505790773
7305709,"Какие бы санкции не вводились против Белоруссии за поддержку СВО, Россия и Беларусь всегда будут вместе. А Еврокомиссия не способна ничего нового придумать, кроме санкций, которые вредят странам ЕС. Мир избавился от злобной Нэнси Пелоси, надо и Урсулу туда же.",1673364158,384468795
7305709,Так а что там такое страшное то печатали?,1673367390,150483021
7305051,,1673355263,94100665
7305051,,1673355354,395092865
7305051,За копейки все скупят.,1673355809,748282550
7305051,Враньё!,1673390327,211243497
7305051,"Анжелика, ничего личного, кот прошел по клавиатуре...😈",1673410255,26587962
7305051,"Хорошие отношения с Китаем необходимы, для экономической стабильности в стране. Ведь производства активно развиваются, Китай, на данный момент, как платформа, на ней держится практически все и строится на их платформе все. Вот даже кластер открывают https://www.mos.ru/news/item/118392073/",1673437533,752956378
7303833,Самый болезненный удар американцев отключение нашего урана от их АЭС,1673342595,169921807
7303833,"Вот с этим флагом покоряли, и побеждали, всех, в любой галактике. Но по голливудским сценариям. И по всему миру впаривали своё превосходство.",1673342906,483384809
7303833,Остались компании которые поставляют пальмовое масло?🤔,1673344735,2870063
7303833,Национализация всего вот это будет ощутимо даже в Вашингтоне!,1673352435,752690892
7303833,И Кока-Колы стало больше чем было. Кто её только сейчас не делает.,1673357642,19002011
7303833,"Но нужно приоритет дать именно дружественным , тем более в Узбекистане, Азербайджане, Казахстане, Белоруссии, Индии и Китае сегодня есть возможность делать на совесть что-то. Но и свою промышленность стимулировать, это наверное в первую очередь )",1673367498,742912208
7303833,"Многие ушли и вернулись, ну и не удивительно, ведь без Российского рынка они просто разорятся. 
Но до их возвращения, мы уже смогли многие производства заменить, и приготовили еще места для дальнейшего развития. https://www.mos.ru/news/item/118392073/",1673432543,752728920
7303087,В сравнении с 1914 годом?,1673334700,29098868
7303087,Ты представь если не было нефти и газа и чтобы мы продавали и как мы жили,1673334850,619870198
7303087,"Смешно, если учесть что вчера Urals торговался меньше 40 за бочку)",1673335066,288306494
7303087,"Запасы нефти конечны. Быстрее добываем - быстрее она закончится, вот и всё.",1673335566,283109166
7303087,Читал как то - открыли уже вроде бы законченную скважину - а там опять полно нефти.,1673335739,275306738
7303087,"Роснефть же вроде катарскому фонду продавали,откуда она снова российской-то взялась?",1673336835,288404894
7303087,А бенз дорожает😁,1673336967,184809179
7303087,"У нас богатая страна недрами, только пользуются избранные. Ах да рабочие места дают и налоги платят. За остальное не суйте нос....",1673338610,175764299
7303087,🌹,1673362537,581677943
7303087,"Потому-что покупают) Значит еще и для себя качаем больше. Производство все же развивается, нужно топливо для перевозок, производства www.mos.ru/news/item/118392073/",1673365342,482279620
7303087,Качают и будут качать и продавать хоть по рублю. Жадность алигархов,1673366707,681167798
7303087,"А почему же тогда жить становится дороже, раз всё так зашибись? 🤦‍♂️",1673420744,163965801
7298601,Замёрзли))),1673248288,194279891
7298601,"Голова то правильно думает ,а печень трясется от страха",1673248448,678215164
7298601,Приперло уже,1673249039,233409194
7298601,"Пусть к нам приедут, по греются! 😜",1673250222,234142102
7298601,"Недавать - пока оружие не перестанут постовлять , вот тогда и поговорить можно . А так даже не сталбы !",1673251416,752690892
7298601,ПОЛНАЯ ОТМЕНА ВСЕХ САНКЦИ!Й,1673251872,83586228
7298601,"Ору. Как может шантажировать президент страны, которой скоро не станет(шутка)?У Украины нет рычагов давления на Европейские страны, кроме АЭС, которую они так и так бомбят",1673255747,132454358
7298601,"Вот так тебе , дожилась Европа  - боится шантажа со стороны зеленского. Это называется - приплыли.",1673259156,712628348
7298601,Сосите лягушатники пустую трубу.,1673259385,681167798
7298601,Неужели кто то Зеленского боится?,1673271362,197531339
7298601,Надо еще немного потерпеть ? 🤣 А за царька поумирать.,1673274262,232980197
7293316,"Proprio ,sei un Genio🤔🤔🤔👏👏👏",1673108890,99120123
7293316,"Обидно, что русские едут в Европу гадить России, а европейцы в Россию - жить и работать! Браво Джулио Дзомпи! 👍👍👍",1673109468,378478765
7293316,Братан,1673109700,305405279
7293316,Коллаборант идёт вслед за русским военным кораблём.,1673110719,28915895
7293316,"И у нас во Владимире есть итальянец, инженер,. Живёт и очень доволен.",1673112432,731592159
7293316,"Ну и молодец. Работай, брат.",1673112500,706313322
7286375,"Охранять, ничего не производим кроме танков, нефти и газа. А самые сильные, как так?",1672959943,60680131
7286375,,1672960117,180914443
7286375,Почему ВВП в долларах?,1672960135,731301305
7286375,"Насколько жидкий понос должен быть в голове, чтоб в это верить?😂",1672960242,410153757
7286375,"Хорошие санкции)) нам подходят, несите ещё )",1672960692,94100665
7286375,"Сколько можно врать то ? У нас , если верить вранью правительства,  самые низкие налоги , благосостояние растёт , а цены падают , медицина прекрасная и лес перестали ворованный вывозить из страны , дороги чистят и ремонтируют , газ бесплатно проводят в дома , мы стали долгожителями  ,  ... . ,....всё у нас работает и процветает !",1672960770,239144128
7286375,"Чем больше падает благосостояние россиян , тем хуже у всех по телевизору",1672960961,768850001
7286375,"ЕСТЬ ФАКТ САМОЙ ВОРОВСКОЙ ЭКОНОМИКИ  МИРА ,!!""ВПЕРЕДИ ПЛАНЕТЫ ВСЕЙ !!! ЕСТЬ ФАКТ НИЩЕТЫ   РОССИИ!!""НИКУДА ""НА ДЕРЕВНЕ НЕ СПРЯЧЕШЬСЯ """"!! ОСОБЕННО ЗАЖРАВШИЕСЯ ОСОБИ, ЕДЯТ ,И ЕДУТ,И ЛЕТАЮТ,МИМО !!ОСОБЕННО ГОЛОДНЫХ,ОХЛАЖДЕННЫХ, И  ""АЛЫЧУ НОСЯТ  МИМО !!НОСА""!!!ЗАЖАТЫ  ,""!,""ИНАГЕНТЫ""! ПАЦИЕНТЫ, ,ВСЕ ,И ВСЁ!!",1672961168,388572628
7286375,Мы стали жить лучше что ли?) отличная новость.,1672961212,516017059
7286375,🤣🤣🤣🤣🤣🤣🤣,1672961276,533646322
7286375,"ПРОСТО ,!""ТРУПЫ ТЕПЛЫЕ "",РОССИЯ "",СПИСЫВАЕТ""!",1672961332,388572628
7286375,"Если учесть что население у нас низкое, то это вполне возможно, вот только все наше ввп распределяется на чиновников",1672961835,185017827
7286375,"Конечно определять рейтинг экономик по ВВП да ещё в долларах - это чуть лучше, чем определять мощность видеокарт объёмом видеопамяти.

Но скажу так, когда народ захочет выйти из под внешнего управления, то наш ВВП с 2% возрастёт тут же до 6% с перспективой роста до 30%. Это реальный рост дохода граждан при ценах начала 2014 года в 10-15 раз. Решать вам.",1672962113,3938809
7286375,"Очень странно на самом деле. Судя по ранее принятым +100500 программам с ярдным финансированием (половина из которых была героически и традиционно спи жена и вывезена во вражеское Майами) и призывам вождя войти в первую пятерку, мы уже лет как 10 находимся в первой пятерке экономик мира, да что там, в первой тройке, а по паритету покупательной так вообще, аж арабы плачут стоя... И самое интересное, если Россия составляет 1.8% от мировой экономики, а например США, ЕС, Китай и Индия 75%, то даже если мы станем 5 ми с той же долей, особо россиянам холодильники этим не наполнить и ментам с пенсионерами ЗП и пенсии не поднять. Полагаю что пропагандонам (топорным и некомпетентным) справедливее было написать что по ВВП, мы на 10 месте после Калифорнии...",1672962119,217315026
7286375,,1672962390,159011493
7286375,"Зато, вся сфера машиностроения уже более 10 лет работает и развивается!!!",1672962416,4755138
7286375,"Огласите весь список этих мест☝️🤣 Голова?
Руки?
Ноги?
Туловище? 
Ягодницы?
Или дальше?🤣☝️",1672962973,391490381
7286375,Комментарии огонь. Отрабатывают. Причём некоторые бесплатно по глупости.))),1672964240,219523024
7286375,"САМОЕ ОСНОВНОЕ ,!!ДЛЯ  РОССИИ,СЕЙЧАС , ОТВОД РОССИЙСКИХ ВОЙСК К ГРАНИЦАМ РОССИИ, !! МГНОВЕННО УКРАИНА ГОТОВА К ПЕРЕГОВОРАМ ""!! КОЛИЧЕСТВО ТЕПЛЫХ ТРУПОВ НЕОГРАНИЧЕННО!!!",1672964575,388572628
7286375,Поржала в голос,1672966708,110400
7286375,"Сверху только пафос один.
Мнение МВФ последняя инстанция?",1672973377,707605861
7286375,А у нас коммунальные расходы увеличились на 50 %.,1672977452,773634000
7286375,,1672982531,771737851
7286375,"Всё хорошо, прекрасная маркиза, всё хорошо, всё хорошо...🤣🤣🤣",1672982705,297007187
7286375,Экономики недружественных стран вне учёта! Пусть сами как хотят !,1672983225,64101194
7286375,"ВВП больше 2 трлн., а где тогда деньги?",1672984143,735840728
7286375,ВВП  устаревший и необъективный показатель.,1672984680,587736297
7286375,"Это типа в Италии хуже чем у нас!????не смешите мои подковы!
Или где деньги Зин!!!",1672992718,136147050
7286375,До дня дурака ещё далеко...💩💩💩,1672999130,68232963
7286375,"Любые санкции работают только во вред, но иногда в отдельном месте, как говориться они принесут пользу. Не ужеле мы? откуда эта инфа то? Болтались так на месте 40, как подросли то? Глядишь телек скажет или КП, что мы и Китай обогнали, она вторая экономика. Только вот жители и россиЯне этого не заметили и быстрее обеднев на фоне роста экономики.",1673046875,256024255
7276392,Ну что ж. Подтвердил свои взгляды действиями 👌😁 Под санкции он попал еще в восьмом пакете 😂,1672746550,352354930
7276392,Не особо патриотично в Дубае отдыхать.,1672746637,594993919
7276392,"А почему в Дубае? Как же Россия? Кавказ, Азовское море, Воронеж",1672746657,277126835
7276392,"Нечего ездить куда не следует, что свою страну всю увидел?",1672746825,731564394
7276392,Сейчас в Дубае полный аншлаг посещения славян.,1672746967,45753642
7276392,"Ну..что-то не совпадает с показанным по ТВ
Меладзе кричал "" Слава "" , а Газманов просто сказал "" Отстаньте ""типа он пьян. Так, что не очень патриотично находиться среди врагов. Мы ведь его любим и уважаем.",1672746971,144576065
7276392,"Посмотрите скандальное видео с реальным пацаном, или лучше сказать реальным Бандеровцем Николаем Наумовым!",1672746981,716862404
7276392,В такое сложное время отдыхать в Дубае?,1672747264,550893119
7276392,Идиотизм,1672747272,197795930
7276392,весело живут,1672747329,264560473
7276392,"Звездуны уже совесть совсем потеряли. Они ""отдыхают"" видите ли. А почему бы на передовых военнослужащим не дать отдохнуть под свои песни. Или ссыкотно?",1672747694,711866781
7276392,Можно и подраться.,1672748002,447927194
7276392,"Зато Меладзе,ни разу не  постеснялся,в том же Дубае.",1672748095,505790773
7276392,"Да видели мы , как он "" Чуть не подрался"". Просил у казаха и бандеровца дать ему отдохнуть, в тот момент когда они спрашивали у него  - за войну он или против.",1672748216,90236524
