post_id,text,comment_time,from_id
7190767,"почему бы им просто не перекрыть все краники? ахахха, они ведь так запросто смогут без наших ресурсов",1670842104,691295651
7190708,Хорошие новости!,1670827543,372419912
7190708,"к сожалению много аналогов не такие эффективные, а то и вовсе не эффективные(((",1670828150,286352550
7190708,"Интересно, а стоимость и эффективность наспех изготовленного препарата от СМА будет такой же как у Золгенсмы?)))",1670828217,806090
7190708,"Единой вакцины против разных штаммов гриппа? Разводилово и к тому же наверняка она как и антиковидная меняет ДНК, а последствия вмешательства в геном опасны намного больше гриппа",1670828509,114612151
7190708,Сами ешьте свои аналоги,1670829469,326265706
7190708,"Это как иномарка и Жигули, вроде одно и тоже но разница…",1670838283,738746638
7188616,"Турция сама решит без Борреля,что ей делать.тем более она не входит в ЕС и не будет в ущерб себе вводить антироссийские санкции как Европа.",1670762838,300270981
7188616,Жозеп он и в Африке - Жозеп....,1670762847,386027849
7188616,Поэтому  Эрдоган и  собрался уходить...,1670763139,231118109
7188616,Полный кретин😬,1670763221,51099552
7188616,"Турция забыла старика этого спросить, пусть указывает бандеровщине",1670763560,615795980
7188616,Господа вы уже заигрались в большую политику подумайте о том что вы делаете с этими своими санкциями весь мир вас презирает но не могут вякать из из американцев так не должно быть задумайтесь,1670763652,618039952
7188616,"Расскажи это Эрдогану, который гребёт деньги лопатой сейчас , клал он на эти заявления , это бизнес",1670763668,94100665
7188616,"Заявил"",прямо.. Сидел бы со своим гинекологом в кабинете.. 😄",1670763675,272855721
7188616,"Борель договорился, будет висеть на аисилице рядом с зеленским",1670763982,56191290
7188616,"Вообще-то санкции против Турции и Азербайддана надо применять, как агрессоров из-за войны в Карабахе.
Но Европу и америку волнует лишь или, на все другое им наплевать. От бессилия и злобы даже Достоевского и Чайковского запрещают:(((",1670764067,369673666
7188616,,1670764223,375739564
7188616,Вам не об этом надо беспокоиться 😂,1670764941,52841218
7188616,Баррелю пора тапки белые примерить и уже не снимать. Чуть-чуть осталось и добро пожаловать в АД!,1670765795,528288061
7188616,"Как буд-то турки забыли сколько Европа динамила их не давая вступить в Евросоюз! Предлоги были самые экзотические! А ведь Турция, страна с большой историей, но видимо правителям Европы на это наплевать, у них видимо цвет кожи не такой, вот и заигрались.",1670766962,719596543
7188616,"Кто про что, а вшивый все про баню!",1670767224,711830146
7188616,Старый фашист.,1670772097,114473064
7188616,Не.трож.россию.предупреждаем,1670773777,678728186
7188616,"Глубоко пожилой человек... В кресле-качалке на лужайке надо наслаждаться жизнью, а он всё жилы рвёт, что бы нагадить целому народу, стране.... Безумный.",1670774744,613383129
7188616,Турция должна) Потому что Жозэпу беспокойно 😜🤪😁,1670779805,713196643
7188616,"Боррель и Урсула разрушили экономики европейских стран и сильно ухудшили жизнь граждан. Боррель хочет и экономику Турции разрушить.Боррель ничего не может требовать от Турции,она не состоит в ЕС. Боррель евро""садовник"" с фашистскими испанскими корнями.",1670783580,712198827
7188490,,1670761151,541343831
7188490,"С нами,русскими и Россией,🙏🙏🙏 Бог",1670761309,285291235
7188490,Дошло наконец,1670761349,376758060
7188490,"И не просто продолжаем развиваться, а еще попутно отправим вас сначала в 19 век, а потом в 10й)",1670761372,713196643
7188490,"Ага, тарифы ЖКХ с 1 декабря  на 9% подняли, и в июле на 4% поднимали... офигенное развитие",1670761998,6713377
7188490,Все вице прям такие умные и здравые вещи говорят.,1670762996,300270981
7188490,"Ну ясно дело, кто уже не у дел, всякие эксы реально смотрят на происходящее,
Болтать - не делать.
Спросу с них нет",1670770338,707605861
7188490,"Михаил Ляхович, восстанавливать тяжелее чем разрушать, тем более, что люди привыкли всё брать со стороны, а не самим производить или изготавливать в своей стране. А сейчас нужно всё начинать с нуля и самим. Давно пора было объявить России санкции, глядишь и уже чуть полегче жилось, надо поактивнее работать, а то всё раскачиваемся, всё надеемся, что "" Дяди"" вернутся и всё опять будет. Надо развивать всё своё и не от кого не зависеть",1670776236,316267269
7187611,Зато в Европе 😂😂😂,1670744782,16564681
7187611,"В контейнеры это нормально. В России 6,5 млн только узбеков живут в бытовках. А еще 1,5 млн армян. И 400 тыс дагестанцев. Остальных по мелочи. Жили и будут жить. По другому вам жилье не построить.",1670745024,64366271
7187611,"Укры!Не отказывайтесь,от одеял ,это вещь на годы,сносу не будет,хоШЬ на голову как платок,хоШЬ на плечи как воротник.🤣Немчура на складах порылась,раритет отыскала.",1670745955,505790773
7187611,"Пакеты имеют свойство заканчиваться при генеральной уборке , ещё не весь мусор в них сложили сложили ?",1670746709,352236758
7187502,"Типа у нас всё норм, смотрите как цены растут в Европе?",1670742017,77633244
7187502,Дану на цены у них не выросли на топлива у нас в красноярске дизель с 55 до 61 и это на Роснефти самый дешёвый вариант а про остальные заправки и того дороже  . очки оденьте если нихрена не видите 1 процент у них пи..... Ы одно слова.,1670742056,626591067
7187502,Подешгевевшие смартфоны .😂😦😦,1670742162,560739533
7187502,"3,14здят привычно,нам уже..🤦‍♂️",1670742720,36343267
7187502,Русский язык учить надо,1670743142,641385519
7187502,"Да все подорожало в разы, чего обманывать самих себя то.",1670743214,176355925
7187502,"Борщевой набор на Ставрополье с 60 до 30🤙🏻 мощь
А зато газ 7.08 с 6.50 и вода с  64.60 до 69.94
Пшеницу не знаю куда продать никому не нужна зато печенье дорогое",1670743414,328050052
7187502,"Кто пишет эти отчёты?
Дизель подорожал с 56 до 61руб. 
  Цена на фуражное зерно для животных упало в 2 раза из-за большого урожая.",1670743424,346503267
7187502,Послать бы их со своими косметическими средствами...б как они бесят со своей жадностью.,1670743667,93043373
7187502,"Есть проблемы с зерном. Его предлагают со всех сторон. Слишком большие объемы, это ненормально.",1670744318,64366271
7187502,,1670744599,308235835
7187502,"Конечно все дорожает. Если бы как в Белоруссии законом запретили повышать цены, хотя бы на продукты и вещи для военных. Что подешевело, не знаю, не видела.🤷‍♀️",1670744711,383294774
7187502,"Кроме видях ничего не видел подешевевшего. И то тут никакой заслуги наших ""слуг народа"" нет",1670745939,21564412
7187502,Левых ботинок ещё произвели в 100 раз больше! Ура!,1670750846,114379
7187502,"Коммуналка растёт, цены в магазине растут, инфляция растёт, зарплата как стоит на одном месте лет 10 уже😂",1670755018,179182946
7187502,Пенсионеров особенно обрадовало подешевение смартфонов🤦‍♂️,1670786742,718760133
7187502,А в РФ с момента распада СССР всегда есть причина для роста цен. Это уже классика жанра. Все привыкли.,1670799451,256024255
7187502,"А почему за фейки СМИ не наказывают? КП должна нести ответственность за свои новости. Расскажи нам, что именно там подешевело?",1670801271,96878386
7187502,воще попутали просто ниже плинтуса загоняют,1670811840,549329852
7187502,Текст для заголовков с подешгевевшего смартфона набирали?,1670827086,5100556
7187502,Ничего не меняется: ежегодно всё дорожает.Думается все давно к этому привыкли.,1670832338,712396939
7187464,Ха! Как бы этого Штрахе заокеанские партнёры не отштрахе за подобную риторику.),1670740801,334676849
7187464,Здравый смысл...,1670741002,609865680
7187464,"Мда.Весь мир бардак.Все бабы -леди.И солнце шар,дающий свет.Все всё понимают,но продолжают грязные делишки.",1670741242,505790773
7187464,"Был бы хороший шаг если после отмены санкций, мы ввели те же санкции против Европы и США.",1670742301,27256353
7187464,Энерго - рубль.,1670742398,689291376
7186126,Смешно,1670689994,238358420
7186126,"Выдержать придётся не только сам конкурс, но и откровенную русофобию. Держи голову гордо, наша красавица!",1670690036,177016409
7186126,Могу поспорить что первое место возьмет черная лесбиянка не важно откуда...,1670690226,33913050
7186126,🙏🙏🙏🏆🏆🏆,1670690504,20548321
7186126,"Без вариантов,нельзя победить у тех,у кого такие красавицы.",1670690833,505790773
7186126,Какие бы НИ,1670690959,184295040
7186126,Конкурс дорогих проституток,1670691168,668377026
7186126,А победит тумбочка из Украины.,1670691500,216658109
7186126,Зачем?,1670692149,8307520
7186126,"Русская красавица! Как с полотен 18-19 века! Держись! Участие уже победа! На справедливость не расчитываем, но красотой своей затмишь любого!",1670692992,384514354
7186126,"Девочке много чего придется вытерпеть, но победу ей все равно не отдадут, даже если она будет лучшей. Победу отдадут лесбиянке, негритянке или украинке, даже если они будут страшнее черта.",1670693272,104286173
7186126,"Пустая затея! А судьи кто! Пусть будет хоть семи пядей во лбу, там запрет на всё русское. Победит "" оно"" .🤣🤣🤣",1670693287,719596543
7186126,"Дюймовочке бесполезно соревноваться с гусеницами в красоте. ""У неё даже нет талии...""",1670693397,730873721
7186126,А Сильвестр Сергеев не против?,1670694084,12600503
7186126,Пожелаем удачи 👍,1670694645,592247447
7186126,Ради чего????? Понимаю спортсменов....,1670695383,30219680
7186126,Зачем она там участвует? Ее туда насильно затащили?,1670696596,9057476
7186126,А победит какой нибудь транссексуал с украины,1670698884,738746638
7186126,"Она же РУССКАЯ, а этим всё сказано, мы с тобой девочка!!! 🤗🤗🤗👏👏👏",1670699294,713261240
7186126,"Во всяком случае, Аня произведёт фурор, как и изложено, в композиции Шнура, ""Фотосессия""( ""Фотосессия, на вилле! Или в лесополосе! Я, такая вся, на стиле! Чтобы - АХ! Уели, - все!!!...)",1670701273,575838960
7186126,Своевременно...конечно...не понимаю...,1670746246,708313827
7186126,А вот ехать туда не следует.Попомнтите мои слова!,1670758198,443329304
7186126,"Наверное , и видно не по блату прошла ...",1670762080,734701507
7183234,Можно одну другую зиму как нибудь без коньков обойтись. Идёт война.,1670654797,748540641
7183234,“Фишер“ ушёл с Украины?,1670654812,86912376
7183234,"> из-за антироссийских санкций
Что за чушь? Санкции не предусматривают уход той или иной компании из России, это собственная бизнес-инициатива.",1670655123,581370267
7183234,"Хреново, что у нас кроме ракет и нефти больше и нет нихрена....Вторичный рынок будет процветать...",1670656108,99926735
7183234,"""Вся контрабанда делается в Одессе , на Малой Арнаутской улице.""(И.Ильф , Е.Петров."" 12 стульев"".)",1670657627,213822484
7183234,"А что, мы уже разучились делать лыжи и коньки? У Третьяка были коньки отечественного производства. Не пора ли обьявить мобилизацию предпринимателей?",1670661948,714959373
7183234,А сколько их простаивает годами на балконах и клодовых!!!!!,1670662874,179838505
7183234,"[id20667757|Евге]
Н@уй  нужны ваши  соревнования!!!!
Скажите  что  изменится   если  не один спортсмен не  выиграет?
Ответ  ровным счётом ничего.  Максимум  через 72 часа об этом  и не вспомнит никто. 
Если  в вашей квартире  72 часа не  будет  функционировать горшок  вы  взревёте и взревёт весь дом и  жильцы. Со  светом  тоже самое  . Если  не будет. 72 часа общественного  транспорта  или продавца на кассе. 
Так вопрос   кто в приоритете?",1670664801,606153514
7183234,Лапти плетите рабы!😂😂😂,1670664992,767270004
7183234,готовь сани летом.......))))),1670672467,487159748
7183234,"Не заметил, по моему, стали дешевле",1670682841,1606166
7183096,"Понятненько,если раньше из подтишка науськивали,то теперь отмашку дали-фас.Посмотрим сколько грузины продержатся,до открытия второго фронта,что сработает-совесть(хотя ею там и не пахнет) или звон монет(почему-то думаю,что сторгуются)",1670653465,505790773
7183096,"У Украины и у Грузии свой разум.
Везде человек есть.
О глобальном говорить пора.
Хватит выяснять превосходство .
Нет его.",1670655725,689291376
7183096,"Куда-то Мишико пропал - ни слуху, ни духу...)🤣🤣🤣",1670662963,166764943
7183096,"Ну так и мы не должны требовать не наносить климатические удары в виде торнадо, атлантических цунами и так далее по территории США",1670663358,114612151
7181530,А Россия ввела канаде ☝☝☝,1670609096,619328383
7181530,канада - нелюди живущие в фантазиях!,1670609165,124865791
7181530,Сотрудникам не позавидуешь!,1670609200,281551237
7181530,,1670609606,505790773
