post_id,text,comment_time,from_id
7405195,"Разве можно уничтожить то, что уже было уничтожено до них всякими Гайдара и и Чубайсянами?",1675192443,141262572
7405195,Че там принято? Скотч всемогущий и окропление кадилом?,1675192838,665338773
7405195,"Это они там, на западе, так думают. А оказалось, что санкции направлены на поднятие отечественного авиастроения !",1675193000,708519845
7405195,"Цитата:""Как заявил глава Росавиации в интервью РБК, санкции Запада, введенные после начала российской спецоперации на Украине, направлены на уничтожение российской авиации"" 
Вопрос  к Нерадько, а санкции что для процветания вводят?",1675193063,377920389
7405195,"Нельзя уничтожить то, чего нет.",1675193372,64366271
7405195,То что мертво умереть не может ©,1675193568,441790734
7405195,Не дождутся 🇷🇺🇷🇺🇷🇺,1675193794,235081504
7405195,Мне как то паралельно.я не летаю..а авиацию стали ещё в 90х уничтожать.и всем нравилось..у нас целый авиазавод закрыли делали ту 154м..,1675194724,371886443
7404888,На ямал там красота сам бы сьездил🤣,1675186404,291586643
7404888,Украину,1675186552,679578184
7404888,Вот и прекрасно!!! 🇷🇺❤️👍🏼🙌👏,1675187496,779538429
7404888,Открыли везде где можно заразу поцепить🤣,1675188597,151032287
7404888,Но мне туда не надо...,1675188782,477784817
7404888,"Нам бы свою страну облетать...... жизни не хватит ..... ты нести меня река ,да  в родные берега.... сколько мест, а народ -то какой !!! ... что несёшь,   то и видишь
ВСЕМ ДОБРА И БЛАГА",1675189344,230024913
7404888,Прямым рейсом из Москвы...,1675190667,10592759
7404888,Убрали все рейсы из Минска в Красноярск. На родину не попасть без мытарства пересадок. На фига мне Мьянма?,1675192434,155485542
7404888,А в России отдохнуть не хотите?,1675203102,508875037
7404888,"По своей стране тоже можно поездить) 
Да и в целом мы можем и отказаться от других стран) 
Лично мне кажется, что мы сможем жить, отдыхать, полноценно в своей стране. 
Даже различные санкции не помешают, даже если говорить про ограничения тех компаний, которые нас покинули, у нас и свои предприятия есть, производство, которое тоже хорошо развивается) 
https://www.mos.ru/news/item/118926073/",1675263545,637485459
7403537,,1675173246,340044546
7403537,Отрицательный рост😂,1675174147,131803080
7403537,Путин Сталина догоняет по экономическому росту. Разница всего в сто раз,1675174382,393634508
7403537,"Обьемы то могут расти и в 2 раза, за какие цены продается вопрос???",1675175103,707213620
7403537,"+0,1 самый оптимистичный прогноз!!!... Было бы не плохо посмотреть на результат в конце года! Мой личный -0, 2...покупательная способность самих россиян упала! Не забываем про санкции, которые пока не дали нужного результата в долгосрочной перспективе, новые санкции, и вывод денег за рубеж будет продолжаться!!! Отсутствие стабильности подрывает и экономику и рынок, и влив финансов в производство, сильно не спасёт экономику...",1675175336,615366188
7403537,"Только следует уточнить, что российская экономика не растет уже несколько лет, в ""минусе"". И прибавка в 0,3% из этого отрицательного роста ее не вытащит. Ну а дальше будет  хуже.",1675175698,467990555
7403537,Повышением МРОТ объяснил рост цен за проезд комсомольский перевозчик https://www.dvnovosti.ru/komsomolsk/2023/01/31/151336/,1675177101,606766316
7403537,"Вот и хорошо! Потому что всё таки знаем как нашу страну поднимать,потому что руководство страны у нас с мозгами",1675211412,780280573
7403537,"Хорошо, что мы сейчас активно сотрудничаем с восточными странами, благодаря чему мы в какой-то степени улучшаем свою экономику и торговые отношения. Наша экономика стала очень расти благодаря санкциям ЕС. Так, Москва смогла увеличить объемы своего промышленного производства на 9% с января - ноябрь 2022 года. https://www.mos.ru/news/item/118712073/",1675258776,719637731
7402856,"Турция, как всегда, ищет выгодные варианты для   себя.. Байрактары поставляет,не забывая, от России выгоду получать:зерновая сделка, газовый хаб, АЭС и пр...",1675165233,674929779
7402856,"США любители давить на всех со своими санкциями, мало того они хотят чтоб все поддержали антироссийские санкции, так еще и в случае чего на тех свои санкции распространяют , если они не поддерживают их бредовую идею",1675165484,684457917
7402856,"Мм, ну так то ничего нового и удивительного, США так на многие страны давили, чтобы они против России что-то делали, они уроды и не скрывают этого...",1675166284,674514314
7402856,"Политика-игры без правил, союзы по интересам, в т. ч. экономическим.. Так устроен мир. Кто лучше просчитал выгоду, заключил выгодную сделку, тот и молодец!",1675167346,674929779
7402856,"США умеет тока вести дела, как спаситель, какое давить. но конечно же мы знаем, что США самое прогнившее государство, которое использует все методы информационной борьбы, и морает руки другими странами рабами",1675167441,697021675
7402856,"Эрдоган - взрослый дядя. Сам разберётся, что делать🤐",1675168076,778439425
7402856,"Ждем, когда уже наконец весь мир начнет США дать понимать, что устали быть рабами, лучше с Россией равные иметь отоношения",1675169127,681509344
7402856,"А че им всем америка упёрлась, сотрудничали бы с Россией и все в шоколаде были бы и мы и они",1675171475,774807683
7402856,"Пусть Фейтулаха Гюлена вернут в Турцию, чтобы что-то просить или требовать",1675172400,668377026
7402856,"Ну вот уже год назад они все пошли на поводу у США и куда их этот путь привел? К серьезным потерям в собственной экономике. В России же ничего не остановилась, а только продолжило развиваться. Онлайн сервис ""бизнес-боксы"". Проект помог начинающим предпринимателям запустить первые продажи и справится с теми трудностями которые по началу требуют вложений https://www.mos.ru/news/item/118840073/",1675262324,625540854
7401234,"Выбора то нет, только китайщину теперь и везти😂",1675146755,1622508
7401234,"Олигархи саботируют импортозамещение, сажают Россию на китайскую иглу.",1675146833,365173399
7401234,"Россия что-то делает из древесины? Может, даже мебель?)
Ах, ну да, матрёшки...",1675146836,283109166
7401234,"А теперь представьте страшный сон. Вдруг Китай отказывается иметь с нами дело. Всё тогда. Конец. Ведь других крупных партнёров больше нет, ни Америки, ни Европы.",1675147052,572814494
7401234,Может хватит уже ныть ваше нытьё в комментах уже надоело! Хватит хаять свою родину по сути мать родную! Всё идет как и должно идти! Или вы хотите под американскую дудку танцевать? Не нравится жить в РОССИИ езжайте в Америку вас там таких ждут с вашим нытьём про Россию!!!,1675147076,742900421
7401234,"короче не вышли планы амеров, все таки мы с Китаем надежные союзники, как ни крути",1675147333,709794296
7401234,"Китай закупает нашу нефть по скидке,а потом перегоняет её и перепродаёт по рыночной цене.Это для тех,кто думает,что Китай -друг. Так то да,у нас есть общие цели - свержение западной гегемонии,но они тоже свою выгоду преследуют",1675147858,721040083
7401234,"Вам не стыдно такое заявлять? Импортозамещение это производство отечественных автомобилей, а совсем не - ""автопром КНР едет к нам"".",1675148208,714959373
7401234,"США постоянно пытается вставить палки в колеса нам, чтобы мы не могли выстраивать отношения с Китаем,но не выходит",1675148331,707662440
7401234,Китай наш самый надёжный партнёр.,1675148554,756217783
7401234,"Возможно, если бы не штаты, мы бы никогда не сблизились, так что спасибо им за это! Просто соединили сердца. То же самое с Сербией, Венгрией и теперь, кажется, с Хорватией?))))",1675149737,709811751
7401234,"Отношения Китая и России выходят на новый уровень, постепенно создавая коалицию против США",1675150206,687419810
7401234,Я думаю что санкции Штатов уже никогда не смогут в полной мере ограничить действия России,1675151774,709794464
7401234,"У американцев не получится разорвать связь таких мощных государств как РФ и Китай, у нас отношения построены на доверии, это чуждо диктаторам из сша",1675152638,710615528
7401234,США думали что смогут весь мир настроить против России только из-за своей лжи и диктаторства что-ли?,1675152779,710627736
7401234,"Американцам мы утерли нос в очередной раз, будут смотреть как в будущем наша страна и Китай сотрудничают и развиваются дальше!",1675152782,710615202
7401234,"Китай ничего не боится, точно так же как и мы, таким странам лучше держаться вместе, что мы и делаем собственно)",1675152893,710661722
7401234,"Все это значит одно, Россия стремительно уходит от Запада, которому довольно плохо уже без наших ресурсов)",1675153497,710574263
7401234,"так что никакой запад не сможет рассорить нашу дружбу, ведь Китай как и мы выступает за многополярность",1675153852,712704284
7401234,"Вот именно такие союзники нашей стране и нужны, те, кто не только берет, но и щедро отдает!",1675154566,710665810
7401234,"Если товаров поставили больше, чем получили- опять в пролете ...Русский купец грузил обоз пеньки и вез за бугор. Там свой товар продавал за местную валюту и тут же тратил до последнего фантика, закупая ТРИ обоза ширпотреба для каждого россиянина, современное оборудование, технологии.  А уже потом продавал товары Народного потребления своим землякам, выручал рубли и создавал капитал, с помощью которого развивал отечественную экономику, после чего Страна развивалась семимильными шагами. Почему сейчас все иначе? У Китая и сейчас такая модель Хозяйствования работает успешно .",1675154744,734483674
7401234,С такими друзьями надо быть начеку,1675154872,736378077
7401234,"Китай может в любой момент перестроиться на нашу экономику. а у Штатов все производство в Китае, вряд ли они будут вводить против них санкции",1675156183,706738668
7401234,"И это только начало!! Кто бы не хотел иметь сотрудничество со страной, которая гарантировано буде выполнять условия, только если европа 🤣",1675156222,712668093
7401234,"зато все орут про мировую изоляцию))) Изолировала себя только Европа, причем себя от нас, да так, что осталось без всего",1675156264,719840903
7401234,"Европа плаче в сторонке 🤣 Все что должно было поставляться им, теперь будет получать Ближний и Дальний Восток",1675156285,719841037
7401234,"так США нам наоборот оказали услугу. благодаря их агрессии, наши с Китаем связи только укрепились.",1675156289,710600646
7401234,"Доигрались на западе, Россия широкая страна, покупателей всегда найдет, а вот они замену нам вряд ли найдут",1675156310,758720942
7401234,США при этом всеми силами хотят доказать что нам союз не такой и крепкий),1675156483,708072427
7401234,"Штаты явно не предполагали даже, что Китай точно выскажет свою позицию. Теперь может они и пыл свой подубавят",1675157593,709793523
7401234,"Американский план не удался, собственно растет у нас товарооборот не только с Китаем, но так же и с остальными странами БРИКС",1675157824,709795285
7401234,"Главная наша цель это такой же товарооборот что бы был в странах БРИКС, это тоже не за горами",1675157846,706786908
7401234,"Да тут первостепенно главное что США боится Китая) К стычкам еще и с ним они точно не готовы. Они надеялись, что Россию быстрее смогут вывести из строя. но не получилось.",1675157906,710582028
7401234,"Помимо Китая имеется так же Индия, Бразилия, с которыми у нас сотрудничество растет в рамках БРИКС",1675157989,711176500
7401234,"Санкции убьют нас говорили страны запада, а что по итогу, почему у них рецессия куда больше, как объясняться будут?",1675158014,721010181
7401234,"Мы поняли, с кем можно и нужно развивать сотрудничество, по этому к странам запада уже никогда не будет никакого доверия",1675158052,721051865
7401234,"Доверие к американцам, а так же к Европейскому Союзу уже нет, слава Богу, что мы во время все это поняли и перестали с ними вести товарооборот",1675158101,777236095
7401234,"Китай - экономический гигант, который, к тому же, держит больше 80% американских производств)))",1675158106,671394995
7401234,"И для кого проблемами стали санкции, логично что для самих европейцев, товары то теперь им некуда поставлять, теряют миллиарды",1675158128,777221956
7401234,"Мы никогда не были против сотрудничать с той же Европой, но они показали что они полностью под подчинением штатов",1675158158,777221977
7401234,"Ну все делается для создания многополярного мира, и Россия и Китай этому сильно способствуют",1675158183,709794433
7401234,"Штаты по факту разрубили экономическую связь с нами себе же в убыток, а думали, что нанесут удар нашей экономике",1675158191,777221937
7401234,"А что думали американцы, что мы испугаемся остаться без макдональдса что ли? Ахах, насмешили)",1675158223,777221918
7401234,"Импортзамещение, а так же товарооборот со странами Азии в частности с Китаем и Индией показали что всем найдется замена)",1675158264,778396400
7401234,"[id294488005|Катерина], где? Я в Сибири живу, и поверите вижу как лес выпиливают и бесконечно везут в Китай. Максимум что у нас делают это мелкие производители вагонки и то не слишком высокого качества",1675158384,672707755
7401234,"И наши взаимоотношения будут только расти и крепнуть, ибо Европа показала себя не надежный партнером",1675158465,720907586
7401234,"Прекрасно,что все силы штатов были брошены на ослабление России,но мы напротив стали укреплять отношения с союзниками",1675158605,709796795
7401234,Так как раз-таки провокации США в сторону Китая и Тайваня и поспособствовали еще большему сближению наших гос-в,1675158716,709794560
7401234,Наша торговля и отношения продолжают расти и тут совершенно нечему удивляться,1675160670,780101227
7401234,"Ну ожидаемо , чать ушедших заняли наши компании , часть китай , глупо было ожидать , что оно останется пустовать",1675161646,720899769
7401234,"Россия хороший и перспективный рынок , не удивительно что китай спешит его занять , в рамках происходящего",1675161682,719735233
7401234,"В едь так надеялись , что никто не придет , что жкономика загентся , но все никак и никуда",1675161718,719699171
7401234,"Нужно понимать то, что сколько бы нас не старались настроить друг против друга - не получится. Многовековая взаимовыгода и помощь друг другу не прошла бесследно!",1675161975,708072325
7401234,"Китай никогда видимо не откажется от связей с Россией, потому что это сотрудничество действительно дает обеим сторонам большой профит.",1675162714,674516270
7401234,"Китай в любом случае, даже в случае введения санкций выдержит потому что он на стороне правды.",1675162723,708607123
7401234,"У России и Китая прочная экономическая связь, радует, что мы отошли от западного рынка в пользу восточного",1675163363,707731642
7401234,"просто нужно понимать и чувствовать разницу всего происходящего и того, что в нашей стране и в Китае тем-более не боятся ограничений.",1675163421,708074538
7401234,"а чего штаты хотели? Китай видит как штаты накачивают и настраивают украину против России, все это происходит, а потом штаты отправляют Пелоси на Тайвань, чтобы накалить ещё и там обстановку. Конечно после этого страны, у которых есть воля отставивать свои интересы не будет с ними пытаться сотрудничать",1675163970,712667709
7401234,"Россия не только сотрудничает с Китаем, но мы плюс ко всему еще и друзья, тем более, что у нас есть общий враг в лице НАТО, который намеревается начать 3 мировую войну, только они видимо не совсем понимают, что в случае войны с нами НАТО будет разгромлено",1675164455,708714227
7401234,"Санкциями США и ЕС уже никого не испугают, все и так прекрасно ясно, чего США добиваются",1675165690,715362172
7401234,С Китаем. Да он использует Россию просто.,1675166286,256024255
7401234,"В итоге по экономике мы даже не просели, всё из-за грамотного подхода наших экономистов.",1675169921,706783955
7401234,"Китай наши братья, которые поддерживают нас, самое главное, что у нас один общий враг, который будет разгромлен",1675170341,715362307
7401234,"Китай наш верный союзник и партнер, который придерживается тех же настроение, что и мы в отношении штатов",1675170560,709801938
