post_id,text,comment_time,from_id
20172484,"Мы должны признать, что запрет на выдачу лицензий на программное обеспечение и включение положений о запрете экспорта товаров в контракты с партнерами в третьих странах не соответствуют принципам свободной торговли и международным стандартам.

Участие России в международной торговле играет важную роль в нашем экономическом развитии и процветании. Мы стремимся к установлению взаимовыгодных отношений с другими странами на основе взаимного уважения и доверия.

Поэтому мы просим вас учесть интересы и потребности обычных людей, которые живут как в России, так и в Евросоюзе. Российские товары и продукты играют важную роль в их повседневной жизни, удовлетворяя их потребности и способствуя экономическому благополучию.

Мы должны искать возможности для диалога и сотрудничества, а не для ужесточения ограничений и разрыва экономических связей. Я призываю вас пересмотреть эти предложения и стремиться к построению конструктивных отношений между нашими странами.",1698771272,336495513
20172484,"Пока газ и некоторые природные ресурсы продаем им, так они и будут себя вести….",1698771597,13586849
20172484,"А какая цель, у этих санкций? Сделать Россию полностью самодостаточной страной, если бы они наращивали своё присутствие, это навредило бы гораздо больше",1698772301,639897145
20172484,"В пакет с пакетами, это мусор",1698772801,339652864
20172484,А когда же наконец на Израиль санкции введут????😡,1698776152,750603369
20172484,"12-ый пакет!!! Коалиция из 50 стран, 150 млд. долларов, 30 тыс санкций, а перемоги все нет😀😀😀😀",1698798387,142023791
20172484,,1698804225,413251556
20167615,"Все хотят дружить с Россией, даже сербы",1698584923,624287987
20167615,"Всё будет хорошо Вучич, надо немного потерпеть.",1698584982,587755572
20167615,"«...Белград развивает отношения с Америкой» – до следующей бомбардировки Белграда...
.",1698585251,229217297
20167615,"Мы хотели бы выразить нашу благодарность Сербии, которая уже более двух лет остается единственной страной в Европе, не применяющей антироссийские санкции.

Однако, мы хотели бы подчеркнуть, что такая автономная позиция Сербии вызывает уважение не только в России, но и во многих других странах, ценящих суверенитет и независимость в принятии решений.

Мы надеемся, что Сербия и другие страны продолжат следовать этому направлению. Это важно не только для наших двух стран, но и для всего международного сообщества, которому нужны примеры справедливой политики.",1698586223,336495513
20167615,"Вообще то это небольшая страна в европе ,окружена странами нато ,которые полностью легли под сша. Так что молодцы.",1698586509,155849408
20167615,"""Как закалялась сталь."" в помощь.",1698587226,314835365
20167615,Хороший конечно показатель независимости и свободы особенно гуцулам,1698590264,59116432
20167615,"Да и Венгрия не осбо-то бедствует, получая российские ресурсы",1698590610,732467278
20167615,,1698590634,615316149
20157094,Что может быть хуже врага? Предатель. Вот это Зеленский. Новое воплощение Иуды в 21 веке. Пособник фашистов 80 лет спустя.,1698178647,764196834
20157094,"То, что разговоры о мире начинают возникать, радует, но то, как их ведет Зеленский - сюр полнейший. Он обвиняет РФ в том, чем занимался/занимается сам, при всем этом, продолжает отказываться от переговоров и вымаливает у запада еще больше оружия.",1698179419,791203500
20157094,"а как запад может поддержать план который украина не может осуществить ? Россия конечно (в самом крайнем случае) может оставить временно часть территорий, но это не значит что она проиграет и капитулирует, и само собой война на этом не закончится. Зачем западу соглашатся на этот бред, если мир возможен только на условиях России ?",1698179629,798051133
20157094,"А кто там будет собираться, кончились бублики остались только дырки.",1698182526,375813793
20157094,"Нечего предлагать Зеле ,поэтому ему будут тактично отказывать, опять в коррупции обвинить могут.",1698196950,711113044
20157094,"Пару  месяцев назад этот саммит подавали бы , как пэрэмоху в весеннем контрнахрюке кошерного фюрерка гавнабородьки, а теперь вместо результатов пэрэмохи будут говорить о том, как переименовать капитуляцию кастрюлеголовых, и куда пристроить самого кошерного фюрерка гавнабородьку, к ССаке в соседнюю палату или сразу к бандерке отправить! Интересно общее фото с саммита будет в сети?",1698205177,379617231
20157094,Зеленский борется только за свою шкуру. На кону -жизнь его. А на Украину ему давно на.. рать!,1698226049,777108939
20157094,"Дьевольета может повзрывать, атомные станции на Украине.",1698229276,710532655
20157094,,1698233450,812879191
20157094,"Он мечтает при полном провале, что бы все проголосовали так: все завоевания России считать завоеваниями укрорейха, потому что он так хочет!",1698234085,710563982
20153871,,1698065179,57549813
20153871,,1698065182,756919803
20153871,Идиотизм продолжается,1698065182,677678414
20153871,"Лягушатники засрались, а Россия виновата.",1698065187,614589974
20153871,"Все,как вы любите,европейцы-Ложь и провокация,наслаждайтесь.",1698065214,756919803
20153871,"И тут Россия виновата🤣, Петров и Баширов опять хулиганят🤣🤣🤣",1698065291,274494947
20153871,"У Франции клопы - виновата Россия.
Классная логика у стран Запада, обвиняют нас даже когда мы реально не виноваты",1698065331,706707183
20153871,Когда разведке действительно есть чем заняться 😂😂😂,1698065452,13519949
20153871,"Оооо, дибилизм сплошной, а если понос у всех жабоедов пиндосовских начнется тоже Россия будет виноваты, дебилы если не хуже .",1698065593,176275606
20153871,"Европу в средневековье! ""Старый свет"".👎🚽",1698065719,651416396
20153871,Так во Франции и крыс не меньше чем клопов.,1698065871,46293266
20153871,,1698066025,812879191
20153871,Маразм крепчал🤦‍♂,1698066089,21869853
20153871,"Им совсем заняться нечем что-ли?) Пускай лучше клопов травят, а не байки в интернете)",1698066096,680011794
20153871,Клопы будут свободны.,1698066151,253228083
20153871,"С больной головы , да на здоровую ).",1698066675,135333598
20153871,А зачем фрацузы читают российские СМИ?,1698066721,37633694
20153871,"Бань не было мылись два раза в жизни  родились и женились ! Всё ) воды не было , дров .тоже .",1698066849,135333598
20153871,"Если о проблемах не говорить, то и проблемы не будет 🤣",1698066863,811844704
20153871,Как же их легко довести до психоза 😂😂😂,1698068057,710419899
20153871,,1698068099,746852914
20153871,🤣🤣,1698068369,506637054
20153871,,1698068397,506637054
20153871,Российские СМИ везде блокированы..  . как это возможно..?!)),1698068409,515718140
20153871,"Толпы Буддистов вышли на улицы Франции, с требованием прекратить убийство клопов, потому как это могут быть их родственники! 🤣🤣🤣",1698068562,710603685
20153871,"мм , тобишь всей францией они смотрят Русские сми , которые только об этом и говрят , я вообще до обвинений не слышала о таком",1698068905,712666677
20153871,"А прибраться в доме и на улице не пробовали? Белье, например, постирать и погладить,как у нас это делают, раз в неделю?",1698068967,728436525
20153871,Это Путин виноват.,1698069716,746352891
20153871,"Развели клоповник, ещё и возмущаются.",1698069993,148009792
20153871,Клопы с нашими паспортами и российскиии флагами,1698070412,711150221
20153871,А что во Франции клопов не едят?,1698070918,34283852
20153871,"Надо мыться и стираться, а не жрать лягушек!",1698071173,287951864
20153871,"А Европе и не привыкать жить в говне и копаться в клопах!Возврат в прошлое.Хорошо,хоть Россия научила их купаться и не вонять!",1698072196,699925412
20153871,"Как были плебеями, так и остались! Хранцузы блин!",1698072599,750603369
20153871,"Дожили, разведка клопами занялась, идиоты.",1698073695,621725024
20153871,"Закирьян агай молодец, настоящий ученый!",1698074075,348632379
20153871,"Придурки, сами разнесли, гавнюки.",1698074397,816187988
20153871,Не мытая Европа,1698074465,339652864
20153871,Клопы..тараканы..и воши конечно..я вас поздравляю французы сердечно...за что наказанье...? От куда зараза? Да просто не любит Господь..педерастов👺,1698075188,364675572
20153871,,1698075195,11354300
20153871,"ладно бы СМИ сообщили, но французская разведка? Какой макрон, такие и службы",1698075203,683601553
20153871,"Жизнь клопов во Франции тоже имеет значение ""Слава Французским клопам""",1698076598,792331186
20153871,"Лягушатники ваша разведка, это детский сад😃",1698079829,343381587
20153871,"«Украинцы  странные люди -молятся на  европейцев , работают на евреев, воюют за Америку  и за все это ненавидят Россию»-В В Жириновский",1698079877,718750589
20153871,"А ведь Россия предупреждала.
Не будите медведя.
Нет же разбудили весь лес. Вот и клопики подтянулись.🇷🇺🇷🇺🇷🇺💪",1698081380,627232435
20153871,"Как я погляжу, они в средневековье летят на всех парах...",1698082519,878146
20153871,,1698082734,71436975
20153871,Мисье Ле клоп😂😂😂,1698083617,251170649
20153871,"В смысле Россия не имеет отношения к наплыву насекомых????? Нет уж, это мы их подбросили! 😂",1698088666,495815453
20153871,"Похоже на адекватность нужно проверить Европу вместе с Украиной, да заодно и Америку. Что бы где не случилось, даже чихнуть , не говоря про клопов,  виновата Россия . У виновного всегда безвинный виноват.",1698089456,136673020
20153871,Это наши клопы-разведчики 🤣🤣,1698090830,41890728
20153871,А что их разведка только с клопами. Я помню 70г у нас они уже были а может другая причина,1698090933,748239956
20153871,Пусть жрут это им будет урок как весело в России живётся это им за жука,1698091373,748239956
20153871,Так вот они какие!,1698091938,251375304
20153871,Засрались.,1698094039,134675117
20153871,"Они всегда были, вонючки",1698096714,705337551
20153871,Одевали парики,1698096744,705337551
20153871,Ещё вшей им за это подбросить надо бы и триппер бытовой! Пусть чешутся грязнули.,1698141471,17719421
20151302,А шо таке?,1697968625,67456222
20151302,"Парадокс , от санкций страдают все кроме России.",1697968782,456820085
20151302,Ну давайте же их пожалеем…погладим по этим бокам😜,1697968945,15849803
20151302,"Да многим странам, которые решили вводить против России санкции, сами сейчас и страдают от них",1697969228,712815249
20151302,"О а это уже и последствия пошли самим инициаторам антироссийских санкций, то ли еще будет, осознают как хотели РФ напакостить",1697969233,684457917
20151302,"Ну и пусть складывают свои санкции на полочку, зимой буржуйку растопят ... Как то начихать на все их потуги......",1697971536,144315162
20151302,Правильно,1697974704,643312365
20151302,на что они вообще надеялись своими санкциями,1697975106,683601553
20151302,"Блин, если у нас столько лососёвых в РФ, то почему я в СПб покупаю её по великим праздникам по 800₽ за кг. Рыбка выходит в 3-4 к",1697975904,7032750
20151302,Пусть свою ловят,1698014821,356752281
20151302,япономать ....),1698024180,123093432
20151302,"Нисколько не жалко,пусть едят  побольше,чтоб не пропала",1698043899,643211144
20149013,12🤣🤣🤣,1697875602,251286931
20149013,все санкции которые вводят против России потом на ЕС и оказывают влияния ),1697878016,722101952
20149013,Ну хоть скрепки оставили )!!!,1697878227,148130477
20149013,сколько бы не было этих санкций всё равно нам уже. не первый год с ними живём всё таки,1697879162,729710609
20149013,"А вот что толку от этих санкций? Какоео они значение в целом должны оказывать то? Запад вечно пальцы гнета,а по факту вредит экомические сам себе,да и спрос на наши энергетические ресурсы на деле никуда не делся",1697887465,693147314
20149013,"""О господи! Как мы проживем без Латвийских иголок и спиц?"" (САРКАЗМ)! Они реально думают что это на что-то повлияет? У нас даже если бы не было производства (а оно есть), организовать своё - ничего не стоит. Россия самостоятельная страна, все уже должны были это понять.",1697888825,699923152
20149013,"Ой, санкции санкции, сейчас их полно, при этом Развитие в России идет полным ходом... Пусть дальше пугают",1697888845,695212122
20149013,"Жалко, что не сотый пакет санкций, мало видимо инициаторам санкций последствий было, аз они продолжают о новом говорить, хотят еще в свои страны последствия притянуть",1697888972,789960441
20149013,"Ой, да это смешно просто, они до сих пор не поняли, что своими санкциями против РФ вредят собственной экономике",1697891082,729847302
20149013,"Прекрасно, а то мы уже думали что они решили больше не помогать Рсосии развиваться",1697892177,728585909
20149013,интересно сколько максимум будет пакетов санкций ? 20 ? 100 ? просто насколько фантазии у ес хватит,1697893405,731814144
20149013,"ве санкции на Россию никак не оказывают никакого влияния , тем более мы сильная страна",1697896137,730789302
20149013,"Я только вчера была в магазине пряжи. Латвийских спиц не нашла🤣, купила проверенные и качественные российские. Ещё и выбирала. 😃",1697899671,71409855
20149013,"антироссийские санкции же обыно самим накладывателям и вредят, пока на Россию они совсем не влияют",1697926839,701315928
20149013,"Санкции не могут иметь долгосрочный характер, ибо она навредит всем ее участникам, а не только одной стороне",1697936214,729696716
20149013,сами то не устали в ес и сша ещё от этих санкций. ну их уже кажестя под миллион. фантазии не хватит же больше,1697960892,695205001
20148301,,1697832910,25642781
20148301,Ваш гномик никого не пугает.,1697832982,25642781
20148301,"Китай боялся такого союза, и при этом только сами подтолкнули наши страны к этому союзу, и теперь будут делат ьвсе что бы разделить наши страны",1697837341,809299781
20148301,"Да америка в принципе переживает когда Россия и Китай что то обсуждает , потому что они понимают насколько вместе мы сильны",1697850150,767367493
20148301,"Дай то Боже, что бы у России и Китая все получилось,  противостоять Империи зла.",1697858467,136673020
20148301,"Западники понимают, что союз России и Китая - мощнейший союз, который никогда не прогнется под гегемонию Штатов, вот и напряглись.",1697863317,730091106
20148301,,1697869490,709632064
20148301,"Кого может напугать дедушка, что вы несете.",1697873085,277974390
20148301,,1697902520,611816411
20147824,"Врёт, постоянно врёт.",1697814525,812799155
20147824,"Они много еще чего не считают... В частности, не считают необходимым быть вне политики... :)",1697814591,484282464
20147824,Ну вот ведь сволочи! Выкрутился 😡,1697814612,429134593
20147824,Маразм крепчает!,1697814720,765047024
20147824,Урод!,1697814739,233726054
20147824,"А насчет евреев что ? Под нейтральным флагом ? Да что я, это другое, сионистов нельзя трогать, гляди потом себя придется исключать",1697814783,34119855
20147824,какой же этот бах урод по жизни. Не даром он потомок гитлеровца. Киланин и Самаранч такими не были а были самостоятельными и независимыми и Киланин бойкот московской олимпиады отклонил а этот прогинается,1697815097,679601190
20147824,"Пошел вон слабое звено ! Впредь Россия будет проводить Олимпийские игры .Америка ваша с вами , а с нами весь мир ! 👍",1697815158,135333598
20147824,чёт не помню чтоб америкосов и натовских подстилок дисквалифицировали когда они бомбили страны,1697815327,181310260
20147824,"А что это?’ Имела вас,Россия,с вашими заявлениями!",1697815793,695264552
20147824,"Шел бы он лесом, ему наверно приятнее будет смотреть на трансгендера, в этом случае приятного просмотра и радужный флаг ему в руки, а  мы в такие ( не соревнования )  игрульки не участвуем и слава богу....",1697815841,730787399
20147824,"Почему же тогда не отстранили от Игр всех европейцев за бомбардировки Сербии и Ливии? Однако МОК 3,14 здит. Лёг под американцев, а признаться стыдно.",1697816084,270415994
20147824,Бах...и завалил е..ало,1697816345,472578467
20147824,Не надо платить ни рубля пошлину в МОК!,1697816378,64551369
20147824,"А штаты когда Белград бомбили, где были их олимпийские хартии?)Двуличные особи",1697816474,738578015
20147824,Этому МОК не стыдно на фоне 5 колец чего то говорить??? Несёт сидит какаю то ересть!,1697816589,441803157
20147824,Лицемерие ничего больше.,1697816782,13139548
20147824,"МОК  вылечитесь от слепоглухонемощности и когнитивные функции подтяните!
 Равенство - это, когда для всех одинаковые условия!
 А разные - это и есть дискриминационные?
 А, может, России привлечь МОК к уголовной ответственности  за дискриминацию спортсменов РФ по законам РФ?!",1697816912,625002055
