post_id,text,comment_time,from_id
20288100,"Я предлагаю перефразировать текст, чтобы сделать его более уникальным и легким для восприятия:

Санкции, по-моему мнению, стали слишком тягостными. Они не направлены против мирных россиян, а против тех, кто поддерживает текущую ситуацию.

Нельзя сказать, что все идет гладко. Россия не полностью справилась с последствиями этих ограничений. В некоторых случаях нам удалось преодолеть их воздействие, но в других это было крайне сложно. Эти санкции серьезно влияют на повседневную жизнь населения России.

Прошу вас вернуть на российское телевидение наши любимые каналы: Discovery, Disney, National Geographic, TLC и Animal Planet. Их отсутствие создает неприятную пустоту в нашей программе.

Эти телеканалы являются источником уникальных возможностей для образования и развлечения. Они помогают расширить наш кругозор, позволяют погрузиться в разные культуры, природу и науку. Многие из нас долгое время пользовались этими каналами, чтобы узнавать новое и получать вдохновение от их программ.

Уверена, что восстановление этих телеканалов на российском телевидении принесет огромную пользу обществу. Они могут стать источником знаний и вдохновения для многих зрителей в России.

Надеюсь, что вы обратите внимание на нашу просьбу и учтете наше стремление получить доступ к этим важным телеканалам.",1702652382,336495513
20287364,"Ну и дичь)
У ЕС по всем фронтам просадки, а они лишь на очередной пакет санкций разразились, ну и идиоты, очередной выстрел в собственное колено.",1702630544,680011794
20287364,"В Европе и остальном мире никак не могут догнать, что санкции изжили себя давно, как инструмент давления на определённые страны многие страны находятся под ними долгие годы и никакой катастрофы не произошло",1702631683,82095948
20287364,вилки и ложки запретят поставлять ? ну что это за цирк такой,1702631949,710565173
20287364,"Даже читать не буду, пускай этот пакет вставят себе в жопу и прыгнут на него с пятого этажа , придурки.",1702664640,176275606
20287272,Перекрыть нахрен трубу!!!,1702627829,338706877
20287272,"Во демократия, а. Европа хочет принять выгодной для саттелистов США закон, а кому не нравится, тем указывают на выход",1702629258,610527236
20287272,"В ЕС коллективное сумасшествие продолжает набирать обороты, ведь иначе эту дурость с санкциями просто назвать нельзя)",1702630620,680011794
20287272,в ЕС не устали просто так санкции вводить в воздух?,1702653241,680870853
20286427,"Венгрия, Словакия.",1702586369,6059233
20286427,"Смысл и суть экономического роста государства заключается в том, что не снижается численность населения, а повышается производимая нацией продукция, таким образом, чтобы объем, производимый нацией, превышал запрос демографического прироста нации.",1702627235,795835577
20280057,"Ну да, приехал с протянутой рукой снова. А у них в телеке народу будут показывать что все отлично т.д и т.п. А смысл помогать? Пепел снова не загорится, наркоман бы уже давно смерился что у него ничего не вышло, а он продолжает побираться",1702450748,830776569
20280057,,1702450978,144315162
20280057,"И чуть ниже в новостях:
Байден объявил о выделении средств на встрече с Зеленским в Белом доме. Деньги выделят из уже одобренного конгрессом объема финансирования, они пойдут на обеспечение оборонных нужд Украины. Россия осуждает поставки оружия Киеву 
Антонов уверен, что встреча пустая получилась?",1702451784,5625137
20280057,"ну так ничего такого и не произошло, потому что Зеленскому даже не пообещали ничего",1702453253,701809050
20280057,"как и все его последние выползки , на них забили болта , в связи с чем и результатов никаких нет",1702453453,721074920
20280057,ответ прост: все устали от УКраины и от Зеленского,1702454109,701808802
20280057,,1702455949,441644982
20280057,"Американская демократия действует лишь в угоду собственным интересам, а решившие поиграть в неё страны быстро становятся жертвой интриг США и лишаются суверенитета, после чего их народ превращается в рабов, которым придется до конца своих дней выполнять волю США.",1702456562,688270085
20278118,"Хм, надо будет спички закупить...",1702401371,597587856
20278118,Пошли в дыру.,1702403588,590800924
20277947,"Расширят они санкции или нет, нам вообще по боку на это и никак на наши жизни не повлияет",1702398885,676458347
20277947,🤬🤬🤬,1702399117,593657723
20277947,,1702399124,751384977
20277947,Да как то ухю.,1702399833,13301470
20277947,"Тем не менее экспорт стратегических ресурсов (например, урана, редкоземельных металлов) из России в США расширяется. То есть, как всегда, в ответ на санкции, РФ подставляет вторую щеку для удара. А встречных санкций, как не было, так и нет.",1702400428,352714139
20277947,Значит в нас выдуть сверх держава и это не за горами,1702402178,765370773
20277947,"Китайская экономика, разработанная в неокейнсианской политике, позволила этому государству добиться огромных высот на промышленном ""поле"", так как именно эта отрасль ставится там во главу угла. России подобное бы тоже не помешало.",1702407209,407551736
20275113,"Ясен красен, они же никак не связаны с сво",1702328838,116219564
20275113,"Просто скажут,санкций не было. Санкции придумали фантасты.",1702330304,510425105
20275113,"Да судьба там будет такая, что по итогу чисто там будет так что они не смогут жить бюез России, и с этими санкциями там чисто просто все загнуться и все",1702339529,767373417
20275113,Приедут с повинной.,1702364864,404745674
20271121,Шатать из внутри,1702226182,80465657
20271121,"Деньги закончились, а самое главное они там ......  ненужны.",1702226428,217405652
20271121,Все они возвращаются с заданием от ЦРУ,1702226496,826373203
20271121,Очень кушать хочется🤣,1702226582,15060823
20271121,Вам здесь не рады.,1702226737,134237515
20271121,"Вот и всплыло всё дерьмо... 
Присягавшее когда-то... 
Все «детишки» — навальнята, 
И всё прочее «ОНО»... 
Кто от Армии «косил», 
Громче всех кричал о «праве», 
Кто вдруг сразу стал «больным», 
«Голубым», дегенератом... 
И «поют» теперь в сетях, 
Сидя дома на диване, - 
«Всё пропало, всё не так, 
Мы ни в чём не виноваты..». 
Или, прыгнув в «Мерседес», 
Мчат в Израиль... и в ЕС... 
И пора уже понять, 
Хватит с ними нам играть! 
Эту «пятую колонну» 
Надо «вычистить» до дна, 
Чтобы было неповадно 
Грязью русских поливать!",1702227041,27216126
20271121,"Опять мусорит, срать, сать и плеватся начнёт этот биомусор ненавидящий Россию и русских 🤔 👎",1702227309,14882526
20271121,"ПРЕДАЛИ. А уж из идиотизма, трусости, подлости, денег - не принципиально. ПРЕДАЛИ. И за это надо отвечать.",1702227335,179681236
20271121,"В России все знают американских певцов, в Америке никто не знает российских певцов...",1702227408,10241293
20271121,"Нет такого слова в русском  языке, есть предатель, изменник, враг",1702228637,595268557
20271121,Бог им судья! Они возвращаются пить из колодца в который плевали! Вот и все.,1702228822,768721772
20271121,Игнорировать их всех. Никаких концертов ни передач. Пусть идут на фермы коровм хвосты крутить. Хвптит им деньги лопатой грести. Пусть вьеб.... т по полной. Тва. и. Прижало и о России вспомнили.,1702229034,763614523
20271121,"У эксперта должно быть имя , а так .... ,это фуфлогон от LIFE.ru",1702229122,570359098
20271121,"Потому что лучше, чем на родине,нет нигде. В целом было просто глупо полагать, что на западе им будут рады",1702231159,803722345
20271121,Как к предателям надо относится ? так чтоб другим не повадно было !!!!,1702232544,821379175
20271121,Они никому не нужны,1702262100,696309777
20271121,Они и тут не нужны,1702267810,352912650
20271121,В окопы его.... Кому пуговицу пришить... Под воротничок подшить,1702276342,466950721
20271121,Почему их пускают назад,1702278714,807545514
20271121,"Этому Васильеву уже 60!! Посадить его на 12046р07 коп. , и пусть выживает. А ещё хорошо бы в деревню и поглубже. В России мест много. И пусть выживает. А так же ряд других иже с ним!!!.",1702289545,455631515
20271121,"Почему их то есть этих го.....нов надо прощать.... получается наши солдаты ради этих там погибают?!,надо их через СВО принимать..Мы задали этот вопрос Путину,если нас больше будет, неверно ОН примет подобающие меры!Сейчас как раз Момент?Ато нас они за людей не считают",1702290734,816871674
20265098,Чайник свистит у пендосов,1702069708,41821200
20265098,Братеево )👍,1702071305,45850605
20265098,Скоро всей вашей Америке кердык 😄,1702088701,64114432
20265098,"Против всех вышестоящих ввели санкции,теперь против простых поименно вводить будут. И почему один Ваня? Больше так никого не было,он один нарушал? А сами то права человека соблюдают?",1702096250,201274157
20259934,"Уши ему надрать, что бы как ручки у самовара стали.",1701975939,176275606
20259934,Всё больше разумных голов появляется в Европе.,1701981764,290257427
20257504,"а мне радостно. Чем меньше нашего ворья там жирует, тем благостнее у меня на душе",1701892151,492725672
20257504,"Все устали повторять, что ""англичанка гадит"".",1701893692,290257427
20254894,"🤣👌Да у меня он на Даче в Завидово «Дон»… Хороший сон , отличный аппетит и прекрасное настроение… Госдеп просьба НЕ беспокоиться… Даже не знаю чем вам помочь… 😝🤣😇",1701794632,341297204
20254894,"Папашка его и здаст,  деньги то не лишние! 😁",1701794800,408551257
20254894,Что? Папа -Павлик Морозов наоборот?,1701795380,767043072
20254894,Перечисляйте денег!,1701795447,828454897
20254894,"Они найдут 7 млн причин чтобы не отправлять деньги россиянину и тем более в Россию, а Россия - одну, чтобы его не отправлять в США, так что домой Артём)",1701795858,66407068
20254894,"Я б на месте Артюши скинул им свою геолокацию в РФ и заработал 7 млн зелени...
Вообще, я б посмотрел на этот вестерн как они его отсюда выколупывать будут 😂",1701796124,432126908
20254894,обвиняют в уклонении от санкций и отмывании денег🤣🤣🤣🤣🤣🤣🤣🤣🤣🤣🤣🤣🤣🤣🤣🤣,1701796205,492571819
20254894,"Интересно, что они в амере пьют и едят? Все время как под кайфом - такие предложения скидывают, что в цирк ходить не надо! С ними весело",1701796336,11222513
20254894,"Ну за уклонение от санкций в розыск не объявляют 
Что же он вам такого сделал, интересно? 😁",1701799458,10281480
20254894,Обделались сша со своими санкциями,1701800334,339652864
20254894,"Ему ваши санкции,как до одного места.",1701800341,784960070
20254894,Папу надо трясти срочно чтобы дал наводку где его сынок и сколько денег на нас отмыли,1701805175,282597953
20254894,Я знаю где он деньги давайте,1701826788,29564109
20254894,Сдать его Американцам,1701828074,778752446
20254894,В США НЕ ЛЮБЯТ РОССИЙСКИХ БАРЫГ ! Нажившихся на грабеже России . 🤣🤣🤣🤣🤣🤣🤣🤣🤣🤣🤣,1701842481,742788726
20254894,Вместе с папой выдать к едреней фене.Зачем нам аферисты нужны.,1701863729,137904445
20244794,,1701425346,597600777
20244794,"Как бы европейцы могли догадаться, что сокращение присутствия России на мировом рынке повлечет за собой и сокращение продукции, а чем продукции меньше, тем цена выше. Обыные законы рынка, который Европа собственными руками продолжает душить.",1701425951,832171250
20242257,Придурки,1701330234,442217324
20242257,"В отличии от наших властей РФ, они не балаболят , а делают..",1701330554,679079959
20242257,"Куда это она собралась, да ещё в сторону запада. Новогодние праздники в недружественных странах снова отмечать, айяйяй",1701330564,755205723
20242257,"Очередная нелепая и провокативная выходка болгарских властей. Подло и бездарно как-то у них всё получается. Мария Захарова права, когда говорит, что они позорят свой народ!",1701330606,749231672
20242257,Боятся! Значит уважают Машеньку☝️💪💤,1701330885,616358961
20242257,"Болгары- заразы
Вы же славяне
Продались Вы западу
За мани- мани
Но время рассудит 
Кто прав, а кто нет 
И будете делать
России м… т!",1701331128,440527005
20242257,"Вот не нравилась она мне раньше, но чем больше её узнаю, тем больше люблю😍😍😍",1701331467,11404893
20242257,"Вообще то они летят на саммит ОБСЕ, а вот "" братушки ""   съехали с катушек",1701331939,525080060
20242257,Ну тупые...аукнутся им еще ее слезки.,1701332360,563690196
20242257,Задолбали эти недогосударства,1701333205,254996086
20242257,"А что они сделают если пролетят? Хахахах, ножками громко потопают?)))",1701333382,27200501
20242257,"Только правду говорит умная женщина, красава.",1701333693,375676460
20242257,Да как они посмели меня не пустить?! Ни за фто не прощуууууууу,1701334130,2529623
20242257,Киркорова им назад отправить👍,1701335323,755027399
20242257,"Болгары -шкуры продажные .  Ещё хуже чем немцы . От немцев хоть знаешь что можно ожидать , а эти
 "" братушки"" просто нож в спину вставляли  из покон веков.",1701340910,649437486
20242257,"Братушки они давно не суверенны, всё решает хозяин из-за океана.",1701346217,640746808
20242257,Они ничтожны. Их раболепство перед США Смешно. Наша сила в правде. Со временем они это поймут.,1701366624,696274262
20237163,Плохо наш Минфин и Центробанк работают по обмену активов...,1701160455,504151277
20237163,"о как, ес поняли, что не могут справиться без России со своими санкциями и изоляциями, решили теперь уже грабежом наших актовов заняться?",1701160900,721008814
20237163,"Надо было строить все у себя в стране, хотя тоже не факт « сбережения»!🤷",1701161103,13586849
20237163,Это называется воровство по-западному и зря они думают что им потом не придётся это имущество русским возвращать,1701161188,681497098
20237163,Изымайте,1701161807,621725024
20237163,"Партнёры они такие, да Вован? 🤔",1701162528,14882526
20237163,"Большинство россиян так расстроились, так расстроилась",1701163738,202587055
20237163,Всё просто прекрасно мне это даже нравится напоминает 1917 год когда у богатых холопы всё отнимали,1701164707,686295325
20237163,Тут только объявлять войну больше ни как уже не чего не вернешь,1701167638,13275273
20237163,"Разве это санкции. Это моськино лаяние. Вот ели бы они... Вот не знаю. Нет у них никакого ""если бы"".",1701167679,222870624
20237163,Очень радует🥰,1701169631,739379774
20237163,скроем их в арене,1701175962,165847059
20237163,"За все платить придется. Я даже знаю когда. Когда одна из стран наты  довые...тся и получит п...двъы, а остальные тихо сольються. Вот тогда шавки и призадумаются.",1701178581,142023791
20236085,"Я бы конечно одно словечко написал, но боюсь удалят.
Л****Ы😀",1701103617,92557991
20236085,"Русских теперь ненавидят в Европе. Странно это видеть, потому что страдают обычные люди от этого, хотя европейцы все еще твердо уверены, что они демократы и либералы полностью, никакого расизма и национализма. Ну да, держите карман шире.",1701103926,793795617
20236085,Венгерские политики вслед за Орбаном начинают понимать чтот,1701107289,797192812
20235968,конечно Киев не подпишет потому что уже ни кого не будет все сдохнут на сво,1701100537,91402939
20235968,🙄 что у них в голове?,1701100771,772874639
20235968,ну тогда ждем когда желтоухие свинья начнут визжать - а киев чей? ахах,1701100779,154323699
20235968,"Спрашивать никто не будет .Америка все решила .Подпишите все , что скажут )))",1701100989,135333598
20235968,Ню-ню🤣🤣🤣🤣,1701101249,60265147
20235968,"Украина должн принять условия России,если хочет сохранить то, что у них есть сейчас",1701101506,710933374
20235968,"Ирина не мудра, а Тупа, поэтому хрень и несёт🤦‍♂️",1701102782,496325537
20235968,"Я может чего-то не понимаю, но репарации и контрибуции и т д выплачивает проигравшая страна Судя по сводкам с фронта Россия таковой не является  Если хотят мира пусть замолчать и принимают условия России",1701103129,590106541
20235968,,1701103249,217622665
20235968,,1701104877,263976320
20235968,Уже торгуются?),1701105307,229045275
20235968,поссосаций россия может только выписать,1701105370,527264502
20235968,"Есть один нюанс вас поганых и спрашивать никто не будет, ещё и пара городов отдадите 🤣💨",1701105505,59116432
20235968,Тогда Россия заберëт себе всë.,1701106097,100414886
20235968,"..😕мировое соглашение (?),❗ КАПИТУЛЯЦИЯ❗☝😐❗и не репарации , а с трепанацией всей фашисткой своры с пособниками и сочувствующими помогалками ..",1701106195,832231443
20235968,"Укропы ещё думают,что у них есть страна? 🤣
Страна Долгов и должников с Майдановской болезнью 🤣",1701106505,39759533
