post_id,text,comment_time,from_id
20053787,Международные санкции вводит лишь СБ ООН ( ст. 41 Устава ООН),1694009001,292246494
20053787,Уже только в прошедшем времени.,1694009219,287958914
20053787,"Ну и что нам порадоваться надо ? Какой прогресс,а страна под санкциями.",1694012478,711650503
20053787,Камень тронулся . Зима на носу,1694021490,709288787
20053787,Видео хорошо за щеку взял!,1694093094,278413020
20053364,В чью пользу отменят у Франции игры,1694010959,339652864
20053364,"Да, зачем России ЛГБТ- Олимпиада? 
Без  Гимна РФ и Российского Флага?
Сделать БРИКС - Олимпиаду надо!
Политико- свободную со спортивной отвагой!!!!!",1694013691,625002055
20053364,"Что есть WADA? 
ЛГБТ бадага???",1694013730,625002055
20049790,Батурина--гений!..,1693856540,11201322
20049790,"Для чего нам эта информация?Потроллить нас?Переживаем за СВО,пока кто то скачет по местам первенства в достатке.",1693857149,711372004
20049790,Если Честно Совсем Пофиг.,1693858146,378579402
20049790,"Мдааа, лайф уже не тот, пора отписываться походу",1693858855,658669072
20049790,Вот бы я ещё о ней думала. 😈,1693875551,698543509
20049790,Без Лужкова Батурина - никто ! Ноль !,1693887716,7295773
20049790,"Да все эти черти у народа России наворовали столько,что на 100 жизней хватит.",1693898041,599364642
20049729,Эта отрасль-рост цен...(,1693854163,361747674
20049729,пятерочки магниты манетки?)😂,1693854661,241617507
20049729,"Чиновничество. Ведь СССР был больше, а чиновников в нём было меньше и вот несмотря на санкции их становится все больше и больше.Стабильная отрасль.",1693854802,66439922
20049729,отрасль коррупции и узурпации путиным государственной власти или отрасль по производству цинковых гробом для россиян уничтожаемых путиным своей военной авантюрой??,1693855305,797404739
20045950,Сам себе отморожу уши. И чего ради?,1693730676,590800924
20045950,"Неужели в ЕС поняли, что санкции антироссийские им только боком встали?",1693734720,793159569
20037365,на пару воровали....,1693402633,139924049
20037365,Тупые опросы,1693404575,5787384
20037365,"наверно кассиршей в ,,Пятерочке,, работает😄😄😄",1693412468,432387204
20037365,"Трудом правильным, не наживешь палат каменных!",1693469736,389477987
20037365,"Ничего себе, как живут и чем занимаются ректора петербургских университетов. Это ж что получается, что ректора учебных заведений в России получают такую зарплату, что в состоянии делать миллиардные вложения в бизнес? А еще они удивляются, что на них санкции накладывают и  арестовывают их счета и недвижимость на Западе? Такое только в России возможно, чтобы простой ректор был миллиардером.",1693489708,19324634
20034219,"Ну, США как всегда, пытаются манипулировать, они только так всегда и действуют",1693264570,793203730
20034219,"Придурки , а просто снять их ? Кто вообще Штаты такие , чтобы миру что-то приказыыать",1693266274,793171226
20034219,"Белый дом начинает осознавать, что их санкции совсем не работают на другие старны, особенно на Россиюшку",1693272511,683616581
20034219,"США слишком сильно полагаются на свое влияние, которое с каждым днем все слабее и слабее, а все из-за отстутсвия компетентного органа упралвения, вместо него старый дед с деменцией.",1693273754,706788839
20034219,"Венесуэла умирает от простуды и прочих легких заболеваний и голода!!!! , сша геноцидом извращённым заниматься. мир согласно отсасывает сша то что  давно не стоит.",1693279422,103022173
20034219,После сына Джо НЛО 😂 он стал ещё белее,1693282792,59116432
20034219,"Что нефти захотелось, саудиты послали так стали примазыватся к Венесуэле. 😏",1693307469,714473972
20033718,Дебилы европейские,1693235045,534626673
20033718,Они ждали какой то мольбы от него ? Е5 наивные клоуны ),1693235422,337836044
20033718,✅️лучший президент,1693235462,215513576
20033718,Справимся ! Россия самая сильная страна ! ❤,1693236252,135333598
20033718,Ну так это не россияне под санкциями стирают туалетную бумагу и вместо лягушиных лапок жрут бородавочных жаб с болот😜🤣🤣🤣,1693236386,753182144
20033718,Самый Лучший Президент в Мире. Россия Все Выдержит и Победит.,1693236600,378579402
20033718,Наш президент!!!,1693236765,41219931
20033718,😁😁😁,1693237861,594606700
20033718,🇷🇺🇷🇺🇷🇺❤️,1693238850,59116432
20033718,😍,1693240822,164152560
20033718,Не прошло и двух лет...))),1693242606,712935737
20033718,"Россия, ещё нет воевала, Россия сильная держава, Россия  победит!?!",1693242859,746689251
20033718,"Ну, в марте 2022 он всё ещё думал что всё у него будет чики-пики. Ему же кум Медведчук обещал!",1693246753,155635309
20033718,"Потому что пофигу что они там на западе решили.
Взяли и отрезали свои компаниям там доход.
Из-за этого компании начали мигрировать с запада.",1693302240,339652864
20032373,"Какой сюрприз , кто бы мог подумать.",1693177964,329325861
20032373,"Ну писец ,прям открыли тайну 🤦‍♂️",1693178754,573309635
20032373,Ну и что мы хотим?,1693179241,705474893
20032373,"ФОП меняется с 1 сентября, для всех ОУ учреждений.",1693179649,812799155
20032373,Скоро все будут по единому стандарту учиться,1693181241,763725891
20032373,,1693181633,409469450
20032373,"идем к тому , что алфавит выутат и все , на этом обучение закончится ..",1693182378,45738964
20032373,"Ну рассказали нам эту новость-не новость, дальше что? Какой реакции добиваются, что хотят от нас манипуляторы?",1693182437,184158181
20032373,А почему они всё ещё работают,1693197599,467273157
20032373,придурками становятся.,1693199958,286587742
20032373,Ну так пускай соответсвующие органы заинтересуются этим вопросом.,1693201093,198647354
20032373,"У нас патриотизм и любовь к отечеству, это только для простого люда",1693208715,398596675
20030911,"Так может поэтому,что вы все там безбожники,а с нами Господь Бог и Богородица!",1693127136,81282440
20030911,Не такое уж и грозное оказалось НАТОвское оружие!...,1693127333,806415621
20030911,"Да и не помощь это. Раскройие глаза!! Все вооружение устаревшое, было под утилизацию, утилизация стоит денег. Конечно выгодно под видом помощи продать стране 4 мира, то что им не нужно. Их военные парки обновляются, старье успешно с приболью утилизируется. Это бизнес. Любая война длится ровно столько, пока это кому то выгодно.",1693127517,6530971
20030911,"Ну если не помогло ни что, так милости просим на биржу в СПб. И!!!, за рубли. А то сдохнуть готовы, лишь бы российские товары за рубли не брать.",1693128975,750274593
20030911,"Мне известно одно преступное государство. Оно, заручившись поддержкой всего ""цивилизованного"" мира, занималось геноцидом гражданское население Ирака и Ирана. Но что-то общественного улюлюканья не наблюдается.",1693129271,810539684
20030911,"потому что пора признать тот факт, что какое бы оружие не дали украине-им не поможет, потому что управлять им будут необученные всу",1693129317,712681708
20030911,"ну так это то по сути к чему запад и стремился, они просто не смогли выиграть прокси пойну, и поставки не помогли, потому что вооружение у ВС РФ в разы сильнее",1693130163,721074694
20030911,Да хоть сколько там оружие!Что такое сраный Киев против огромной Страны!?,1693130688,540703298
20030911,"А на какие поставки Украина все еще рассчитывает тогда? Не помогут им и новые поставки, только потери будут считать",1693130741,793159569
20030911,Нет не проваленной. Они добиваются поставленных целей. Хаус войны  в умах большинства.,1693130782,426506683
20030911,А кого защищать им  на  украине -Зеленского ? Так  он им на гад ненужен !народ украинский  понимает все !,1693130907,812458305
20030911,А как Столтенберг махал руками угрожая Путину . Осталось только развести руками. Куда и спесь ушла .,1693131031,813636909
20030911,"У НАТО и не было такой цели, у них всё идёт по плану, сбыть всю старую технику, измотать Украину и Россию, что они и делают",1693131272,737629514
20030911,Надо читать историю,1693131595,785150864
20030911,"Западные поставки и не помогут всу ничем, уж больно Украина возлагает все на них какие-то надежды пустые",1693134542,684436400
20030911,"Бред! Это успех с их стороны. Конечно, что могут понимать лохи. Их заботят люди, а цель была в цифрах. Они были получены с избытком. БИУСы получили реальные данные, а не расчетные.",1693137759,135498715
20030911,"Вообще Украинское наступление просто смешно, все чего добились ВСУшники - это потеря 25 тыс солдат и 450 танков за 2 месяца",1693170636,719458332
20030911,"Дурачьё, дружить надо с Россией, а не воевать",1693172538,590010006
20024523,"Потому что сами наступили, на свои же грабли.",1692881052,812799155
20024523,"Взглянул на цены, провала санкций не обнаружил💁‍♂️",1692881542,755205723
20024523,"Слова этой откровенной дуры не стоят того, чтобы их  цитировать. Стыдно за Германию.",1692881607,673989267
20024523,"Ничего удивительного в их провале нет, ведь наша страна лишь укрепилась после введения всех этих ограничений.",1692881656,809266493
20024523,"Учитывая, что на поддержку туристической индустрии в России выделили аж более 20 млрд, то можно не беспокоиться о том, что некуда будет съездить отдохнуть из-за закрытых границ. У нас тоже есть много мест, где можно отдохнуть и полюбоваться красотами.",1692882052,806220734
20024523,"Посольство РФ в Берлине отправило ноту протеста из-за дискриминации наших соотечественников. Люди вышли на митинг и просят местные власти остановить травлю. Ненависть достигла такого накала, что сейчас для русских и русскоговорящих, кто живет и работает в Германии, это вопрос безопасности",1692882080,806223776
20024523,"Да у них всегда найдутся оправдания для своей тупости...тем более у Бербок, которая всю жизнь оправдывает собственную )",1692884259,710891667
20024523,За своей экономикой следи 🤣😂,1692885390,59116432
20024523,"А я думала, что опять кусты помешали.",1692887221,134675117
20024523,"Санкции западных стран против наших деятелей искусства лишь показывает слаботь этих государств. Им нечего нам противопоставить в политике и поэтому они пытаются подгадить нам в других сферах. Здесь все предельно ясно. Запад сам себя не уважает, поскольку так наплевательски относится к своим же ценностям",1692926438,814284436
20013732,"Запад себя уже задушил этими санкционными пакетами, напялив их себе на бошки",1692514646,707063119
20013181,Наконец то....,1692474904,789227719
20013181,"А вот это правильное решение. Себя уважать надо и добиваться того, чтобы и другие тебя уважали. Россия не станет пресмыкаться перед другими как некоторые.",1692488395,763685117
20013181,"Россия имеет гордость, и это правильно. Раньше надо было думать, когда наша страна взывала к дипломатии и говорила, что с нами выгодно сотрудничать",1692493331,810137087
20013181,"Спасибо Минфин РФ за то, что , наконец-то, выкатили яйца и шлепнули ими об Британию. Давно уже было пора напомнить о себе. И это радует, санкции ввели - никаких более дипломатических сообщений)",1692503990,728684387
20012939,,1692461311,30250282
20012939,Хорошо прятаться за спинами настоящих мастодондов.,1692461974,236884020
20012939,,1692461976,701587276
20012939,"Он истину говорит ,другого результата априори быть не может .Или мы их или они с нами кто в ад а кто в рай отправятся .",1692462166,747776498
20012939,Димас- айфончик)))😁,1692462325,802884752
20012939,"Ну всееее! 
Берегись запад! 
Медведев вышел на тропу войны!",1692463247,599944793
20012939,"Победить мощную ядерную державу невозможно при всём желании, об этом,даже, речи быть не может! Сотни раз неправы те, кто думает иначе!...",1692465544,806415621
20012939,"«И сгинет запад вместе с нами» -мне нравится такой расклад ,если дойдет до этого не дай бог этого.Не хочу чтобы янки и их шестерки  страны-вассалы жили после нас",1692465890,3825522
20012939,"Ребята, пора признаться что провалили все в стране.",1692470596,767235755
20012939,"Сколько бы украина не старалась и не брала тонн оружия, укронацисты никогда не сломят нашу страну.",1692492181,680867085
20012939,Из ЛТП выпустили?????????,1692499635,251150953
20012939,новые миры без жертв не появляются,1692506616,286587742
20011058,"#убегайте……мы вас поймаем мыши…,,.😂😎😏🤫и приведём к суду православному//////
простите вы враги!!!!",1692381018,363444135
20011058,"Зачем нам ваще эта информация? В мире столько войн, голода, болезней, а мы какую-то хрень постим",1692381269,21073381
20011058,Берюлева внесли?,1692426614,61660873
20010948,"канада горит,но мы поможем потушить посейдоном.",1692380578,282543539
20010948,"Ну а что им больше заняться нечем , вот они санкции нам и вводят",1692402011,721775213
20001539,"Отличный маркетинговый ход ,показывать разбитую западную военную технику .",1692014281,747776498
20001539,А где ароматы? Неужели все на Украине?,1692015164,556836197
20001539,"Не показала свою неэффективность, это как понимать?",1692015283,655491396
20001539,"Это к автору статьи, поколение егэ",1692015485,43370281
20001539,"Приятно видеть, что несмотря на информационное давление, столько стран и организаций все равно проявили доверие и интерес к данному мероприятию!",1692026111,778120130
20001539,"Теперь покупателей на нашу технику, в разы появятся",1692026749,145532936
20001539,"Далеко не безупречные,как гооврит сам запад о совей технике, но вес равно наше оружие в разы лучше) это еще и в зоне сво видно!",1692087983,731370155
20001539,"Дык так и надо выставить на всеобщее, пусть приезжают смотрят а кому не нравится посейдон в одно место с кинжалом...",1692163656,76905488
19995749,Истина,1691772706,464080534
19995749,"Мне не надо переходить по ссылке, чтобы узнать подробности? Live ты ли это?)",1691772761,167143
19995749,"Ух ты, сколько  у него Героев!?",1691773212,162822126
19995749,Фашистен сдавайся....,1691773381,338273215
19995749,Надо доделать что начали или наши сыновья опять с этой чумой столкнуться,1691773419,101124334
19995749,"100% прав, браво Кадырову 👏👏👏",1691773764,405692603
19995749,Главный тиктокер нашей страны)))🤣,1691774062,802884752
19995749,"Можно вообще все подразделения вывести на третью линию... и чехи разберутся с этой проблемой в один момент, главное не мешать...",1691774560,734780111
19995749,Красиво сказано 👍👍👍,1691774976,143040762
19995749,Абсолютно полностью согласен,1691775079,754278992
19995749,"Как Сталин ,коротко и ясно",1691775607,712087437
19995749,Кадров чётко сформулировал!,1691775798,788239641
19995749,А академика и генерал - лейтенанта звали на переговоры ? Его мнение такое же кухонное как и мое.,1691775830,456820085
19995749,Рамзан прав на все сто!!!!! Какой смысл вести когда-либо переговоры с этой бандой По факту это гринго командуют парадом и им нужна передышка и ничего иного- выборы рядом у их придурка старого,1691776488,288256547
19995749,"Что же все его многочисленные сыновья не на фронте? Сняли показушной видео и все. Вот пусть сам и идёт, раз поддерживает войну",1691777123,324885522
19995749,"✈️✈️✈️✈️✈️
                      💣
                  💣
             💣
        💣
   💣
🐷🐷🐷🐷🐷",1691777410,506391347
19995749,👍👍👍👍,1691778726,89622978
19995749,А по другому никак нельзя. Там бандеровцы. Это нелюди.,1691779422,721674929
19995749,"Правильно говорит, ни каких переговоров",1691782505,626882649
19995749,Красавчик Бро,1691782669,710394158
19995749,во бла у  него три зведочки. брежнев отдыхает,1691782946,750442979
19995749,,1691784174,601067856
19995749,"Обязательно разбомбить это фашистское логово и показать хороший урок тем,кто этим фашистам помогает.Хотя,и те такие же фашисты!",1691784208,699925412
19995749,Правильно сказал 👍,1691786345,783256141
19995749,Уважение лидеру Чечни! Уважение народу Республики Чечня. Ахмад сила! Россия мощь!,1691786912,92746535
19995749,Спасибо Вам! Так думают многие Россияне!,1691789140,625002055
19995749,"100%, смысла переговоров нет..  только уничтожение режима",1691791077,751260919
19995749,Молодец,1691803989,606168990
19995749,Поддерживаю слова Кадырова.,1691810178,353827202
19995749,"Да, но о мирных переговорах постоянно только Путин говорит",1691820966,27442630
19995749,🐻ПУТИН УМ🎈РОССИЯ СИЛА🐻,1691831303,686572235
19995749,"Нужны переговоры! Пожалейте же ребят, которые там воюют",1691831885,800927836
19993597,"Да на санкции всем всё равно, потому что никаким образом они не повлияли на наши жизни",1691693861,676458347
19993597,ага и цены огонь))),1691693938,30809344
19993597,"Где проводили эти опросы, опять у депутатов в думе?",1691693970,293594323
19993597,"Русским не свойственно скулить, ныть и слюни пускать...справимся как -нить. Как всегда!",1691693974,52968294
19993597,"Всё нормально. Кто работает, тот и не жалуется.",1691694999,812799155
19993597,вообще никак не влияют на меня и нашу семью...,1691699694,777441501
