post_id,text,comment_time,from_id
20372166,она хорошо гадает о картам,1704001355,286587742
20371201,если укpaинские вoeнные перестанут yбивaть мирных жителей и детей?,1703937984,749603733
20368161,ВС РФ достигают успешых результатов каждый день и приближают победу для нас,1703855687,710573547
20368161,у всу получается ускорять только отступления,1703855879,758235782
20368161,Глупости какие что они не понимали что мы как во вторую мировую такой страной будем активно наращивать потенциал.,1703856261,794693689
20368161,"Совет всу перейти на сторону рф и хватит погибать,такие же славяне,мальчики которых посылает на убой зеленский наркоман.Воевать всу будет не против своих,а против нацистов,которые их не жалеют.И за мир своей страны и будущее в составе РФ.",1703856384,464411492
20368161,"Скорее продвигайтесь мальчики ...мы вас очень, очень ждем, от этого зависит и наша участь... дай Бог вам всем выжить и вернуться домой с победой... и пусть Господь хранит и оберегает всех вас...🙏",1703857413,254988242
20368161,Они еще хотят до сих опр наступать? Им самим не смешно это?),1703858147,706723891
20368161,"наши парни как всегда только вперед идут и это главное, все у них получится",1703863188,717854873
20368161,"похоже немцы допрыгались, кто следующий",1703876211,651191060
20368161,🙏🙏🙏,1703889970,392922482
20366538,А суперджет?,1703799277,814425238
20366538,"пишите ""боинг"" ..также как и ""шаума"" .",1703799468,688128529
20366538,"Это как? Было 13, получат ещё 1 и станет 42  ????",1703800213,643402529
20366538,А чинить эти боинги чем будут? Запчастями от суперджетов? 😂,1703801702,244403419
20366538,"Наша страна и дальше будет хорошо импортозамещать дураков, которые решили, что им без РФ лучше будет.",1703802333,718998894
20366538,Что то там пишут у 737 проблемма с болтами и гайками?,1703805805,112885811
20366538,"Очень хорошо, то что российская авиация не стоит на данный момент на месет и то чт о они там просто делают все для того, чтобы развиваться и дальше",1703807730,767351789
20366538,"А сколько же проблем нам Запад обещал и где они все по итогу? Их как не было, так и нет, потому что наша сторона все делает для собственного благополучия, а параллельный импорт нам помогает с санкциями",1703809771,806824021
20366538,"Славно, это пойдет только на пользу нашей стране!",1703813069,718996489
20366538,"Вот и прекрасно, плюс один борт - это хорошо. Санкции - это не всегда какой-то негатив, но и дополнение. Плюс стимул для экономики становиться все более обширной)",1703820276,730093593
20366538,"славненько, читала,ч то наши успешно провели тест самолета, произведенного в РФ",1703821997,697036715
20366538,"Никогда больше не полечу этой автокомпанией, хоть а380 у них будет!",1703826403,585857141
20366538,"сейчас еще будут отечественные самолеты выпускаться, ждем",1703836045,683602362
20366538,Вообще не понравилось летать этой авиакомпанией. Никому не рекомендую,1703850509,369391048
20366538,"Никаких больше самолëтов и вертолётов и военных тоже! Летайте сами, кто с крыльями, и на драконах. Или ещё на чëм-нибудь новом.",1704508137,606148119
20366423,"Ну и пусть дальше планирует. Чем бы дитя не тешилось, лишь бы не вешалось😂😂😂",1703796214,747113880
20366423,В доход несуществующего государства 404.,1703797758,836937689
20366423,"Киев думает, что они смогут воровать у нас деньги? Смешно смотреть на то как они стараются за счет других себе пополнить бюджет.",1703801859,646116163
20366423,"уже преступления свои планируют сделать, что бы Зеленский смог денег заработать, иначе будет его жена без новой сумочки ходить",1703813843,809299781
20366423,"так а чего))) киев ж от всего, что с РФ украину связывает избавляется, а тут что ли на самолеты это не распространяется",1703820911,717909805
20366423,"Чё, сваливать на них собираются??🤣🤣🤣 тогда ясно 😝",1703872369,779222164
20366386,Статуя уже руки вверх подняла,1703794987,320909867
20366386,"Это всё результат неправильной политики Кремля последнии 30 лет..Более 20 ти из них главой России был именно Путин.
Вспомните,что всегда заявляла Россия? ( А заявляла она всегда одно и тоже).
Россия заявляла о своём невмешательстве в дела соседей.
Вот такая была Россия.👎
сша за несколько тысяч км важно,что происходит на украине,прибалтике,грузии.А вот России что делается у соседей? (такая она хорошая),ей это не интересно.
Вот и доигрались в добреньких.
А в мире доброта России воспринималась как слабость.
Россия виновата что стала слабой и предала своих союзников.
Предателей не любят.",1703800806,791919423
20366386,"а что законные основания имеются? нет лишь покажут свое преступления, хотя чему тут удивляться, страна перступников, только на это способна",1703820646,830839815
20366386,Антей уже конфисковывали.,1703821670,837390518
20366386,А куда они на них летать собрались? Вся 404-я бесполётная зона.,1703823847,395157802
20366386,Продадут,1703835045,828660447
20352729,,1703622086,582197295
20352729,"Как это смешно))
Британия имеет свое место за счет банковских продуктов, то есть валютного мультипликатора. Предполагается что Германия также начнёт барыжить услугами?",1703622203,397342448
20352729,Врут.,1703622398,806245177
20352729,Вот она была … и НетЮ…,1703624796,337075145
20352729,"Пятёрка стран мира по ВВП выглядит так: 
Китай ($31,559 млрд) 
США ($23,149 млрд) 
Индия ($15,875 млрд) 
Япония ($5,675 млрд) 
Россия ($5,510 млрд) 
У Германии — шестое место с $5,011 млрд. За ней идут Индонезия ($4,811 млрд), Бразилия ($4,288 млрд), Турция ($3,696 млрд) и Франция, которая замыкает десятку ($3,533 млрд). Великобритания в топ-10 не попала.",1703629265,243995582
20352729,Они этого усердно добиваются с помощью санкций,1703637713,365204389
20352729,Германия ползает в каменный век в угоду гегемона. Пора свергать Шольца или молча тонуть в болоте.,1703676889,696274262
20338931,"Не удивительно, что к этому приложили руку западные страны, которым выгодны конфликты там, где они не держат ситуацию под контролем",1703506119,710962543
20338931,"будем надеяться, что Вучич усвоил украинский урок и не хочет закончить, как Янукович.
 Лучше немедленно вмешаться всеми средствами, включая оружие, чтобы избежать нового Майдана, чем позволить американцам совершить уже организованный государственный переворот.  Почему бы не запросить помощь у России?🤔",1703506162,405559525
20338931,По сценарию должны появится снайперы.😡,1703506332,172393188
20338931,"И ежу понятно, кто платил за эту попытку и кто дергал за ниточки. Вучич тянет с признанием Косово, как независимого государства, а это не устраивает в первую очередь США и ЕС. Вот и решили сменить его на более лояльного политика. Вучичу пора понять, что дружить с Европой себе дороже",1703506366,336476588
20338931,Сценарий как под копирку.,1703506635,617989818
20338931,систему может сломать только другая система...,1703506787,491116612
20338931,"Вучечу может подсказать правильное решение , например, Бацька!",1703506841,224933185
20338931,,1703507116,774959980
20338931,"Как одна известная англосаксонская барышня говаривала: ""Если плюнете в Россию, знайте, что она утрется. Если плюнет в вас Россия, то полмира захлебнется"". Мы наблюдаем реализацию этой пророческой фразы. Евросоюз долго и упорно игнорировал обеспокоенность России их делами на Украине. Они не хотели слушать и перешли черту. Теперь вся их сытая жизнь, от которой они с жиру бесились, подходит к концу. Хотели спровоцировать волнения в России, а получили у себя. Евросоюз на грани раскола. И всё это сделал один человек - президент России Владимир Путин. И народ России его поддержал - более 80% поддержки!!! Такого еще не было. России бросили вызов, народ сплотился под руководством своего лидера чтобы дать досточный ответ. И мы победим, это просто неизбежно!",1703507179,795097794
20338931,"Россия сражается за правое дело! Это именно что освобождание Украины, как от ""фашистких захватчиков"" во времена ВОВ. Русские солдаты и россияне, по многочисленными видео понимают, что там их давно ждали, и это не может не придавать сил!!! Путин это знал! Путин - герой России и миротворец! Именно поэтому у него сейчас просто рекордные рейтинги, если верить социологическим опросам.",1703507302,814426357
20338931,,1703507311,17719421
20338931,Запад зарвался…надоели,1703507426,594333311
20338931,Друзьям нужно помогать во время. Чтобы не было поздно как на Украине,1703507518,830527903
20338931,,1703507649,170596598
20338931,Амеры отработали.. Нуланд с печеньками уже приезжала или с вафельками??😎,1703512389,277543811
20338931,Вучич такой же ссыкло как Янукович,1703514330,732092531
20338931,Запад перешел все грани дозволенного.Нужно странам объединиться и выйти из НАТО.Америка всех достала...,1703517581,392292806
20338931,Президенту Вучич сил и ВЫДЕРЖКИ 👏👍,1703520416,389121667
20338931,"А, как сербы хотели, или с нами, или теряйте свою независимость, выбор есть, а, не хотите православия и нравы, переходите к либералам, путь не далее, мы это проходили при Ельцине и Горбачёве. До сих пор плоды поедаем. 💓",1703521012,706842212
20338277,Когда нам стоит ждать курс доллара по 200?),1703501727,672805221
20338277,"Набиулина, поздравляю вас с евро по 100",1703501764,664686351
20338277,"Умная женщина, все делает во имя России.",1703501910,31148554
20338277,Экономика держится потому что никто не знает реальное положение дел одни догадки,1703504099,595449682
20338277,"Да хрен с евродолларами, а вот по яйцам дали круто)))+50%+/-",1703504116,560901491
20338277,"Да ладно яйца, а вот как выживать на пенсии в 13 тысяч и зарплатой 19",1703504191,706846153
20338277,А давайте всей страной пожелаем ей добра ...,1703504632,669127393
20338277,Ужасная тётка,1703504752,5714921
20338277,Ну и МЫМРА 🤦‍♂️😭👌,1703507746,824917891
20338277,"Главное, что наши выстроили крепкую и надежную экономику! которая выстояла и не дала себя уничтожить.",1703507756,690367937
20338277,У ЦБ будет дом ВЫХОДНОЙ,1703515450,811964415
20338277,"Время покажет на чьей стороне правда,дожить бы?",1703516664,579123771
20338277,"Потом  уедет  в США, из  страны, сколько  вице  премьеров рвануло, из  страны, очередь  за  ней",1703525684,270118151
20338277,"А ни чё,что эта рожа ставленника МВФ,и не подчиняется ни кому кроме них?",1703530830,642123942
20338277,"Это не председатель ЦБ...а сотрудница ГОСДЕПАРТАМЕНТА !!!!
Там и зарплату получает и звания !",1703531178,595945248
20338277,"Не понял почему 22 год , я думал заканчивается 23 , так кто в каком годе живет , она в 22 , а мы все остальные в 23 ....",1703552521,293221749
20336453,"А миллионы людей размещая свои активы за рубежом о чем думали? Им же очень давно сказали: ,, Замучаетесь пыль глотать,, 
 Неужели так много идиотов веривших в священное не прикосновение частной собственности?",1703486653,827853372
20336453,ау набибулина скока ресурсов хотят на западе заморозить ?как вы готовились или я что то не понимаю?,1703486678,719261704
20336453,"пора может востановить Почту Росии =отдать в мировой Когонат -и подключить к ней современный софт с переводами и тд что б работала во всем мире = в Оон отбор делать нормальный всех нации? например из муфтиев монахов и тд а не понятно может там текст - дают читать - наняли их - пишут 
и с рим статутом —- дабы делать нелегальное легальным и нормальным",1703486728,986628
20336453,Для этого она в Америке училась?,1703486764,555943330
20336453,Че сказала сама не поняла!😂😂😂,1703487097,577077186
20336453,"Простому люду переживать нечего, живём от зарплаты до зарплаты, миллионов у нас нет, замораживать нечего😊",1703487124,199886215
20336453,"Я думал,готова со времен пандемии..Но нет,мы пошли дальше и вот уже 9 лет укрепляем свое экономическое положение",1703487245,708607111
20336453,"В общем на западе сделали всё правильно... ворованные деньги заморозили , это средства вывезенные из россии",1703487248,828426211
20336453,"Твари, везде забанили, не кого лесом послать!
Если только Задовну.",1703487346,479170560
20336453,"При советском вожде, уже бы всех расстреляли!!!",1703487686,333787654
20336453,А если бы не санкции то до сих пор бы деньги за улеводороды в Америке оставляли,1703487698,246677147
20336453,"Именно поэтому активы оказались замороженными, не частных лиц",1703487814,459375618
20336453,,1703487867,250130729
20336453,Один трёп!!! 👎,1703487890,250130729
20336453,"Чего так все застонали? У вас у всех вклады пропали? Или вы все дипломы фнансистов имеете? Не лезьте туда, где ни в чём не разбираетесь!",1703488329,357272018
20336453,Ты овца подготовилась с яцами,1703488689,640612465
20336453,Импортозамещение норм.,1703488830,748282550
20336453,Так  говорится  ВЕТРОМ  ПРИШЕЛ  И  ВЕТРОМ  УШЕЛ!!!🤣,1703491149,754438449
20336453,"Молодец Эльвира !!!
Тебе памятник должен Запад поставить прямо при жизни !!!!
Профинансировала экономику ЗАПАДА на 500 млд зелёных !!!
БРАВО !!!!---лучший банкир мира !!!!
Тебя очень ценят в США !!!",1703491231,595945248
20336453,"Хвалили Кудрина, не зря он носил звания лучший министр финансов планеты,не раз об этом  велись споры на различном уровне,на эти деньги сколько дорог можно было построить.Наивность вновь нас подвела,нельзя врагам коварным верить,сигналы были с Украины,нацизм  давно там  процветал...",1703495917,579123771
20336453,Хорошо что мы живем на одну пенсию и вкладывать не чего ели хватает на жизнь.🤧😰,1703501553,721875860
20336453,Молодец! Умная женщина...,1703506167,710628705
20336453,"Бла ,Бла , -Где решение ,как выходить из сложившейся ситуации ?",1703515354,710785662
20332093,"Они,что лохи оставлять нарушителя в служебном авто одного .",1703418827,255403980
20332093,Махнул не глядя ...,1703430565,38976761
20332093,"Прям, анекдот!",1703436820,228111240
20330961,В этом можно увидеть скрытое желание призвать к себе службу денацификации,1703400551,4676965
20330961,"Здорово!!! Выходит нам надо отвечать, а чем только",1703400805,448836637
20330961,"Фашистские прихвостни, никогда небыли лояльны к нам, даже в советские годы 😡😡😡😡",1703400832,4718048
20330961,"А я уже не помню, когда последний раз отправлял письмо или открытку. Зачем, когда можно поговорить по телефону или послать смс. Оказывается, есть люди, которые пишут обычные письма, на бумаге.",1703401582,465040805
20330961,достоиные потомки веиса и монгулиса 😆😆😆,1703402094,603755506
20330961,Всё правильно письмоа отправляющиеся в тюрьму всегда читают вдруг жертвы планируют побег.,1703403447,840097438
20330961,Свиньи они всегда свиньи .,1703404209,801429056
20330961,ну то есть вот про эту свободу слова говорят на западе? даже письма обычные уже спокойно отправляться не могут,1703404603,709925025
20330961,Ещё кто-то письма пишет? 😳 Они об электронной почте не слышали что-ли?,1703405917,25262498
20330961,"Демократия, понимать надо😁",1703428444,21696751
20329088,Агония зелибобы,1703340665,156163439
20329088,,1703340690,827845518
20329088,"абы как у барина. США вводит санкции? Ух, мы тоже введем, мы це европа, мы запад!",1703340720,718997282
20329088,"Ему жить осталось девять с половиной недель, а всё какие то санкции вводит..",1703340722,365495354
20329088,"Уходя, уходи уже..",1703340767,272855721
20329088,Всё правильно: пора лапу сосать как медведь в берлоге. А народ он подождёт...,1703340822,265798947
20329088,"Украине вредишь ты,кокаиновая моль",1703341006,39759533
20329088,Напугал голой жопой ежа... Страшно аж жуть🤡,1703341081,413251556
20329088,,1703341121,34970705
20329088,Перед смертью не надышешься!,1703341187,37613186
20329088,Украина встанет с колен!,1703341230,1419637
20329088,Клоун кокаиновый 🤣🤣🤣🤣🤣🤣,1703341486,184511568
20329088,"Зачем столько санкций, если не работают ни первый ,ни второй пакет🙈.Европка ведь уже прошла этот болезненный путь.",1703341882,269853187
20329088,"Скоро ли его уберут с экрана ,навсегда?!",1703342391,784960070
20329088,Во понесло его!,1703342788,839193144
20329088,,1703342823,84926472
20329088,Его по сути уже убрать должны  клоун а не президент .👍,1703343029,257524912
20329088,"кто-нибудь заткните его уже, пожалуйта, как он задолбал, лучше бы армии хоть как-то помог своей",1703344862,710890345
20329088,Он же умер😂,1703345229,430387979
20329088,"У него токсикоз, все кругом вредно и ядовито.",1703345790,366524895
20329088,"Пхаха, ну сакнции от Украины это серьезно) Да ведь? Или все таки всем плевать?)",1703345935,810606753
