id,owner_id,post_time,post_text,comments.count
8574700,-24136539,1703845127,"Заявления пресс-секретаря президента РФ Дмитрия Пескова. Главное:
 
📌 Песков назвал неоспоримым тот факт, что Путина поддерживают разные возрастные категории, в том числе много молодежи. 
📌Уровень поддержки Путина россиянами в 2023 году стал максимально высоким. 
📌 Песков назвал личным делом каждого сдачу подписей в администрации президента в поддержку выдвижения Путина, ""здесь нет места компанейщине"". 
📌 Власти РФ продолжат поддержку отечественных производителей. 
📌 РФ заранее анализировала возможные ответные шаги на конфискацию своих активов Западом, Москва будет делать все, исходя из своих интересов. 
📌 У России есть список западных активов, которые она может конфисковать в ответ. 
📌 Предложение США по конфискации активов РФ не может быть законным, это подорвет международную экономику. 
📌 Эффект бумеранга от санкций Запада против России очевиден, многие задаются вопросом, правильно ли они поступили. 
📌 Путин в последний рабочий день уходящего года встретится с главой ""Аэрофлота"". 
📌 Путин планирует проводить рабочие мероприятия во время новогодних праздников, Кремль будет о них своевременно сообщать. 
📌 Песков не стал говорить, где и как встретит Новый год. 
📌 Кремль не будет анонсировать формат новогоднего телеобращения Владимира Путина к гражданам.",45
8572245,-24136539,1703756673,"Сергей Лавров в эфире телеканала ""Россия 24"" усомнился в слухах о ситуации в секторе Газа, что израильское руководство было предупреждено за год до начала конфликта. 
 
Министр иностранных дел напомнил, что слухи были также о теракте 11 сентября и о высадке американцев на Луне. 
 
🔺Лавров: американская глобализация развалилась из-за пандемии и санкций. Теперь все рассыпается на локальные регионы.
 
🔺Сергей Лавров рассказал Дмитрию Киселеву об основных тенденциях международного развития: становление полицентричного мира и дедолларизация.",16
8552427,-24136539,1703227500,"Леонида Гозмана (включен Минюстом России в список СМИ-иноагентов) обвиняют в распространении заведомо ложной информации о деятельности ВС РФ. 
 
Опубликованные им материалы прошли соответствующее психолого-лингвистическое исследование. Было доказано намеренное искажение информации. 
 
Санкция статьи предусматривает наказание в виде лишения свободы на срок до 10 лет.",129
8551011,-24136539,1703178031,,71
8550887,-24136539,1703175192,"Владимир Путин провел телефонный разговор с президентом Венесуэлы Николасом Мадуро. Как сообщили в Кремле, российский лидер пригласил венесуэльского коллегу посетить Россию в следующем году. 
 
🔺 Президенты подтвердили общность взглядов на формирование многополярного миропорядка и неприятие незаконных санкций. 
 
🔺 Мадуро проинформировал Путина о переговорах с Гайаной по вопросу спорного региона Эссекибо.",42
8550175,-24136539,1703162190,"Владимир Путин выступил на заседании Совета по стратегическому развитию и национальным проектам. Вот основные заявления президента: 
 
• Надо расширить национальные цели развития и уточнить планы до 2036 года. Все наши планы в развитии инфраструктуры и социальной сферы реалистичны, они учитывают динамику развития и индустриальный рост. 
 
• Уровень бедности в РФ в 2023 году будет на историческом минимуме, но нужно вообще сводить его к нулю. 
 
• Доля рубля во внешних расчетах удвоилась и составляет 35%, а вместе с валютами дружественных стран – 75%. 
 
• Об антироссийских санкциях Запада: ""Им пора закончить валять дурака и ждать, пока мы рухнем"". 
 
• Все решения по развитию экономики объединены главной целью – сбережением народа и повышением благосостояния людей. 
 
• Необходимо установить статус многодетной семьи с указанием льгот, сделать это следует оперативно.

• Нужно проработать меры по защите материнства и детства, надо возродить традиции многодетной семьи. 
 
• Оценка граждан – ключевой критерий эффективности работы правительства. Результаты, которых получается достичь, должны стать основой для долгосрочных планов.",62
8549503,-24136539,1703153100,"Заявления главы Генштаба ВС РФ в ходе брифинга для иностранных военных атташе по итогам деятельности Министерства обороны РФ в 2023. Главное: 
 
📌 Сегодня формируется новый многополярный мир, гегемония США и их союзников уходит в прошлое. 
📌 Европа стала ареной противостояния Запада с РФ в политической и экономической сферах. 
📌 Ежегодно у западных границ России проводится около 40 крупных учений НАТО, их сценарии основываются на вооруженном противоборстве с РФ. 
📌 Безответственная политика США привела к очередной эскалации палестино-израильского конфликта. 
📌 Запад стремится создать новые горячие точки и поддерживать конфликты на Балканах, в Приднестровье и Закавказье, Средней Азии и Афганистане. 
📌 Санкции США против РФ спровоцировали кризис продовольствия в Африке, это привело к смене власти в ряде стран. 
📌 Активность террористов деструктивно влияет на обстановку в Африке. 
📌 С начала спецоперации Киеву передано более 5 200 танков и бронемашин, более 1 300 орудий артиллерии, более 100 единиц авиации и 23 000 БПЛА. 
📌 Около 100 тысяч украинских военных прошли обучение в США и Европе, ВСУ передано более 200 ракет Storm Shadow, Scalp и ATACMS. 
📌 Основной задачей ВС РФ в 2023 году стало отражение контрнаступления группировки ВСУ, планировавшей лишить РФ сухопутного коридора в Крым. 
📌 ВСУ планировали за 15 суток наступления блокировать Мелитополь, продолжив наступать к Азовскому морю, Мариуполю и границе с Крымом.Группировка ВСУ, сосредоточенная на запорожском направлении, была увеличена с 50 до 80 батальонов, их продвижение оказалось незначительным. 
📌 Широко разрекламированное Украиной и ее союзниками из НАТО контрнаступление провалилось. 
📌 Войска РФ успешно ведут активную оборону, удерживают рубежи и расширяют зоны контроля на всей линии боевого соприкосновения. 
 
📌 Московский и Ленинградский военные округа формируются в ответ на расширение НАТО. 
📌 Три соединения Воздушно-космических сил, а также в Сухопутных войсках 2 общевойсковые армии и 14 соединений родов войск и видов обеспечения сформированы в ВС РФ. 
📌 Миротворцы РФ обеспечили выезд в Армению почти всех жителей Карабаха.",61
8548645,-24136539,1703140531,"Мария Захарова прокомментировала подготовку в Евросоюзе новых пакетов антироссийских санкций. ""Что же они никак на чемодан не накопят?"", - написала официальный представитель МИД РФ в своем Telegram-канале.",151
8546125,-24136539,1703057400,"ЕС не отменит антироссийские санкции даже в случае полного завершения СВО и подписания соглашения о мире с Украиной, сообщил ТАСС со ссылкой на источник.
 
По его словам, должно быть принято единогласное решение. ""Достаточно, чтобы одна из 27 стран ЕС не поддержала отмену санкций под любым предлогом, и этот вопрос может быть отложен на неограниченное количество времени"".",81
8544621,-24136539,1702992362,"No Russia назвали в ЕС правило санкционного реэкспорта в Россию. Об этом говорится в постановлении Совета Евросоюза о введении в действие 12-го пакета санкций. 
 
Статья будет применяться ко всему списку товаров и технологий военного и двойного назначения, который ЕС запретил к экспорту в РФ с 2014 года.",50
8543908,-24136539,1702978786,"Дмитрий Песков: введение санкций против общества ""Знание"" - красноречивое свидетельство санкционного безумия.",39
8542154,-24136539,1702918200,"Евросоюз утвердил 12-й пакет санкций против России, который вступит в силу позднее после публикации в официальном журнале союза. 
 
🔲 С 1 января вводит ограничения на импорт непромышленных алмазов, добытых, обработанных или произведенных в России. 
 
🔲 С 1 марта начнутся поэтапные ограничения на импорт российских алмазов, обработанных в третьих странах. 
 
🔲 В новом пакете санкций вводит ограничения на импорт из России изделий из алюминия, включая проволоку, фольгу, трубы. 
 
🔲 Также ЕС обязал европейские компании оговаривать в контрактах с партнерами запрет на реэкспорт ряда товаров двойного назначения в РФ.",69
8540486,-24136539,1702884600,"Новый пакет санкций ЕС против России планируют утвердить сегодня в Совете ЕС, сообщили СМИ со ссылкой на дипломата в Брюсселе.",57
8535815,-24136539,1702736702,"Евросоюз под давлением геополитических просчетов США продолжает терять политический и экономический вес. Об этом заявила официальный представитель МИД РФ Мария Захарова.
 
📍️Ресурсы ЕС направляются на обслуживание интересов США и обогащение американского военно-промышленного комплекса.
📍️Евробюрократия всеми правдами и неправдами, процедурными ухищрениями пытается неуклюже прикрывать творящийся в ЕС хаос.
📍️Оплачивать высокую цену конфронтационной политики ЕС, последствия решений по Украине и Молдавии придется населению европейских стран.
📍️Новые санкции против РФ, как и все предыдущие, нанесут больший вред самому Евросоюзу.",36
8534912,-24136539,1702720200,"""Сегодня Владимир Путин – единственный реальный мощный лидер мировой политики"": такое заявление сделал режиссер Никита Михалков в интервью телеканалу ""Россия 24"". 
 
Он отметил, что благодаря Путину и его команде страна отошла от края пропасти, ""нарастила мышцы"" и удержалась в тяжелейшие моменты санкций.",205
8525898,-24136539,1702452600,"Джо Байден в ходе встречи с Зеленским рассмеялся после вопроса журналиста о том, хочет ли он победы Украины в конфликте с Россией. Однако пресса так и не дождалась ответа от президента США – он лишь продолжил хохотать. 
 
Позже, во время совместной пресс-конференции, Байден решил высморкаться в тот момент, когда Зеленский благодарил его за антироссийские санкции.",137
8523745,-24136539,1702387946,"После введения антироссийских санкций немецкий автопром столкнулся с серьезными проблемами: стоимость издержек выросла, а количество покупателей значительно снизилось. Только за газ в 2023 году Германия стала платить в 2,5 раза больше. 
 
Последствия не заставили себя долго ждать — Volkswagen уже сократил штат и приостановил выпуск автомобилей определенных моделей. 
 
Смотрим подробности: https://smotrim.ru/video/2727890?utm_source=smm&utm_medium=vgtrk&utm_campaign=r24",107
8520431,-24136539,1702269000,"Новое подразделение для контроля соблюдений частными компаниями санкций в отношении России учредит правительство Великобритании, сообщило министерство по делам бизнеса и торговли королевства.",46
8510642,-24136539,1701967441,"Санкции против России не работают, но это табуированная тема в высших органах Европейского союза, отметил премьер-министр Словакии Роберт Фицо. 
 
Он заявил, что в итоге санкции привели к тому, что РФ стала самостоятельной в тех отраслях, в которых до этого такой не была. ""А самое плохое это то, что санкции часто вредили ЕС и Словакии"", - добавил Фицо. 
 
Также он подчеркнул, что Словакия не поддержит новый пакет санкций, если в него будет включен мирный атом.",38
8508287,-24136539,1701929700,"Заявления пресс-секретаря президента РФ Дмитрия Пескова. Главное:
 
📌 Путин и саудовский кронпринц детально ""сверили часы"" по вопросам общих интересов стран. 
📌 Путин и саудовский кронпринц обсудили сотрудничество в ОПЕК+, оно будет продолжаться. 
📌 Путин и саудовский кронпринц провели обед тет-а-тет с переводчиками. 
📌 Путин и саудовский кронпринц обсудили палестино-израильский конфликт. 
📌 Инвестиционное сотрудничество России и Саудовской Аравии будет продолжаться, детали не разглашаются ""из-за большого числа недругов"". 
📌 Визит саудовского кронпринца в Россию будет прорабатываться по дипканалам, о точной дате пока сложно говорить. 
📌 Путин подарил президенту ОАЭ картину, в ответ получил в подарок мозаику. 
📌 Санкции G7 по российским алмазам — не новость, компании РФ прекрасно осознают все риски и пытаются хеджировать их. 
📌 Запад хотел бы поражения России в украинском конфликте, но происходящее на поле боя говорит о неизбежности обратного. 
📌 Спецоперация продолжается, для России главное — достижение поставленных целей. 
📌 Российские и саудовские дипломаты готовят общий документ по итогам переговоров, но не отдельный по украинскому урегулированию.",18
8504484,-24136539,1701806400,"Главные новости вторника: 
 
🔲 Путин: Киев целенаправленно корежил население Донбасса русофобией: https://smotrim.ru/article/3690136?utm_source=smm&utm_medium=vgtrk&utm_campaign=r24
 
🔲 Россия и Иран подписали соглашение о противодействии санкциям: https://smotrim.ru/article/3689693?utm_source=smm&utm_medium=vgtrk&utm_campaign=r24
 
🔲 Новым послом России в Нидерландах стал Владимир Тарабрин: https://smotrim.ru/video/2725092?utm_source=smm&utm_medium=vgtrk&utm_campaign=r24
 
🔲 Пресс-секретарь Байдена сбежала с брифинга после вопроса о деньгах его сына: https://smotrim.ru/video/2724857?utm_source=smm&utm_medium=vgtrk&utm_campaign=r24
 
🔲 Власти Владивостока запретили выходить на лед до Нового года: https://smotrim.ru/video/2724896?utm_source=smm&utm_medium=vgtrk&utm_campaign=r24",25
8503888,-24136539,1701787973,"Власти Кипра предписали местным банкам прекратить проведение рублевых операций и ограничить отношения с клиентами из России. Поводом стало расследование 29 дел о возможном обходе антироссийских санкций, пишет газета Politis.

Смотрим подробности: https://smotrim.ru/article/3690020?utm_source=smm&utm_medium=vgtrk&utm_campaign=r24",17
8494873,-24136539,1701440606,"В Нидерландах победили противники вооружения Украины. Согласно окончательным результатам парламентские выборы выиграла крайне правая ""Партия свободы"". 
 
Ее представители выступают против поставок Киеву западного оружия и антироссийских санкций. Во время выступления в парламенте страны президента Украины ряд депутатов партии отказались прийти на заседание.: https://smotrim.ru/article/3683822?utm_source=smm&utm_medium=vgtrk&utm_campaign=r24",10
8494067,-24136539,1701423595,"Дмитрий Песков: Россия знает, что санкции США против нее сохранятся на долгие годы, и исходит из этого, выстраивая свою политику. 

📌 США будут продолжать давление на всю систему международных экономических отношений, разрушая существующий формат. 

📌 Америкоцентричный мир завершается, наступает период многообразия, в том числе в международных экономических отношениях; 

📌 Россия заинтересована продолжать работу в формате ОПЕК+, в том числе и после вступления Бразилии.",25
