post_id,text,comment_time,from_id
7433868,"Прямой конфронтации США не ищут, они Украину для этого используют, зачем мараться когда есть слабоумные которые готовы гибнуть за хозяев",1671613982,681342627
7433868,Надеюсь он там и останется,1671615048,356431412
7433868,Белый дом -паперть для незалежников😉🤗,1671615580,376279263
7433868,"О какой стратегической ситуации будет обсуждать Зеленский, если НАТО и так руководит всем процессом на Украине",1671615708,707491195
7433868,"Решили повонять Грязной  тушкой и майкой на авось побольше подадут накляньчить?  Типа -на! На! Только Вали отсель, а то задыхаемся воняет!",1671616136,706869347
7433868,"Выступление не равно проведению циркового представления, так что называйте тут вещи своими именами",1671618022,710435694
7433868,"Какой там квартал приехал в белый дом на шоу клоунов, мест свободных нет",1671618215,758549840
7433868,Внук к деду собрался... на (игрушки) кляньчить денег... 😡😡😡,1671620370,118970232
7433868,А салют будет,1671622363,391015890
7433868,,1671625078,87393623
7433868,"Да что нам эти санкции! Они нам только на пользу играют! Валюта крепчает и промышленность растет, благодаря поддержки от правительства. Огромные суммы выделяют, чтобы этот рост только увеличивался https://www.mos.ru/news/item/117161073/",1671627607,217732715
7433868,Бежит с Украины праздновать Новый год!,1671629155,402082393
7433868,"Да сто процентов приехал наличку снимать, у них же нет света, банкоматы не работают",1671634881,707476294
7433868,Классно у кремлеботов пуканы рвет),1671636707,157087734
7429540,А ВЕДЬ ТОВАРИЩ ПЕРВЫЙ ПРЕДУПРЕЖДАЛ (ВСЕХ) !,1671478133,7702025
7429540,Так ему.👎🏻,1671478138,419821100
7429540,Туда ему и дорога. И напомню на фронте НЕТ снарядов для артиллерии 122мм и 152мм!!!!,1671478151,705146650
7429540,Путин не боится банкротить олигархов?,1671478525,96890495
7429540,👍👍👍👍👍👍💩💩💩💩😈😈😈😈🐀,1671478756,143449738
7429540,"Ключевое ""как считается"" Абрамович потому и  богат, что дальновидный 🤣",1671479431,38565693
7429540,,1671479903,159959722
7429540,"Ну, я думаю, там быдет примерно, как в классике, ибо не был бы он столь богат и так долго!)))",1671483581,27861262
7429540,Нам его и не жалко  . Утащил из России всё что мог. Да и сейчас у него в России несколько крупных компаний.,1671493472,378069765
7429540,🙄🤔😡,1671496205,709589171
7429540,Приуныл,1671496281,156298048
7429540,"Уж кого ,а этого любителя английского футбола мне вообще не жаль.Все что у них есть-это все заработал Сов.Союз,под шумок захапали собственность,мелкие клерки .😱😱😱",1671498923,239508603
7429540,"То что деньги в России украл конечно плохо, а то что отберут это нормально. Так всегда делали.",1671504719,706322202
7429540,Мне кажится что Абрамович просто подставное лицо. А вот кто действительно владелиц всего этого. Это вопрос.,1671505404,736228220
7429540,Вор у вора украл...,1671509595,287410935
7429540,думал сказочка вечно будет играть?,1671520082,-198473542
7429540,"))))) ну что сынку, помогли тебе твои подлизывания?))))",1671522395,755681905
7429540,"Ничего, ничего, купит наемникам еще айфончиков, и его простят, вон на туманном альбионе его де простили",1671522549,582366970
7429540,"В Кpacнoяpcкe 12-лeтнeмy peбeнкy пpишлa пoвecткa в вoeнкoмaт ""для пepвoнaчaльнoй пocтaнoвки нa yчeт"". Пyтин этo имeл в видy, кoгдa гoвopил, чтo вoйнa зaтянeтcя? И 12-лeтниe дeти ycпeют пoвoeвaть?",1671524917,64502128
7429540,"Вроде и не замечен был в помощи СВО и за него даже топил Зеленский, а всё равно подвергся русофобии. 
И так будет со всеми в ""цивилизованном"" мире, Дождь вот тоже надеялся усидеть в ""свободной"" стране, ан нет, не вышло, дали подпердак",1671527157,24534560
7429540,Какая замечательная новость.,1671529346,157078868
7429540,"На том свете бог всех расудит,все мы живем под крышей бога и прокурора",1671533116,689079625
7429540,А мог ведь фабрику по производству гвоздей построить. Поделом ему,1671543027,582061291
7429540,Водят эти санкции и что дальше? Кто нибудь реально ощущает их? Я думаю кто реально ощущает это бизнес поддержку властей. Для многих это как новый вздох. В Москве например для бизнеса уже более 80 мер поддержки введено https://www.mos.ru/mayor/themes/12299/8788050/,1671549007,158000183
7429540,"Верьте Путину. Он вас не обманет. О конфискации активов Президент говорил неоднократно. Российские чиновники ,вероятно, тоже прошляпили 300 миллиардов долларов. Кто ответит пофамильно, если это произойдёт?🤑",1671567258,714788817
7429540,Только за!,1671576501,758238874
7429305,Ммм даааа я думал что-то будет......,1671472795,398652340
7429305,"Молодец, Батька! Страну не бросил и народ свой не предал, не бежал как Янукович.",1671472938,633574846
7429305,Путин наш Государь. Дай бог ему здоровья и сил.,1671473885,14017569
7429305,"Кароч был послан даже лукашенко, герой стратег, политиик , лидер и борец",1671474652,13278440
7429305,10 пакет санкций будет против Белорусии,1671478433,26387035
7429305,Для модернизации центров занятости населения требуются социальные биологи.,1671489457,-199453732
7429305,"По всему периметру границы с Украиной надо устанавливать защитный рубеж-типа ""Линии Манергейма"",чтоб ни одна вражеская ракета к мирным людям не долетела.А еще лучше перепрограммировать эти ракеты и они могли бы лететь туда откуда были выпущены(наверное это фантастика)!🚀🚀🚀",1671499168,239508603
7429305,"Вce мы знaeм, чтo вceгдa нa этoй бoльшoй пpecc-кoнфepeнции был cпиcoк вoпpocoв и oтвeтoв, вcё былo cpeжиccиpoвaнo и opгaнизoвaнo. Однaкo yжe дaжe никaкиe зaгoтoвлeнныe вoпpocы и oтвeты нe cпacaют, пoтoмy чтo дeйcтвитeльнo cкaзaть нeчeгo, cкaзкa пpo «вcё пo плaнy» бoльшe нe cpaбaтывaeт. Вeдь чтo cитyaция в Рoccии нy oчeнь плoxaя – и c экoнoмикoй, и c мoбилизaциeй, и c вoйнoй нa Укpaинe, и c мeждyнapoднoй изoляциeй, и c диплoмaтиeй. Вoт пoэтoмy и peшил ВВП – мoлчaть, тpycливo и пoзopнo!",1671530417,64502128
7429305,"Покров Георгия Победоносца! 
Да будет символом навечно Союзных друзей – 
Дух Справедливого, Победного и Славного Георгия! 
Как Русь хранил всегда, чрез веру, Святостью своей, 
Так, Обновлению Мира, покровительствует Сила Божия! 
Та Сила Духа, что карает тьму и мрак, 
Которой и владел Победоносный Воин! 
Мистерия вершится Неба на Земле, чтоб сгинул враг, 
А чада Божии вернулись все – Домой! 
23.11.22. Да будет Георгий Победоносец символом – 
Победы Славной, Справедливой на возвращении 
Украины в отчий дом - Благую Русь! 
 
Преображающая сила батюшки Ипполита! 
Своею добротою о отче Ипполите, 
Из Царства Славы Божией всем, умягчи сердца! 
И отведи тьму внешнюю с народа Украины, 
Дух власти обновится пусть - велением Бога-Отца! 
И всей Небесной силой, порок из них изгонит, 
И президент Владимир, всю осознает боль! 
С раскаянием великим — спасения попросит, 
Чтоб вразумился весь народ, что есть земли сей — соль! 
Вся Русь об этом молит, чтоб исцелилась рана, 
Чтобы любовь вернулась в Единый наш народ! 
О отче Ипполите, верни Единство странам 
Насильственно разделенным, молись за Единый Род! 
16.12.22. В день памяти, отче Ипполите, преобрази 
Святую Русь — в Единую Благую Русь! 
 
И это должно стать нормой, для всех глав стран, где дружественные 
и добропорядочные отношения во Славу Бога и своих стран и народов! 
19.12.22. Визит В. Путина в Белоруссию! 
 
Божественной Любовью Христа, преобразится и обновится Мир-Дитя! 
Будем жить вечно и славить Бога нашего, своей любовью и добром! 
Нас Небеса хранят и созидают для Царствия Божиего! 
 
В совете и согласии рождаем Благой Мир! 
Благодарение и низкий вам поклон, 
Всем тем кто принял, из команды Президента, 
Ту участь миссии, что выбрал он, 
Что Богом предначертана для — Главного момента! 
Все вы поддержка и помощь для него 
И для себя, вы Божию Волю утвердили! 
И весь народ сплотится для того, 
Чтобы Единым Духом — Мир Истинной Любви родили! 
15.12.22. Соборный Зов — Правдивым Делом, воплощают 
с Богом! 
 
Вечная Слава – Чудотворче Николо! 
Мысли Добрые, дела Славные, 
Утверди ты в нас Николо в православных! 
Чтоб Любовь и Свет нести миру, 
А Завет с Богом дал твою Силу; 
Удивлять, восхищать, людей радовать, 
Помогать, защищать, счастьем баловать! 
Все то, есть в тебе, щедрость немерена, 
По заслугам твоим Богом отмерена! 
Научи всех людей быть такими 
Жить для Бога, чудеса вершить большие! 
Ты, молись за детей, внуков наших, 
Чтоб им стать Духом Божиими, душой краше! 
Все во Славу Всевышнего Бога-Творца, 
Пусть твой Свет живет Вечно, не зная конца! 
19.12.21.",1671536673,281042135
7429305,"Мне кажется, что мы не боремся с санкциями, потому что они нам не мешают развиваться и поднимать своё производство, они там только дали к этому толчок, можем сказать спасибо за это😁 
А в остальном, все товары даже повседневного спроса, мы давно делаем самостоятельно. https://www.mos.ru/news/item/117191073/",1671544293,637485459
7429272,"Что-то мне подсказывает, что вскоре против России восстанут все, кто когда-либо хотел ее захватить.",1671471736,101230257
7429272,Гей парадами восстанут? 😄,1671471821,14802484
7429272,"Если гопник ударит в лицо ботаника, а у окружающих будет истеричная реакция, то значит удар был абсолютно необходим. Л-логика.",1671471831,72558227
7429272,Сто процентов не верит глава МИД РФ,1671472575,319950630
7429272,"Оказывается чтобы понять это необходимо было услышать признание Меркель,так че там с профпригодностью у вас ребята,че вы там делали всё это время и отвечать то кто-нибудь собирается",1671473100,497212700
7429272,"когда наконец начнут строить водопровод в днр из реки дон . население днр без воды уже более 8 месяцев . а руководство днр получает постоянно награды . ответьте мнекто знает как можно прожить 8 месяцев без воды .оказывается можно и нужно считает руководство республики , за что и получает награды .а население городов покупает эту воду в магазинах по 100 рублей за 5 литров .так еще мишустин сделал в днр самый маленький коэффициент по социальным выплатам в российской федерации . где скажите мне справедливость .горловку например утюжат каждый божий день так их еще получается ущемляют . я понимаю что справедливости ни когда не было от слова вообще . но ущемлять права людей которые живут под обстрелами и не знают как они на утро будут живы или нет . это уже край. припоминаю слова медведева - денег нет но вы держитесь .это как раз подходит для нынешней ситуации",1671494810,768146870
7425340,Bonjour,1671374233,644605343
7425340,Ой ну Франция вообще не показатель. Там 24/7 протесты по разным поводам. У них культура такая...,1671374236,138965
7425340,"«Генерал де Голль, предрекая этот процесс»

Евросоюз изначально носил чисто промышленно-экономический характер, а вот политизация этой структуры какими-то ценностями началась только в 70-х годах. Генерал де Голль, предрекая этот процесс, долго не пускал в Европейское объединение угля и стали (так назывался будущий ЕС) Британию, понимая, что через островитян в Европу зайдут янки, которым интересы Старого Света важны чуть больше, нежели проблемы индейцев Центральной Америки. 
 
В 1969 году генералу устроили откровенный майдан, а спустя пару лет Великобритания была принята в Евросоюз. 
 
Выкрутив руки всем несогласным, янки в 1966 году фактически назначили президентом международной литературной организации ПЕН-клуб американца Артура Миллера. На европейских писателей фактически натянули полосато-звёздный флаг, выкорчевав всех радикально несогласных. 
 
В 80-е годы их взгляд упал на европейских зелёных. Работали с огоньком, поэтому адепты пацифизма и заботы об экологии в лице их лидера Йошки Фишера в 1999 году выступили за проведение военной операции НАТО против Югославии. На Югославию высыпали, по самым скромным данным, около 15 тонн обеднённого урана, а косовские ОПГ смогли удивить даже видавшие виды преступные группы Италии. Правда, у самого Фишера всё прекрасно: покинув свой пост вице-канцлера в 2005 году, он получил тёплое место в Принстонском университете США.

Украинизация Европы более не миф",1671374282,158563525
7425340,"Уважаемый Лавров Сергей Викторович прошу передать данное мной сказанное для Евросоюза и США и их граждане. Я Шидаков Рашит Анзорович, граждан России хочу обратиться к правительству Евросоюза и США, а так же простым гражданам этих стран. Прошу подумайте, что вы делаете вводя санкции в отношении России и российского народа, ведь уходя с российского рынка вы думаете что напугаете русский народ? Нет, зато действия правительства Евросоюза и США расцениваю не как санкции против России, а как попытка истребление Русского народа, так как умышленные действия и разрыв международных отношений, не исполнение договоров, отказ поставлять лекарства аналогов которых в России нет, детали ( запачасти) на машины и самолеты, которые поставлялись для обслуживания завезённой техники, тем самым попытка истребить Российский народ! Однако такими действиями вы делаете плохо не только в отношении России и российского народа, но и в отношении своего народа,  лишая ресурсов которые представляла Россия как газ, нефть. Сколько предприятий Европы работали в основном на импорт в Россию, так кому же правительство Евросоюза и США делает хуже? России или своим же   Граждажданам? Действия властей Евросоюза и США являются губительными  и для своих сограждан, ведь цены выросли, режим экономии объявлен  в Европе, карается до лишением свободы. Поэтому жители Евросоюза и США обратите внимание, что не только граждане России страдают от санкции, которые направлены на истребление Российского народа. Россия сильная и могущественная страна, которая выстоит и справится. Посмотрите, что ваше правительство доводит вас, вынуждая экономить на себе. Цены подняли, вынуждают экономить, угрожая  реальными сроками. Поэтому если кто то решит поступить с президентом России как с Саддам Хусейном, то хочу сказать, что тогда я лично сяду в танк возьму необходимое оружие и освобожу своего лидера страны. Одумайтесь народ ведь вы в сего лишь пешки в игре США за лидерство. Своими действиями и санкциями Евросоюз создал в России массовую безработицу, вводя санкции по указу сша. Сколько ещё должно пострадать народа и лишиться всего, ведь даже спортсмены которые посвятили жизнь профессиональному спорту, а теперь не могут выступать только лишь потому что кто то хочет больше власти и обвиняя Россию в терроризме, что не является правдой. Считаю Евросоюз и США террористами",1671374722,464660741
7425340,"Сегодня Париж сгорит , независимо от результатов финала",1671374920,118365881
7425340,Смешно читать когда тут пишут что правительство Франции не беспокоятся о своём народе. А наше правительство ну так беспокоятся а своём народе прям лучше не куда ну прямо бутерброд не лезет в рот думают а как народ,1671374980,698142079
7425340,"Да,теперь Китай руки потирает: такое место,  как Россия, освободилось от западного импорта.Теперь ждём Китайские пластмассовые яйца, капусту и т.д.машинами нас заполонят ,которые им уже не нужны,а русские всё купят: у нас же нет ничего своего: всё разорено,наше правительство хорошо здесь поработало: сколько заводов позакрывалось: ничего не надо стало Так обидно за нашу страну",1671375074,637898092
7425340,Рано вам нато покидать. Рано,1671375108,563367541
7425340,"Макрон уже позвонил, согласовал, очко приготовил?",1671375112,509716865
7425340,Полнейшая показуха как были жопализами так и останутся ими .всё еврочмошники носят одну маску и называется она как угодить своему суверену.и пусть инфляция и цены растут у этих чертей по часам.макрон богатый лягушками по делится😄😄😄😄😄😄,1671375143,712359038
