id,owner_id,post_time,post_text,comments.count
8492442,-24136539,1701346269,"Каждой стране, где сейчас активничают западные фонды и, так называемые, неправительственные организации, стоит задуматься, отметил Сергей Лавров на заседании ОБСЕ.
 
📍 Государства НАТО и Евросоюза своими руками разрушили военно-политическое измерение ОБСЕ. 
📍 Западные политические элиты, присвоившие себе право вершителей судеб человечества, сделали близорукий выбор не в пользу ОБСЕ, а в пользу НАТО.
📍США и Европа ввели против РФ тысячи санкций, поставив крест на широкой практической кооперации между Востоком и Западом.
📍Своими действиями американцы похоронили и Договор по открытому небу, и девальвировали целый ряд других основополагающих документов, направленных на укрепление двусторонних отношений в области безопасности.
📍 Одной из ключевых составляющих такой линии стала безоглядная экспансия НАТО на Восток, начавшаяся после роспуска Организации Варшавского договора.
📍 ОБСЕ находится на краю пропасти, возникает вопрос, стоит ли в нее ""инвестировать"" для обеспечения безопасности.
📍Молдавии уготована участь следующей жертвы в гибридной войне Запада против РФ, формат урегулирования ""5+2"" ""убивают"".",22
8489923,-24136539,1701251170,"Заявления пресс-секретаря президента РФ Дмитрия Пескова. Главное:
 
📌 Телефонного разговора с Пашиняном пока нет в планах Путина. 
📌 Пашиняна ждут на неформальном саммите СНГ в России в конце декабря, это будет прекрасная возможность поговорить. 
📌 Песков назвал избыточными меры по усилению охраны границы Финляндии с Россией, так как Финляндии ""ничто и никто не угрожает"". 
📌 Украина во всем обвиняет Россию, поэтому обвинения в отравлении жены Буданова можно назвать привычными. 
📌 Путин утром созвонился с Мирзиёевым, обсудили текущие вопросы двусторонних отношений. 
📌 Европейские политики видят неэффективность антироссийских санкций и эффект бумеранга от них. 
📌 Необоснованная концентрация сил на границе Финляндии с РФ представляет угрозу для России и может привести к напряженности. 
📌 Европа может обойтись без России, но теряет свою конкурентоспособность и получит ""очень серьезные последствия"". 
📌 Песков не комментирует инициативу МВД о ""соглашении о лояльности"" для въезжающих в РФ иностранцев.",12
8489682,-24136539,1701244997,"Американское издание Politico назвало главу Центробанка РФ Эльвиру Набиуллину главным ""разрушителем"" года за вклад в усиление российской экономики. 
 
В статье отмечается, что за 10 лет работы на посту глава Центробанка не раз спасала экономику и рубль посредством жесткой денежно-кредитной политики. 
 
Авторы публикации признали: Эльвира Набиуллина помогла нейтрализовать эффект беспрецедентных западных санкций и не допустить истощения российской казны.",62
8484948,-24136539,1701082200,"⚡️ Запад, вводя санкции против российской банковской сферы, не учел, что банк – это не просто кубышка, а часть экономики, отражающая ее состояние, заявил Владимир Путин на встрече с главой ВТБ.",159
8477707,-24136539,1700814023,"Штат Нью-Джерси приостанавливает действия закона о санкциях в отношении России, пишет Politico. 
 
Власти приняли это решение после временного ограничительного постановления компании Kyocera, имеющей дочерние компании в РФ, которую Нью-Джерси планировал добавить в черный список.

Смотрим подробности: https://smotrim.ru/article/3670355",52
8467334,-24136539,1700472781,"Заявления пресс-секретаря президента РФ Дмитрия Пескова. Главное:
 
📌 Почти половина желающих покинуть Газу россиян уже перевезены в РФ, работа продолжается. 
📌 Путин планирует выступить на онлайн-саммите G20 22 ноября. 
📌 РФ сожалеет, что на смену добрым отношениям с Финляндией пришла русофобская позиция — Песков о решении Хельсинки закрыть КПП. 
📌 Россия вряд ли может повлиять на ситуацию с закрытием Финляндией оставшихся КПП на границе из-за отсутствия диалога с Хельсинки. 
📌 РФ не принимает обвинения финской стороны в отношении российских пограничников, они полностью соблюдают все инструкции. 
📌 РФ глубоко сожалеет в связи с решением Финляндии закрыть оставшиеся КПП на границе. 
📌 Россия с уважением относится к выбору аргентинского народа на голосовании по избранию президента республики. 
📌 Российская сторона обратила внимание на заявления, которые в ходе кампании по выбору президента делал избранный лидер Аргентины Хавьер Милей, но будет судить о его поступках. 
📌 Россия выступает за дальнейшее развитие двусторонних отношений с Аргентиной. 
📌 Европа санкциями против России вызывает эффект бумеранга и бьет по интересам самих европейцев — Песков о рестрикциях на алмазы. 
📌 Путин в ближайшее время направит телеграмму соболезнований семье Тулеева.",60
8465452,-24136539,1700392140,"ТОЛЬКО У НАС! На прошедшей неделе Владимир Путин выступил на Форуме объединенных культур и высказался о введенных против РФ санкциях. По мнению российского лидера, никакие ограничения не повлияют на общение людей искусства между собой. 
 
Режиссер Эмир Кустурица в интервью автору и соведущему программы ""Москва. Кремль. Путин"" Павлу Зарубину выразил полную солидарность, ведь он – ""художник, который работает там, где это возможно"": http://smotrim.ru/mkp",10
8463481,-24136539,1700306003,"""Гром грянул – мы перекрестились"": Дмитрий Песков рассказал, что Россия адаптировалась к санкциям и извлекает из них выгоду. 

В интервью автору и соведущему программы ""Москва. Кремль. Путин"" Павлу Зарубину он добавил, что Запад продолжит искать варианты давления на РФ.
 
Смотрим подробности: https://smotrim.ru/mkp",28
8463166,-24136539,1700294404,"Всемирное антидопинговое агентство хочет начать применять санкции к иностранным спортсменам, которые будут участвовать в Играх дружбы, заявил глава WADA Витольд Банька.",41
8458402,-24136539,1700108961,"Стороны возобновляют контакты по военной линии, заявил Джо Байден на встрече с Си Цзиньпином в Сан-Франциско.

📌 Штаты продолжат конкурировать с КНР, но будут сотрудничать в сферах, где их интересы совпадают. 

📌 Страны продолжат дипломатические контакты на высоком уровне в продолжение саммита в Сан-Франциско. 
 

США должны прекратить поставлять оружие Тайваню, заявил Си Цзиньпин на саммите АТЭС. 

📌 Китай не планирует превзойти или заменить США. 

📌 Китайским интересам вредят меры экспортного контроля и односторонние санкции против Китая, которые вводят Штаты. 

📌 Пекин надеется, что Вашингтон отменит односторонние санкции.",38
8454078,-24136539,1699953900,"Заявления пресс-секретаря президента РФ Дмитрия Пескова. Главное:
 
📌 Результаты муниципальных выборов в Молдавии свидетельствуют, что многие жители этой страны выступают за развитие отношений с Россией. 
📌 В Кремле сожалеют, что Пашинян не будет участвовать в предстоящем заседании ОДКБ в Минске. 
📌 Кремль видел публикации о ""круговороте рублей"" из-за новых правил возврата экспортной выручки, экономические ведомства проверят информацию. 
📌 Песков назвал голословным заявление министра обороны США о якобы помощи РФ и Китая КНДР в военной сфере. 
📌 США не прекращают культивировать санкции против России, но Москва адаптируется к ним. 
📌 Путин 14 ноября во второй половине дня проведет совещание по развитию топливно-энергетического комплекса.",37
8451893,-24136539,1699876307,"По данным СМИ, почти половина граждан ЕС за год ощутила подступающую депрессию и тревожность. Специалисты видят причины в экономическом кризисе и нестабильности во внешнеполитической обстановке. 
 
Еврочиновники вместо того, чтобы наладить эту обстановку, готовят новый пакет санкций против России, усугубляя положение, а население потребляет антидепрессанты горстями, указал ведущий программы ""Вести недели"" Дмитрий Киселев: https://smotrim.ru/video/2712557?utm_source=smm&utm_medium=vgtrk&utm_campaign=r24",59
8443422,-24136539,1699542623,"""Прогресса в решении проблем мало"", — заявил замглавы МИД Рябков, рассказав, что Россия и США недавно провели очный раунд консультаций ""по раздражителям в двусторонних отношениях"". 

⚫Россия не намерена инициировать разрыв дипломатических отношений с США. 
 
⚫Однако замглавы МИД РФ допустил понижение уровня дипломатических отношений с США при текущем поведении Вашингтона.

⚫""Попытки США через санкции подавить развитие нефтегазового сектора РФ провалятся"", — заявил Рябков, говоря о санкциях против ""Арктик СПГ 2"". 
 
⚫️ Всем выезжающим за рубеж россиянам нужно помнить, что со стороны США возможны любые враждебные действия вплоть до арестов.",5
8442175,-24136539,1699516873,"Наше взаимодействие в торгово-экономической и промышленной отрасли крепнет, заявил президент Казахстана.

Другие заявления Касыма-Жомарта Токаева на форуме межрегионального сотрудничества России и Казахстана: 
 
🔺Реализованы уже 30 проектов, около 60 находятся на стадии реализации.

🔺Форум стал крепкой традицией двух стран. 
 
🔺Форум посвящен сельскому хозяйству — в следующем году будет 70 лет с начала работы компании. 
 
🔺В Казахстане объем ВВП продукции увеличился в два раза за последнее время. 
 
🔺Сейчас важна индустриализация производства сельской продукции Казахстана, будет построено 115 молочных ферм. Также важно развитие инфраструктуры хранения продуктов. 
 
🔺Третья актуальная задача для рассмотрения - развитие аграрной науки и внедрение инноваций в производство. 
 
🔺Сейчас значительно увеличился импорт российского удобрения в Казахстан. 
 
🔺Для укрепления глобальной продовольственной безопасности сельхозпродукция не должна быть под санкциями.
 
🔺Сейчас главная проблема – засуха и наводнения в центральной Азии, которые могут повлиять на агросельхоз. Планируется модернизация водного сектора.",28
8440466,-24136539,1699451585,"️ ""Антироссийские санкции выполнили свою основную задачу заокеанского политтехнолога — они обрушили экономику Германии"", — так считает депутат бундестага XIX созыва Вальдемар Гердт. 
 
В эфире телепрограммы ""60 минут"" на телеканале ""Россия"" политик добавил, что немцы сейчас не только не могут себе позволить купить отечественный автомобиль, они не могут приобрести и китайские товары.

Смотрим подробности: http://smotrim.ru/60minut",103
8439571,-24136539,1699433321,"Число санкций в отношении России превысило 17 тысяч, рассказал Сергей Лавров во время посольского круглого стола. ""Россия адаптировалась к санкциям, рост ВВП к этому году близок к трем процентам. У ведущих стран Европы экономика в минусе. Это для понимания, по кому больнее всего бьют санкции"". 
 
Вашингтон продолжает навязывать Европе дорогой американский сжиженный газ, при этом продолжая покупать у России уран и другие материалы, добавил министр иностранных дел.",157
8435562,-24136539,1699280700,"Запад подает антироссийские санкции так, будто на них согласился весь мир, но это не соответствует действительности. На это указал министр иностранных дел Индии Субраманьям Джайшанкар в интервью Corriere della Sera. 
 
""Эти санкции, по сути, являются рычагами, которые имеют в своем распоряжении развитые экономики. Они используют эти рычаги, когда им это удобно"", - сказал он.",38
8426617,-24136539,1699013255,"Заявления президента РФ Владимира Путина на встрече с членами Общественной палаты РФ. Главное:
 
📌 Путин поздравил россиян с наступающим Днем народного единства. 
📌 Владимир Путин отметил, что на всех переломных этапах России единство народа было ключевым. 
📌 Западные завоеватели в отличие от орды претендовали на завоевание языка и культуры, что разрушает народы. 
📌 Россия сейчас защищает свои морально-нравственные ценности, культуру и язык, помогает это сделать и жителям Новороссии, подчеркнул президент РФ. 
📌 Владимир Путин о санкциях Запада против членов общественной палаты: противник оценивает то, что вы делаете для России.",24
8426223,-24136539,1699006816,"Родство с иноагентом не должно становиться ""именем нарицательным"", отметил Дмитрий Песков.

Другие заявления пресс-секретаря президента России: 
 
📍Все крупные компании в РФ привыкли хеджировать санкционные риски.
📍Саммит ОДКБ в Минске 23 ноября готовится, о формате участия Владимира Путина будет сообщено своевременно.
📍Кремль не располагает информацией о том, что группу ""Вагнер"" может возглавить сын Пригожина.
📍У Владимира Путина будет загруженный график на следующей неделе, международные контакты и насыщенная внутренняя повестка.
📍На вопрос про возвращение россиян, в том числе Пугачевой: любой гражданин свободно приезжает на свою Родину и выезжает за границу.
📍На вопрос об инцидентах с мигрантами: правоохранители выполняют свою работу, при этом есть много приехавших в Россию, которые закон не нарушают.
📍Про статью WSJ о ""Вагнере"" в Сирии: де-факто такой группы не существует, все эти рассуждения ни на чем не основываются.
📍Санкции создают дополнительные проблемы, но мы адаптировались к ним.",53
8426040,-24136539,1699002600,"Новые антироссийские санкции США являются продолжением их политики ""нанесения РФ стратегического поражения"", но в Вашингтоне ""не дождутся"". Такое заявление сделала Мария Захарова в эфире телеканала ""Россия 24"". 
 
""Козней будет, наверное, еще немало, но мы научились с этим со всем не просто справляться, но и использовать это в своих же собственных интересах"", - добавила официальный представитель МИД РФ.",49
8425260,-24136539,1698985800,"Урон от различных санкций коллективного Запада в отношении Москвы куда больше для него самого, чем для России, отметил посол РФ в США Анатолий Антонов.

Также он добавил, что Москва реагирует на различные антироссийские выпады коллективного Запада с упреждением.",48
8423213,-24136539,1698899419,"США обязуются обеспечить надлежащее участие российской делегации в ноябре на саммите АТЭС в Сан-Франциско с учетом действий санкций в отношении РФ, передают РИА Новости.",15
8422619,-24136539,1698862474,"""Чем меньше барахла — тем лучше, меньше возможности прислать нам из европейских стран постельных клопов"", так Путин прокомментировал возможный запрет ЕС на поставки отверток и иголок.

Президент добавил, что, когда потенциал санкционной агрессии фактически исчерпан, в ход могут пойти диверсии или акты саботажа на важнейших объектах глобальной инфраструктуры.",72
8422606,-24136539,1698862104,"Путин ожидает, что санкции против РФ будут усиливаться.

Нужно усиливать все положительный тенденции экономики — Путин.

Указ по валютной выручке уже сыграл положительную роль.

Безработица в России устойчиво низкая, около 3%, а зарплаты растут выше инфляции.

Путин указал правительству и ЦБ, что нужно скоординировано снижать инфляцию.",98
