id,owner_id,post_time,post_text,comments.count
8422599,-24136539,1698861863,"Путин: экономическая ситуация в целом в России развивается стабильно. Другие заявления президента на совещании по экономическим вопросам: 

Обрабатывающая промышленность выросла 7,1%.

Необходимо следить за динамикой цен на социально значимые товары.

Хотели наказать нас санкциями, а нанесли урон своей экономике.

Путин пошутил на тему новых санкций: чем меньше барахла, тем меньше будут экспортировать постельных клопов.",48
8420111,-24136539,1698770700,"Появились подробности о 12 пакете санкций Евросоюза против России. По информации Bloomberg, в него попадут более 100 физических и 40 юридических лиц. 
 
Суммарный объем торговых ограничений оценивается в 5,3 миллиарда долларов. Новые санкции могут затронуть экспорт сварочного оборудования, химическую продукцию и другие технологии, использующиеся в военных целях. 
 
ЕС рассматривает запрет на выдачу лицензий на программное обеспечение, а также возможность убедить фирмы добавить в контракты с партнерами в третьих странах положения о запрете экспорта ряда товаров в Россию.",57
8418812,-24136539,1698738360,"Через три месяца у России с Финляндией прекращает действовать приграничное соглашение. Финская сторона ввела санкции в отношении нашей страны и ограничила въезд россиян на свою территорию.
 
Тысячи россиян столкнулись с тем, что не могут платить ЖКХ и налог на свою недвижимость в Финляндии, а местные власти готовят закон, дающий право ее конфисковать.",80
8417691,-24136539,1698686100,"Калининград с Шанхаем все ближе: тарный комбинат перешел на расчеты в юанях, завод ""Автотор"" уже выпускает четыре марки китайских машин, а вместо латвийских шпрот теперь отечественные. 
 
После ввода санкций прибалтийскими странами, грузы в Калининградскую область доставляют по новому маршруту — Северному морскому пути.",19
