post_id,text,comment_time,from_id
7137513,"Новая Зеландия поди и не знает, где Украина находится, а туда же...",1665470547,456818261
7137513,Как жить дальше... Моська лает на СЛОНА!,1665470790,420758471
7137513,"Нуу, после такого удара😏 нам будет очень😦очень😧 приочень😜 трудно стать на колени",1665471343,87183146
7137513,А я с ума сойду новая зеландия,1665472231,59539122
7137513,К папуасам не поедем,1665475242,253306597
7137513,Ужасть!,1665479391,461575479
7137513,А нам-то что?,1665480182,105000769
7137513,"Богатеев вынуждают давить на власть . Это у них так  деньги давят на власть 
А у нас природная власть , в том чтобы свои были сыты одеты и обуты и живы и берега не путали по беспределу . А чужие чтобы боялись",1665480353,172648106
7137513,Им же хуже😂,1665487447,291100252
7137513,"Да не обращайте внимание. Просто хотят, чтоб их заметили, может на карте посмотрели, где это чудо-юдо... Процентов 70 жителей Земли и знать не знали, что есть эта страна, а теперь, глядишь, туристы появятся",1665574797,28014123
7137513,Новая Зеландия  скоро будет просить помощи у России .,1665589006,485777530
7134496,А кто строить-то будет? Если всех на фронт заберут,1665409339,3175938
7134496,умнички вы Наши ! так держать !,1665409356,519908337
7134496,Молодцы👍,1665409434,435367262
7134496,Заберите меня на войну,1665409997,676418448
7134496,С оборудованием ещё соглашусь но астальное увольте,1665410054,480559702
7134496,"Только не забудьте проследить, что бы Чинуши, себе, ""любимым"" не поменяли своё жилье на новые квартиры. 🤷‍♀️",1665410079,354115555
7134496,"Считаю что Путин не справился на данный момент с обязанностями президента.  Его политика приводит к обнищанию народа, права и свободы которого он поклялся защищать. В первую очередь он должен позаботиться о гражданах своего государства. Потом уже все остальные, в том числе и новые регионы.",1665410914,246345587
7134496,"Отжимать будет государство бизнес - так и написано : ""поддержка""",1665412848,445743603
7134496,"Где возьмут 24млрд, изымут у нас, изымут у подельников бункерного, напечатают новых? А так то, идея хорошая, тикток зацени т",1665421655,156867898
7134496,"Лучше начните сажать воров из администрации в  регионах , тогда выделяемых денег будет хватать на всё ...🤔🤔🤔👍👍👍😎😎😎",1665451189,156123210
7134496,"Бегают по стране куча уклонистов безработных, никакого дела до них нет.",1665452038,468014142
7134496,Древесина Российская из-за каких санкций подорожала ???,1665457512,24166157
7134496,Денежки осядут у ченушь,1665466203,749153555
7131661,,1665390931,580372279
7131661,Они давно с нами.😎👍🔥,1665390992,627778870
7131661,С Юбилеем Вас!❤,1665391045,518503483
7131661,,1665391456,580372279
7131661,Как часы заведётся Россия.  ПОБЕДА!!!!!!!!,1665395520,630161571
7131661,"По отчетам - прям самое важное, на мой взгляд.",1665424767,546960151
7127134,Я так рада🙏🏿😂😂😂😂😂,1665317981,410524925
7127134,"Бесят американские лживые Журналисты всех . Сочиняют, да выдумывают, до думывают, фантазёры.",1665320813,630161571
7127134,"Страны ОПЕК за нас, но США могут захватить эти страны, нам надо не дать это сделать",1665373999,398833873
7126117,"Если Европа вместе с НАТО враги России, то какого им тогда руководство страны ресурсы то разбазаривает, распродает газ, нефть? Это врагам то? Какие то Северные потоки)",1665293878,38260263
7126117,Так по**й.,1665294163,516062814
7126117,"Вовик шеломов опять будет в три дорого россиянам толкать газ и нефть, а им задарма",1665294315,648687019
7126117,"Не, пока Нуланд печенек не подвезёт, такие гуси не взлетают",1665294366,366936861
7126117,Сейчас всех отправят на восток недовольных зарабатывать.,1665294453,630161571
7126117,Это они так греются.🙂,1665294494,286619955
7126117,США понтуются за океаном. Модные и красивые и сильные да? Соседи называетесь где поддержка ? А Россия простая.  Получите и распишитесь.,1665294692,680836457
7126117,"Волчий хвост не хочет мёрзнуть, сопротивляется🙂",1665294997,14017569
7126117,"Я злыдня  . 
Я хохлушка из Сибири . За мой Донбасс . За родную Макеевку . Мороз вам европейцы желаю лютый .С ноября по март .",1665295144,351189512
7126117,"Здравия, добрым иностранцам🎖️
Правда за РФ 🇷🇺",1665295202,448063889
7126117,"Хорошо, что у нас митинги нельзя",1665295303,20903048
7126117,,1665295390,680836457
7126117,Такое только у нас и покажут по зомбоящику!!на самом деле проживут не одну зиму!!,1665296125,59447225
7126117,"Сейчас опомнились,холода идут, Россия нужна стало,пусть Байдену идут.",1665296589,370526400
7126117,"Зима близко@
Посмотрим на сколь далеко готова зайти нынешняя продавшаяся США правящая кодла в ЕС. Просто так сомневаюсь что ""уйдут"".",1665298004,88425778
7126117,"Нужно отменить санкции, они говорят абсолютно верно. Хватит страдать! Давайте дружить? За отмену санкций.",1665298938,336495513
7126117,,1665299061,602529040
7126117,Профсоюзы ЕС- российский флаг вам в руки!,1665300475,662708236
7126117,"Ну посмотримс, как там в Европе слышат власти народ али нет?)))",1665300510,7739507
7126117,"Ну походили, ну поносили и что изменилось? 😏",1665302694,158784874
7126117,"Германия и Австрия с декабря прошлого года каждый день ходят на протестные митинги. Протестуют против вакцинации, вакцинных паспортов, вакцинного геноцида, с этого года добавились те требования, что перечислены в посте. Молодцы, европейцы. Разобрались в ситуации и отстаивают свои права на свободу выбора. Поддерживаем.",1665304260,326009805
7126117,"Даст Господь, может холод и разруха вашей комфортной жизни в Европе и за океаном природная катастрофа наконец-то излечат вас от безумных идей управлять всем миром через войну.",1665307045,707205940
7126117,"Ага,ж...уже не горит,а примерзает,тоже плохо",1665307258,653591843
7126117,"Уши вянут, а как нам в Сибири в деревне топим печь дровами, а дрова надо купить, стоит телега тракторная 8000тысяч а пенсия 13.700т на зиму надо 3 телеги, так что голод не тётка лижбы не замёрзнуть!",1665307273,529291153
7126117,,1665307361,529291153
7126117,Поздно ...,1665307969,466649175
7126117,"Давай народ, поднимайся, заяви о себе!!! ⚠🔥",1665308683,220544756
7126117,"Везде выходят, везде кричат,а воз и ныне там",1665310320,298544756
7126117,"Дармоеды, привыкли покупать газ за копейки.",1665310472,3705930
7126117,"Толку только ни кто не слышит политикам по барабану,Читая комменты без России нам и не прожить что ли??? Успокойтесь переживём, 90 пережили и это переживём.",1665312051,709553150
7126117,"Громче говорите своим властям и чаще , может быть , что-то и получиться если клоуна ,байдена,гениколога и лису уберут с постов 😃😃😃",1665313250,711531816
7126117,"Людмила,достаточно лет на 50сятврайоне-50удачипидорыгрейтесь обдруг дружку",1665315680,734391193
7126117,,1665316539,448728277
7126117,Полностью прекратить частные поставки нефти на украину и недружественным странами! Ультиматум до мирного урегулирования!,1665322388,298569771
7126117,"Чем холоднее становится, тем больше народу там выходит. Ну дай Бог холодную зиму в этом году, да перемен там к лучшему как власти😏",1665326354,487853650
7126117,"ПИСЕЦ ВАМ ЕВРОПЕЙЦЫ! ВАШИ ЛЮБИМЫЕ АМЕРИКОЫ ВЗОРВАЛИ ГАЗОПРОВОД, ТАК ЧТО ЗАПАСАЙТЕСЬ ДРОВАМИ, МЕНЬШЕ МОЙТЕСЬ, В ОБЩЕМ ТЕРПЕНИЯ ВАМ......ВСЕ РОССИЮ НЕ ЛЮБИЛИ ..И ДИКИЕ МЫ, И СЛАБО РАЗВИТЫЕ, А ТЕПЕРЬ ОКАЗАЛОСЬ, ЧТО ВСЯ ЦЕВИЛИЗАЦИЯ ЕВРОПЫ ДЕРЖАЛАСЬ НА РОССИИ.....",1665335297,468830338
7126117,А у нас подешевело всё в два раза!,1665377674,83354610
7125170,Да России нужно им помочь правда послать не наш газ а нашу полицию с ОМОНом.,1665251044,288845339
7125170,"В недоле́ком будущем...
Чтобы навредить России.... (Они начнут отменять свои санкции... 🤣",1665251132,710455921
7125170,"Будто это что-то даст, эти митинги наблюдались ещё вначале сентября, но с того момента никаких мер не было предпринято",1665251231,564578996
7125170,У Байдена просите он ваш царь!,1665251360,749984570
7125170,"Свечи, тазики, костёр. 
Олаф дьявольски хитер",1665251431,304341257
7125170,северный поток не починишь...,1665251463,7367893
7125170,Люди мира просыпаются наконец от лживой политики Запада,1665251595,695264552
7125170,Европе нужно избавиться от влияния США!,1665251805,163607672
7125170,Вот и до Европы 90-е докатились.,1665252108,561766515
7125170,"""Я хочу российские газ и нефть"" классный лозунг, собственно, их политики тоже спят и видят как они заберут российские нефть и газ",1665252210,185787334
7125170,"Россия - Мир
США - Война",1665252232,274664200
7125170,А где они протестуют они мирно идут их никто  и слушать не будет,1665252367,750623422
7125170,"Они сказали,выдержат 🤷‍♀️",1665252460,571114314
7125170,"Какая вам всем разница? Ну хотят ходят, хотят не ходят. Давайте о своих проблемах) у нас все довольны?)",1665252513,72558227
7125170,Скоро и У нас будет как пойдут первые грибы с моб и лизованными.. учитывая все события на которые только оправдываемся ..ЖАЛУЕМСЯ просто народ бесит,1665253301,214586767
7125170,"Правильно будет, кто не скачет тот замерзнет",1665253326,540597286
7125170,🌲🌲🌲🐑🐑🐑🌳🌳🐑🐑🌳🐑🌳🐑🐑🐑🐑😪🤒🤑🤥🤠😱pecorelle ...z a b l y d i l.i s,1665253415,707631379
7125170,"В ЕС уже точно не выберут то правительство, которое сейчас у власти, если, конечно, выживут.",1665254164,697059415
7125170,Просыпайся Европа!!! Простой народ может многое!!!!!,1665254912,12458954
7125170,"судя по плакатам и транспарантам вообще не понятно, в поддержку или против чего, вышли эти люди.На самом большом транспаранте написано ""жаркая осень вместо холодной"" .На плакатах по меньше ""Наша страна первая"".",1665254941,68565675
7125170,можно подумать властителям не плевать на какой-то там народ🤷‍♂️,1665255344,162297875
7125170,,1665255404,734124698
7125170,Как же приятно 🤭,1665256848,468290759
7125170,"Когда в 2012 году Запад приготовился к концу света, запаниковав из-за предсказаний майя (не имеющих никакого отношения к концу света) относительно изменений с планетой Земля, тогда уже было понятно, что Запад скорее накаляет обстановку, толком не разобравшись, в чём суть. То и сегодня: кто во что горазд - а воз и ныне там! 

Уж определились бы страны Запада со своим поведением - то на амбразуру бросаются со своими санкциями, то требуют от своих правительств дружить с Россией, гоня взашей Олафов, Урсул и тд.",1665258051,69336646
7125170,весело у них там,1665263505,414778459
7125170,Ахаха … вы сами придумываете эти митинги?! )),1665265442,25393481
7125170,"Вообще то ни на одном из Плакатов не написано про это .Можно увидеть надписи типа:Наша страна сперва или типа того.Причём это видео собрано из кусочков :там и Австрия,и Германия ,короче попурри.😂А когда проходили эти митинги,никто и не знает,может это вообще год назад было.",1665266695,676032003
7125170,"Ведь главное соблюдается :заставить россиянина думать ,что там,»у них» все так хреново ,а вот у нас все вообще за@@сь.Бедные люди,сняли бы уже «розовые очки «или так спокойнее жить ?",1665266851,676032003
7125170,"Они за себя выходят, за своей тепло, газ, удобства, если это всё будет, то плевать то им всем на Россию, как обычно",1665270658,504986180
7125170,Какая прелесть😁 А перестать оказывать поддержку Украине они не хотят?? Ну пусть ещё стадом походят,1665273687,713196643
7125170,Таш  неужелиш ???,1665277708,351189512
7125170,Законномерно. Что и требовалось Ожидать.,1665279108,567758787
7125170,И это ещё не зима!,1665286475,328117891
7125170,"Неужели это правда, действительно митингуют?! А где полиция?",1665286711,297808296
7125170,,1665289542,743878634
7125170,40 000 американских солдат на ведут порядок быстро.,1665294735,630161571
7125170,И это ещё не зима...,1665294973,29428344
7125170,Вот выходят люди выразить свою точку зрения и никто их не разгоняет...,1665296081,166123993
7125170,Молодцы немцы. Продолжайте принимать украинских беженцев.....,1665298658,504126631
7125170,Зима близко@,1665298719,88425778
7125170,"Ага, их никто не услышит, хваленый цивилизованный запад😂 а по сути коррумпированные люди в политике, которым нет дела до простого народа",1665299434,47226967
7125170,"Молодцы европейцы, надо всем миром встать",1665302536,708950773
7125170,Остались бы Трамп и Меркель - не было бы всё так плохо.,1665303125,21881731
7125170,Дело в том что люди простые страдают а политикам по барабану продажные.,1665312248,709553150
7125170,"Зима на носу.Бегают, чтобы согреться. 😄",1665319048,523038076
7125170,Слався отечество наше народное,1665327835,13324409
7125170,Поздно спохватились.,1665343316,432088
7116575,Дошло наконец-то 🤦‍♂️,1665117657,20444633
7116575,"Столько потратили бумаги для написания санкций - лучше бы её использовали в качестве топлива, пользы бы было больше😆✊🇷🇺",1665117674,90898775
7116575,Нужно дружить!!,1665117689,343437597
7116575,Брюссель капут,1665117979,493271646
7116575,Ну фейсбук уже заработал 😳,1665118268,455854195
7116575,"А в трубе уже дырка, а на ремонт денег много надо",1665118281,213227
7116575,"Зачем сюда пишут новости про Европу , мне без разницы, что у нас за проблемы у недружественных стран !",1665118331,5132232
7116575,"Собака лает, караван идёт.",1665118479,372349635
7116575,Им д-бам Бисмарка надо перечитать.................................,1665118506,38867475
7116575,"На самом деле санкции принесли большие доходы нефтегазовым корпорациям, которые принадлежат европейским и американским олигархам. Россия в данном случае оказалась лишь поводом в этой игре. Это всего лишь бизнес!

Кстати, для тех кто считает что Европа замёрзнет этой зимой. Боюсь разочаровать. Хранилища Европы заполнены газом на 90%, это более чем достаточно чтобы пережить зиму.",1665119011,160428635
7116575,Ну так не честно. Ввели так ввели🤣🤣🤣,1665119527,239367042
7116575,Поздно.,1665119815,598293811
7116575,"Не менять, а отменять, наверно)",1665120479,11155890
7116575,"Правильно, теперь вам вершки - нам корешки!",1665121141,366936861
7116575,Что о Европе думать-проживут как нибудь.,1665125892,55572019
7116575,"у нас нет такого кризиса ни в умах, ни в экономике. время раздутым финансам развалиться . каждая пирамида имеет точку невозврата. сверхпотребление обречено.",1665128244,134045356
7116575,"А вы не обратили внимание на то, что было сказано им :  ""санкционную политику надо МЕНЯТЬ"",  а не отменять. Или перевод такой, или я не понимаю ничего ..",1665128403,232046101
7116575,"Вечная слава и память всем Героям, Сынам и 
Дочерям Божиим! 
По зову Отца восстал Благой Род-Богатырь! 
Боже, Всемогущий - сей День БлагоСлави Вечностью Своей! 
Сила Животворящего Духа Отца-Бога! 
 
Любимый, дорогой наш – Славный Президент! 
От всей души Народ вас поздравляет - 
С Особым Днем Рождения, в котором есть момент, 
Что заложил Сам Бог! Скоро весь Мир узнает, 
Что Солнце Правды снизошло с небес на землю! 
И Торжество Любви, Добра, познал наш этот Мир! 
Живительное Слово, возрождает всю Вселенную, 
Чтоб Богатырь – Род Века Золотого здесь ожил! 
И сотворил невиданное Чудо из чудес, 
В том Славном Духе, что Отец предъявит Сыну! 
А Сын и есть сей Мир-Дитя, спустившийся с небес 
По зову Отца, Бог, вложил от Сути Благой Своей – Силу! 
7.10.22. И Свершено – Явление Благого Иерусалима! 
 
Вечная слава и память игумену земли Русской преп. о. Сергию! 
Молитва к отче Сергию – Духовнику Руси! 
Подними отче Сергий 
Силу Духа стен Лавры! 
Укрепи отче Сергий 
Ценность Духа в сердцах, 
Не позволь отче Сергий 
Сатане встать над правдой, 
Поддержи отче Сергий, 
Победить ложный страх! 
Ах, как горько и больно 
Рвут Россию на части. 
Изгони с Земли Светлой, 
Чужеродный нам дух! 
Киев статный и бравый, 
Не отдай страшной власти, 
Кои льют реки крови, 
Омрачая Бога слух! 
Стань же нашей молитвой 
Перед Богом Всевышним, 
За Россию Святую, 
За Единство сердец! 
Отче Благий наш Сергий, 
Воскреси Русь Благую! 
Подними над Вселенной 
Духа Подвига Крест!!! 
8.09.14. Молись за Лавру и Киев – Единый наш Дом, 
Благослави Вселенским Животворящим Крестом!",1665131332,281042135
7116575,Молодец Орбан!.,1665134224,461575479
7116575,"Сперва дарю, потом заберу😂",1665141631,541787131
7116575,"Ну вот вернется на рынок Циско, а его место уже займет Хуавей, который дешевле в 5 раз и не выносит мозги в случае чего. Да и кто с Циско захочет связываться после того, как они по факту кинули своих клиентов.",1665143584,728641204
7116575,Да надо менять,1665152390,24166157
7115034,,1665074247,707575333
