post_id,text,comment_time,from_id
7253275,"Давно это нужно было сделать. Закон о персональных данных, как мне казалось, запрещает хранить персональные  данные россиян на иностранных серверах.",1667886362,39045854
7253275,"В России все базы дырявые, инфа утекает стремительным потоком. И эта ""надёжно защищённая"" тоже будет слита в ближайшее время",1667886402,5217190
7253275,"И работа аэропорта встала))) задержки рейсов, опаздывающие пассажиры))",1667886982,478984192
7253275,,1667887133,749588097
7253275,😳,1667899122,260467325
7253275,Надёжно защищена 🤣🤣🤣,1667901311,405834613
7253275,"Уважаемый Владимир Владимирович, я Шидаков Рашит Анзорович обращаюсь к Вам с вопросом как гражданин России на каком основании  в период когда Медведев Дмитрий был Президентом России  подарил Норвегии наши территории  на которых имеется рыба, краб, нефть, уголь? На каком основании земли и воды подарены Норвегии?  Разве данное действие не является предательством родины? Ведь кроме того что мы потеряли территорию, так теперь там  ООН там установила там свои ракеты, что считаю очень опасным для жителей России в сложившееся время. Несмотря на то что, Медведев уже давно не президент, он занимает сейчас должность заместителя председателя Совета Безопасности Российской Федерации. Прошу снять с должности и провести проверку на каком основании находясь в должности Президента России Медведев подарил наши территории Норвегии?об этом я уже писал, но так и не получил ответ",1667916468,464660741
7253275,"Слава богу, ещё бы по русски писать при заполнении электронного билета, у нас Страна огромная !",1668018535,548573131
7253097,А не перекрыть ли им его совсем? 👀,1667882353,10750196
7253097,,1667882404,760369879
7253097,Газпром аж вздрогнул😊,1667882424,633575211
7253097,"Во как.Не платят , а газ хотят.",1667882518,175386218
7253097,Санкции и в суд 😁 Они серьёзно блэт это,1667882537,249897044
7253097,Мечты сбываются!,1667882571,1419637
7253097,"Чем меньше блоха ,тем больнее пытается укусить? А,где денежки, за газ?",1667882623,674929779
7253097,"Я валяюсь, вот это шапито 🤣🤣🤣",1667882672,21154881
7253097,"Так  Молдова  ДАРМОЕД!!!
где  деньги??? Зин, 
Надо  быть  предателем  русского  народа, давая  бесплатно  продукцию,
 заработанную  русским  народом.",1667882814,518940485
7253097,Это страшно!🙃,1667882821,671573689
7253097,🤣Молдавия что это 😂,1667882921,713399046
7253097,А платить вовремя не пробовали?,1667882975,265584333
7253097,Молдова тоже Европе подпевало?,1667882981,561219289
7253097,,1667882992,574542318
7253097,Плати  и будет газ.должны кучу бабла Распизделись..,1667883162,76243426
7253097,🤣,1667883278,482533290
7253097,"Утром деньги, в обед газ) а можно наоборот? Утром газ, а в обед деньги? Можно. Но только деньги - вперёд.",1667883316,1691591
7253097,Выхлопных газов нанюхался?,1667883376,10836678
7253097,Ещё и  выиграют.Европейские суды проплачены.,1667883494,152534875
7253097,А лучше написать в «Спортлото»…,1667883529,710882429
7253097,"За газ не платили в суд на них ни кто не подавал,наоборот пошли на встречу.Платить так и не начали,еще и воровать начали.Так еще и в суд подавать собрались.Тоже в реверсные решили перепрофилироваться?Так реверс уже брать не откуда,запасать дрова придется.Черти неблагодарные.",1667883544,469478355
7253097,Чего хотеть от цыган,1667883747,153165811
7253097,Чё возятся с этими санду манду и додонами,1667883855,209289789
7253097,Ой... Мать честная... Страшно то как,1667883969,161973859
7253097,,1667884099,589021010
7253097,Надо полностью перекрыть и подать на них в суд за неуплату,1667884904,651485347
7253097,,1667885327,739212808
7253097,"Совсем уже ах...? Сами трубу взорвали, а Газпром им виноват🤦‍♀️",1667885549,69273214
7253097,А долги сначала заплатить  Молдавия не хочет за уже поставленный и потребленный газ!?!?,1667885894,387520948
7253097,"Не правительство Молдавии, а цирк. 🤡⛔",1667886328,481292421
7253097,"Вы думаете, что ""дутен пулы"" самостоятельно что либо озвучивают - конечно же нет. Ихний дядя ""Сэм"" за них решает все.",1667886645,658292193
7253097,Дрова на зиму заготовили,1667887073,310846273
7253097,А потом что будут делать ?  Когда Газпром уйдёт навсегда,1667887197,216895446
7253097,"Наглость,второе счастье!",1667887218,44131181
7253097,Попрашайки как и укропия,1667887273,505456809
7253097,Все упирается в Приднестровье..будет коридор..все проблемы пропадут..,1667887626,685894715
7253097,Hui im a ne gaz.,1667887708,523802345
7253097,"Это мне напомнило фильм Лжец с Джимом Керри.
Он тогда про ситуацию говорил когда бандит залез в дом ограбить, но подскользнулся и поранился ножом после  чего подал в суд на хозяйку...
И выйграл 😐",1667888185,88225769
7253097,https://bit.ly/3DPOVub,1667888975,751794433
7253097,"Интересно,а Молдавия как страна вообще будет существовать, когда Газпром выиграет дело и потребует возмещения всех убытков и долгов, или у Газпрома своя собственная страна будет,какая нибудь Газпромдавия?😂😂😂😂",1667889150,203480839
7253097,Добро наказуемо.,1667889168,493061926
7253097,"Похвально админу группы - наконец то начали печатать по русски - Молдавия, а не Молдова(по молдавски).
В этом же русле - Белоруссия, а не Беларусь (по белорусски).
Ну и отчасти сюда же - сшатовцы, а не американцы (в Америке 41 страна), если речь идёт не о чём то континентальном, типа циклон, цунами и т.п., а конкретно о сшатовцах.",1667891405,112809732
7253097,С этого и Украина чидила.,1667894278,9810318
7253097,https://m.youtube.com/watch?v=6-RXPS7cmEM,1667894960,91438334
7253097,"Тврри, их кормят, а они ещё в тарелку срут...",1667895773,656531293
7253097,,1667896495,461575479
7253097,Да что с ними нянчится сколько можно. Закрыть кран и всё или продавать в 5 раз дороже пусть знают своё место. США так делают и ничего к ним на коленях ползут,1667898779,288635765
7253097,"сначало деньги,затем будем решать",1667900756,544413376
7253097,А денег за газ платить не надо?,1667904678,1246861
7253097,,1667910928,546960151
7253097,И какие же санкции применит  Молдавия?Жуть интересно!,1667912794,699225074
7253097,"Сколько недоумков в современной политике , аж диву даёшся ! 😏",1667913865,482156045
7253097,Бээмпэшка,1667915145,12417831
7253097,"Они смеются чтоль? 
Это мы чтоль инициаторы всего были? Нет, конечно, на что они рассчитывают? 
Мне кажется, что им пора спуститься с небес на землю и всячески стараться с нами наладить отношения, потому что он нас многие  будут зависеть, потому что у нас только развивается всё. https://www.mos.ru/news/item/115551073/ мы то крепко сидим, думаю, что в основном многие страны, в нас очень сильно нуждаются)",1667918572,637612008
7253097,То есть у нас не хватает газа а мы ещё и санкции сделаем.... Больные,1667921149,755681905
7253097,Вот нех было раньше идти на уступки! Доброту понимают как слабость. Жёстче надо быть.👊,1667931340,561529552
7253097,"Нет, ну наглые!!! Сами условия договора не выполняют ( вовремя не платят), а от Газпрома чего то требуют... Молдаване уже успокоились? Не стали гнать своё продажное правительство до конца? Ну, ну.... Зима , не тётка!... Да и тётки разные бывают...",1667934867,34849496
7253097,"Щито? Можно глобус Молдавии, понять, откуда хрюканье",1667935808,759590096
7253097,😁😁😁 лютые типы,1667942184,435844557
7253097,🤣🤣🤣🤣 это просто цирк,1667968224,505267131
7250785,Особенно заметно по автопрому . 🤣,1667827766,570359098
7250785,"Ага, справились. Но всю нагрузку от подорожания логистики, сырья и прочего переложили на потребителя, путем повышения цены на продукцию. Но вот как с этим справиться потребитель уже никого не волнует, скажут работай больше и без выходных",1667827878,247111058
7250785,55 это разве не мало?...,1667827977,68397115
7250785,Санкции против России не работают! Санкции больно ударили по Европе и США! Санкции сделали Россию сильной!,1667828591,163607672
7250785,"Как ? Цены повысили, качество снизили?!",1667828722,29356688
7250785,"55% это конечно очень мало. Но всё же как некий показатель разгона экономики. Осталось за малым. Оценить достойно труд и пенсии, чтобы у народа появились свободные деньги, а не только на хлеб и жкх. И потихонечку начнётся счастье.",1667828836,17198848
7250785,"Конечно, все на нас повесили и сидят, не парятся",1667829426,40226955
7250785,А 45/ до них даже не дотянули. В пандемию закончились.,1667830681,224664913
7250785,"еее. вот так хорошие новости. половина бизнеса в каком-то очке, вторая половина даже непонятно где. слава великому геостратегу",1667832575,220424633
7250785,"Женя полностью свами согласна, так всё и есть",1667832693,352561857
7250785,"90% бизнеса-это барыги,которые перепродавали тряпки,электронику и авто с ЕС!Россия может запускать ракеты,но не может собрать ""Москвич 412"" из 100% своих комплектующих!Нет производства даже сменных лезвий для бритья,памперсов,лампочек...",1667834498,483853480
7250785,,1667835287,14929700
7250785,"Где бы был частный бизнес если бы не господдержка . И в пандемию и сейчас. 
Надо признаться уже что мы это не люди бизнеса у нас коллективистский менталитет . 
Люди  открывают частный бизнес чтобы начальникам не подчиняться понятия ге имеют как им управлять . Ладно по Фигу  пусть чем хотят тем и занимаются мы все равно тут проездом на планете  возимся чет авделвапеимся",1667836541,172648106
7250785,"СССР все делал сам,но для себя.А Китай все делает сам но для себя и всего мира",1667837573,702651932
7250785,"Цифры я люблю, хорошие цифры тем более, но тут что-то не плюсуется в 100%🤔",1667838817,138098534
7250785,"Есть три вида лжи: ложь, наглая ложь и статистика 🤣",1667844299,546960151
7250785,"Главное что бы по возвращении назад ""партнеров"" не забили опять на развитие внутри страны",1667855390,133055851
7250785,"На санкции плевать, отмените налоговые реформы мишустена: маркировки, отмена ЕНВД.",1667886865,11568988
7250785,Байден ничком нюхает очко 😎😄✈,1667894472,254844190
7250785,Неужели новые яхты приобрели и открыли новые офшоры?Вот молодцы то какие👍,1667903131,16915487
7250785,"Прежде чем вводить ограничения, надо было знать хоть немного Русских. Русский человек всегда приспособиться к любой ситуации, да и ещё к тому же найдёт выгоду из всего) Вот, например, после ухода иностранных компании, наши бизнесмены быстро придумали и открыли уже свои производства, благо с поддержкой от правительства сделать это стало на много проще) https://www.mos.ru/news/item/112766073/",1667912206,752620489
7238069,,1667535695,315682636
7238069,"Если они забрали нашу дибсобствиность там у себя, я лично пологю что и их собственность которая есть надо тоже национализировать и посмотреть как они запоют.",1667535882,602596849
7238069,"да мы и не ожидаем. мы другое ожидаем: демократы подтасуют снова свою победу, и республиканцы на этот раз не остановятся в своих протестах, потому что поймут, что оттеснены навсегда. в этот раз они поднимут половину америки против другой половины так, что власть будет снесена, а штаты начнут выходить из сша с Техасом в январе. вот на что мы надеемся.",1667542284,39544696
7238069,"Не забывайте, кто ""осваивал"" Америку: конкистадоры-бандиты, авантюристы, пираты, золотоискатели, мошенники... Вобщем, всякий грабительский сброд. Гены сказываются",1667544218,460187439
7238069,русофобию отлично вылечит отработанный уран!,1667627672,190346180
7238069,"Если победят Республиканцы по отношению к РОССИИ, почти ничего не изменится, но одно изменится наверняка  Америка для американцев этот лозунг будет преобладать. Украм они плевать хотели с очень высокой колокольни.",1667643109,741797442
7238069,Посейдон в работу!,1667651606,681184163
7222677,"Правильно мыслишь, продолжай работать",1667205391,611639557
7222677,Какие герои!,1667206287,114487990
7222677,"Лишь бы у них там потом ""самая демократическая"" страна не нашла чего-нибудь запрещённое.",1667209537,259327254
7222677,👍🏻,1667212938,13081609
7222677,"Разборки, передел власти во время открытой войны в России - это крайне скверно. Путин и так не контролирует своего ""повара"" Пригожина и чеченца-""полководца"", а тут еще и тёрки внутри структур. Явно то, что скоро мы получим борьбу за власть похуже 90-х",1667224169,753302333
7222677,👍👍👍,1667243652,747456915
7219382,"Т. Е. Мы, внутри страны, этих крабов по адекватной цене так и не увидим?",1667114054,363462269
7219382,"А можно в российские регионы привезти свежих крабов, да по нормальной цене?",1667114062,243256651
7219382,В смысле доставили знаменитых камчатских крабов на Дальний Восток? Камчатка же и так на Дальнем Востоке?,1667114068,31872159
7219382,То есть камчатские крабы идут из Мурманска?!,1667114123,24545999
7219382,А нельзя открыть новый рынок - Россия,1667114278,158784874
7219382,Пусть китайцы жрут а мы нищие мы всё равно купить не сможем,1667114324,63986367
7219382,все украдено до нас....,1667114613,475665593
7219382,Ценник в прошлом году,1667114896,5954062
7219382,А россиянам не будет?,1667114928,749437385
7219382,"Мы бы тоже поели этих крабов, да цена на них прям космическая.",1667115201,629149611
7219382,Российский рынок? Мимо?,1667115385,345413091
7219382,"Редактор альтернативноодаренный? И не разбирается ни в географии, ни в вопросе, о котором вещает.
У нормального человека, закончившего школу в советское и постсоветское время, сразу возникает вопрос, зачем доставлять камчатского краба с Дальнего востока на Дальний восток? И причем тут мурманские производители?

И редактор, не будь он жертвой ЕГЭ, тоже задался бы этими вопросами.

И понял, что в мурманских водах с камчатским крабом настоящая беда. Он размножается со страшной скоростью. Съедает всю морскую флору.
И если его не вылавливать, будет беда.",1667115612,172572888
7219382,А можно в Питере и Москву хотя-бы привезти!!! ???,1667115884,546401689
7219382,"Парадокс !!! Кормим всех , спросите у россиян ,  кто пробовал крабов , ответят 1 из 10000",1667115987,740768737
7219382,Да уж.,1667116389,2701358
7219382,Камчатские крабы возвращаются на Камчатку,1667116464,4773789
7219382,Ешьте раков. Вкус почти такой же..,1667116471,88600594
7219382,Попробовать б  хоть раз,1667116992,13324409
7219382,"Крым таких крабов и не видовал. А можно нам ? Нафиг кормить сраную Америку ? Есть же свои. И черную икру тоже можно своим продавать, а не все на импорт пускать , по адекватной цене. Что б мамы детям не на словах объясняли что это чудо продукт такой, а могли позволить себе его, хотя бы на праздники",1667117185,287758281
7219382,"Это куда? В Турцию, в арабские страны? Проще напрямую, по Ж/Д путям. Если в Корею и далее, то это рядом.",1667117599,226004890
7219382,У нас с вами нет валюты!,1667117633,139925397
7219382,"Накормите Россию крабом, патриоты",1667118134,708734444
7219382,"Не видим не икры, ни крабов. Видно и впрямь не доступно.",1667120705,30622420
7219382,А по России ????,1667122388,587633966
7219382,"Наконец - то, русское досталось русским!",1667123031,176173711
7219382,"Крабы- пища для элиты, а в Рассеи люди сыты, есть картошка и треска, водка, пиво и тоска.",1667123105,533816022
7219382,Лучше в наши регионы поставляли крабов и ближе и не затратно.,1667123589,734087965
7219382,"Нам как то по.... эти крабы. У нас на воду из под краба денег не хватит. Кто их ест?кто их покупает? Зачем вообще информация,если такие как мы,обычные люди этого не укупим. Ведите свою статистику на сайтах для богатых в закрытых группах. А в нас и без крабов всё ок! Как то так.",1667124942,693808132
7219382,А почему у нас нормальной рыбы мало и дорого что хозяева всё ещё те кто воюет с нами получается какая то не стыковка когда не будь откроется этот занавес,1667124950,400107149
7219382,Ну теперь наедимся крабов..🤤🤤🤤🎉,1667125102,36343267
7219382,"Самые дешевые консервы, до 1941 было мясо крабов). Как так получилось что не каждый россиянин модет теперь его попробовать?",1667126390,582366970
7219382,"Для жителей России это не выгодно, много не заработаешь. Всё везут и продают за бугор.",1667134071,713598818
7219382,"Я ела только в детстве, пока жила на Сахалине и давно забыла его вкус.",1667144123,653565365
7219382,Надо своё  продавать своим! Открывайте переработку и вместо Европы будем мы Россия...,1667145406,408255084
7219382,"Интересно, а почему я не могу попробовать этого краба, а только палочки ""крабовые"" из всякой каки?",1667152692,502822647
7219382,"Какая радость, что опять не нам б",1667157586,466632908
7219382,"За неимением крабов,кушаем раков.",1667159729,561529552
